"rank"	"finalWorth"	"category"	"personName"	"age"	"region"	"city"	"source"	"industries"	"countryOfCitizenship"	"organization"	"selfMade"	"status"	"gender"	"birthDate"	"lastName"	"firstName"	"title"	"date"	"state"	"residenceStateRegion"	"birthYear"	"birthMonth"	"birthDay"	"cpi_country"	"cpi_change_country"	"gdp_country"	"gross_tertiary_education_enrollment"	"gross_primary_education_enrollment_country"	"life_expectancy_country"	"tax_revenue_country_country"	"total_tax_rate_country"	"population_country"	"latitude_country"	"longitude_country"
"44"	43	31200	"Logistics"	"Rafaela Aponte-Diamant"	78	"Switzerland"	"Geneva"	"Shipping"	"Logistics"	"Switzerland"	""	TRUE	"Split Family Fortune"	"F"	"3/26/1945 0:00"	"Aponte-Diamant"	"Rafaela"	""	"4/4/2023 5:01"	""	""	1945	3	26	99.55	0.4	"$703,082,435,360 "	59.6	105.2	83.6	10.1	28.8	8574832	46.818188	8.227512
"1053"	1027	2900	"Real Estate"	"God Nisanov"	50	"Russia"	"Moscow"	"Real estate"	"Real Estate"	"Russia"	""	TRUE	"U"	"M"	"4/24/1972 0:00"	"Nisanov"	"God"	""	"4/4/2023 5:01"	""	""	1972	4	24	180.75	4.5	"$1,699,876,578,871 "	81.9	102.6	72.7	11.4	46.2	144373535	61.52401	105.318756
"1674"	1647	1800	"Healthcare"	"Jin Lei & family"	68	"China"	"Beijing"	"Medical equipment"	"Healthcare"	"China"	""	TRUE	"U"	"M"	"9/23/1954 0:00"	"Jin"	"Lei"	""	"4/4/2023 5:01"	""	""	1954	9	23	125.08	2.9	"$19,910,000,000,000 "	50.6	100.2	77	9.4	59.2	1397715000	35.86166	104.195397
"853"	852	3400	"Energy"	"Somphote Ahunai"	55	"Thailand"	"Bangkok"	"Renewable energy"	"Energy"	"Thailand"	""	TRUE	"D"	"M"	"6/1/1967 0:00"	"Ahunai"	"Somphote"	""	"4/4/2023 5:01"	""	""	1967	6	1	113.27	0.7	"$543,649,976,166 "	49.3	99.8	76.9	14.9	29.5	69625582	15.870032	100.992541
"800"	787	3600	"Finance & Investments"	"Josh Kushner"	37	"United States"	"New York City"	"Venture capital"	"Finance & Investments"	"United States"	"Thrive Capital"	TRUE	"U"	"M"	"6/12/1985 0:00"	"Kushner"	"Josh"	"Managing Partner"	"4/4/2023 5:01"	"New York"	"Northeast"	1985	6	12	117.24	7.5	"$21,427,700,000,000 "	88.2	101.8	78.5	9.6	36.6	328239523	37.09024	-95.712891
"380"	365	6700	"Manufacturing"	"Agnete Kirk Thinggaard"	39	"Denmark"	"Billund"	"Lego"	"Manufacturing"	"Denmark"	""	FALSE	"D"	"F"	"5/18/1983 0:00"	"Thinggaard"	"Agnete Kirk"	""	"4/4/2023 5:01"	""	""	1983	5	18	110.35	0.8	"$348,078,018,464 "	80.6	101.3	81	32.4	23.8	5818553	56.26392	9.501785
"973"	949	3100	"Finance & Investments"	"Sergei Popov"	51	"Switzerland"	""	"Banking"	"Finance & Investments"	"Russia"	""	TRUE	"E"	"M"	"8/12/1971 0:00"	"Popov"	"Sergei"	""	"4/4/2023 5:01"	""	""	1971	8	12	99.55	0.4	"$703,082,435,360 "	59.6	105.2	83.6	10.1	28.8	8574832	46.818188	8.227512
"1263"	1217	2500	"Energy"	"Arvind Tiku"	53	"Singapore"	"Singapore"	"Oil & gas, investments"	"Energy"	"India"	""	TRUE	"U"	"M"	"2/22/1970 0:00"	"Tiku"	"Arvind"	""	"4/4/2023 5:01"	""	""	1970	2	22	114.41	0.6	"$372,062,527,489 "	84.8	100.6	83.1	13.1	21	5703569	1.352083	103.819836
"1793"	1725	1700	"Sports"	"Tom Werner"	72	"United States"	"Los Angeles"	"Sports teams"	"Sports"	"United States"	""	TRUE	"U"	"M"	"4/12/1950 0:00"	"Werner"	"Tom"	""	"4/4/2023 5:01"	"California"	"West"	1950	4	12	117.24	7.5	"$21,427,700,000,000 "	88.2	101.8	78.5	9.6	36.6	328239523	37.09024	-95.712891
"414"	411	6200	"Food & Beverage"	"Lin Muqin & family"	59	"China"	"Shenzhen"	"Beverages"	"Food & Beverage"	"China"	""	TRUE	"U"	"M"	"1/1/1964 0:00"	"Lin"	"Muqin"	""	"4/4/2023 5:01"	""	""	1964	1	1	125.08	2.9	"$19,910,000,000,000 "	50.6	100.2	77	9.4	59.2	1397715000	35.86166	104.195397
"2177"	2133	1300	"Manufacturing"	"Anurang Jain"	61	"India"	"Aurangabad"	"Auto parts"	"Manufacturing"	"India"	""	TRUE	"D"	"M"	"3/21/1962 0:00"	"Jain"	"Anurang"	""	"4/4/2023 5:01"	""	""	1962	3	21	180.44	7.7	"$2,611,000,000,000 "	28.1	113	69.4	11.2	49.7	1366417754	20.593684	78.96288
"2396"	2259	1200	"Healthcare"	"Vadim Yakunin"	60	"Russia"	"Moscow"	"Pharmacy"	"Healthcare"	"Russia"	""	TRUE	"R"	"M"	"1/5/1963 0:00"	"Yakunin"	"Vadim"	""	"4/4/2023 5:01"	""	""	1963	1	5	180.75	4.5	"$1,699,876,578,871 "	81.9	102.6	72.7	11.4	46.2	144373535	61.52401	105.318756
"351"	344	6900	"Healthcare"	"Ronda Stryker"	68	"United States"	"Portage"	"Medical equipment"	"Healthcare"	"United States"	""	FALSE	"U"	"F"	"5/1/1954 0:00"	"Stryker"	"Ronda"	""	"4/4/2023 5:01"	"Michigan"	"Midwest"	1954	5	1	117.24	7.5	"$21,427,700,000,000 "	88.2	101.8	78.5	9.6	36.6	328239523	37.09024	-95.712891
"1699"	1647	1800	"Manufacturing"	"Vinod Saraf"	70	"India"	"Mumbai"	"Chemicals"	"Manufacturing"	"India"	""	TRUE	"D"	"M"	"6/16/1952 0:00"	"Saraf"	"Vinod"	""	"4/4/2023 5:01"	""	""	1952	6	16	180.44	7.7	"$2,611,000,000,000 "	28.1	113	69.4	11.2	49.7	1366417754	20.593684	78.96288
"1939"	1905	1500	"Finance & Investments"	"Ho Hung Anh"	52	"Vietnam"	"Hanoi"	"Consumer products, banking"	"Finance & Investments"	"Vietnam"	""	TRUE	"D"	"M"	"6/8/1970 0:00"	"Ho"	"Hung Anh"	""	"4/4/2023 5:01"	""	""	1970	6	8	163.52	2.8	"$261,921,244,843 "	28.5	110.6	75.3	19.1	37.6	96462106	14.058324	108.277199
"2180"	2133	1300	"Finance & Investments"	"Conni Jonsson"	62	"Sweden"	"Stockholm"	"Asset management"	"Finance & Investments"	"Sweden"	""	TRUE	"D"	"M"	"7/15/1960 0:00"	"Jonsson"	"Conni"	""	"4/4/2023 5:01"	""	""	1960	7	15	110.51	1.8	"$530,832,908,738 "	67	126.6	82.5	27.9	49.1	10285453	60.128161	18.643501
"923"	905	3200	"Finance & Investments"	"Hamilton James & family"	71	"United States"	"New York"	"Investments"	"Finance & Investments"	"United States"	""	TRUE	"U"	"M"	"8/3/1951 0:00"	"James"	"Hamilton"	""	"4/4/2023 5:01"	"New York"	"Northeast"	1951	8	3	117.24	7.5	"$21,427,700,000,000 "	88.2	101.8	78.5	9.6	36.6	328239523	37.09024	-95.712891
"1008"	982	3000	"Technology"	"Lin Xiucheng & family"	67	"China"	"Xiamen"	"Electronics"	"Technology"	"China"	""	TRUE	"D"	"M"	"10/10/1955 0:00"	"Lin"	"Xiucheng"	""	"4/4/2023 5:01"	""	""	1955	10	10	125.08	2.9	"$19,910,000,000,000 "	50.6	100.2	77	9.4	59.2	1397715000	35.86166	104.195397
"1675"	1647	1800	"Technology"	"Valentin Kipyatkov"	46	"Cyprus"	"Peyia"	"Software"	"Technology"	"Cyprus"	""	TRUE	"D"	"M"	"6/5/1976 0:00"	"Kipyatkov"	"Valentin"	""	"4/4/2023 5:01"	""	""	1976	6	5	102.51	0.3	"$24,564,647,935 "	75.9	99.3	80.8	24.5	22.4	1198575	35.126413	33.429859
"2223"	2133	1300	"Diversified"	"Igor Rotenberg"	49	"Russia"	"Moscow"	"Investments, real estate"	"Diversified"	"Russia"	""	TRUE	"R"	"M"	"5/9/1973 0:00"	"Rotenberg"	"Igor"	""	"4/4/2023 5:01"	""	""	1973	5	9	180.75	4.5	"$1,699,876,578,871 "	81.9	102.6	72.7	11.4	46.2	144373535	61.52401	105.318756
"832"	818	3500	"Energy"	"Mikhail Gutseriev"	65	"Russia"	"Moscow"	"Oil, coal, real estate"	"Energy"	"Russia"	""	TRUE	"U"	"M"	"3/9/1958 0:00"	"Gutseriev"	"Mikhail"	""	"4/4/2023 5:01"	""	""	1958	3	9	180.75	4.5	"$1,699,876,578,871 "	81.9	102.6	72.7	11.4	46.2	144373535	61.52401	105.318756
"1388"	1368	2200	"Finance & Investments"	"Thomas James"	80	"United States"	"Saint Petersburg"	"Finance"	"Finance & Investments"	"United States"	""	FALSE	"U"	"M"	"5/10/1942 0:00"	"James"	"Thomas"	""	"4/4/2023 5:01"	"Florida"	"South"	1942	5	10	117.24	7.5	"$21,427,700,000,000 "	88.2	101.8	78.5	9.6	36.6	328239523	37.09024	-95.712891
"1395"	1368	2200	"Diversified"	"Harald Link"	68	"Thailand"	"Bangkok"	"Diversified"	"Diversified"	"Thailand"	""	FALSE	"U"	"M"	"1/12/1955 0:00"	"Link"	"Harald"	""	"4/4/2023 5:01"	""	""	1955	1	12	113.27	0.7	"$543,649,976,166 "	49.3	99.8	76.9	14.9	29.5	69625582	15.870032	100.992541
"448"	445	5700	"Energy"	"Arthur Irving"	93	"Canada"	"Saint John"	"Oil"	"Energy"	"Canada"	""	FALSE	"U"	"M"	"1/1/1930 0:00"	"Irving"	"Arthur"	""	"4/4/2023 5:01"	""	""	1930	1	1	116.76	1.9	"$1,736,425,629,520 "	68.9	100.9	81.9	12.8	24.5	36991981	56.130366	-106.346771
"1819"	1804	1600	"Construction & Engineering"	"Robert Clark"	64	"United States"	"St. Louis"	"Construction"	"Construction & Engineering"	"United States"	""	TRUE	"E"	"M"	"1/30/1959 0:00"	"Clark"	"Robert"	""	"4/4/2023 5:01"	"Missouri"	"Midwest"	1959	1	30	117.24	7.5	"$21,427,700,000,000 "	88.2	101.8	78.5	9.6	36.6	328239523	37.09024	-95.712891
"452"	445	5700	"Finance & Investments"	"Daniel Ziff"	51	"United States"	"New York"	"Investments"	"Finance & Investments"	"United States"	""	FALSE	"U"	"M"	"11/2/1971 0:00"	"Ziff"	"Daniel"	""	"4/4/2023 5:01"	"New York"	"Northeast"	1971	11	2	117.24	7.5	"$21,427,700,000,000 "	88.2	101.8	78.5	9.6	36.6	328239523	37.09024	-95.712891
"669"	659	4200	"Technology"	"Lin Bin"	55	"China"	"Shenzhen"	"Smartphones"	"Technology"	"United States"	""	TRUE	"D"	"M"	"2/1/1968 0:00"	"Lin"	"Bin"	""	"4/4/2023 5:01"	""	""	1968	2	1	125.08	2.9	"$19,910,000,000,000 "	50.6	100.2	77	9.4	59.2	1397715000	35.86166	104.195397
"2265"	2259	1200	"Healthcare"	"Mehmet Aydinlar"	66	"Turkey"	"Istanbul"	"Hospitals"	"Healthcare"	"Turkey"	""	TRUE	"D"	"M"	"7/27/1956 0:00"	"Aydinlar"	"Mehmet"	""	"4/4/2023 5:01"	""	""	1956	7	27	234.44	15.2	"$754,411,708,203 "	23.9	93.2	77.4	17.9	42.3	83429615	38.963745	35.243322
"974"	949	3100	"Finance & Investments"	"Penny Pritzker"	63	"United States"	"Chicago"	"Hotels, investments"	"Finance & Investments"	"United States"	"Inspired Capital"	FALSE	"D"	"F"	"5/2/1959 0:00"	"Pritzker"	"Penny"	"Cofounder"	"4/4/2023 5:01"	"Illinois"	"Midwest"	1959	5	2	117.24	7.5	"$21,427,700,000,000 "	88.2	101.8	78.5	9.6	36.6	328239523	37.09024	-95.712891
"174"	171	10200	"Energy"	"Jeffery Hildebrand"	64	"United States"	"Houston"	"Oil"	"Energy"	"United States"	""	TRUE	"U"	"M"	"3/5/1959 0:00"	"Hildebrand"	"Jeffery"	""	"4/4/2023 5:01"	"Texas"	"South"	1959	3	5	117.24	7.5	"$21,427,700,000,000 "	88.2	101.8	78.5	9.6	36.6	328239523	37.09024	-95.712891
"868"	852	3400	"Technology"	"Bob Parsons"	72	"United States"	"Scottsdale"	"Web hosting"	"Technology"	"United States"	""	TRUE	"E"	"M"	"11/27/1950 0:00"	"Parsons"	"Bob"	""	"4/4/2023 5:01"	"Arizona"	"West"	1950	11	27	117.24	7.5	"$21,427,700,000,000 "	88.2	101.8	78.5	9.6	36.6	328239523	37.09024	-95.712891
"2136"	2133	1300	"Healthcare"	"Chirayu Amin"	76	"India"	"Baroda"	"Pharmaceuticals"	"Healthcare"	"India"	""	FALSE	"D"	"M"	"12/4/1946 0:00"	"Amin"	"Chirayu"	""	"4/4/2023 5:01"	""	""	1946	12	4	180.44	7.7	"$2,611,000,000,000 "	28.1	113	69.4	11.2	49.7	1366417754	20.593684	78.96288
"567"	567	4800	"Fashion & Retail"	"Michael Ashley"	58	"United Kingdom"	"Hertfordshire"	"Sports retailing"	"Fashion & Retail"	"United Kingdom"	""	TRUE	"U"	"M"	"9/12/1964 0:00"	"Ashley"	"Michael"	""	"4/4/2023 5:01"	""	""	1964	9	12	119.62	1.7	"$2,827,113,184,696 "	60	101.2	81.3	25.5	30.6	66834405	55.378051	-3.435973
"2193"	2133	1300	"Diversified"	"Art Levinson"	73	"United States"	"Hillsborough"	"Genentech, Apple"	"Diversified"	"United States"	""	TRUE	"D"	"M"	"3/31/1950 0:00"	"Levinson"	"Art"	""	"4/4/2023 5:01"	"California"	"West"	1950	3	31	117.24	7.5	"$21,427,700,000,000 "	88.2	101.8	78.5	9.6	36.6	328239523	37.09024	-95.712891
"1936"	1905	1500	"Finance & Investments"	"Jaroslav Hascak & family"	53	"Slovakia"	"Bratislava"	"Investments"	"Finance & Investments"	"Slovakia"	""	TRUE	"U"	"M"	"8/30/1969 0:00"	"Hascak"	"Jaroslav"	""	"4/4/2023 5:01"	""	""	1969	8	30	115.34	2.7	"$105,422,304,976 "	46.6	98.7	77.2	18.7	49.7	5454073	48.669026	19.699024
"1834"	1804	1600	"Sports"	"Irving Grousbeck & family"	88	"United States"	"Portola Valley"	"Telecommunication, sports"	"Sports"	"United States"	""	TRUE	"N"	"M"	"7/20/1934 0:00"	"Grousbeck"	"Irving"	""	"4/4/2023 5:01"	"California"	"West"	1934	7	20	117.24	7.5	"$21,427,700,000,000 "	88.2	101.8	78.5	9.6	36.6	328239523	37.09024	-95.712891
"726"	721	3900	"Automotive"	"Mong-Koo Chung"	85	"South Korea"	"Seoul"	"Hyundai"	"Automotive"	"South Korea"	""	FALSE	"D"	"M"	"3/19/1938 0:00"	"Chung"	"Mong-Koo"	""	"4/4/2023 5:01"	""	""	1938	3	19	115.16	0.4	"$2,029,000,000,000 "	94.3	98.1	82.6	15.6	33.2	51709098	35.907757	127.766922
"144"	144	12100	"Automotive"	"Shahid Khan"	72	"United States"	"Naples"	"Auto parts"	"Automotive"	"United States"	""	TRUE	"U"	"M"	"7/18/1950 0:00"	"Khan"	"Shahid"	""	"4/4/2023 5:01"	"Florida"	"South"	1950	7	18	117.24	7.5	"$21,427,700,000,000 "	88.2	101.8	78.5	9.6	36.6	328239523	37.09024	-95.712891
"2036"	2020	1400	"Fashion & Retail"	"Reinold Geiger"	75	"Switzerland"	"Geneva"	"Beauty products"	"Fashion & Retail"	"Austria"	""	TRUE	"D"	"M"	"7/10/1947 0:00"	"Geiger"	"Reinold"	""	"4/4/2023 5:01"	""	""	1947	7	10	99.55	0.4	"$703,082,435,360 "	59.6	105.2	83.6	10.1	28.8	8574832	46.818188	8.227512
"755"	748	3800	"Media & Entertainment"	"Martha Ingram & family"	87	"United States"	"Nashville"	"Book distribution, transportation"	"Media & Entertainment"	"United States"	"Ingram Industries, Inc."	FALSE	"D"	"F"	"8/20/1935 0:00"	"Ingram"	"Martha"	"Former Chairman"	"4/4/2023 5:01"	"Tennessee"	"South"	1935	8	20	117.24	7.5	"$21,427,700,000,000 "	88.2	101.8	78.5	9.6	36.6	328239523	37.09024	-95.712891
"2032"	2020	1400	"Finance & Investments"	"Sasson Dayan & family"	83	"Brazil"	"Sao Paulo"	"Banking"	"Finance & Investments"	"Brazil"	""	TRUE	"U"	"M"	"4/1/1940 0:00"	"Dayan"	"Sasson"	""	"4/4/2023 5:01"	""	""	1940	4	1	167.4	3.7	"$1,839,758,040,766 "	51.3	115.4	75.7	14.2	65.1	212559417	-14.235004	-51.92528
"1538"	1516	2000	"Healthcare"	"Heikki Kyostila"	77	"Finland"	"Helsinki"	"Dental products"	"Healthcare"	"Finland"	""	TRUE	"U"	"M"	"1/19/1946 0:00"	"Kyostila"	"Heikki"	""	"4/4/2023 5:01"	""	""	1946	1	19	112.33	1	"$268,761,201,365 "	88.2	100.2	81.7	20.8	36.6	5520314	61.92411	25.748151
"757"	748	3800	"Real Estate"	"H. Ross Perot, Jr."	64	"United States"	"Dallas"	"Real estate"	"Real Estate"	"United States"	""	FALSE	"U"	"M"	"11/7/1958 0:00"	"Perot"	"H. Ross"	""	"4/4/2023 5:01"	"Texas"	"South"	1958	11	7	117.24	7.5	"$21,427,700,000,000 "	88.2	101.8	78.5	9.6	36.6	328239523	37.09024	-95.712891
"2063"	2020	1400	"Diversified"	"Lee Ho-jin"	60	"South Korea"	"Seoul"	"Diversified"	"Diversified"	"South Korea"	"Taekwang Industrial"	FALSE	"U"	"M"	"12/8/1962 0:00"	"Lee"	"Ho-jin"	""	"4/4/2023 5:01"	""	""	1962	12	8	115.16	0.4	"$2,029,000,000,000 "	94.3	98.1	82.6	15.6	33.2	51709098	35.907757	127.766922
"2115"	2020	1400	"Manufacturing"	"Werner O. Weber"	84	"Switzerland"	"Zurich"	"Electronic components"	"Manufacturing"	"Switzerland"	""	TRUE	"E"	"M"	"2/9/1939 0:00"	"Weber"	"Werner O."	""	"4/4/2023 5:01"	""	""	1939	2	9	99.55	0.4	"$703,082,435,360 "	59.6	105.2	83.6	10.1	28.8	8574832	46.818188	8.227512
"643"	636	4300	"Diversified"	"Daryl Katz"	61	"Canada"	"Edmonton"	"Pharmacies"	"Diversified"	"Canada"	"Katz Group"	TRUE	"D"	"M"	"9/1/1961 0:00"	"Katz"	"Daryl"	"Founder and Chairman"	"4/4/2023 5:01"	""	""	1961	9	1	116.76	1.9	"$1,736,425,629,520 "	68.9	100.9	81.9	12.8	24.5	36991981	56.130366	-106.346771
"1113"	1104	2700	"Healthcare"	"Henri Beaufour"	57	"United Kingdom"	"London"	"Pharmaceuticals"	"Healthcare"	"France"	""	FALSE	"U"	"M"	"6/1/1965 0:00"	"Beaufour"	"Henri"	""	"4/4/2023 5:01"	""	""	1965	6	1	119.62	1.7	"$2,827,113,184,696 "	60	101.2	81.3	25.5	30.6	66834405	55.378051	-3.435973
"2418"	2405	1100	"Food & Beverage"	"Pradip Burman"	80	"India"	"Delhi"	"Consumer goods"	"Food & Beverage"	"India"	""	FALSE	"D"	"M"	"11/2/1942 0:00"	"Burman"	"Pradip"	""	"4/4/2023 5:01"	""	""	1942	11	2	180.44	7.7	"$2,611,000,000,000 "	28.1	113	69.4	11.2	49.7	1366417754	20.593684	78.96288
"458"	455	5600	"Automotive"	"Vikram Lal & family"	81	"India"	"Delhi"	"Motorcycles"	"Automotive"	"India"	""	FALSE	"U"	"M"	"3/5/1942 0:00"	"Lal"	"Vikram"	""	"4/4/2023 5:01"	""	""	1942	3	5	180.44	7.7	"$2,611,000,000,000 "	28.1	113	69.4	11.2	49.7	1366417754	20.593684	78.96288
"528"	523	5100	"Logistics"	"Kjell Inge Rokke"	64	"Norway"	"Vettre"	"Shipping, seafood"	"Logistics"	"Norway"	""	TRUE	"D"	"M"	"10/25/1958 0:00"	"Rokke"	"Kjell Inge"	""	"4/4/2023 5:01"	""	""	1958	10	25	120.27	2.2	"$403,336,363,636 "	82	100.3	82.8	23.9	36.2	5347896	60.472024	8.468946
"64"	64	23400	"Manufacturing"	"He Xiangjian & family"	80	"China"	"Foshan"	"Home appliances"	"Manufacturing"	"China"	""	TRUE	"D"	"M"	"8/11/1942 0:00"	"He"	"Xiangjian"	""	"4/4/2023 5:01"	""	""	1942	8	11	125.08	2.9	"$19,910,000,000,000 "	50.6	100.2	77	9.4	59.2	1397715000	35.86166	104.195397
"949"	949	3100	"Manufacturing"	"Cho Tak Wong"	76	"China"	"Fuqing"	"Auto parts"	"Manufacturing"	"Hong Kong"	""	TRUE	"D"	"M"	"5/15/1946 0:00"	"Cho"	"Tak Wong"	""	"4/4/2023 5:01"	""	""	1946	5	15	125.08	2.9	"$19,910,000,000,000 "	50.6	100.2	77	9.4	59.2	1397715000	35.86166	104.195397
"1520"	1516	2000	"Technology"	"Pavel Baudis"	62	"Czech Republic"	"Prague"	"Software"	"Technology"	"Czech Republic"	""	TRUE	"D"	"M"	"5/15/1960 0:00"	"Baudis"	"Pavel"	""	"4/4/2023 5:01"	""	""	1960	5	15	116.48	2.8	"$246,489,245,495 "	64.1	100.7	79	14.9	46.1	10669709	49.817492	15.472962
"636"	636	4300	"Telecom"	"Patrick Drahi"	59	"Switzerland"	"Zermatt"	"Telecom"	"Telecom"	"France"	""	TRUE	"D"	"M"	"8/20/1963 0:00"	"Drahi"	"Patrick"	""	"4/4/2023 5:01"	""	""	1963	8	20	99.55	0.4	"$703,082,435,360 "	59.6	105.2	83.6	10.1	28.8	8574832	46.818188	8.227512
"2182"	2133	1300	"Technology"	"Laurent Junique"	57	"Singapore"	"Singapore"	"Call centers"	"Technology"	"France"	""	TRUE	"U"	"M"	"12/1/1965 0:00"	"Junique"	"Laurent"	""	"4/4/2023 5:01"	""	""	1965	12	1	114.41	0.6	"$372,062,527,489 "	84.8	100.6	83.1	13.1	21	5703569	1.352083	103.819836
"526"	523	5100	"Media & Entertainment"	"Kwon Hyuk-bin"	49	"South Korea"	"Seoul"	"Online games"	"Media & Entertainment"	"South Korea"	"Smilegate Holdings"	TRUE	"D"	"M"	"1/1/1974 0:00"	"Kwon"	"Hyuk-bin"	""	"4/4/2023 5:01"	""	""	1974	1	1	115.16	0.4	"$2,029,000,000,000 "	94.3	98.1	82.6	15.6	33.2	51709098	35.907757	127.766922
"59"	59	24600	"Automotive"	"Stefan Quandt"	56	"Germany"	"Frankfurt"	"BMW"	"Automotive"	"Germany"	""	FALSE	"U"	"M"	"5/9/1966 0:00"	"Quandt"	"Stefan"	""	"4/4/2023 5:01"	""	""	1966	5	9	112.85	1.4	"$3,845,630,030,824 "	70.2	104	80.9	11.5	48.8	83132799	51.165691	10.451526
"487"	486	5400	"Manufacturing"	"Mahendra Choksi & family"	81	"India"	"Mumbai"	"Paints"	"Manufacturing"	"India"	""	FALSE	"D"	"M"	"4/19/1941 0:00"	"Choksi"	"Mahendra"	""	"4/4/2023 5:01"	""	""	1941	4	19	180.44	7.7	"$2,611,000,000,000 "	28.1	113	69.4	11.2	49.7	1366417754	20.593684	78.96288
"1267"	1217	2500	"Fashion & Retail"	"Roger Wang"	74	"China"	"Nanjing"	"Retail"	"Fashion & Retail"	"United States"	""	TRUE	"D"	"M"	"1/1/1949 0:00"	"Wang"	"Roger"	""	"4/4/2023 5:01"	""	""	1949	1	1	125.08	2.9	"$19,910,000,000,000 "	50.6	100.2	77	9.4	59.2	1397715000	35.86166	104.195397
"397"	397	6400	"Finance & Investments"	"Carl Bennet"	71	"Sweden"	"Gothenberg"	"Investments"	"Finance & Investments"	"Sweden"	""	TRUE	"D"	"M"	"8/19/1951 0:00"	"Bennet"	"Carl"	""	"4/4/2023 5:01"	""	""	1951	8	19	110.51	1.8	"$530,832,908,738 "	67	126.6	82.5	27.9	49.1	10285453	60.128161	18.643501
"2040"	2020	1400	"Manufacturing"	"Rajinder Gupta"	64	"India"	"Ludhiana"	"Textiles, paper"	"Manufacturing"	"India"	""	TRUE	"D"	"M"	"1/2/1959 0:00"	"Gupta"	"Rajinder"	""	"4/4/2023 5:01"	""	""	1959	1	2	180.44	7.7	"$2,611,000,000,000 "	28.1	113	69.4	11.2	49.7	1366417754	20.593684	78.96288
"497"	497	5300	"Finance & Investments"	"Todd Boehly"	49	"United States"	"Darien"	"Finance"	"Finance & Investments"	"United States"	""	TRUE	"U"	"M"	"9/20/1973 0:00"	"Boehly"	"Todd"	""	"4/4/2023 5:01"	"Connecticut"	"Northeast"	1973	9	20	117.24	7.5	"$21,427,700,000,000 "	88.2	101.8	78.5	9.6	36.6	328239523	37.09024	-95.712891
"1234"	1217	2500	"Finance & Investments"	"Joseph Edelman"	67	"United States"	"New York"	"Hedge funds"	"Finance & Investments"	"United States"	"Perceptive Advisors"	TRUE	"D"	"M"	"6/10/1955 0:00"	"Edelman"	"Joseph"	"Founder & CEO"	"4/4/2023 5:01"	"New York"	"Northeast"	1955	6	10	117.24	7.5	"$21,427,700,000,000 "	88.2	101.8	78.5	9.6	36.6	328239523	37.09024	-95.712891
"1426"	1368	2200	"Food & Beverage"	"David Wertheim"	65	"Israel"	""	"Coca-Cola Israel"	"Food & Beverage"	"Israel"	""	FALSE	"D"	"M"	"1/1/1958 0:00"	"Wertheim"	"David"	""	"4/4/2023 5:01"	""	""	1958	1	1	108.15	0.8	"$395,098,666,122 "	63.4	104.9	82.8	23.1	25.3	9053300	31.046051	34.851612
"2391"	2259	1200	"Manufacturing"	"Wenbo Xiang"	60	"China"	"Changsha"	"Manufacturing"	"Manufacturing"	"China"	""	TRUE	"D"	"M"	"6/21/1962 0:00"	"Xiang"	"Wenbo"	""	"4/4/2023 5:01"	""	""	1962	6	21	125.08	2.9	"$19,910,000,000,000 "	50.6	100.2	77	9.4	59.2	1397715000	35.86166	104.195397
"909"	905	3200	"Finance & Investments"	"Ron Burkle"	70	"United Kingdom"	"London"	"Supermarkets, investments"	"Finance & Investments"	"United States"	"The Yucaipa Companies, LLC"	TRUE	"U"	"M"	"11/12/1952 0:00"	"Burkle"	"Ron"	"Investor"	"4/4/2023 5:01"	""	""	1952	11	12	119.62	1.7	"$2,827,113,184,696 "	60	101.2	81.3	25.5	30.6	66834405	55.378051	-3.435973
"120"	120	14600	"Healthcare"	"Xu Hang"	60	"China"	"Shenzhen"	"Medical devices"	"Healthcare"	"Hong Kong"	""	TRUE	"D"	"M"	"5/22/1962 0:00"	"Xu"	"Hang"	""	"4/4/2023 5:01"	""	""	1962	5	22	125.08	2.9	"$19,910,000,000,000 "	50.6	100.2	77	9.4	59.2	1397715000	35.86166	104.195397
"782"	766	3700	"Technology"	"John Sall"	75	"United States"	"Cary"	"Software"	"Technology"	"United States"	"SAS Institute"	TRUE	"U"	"M"	"4/4/1948 0:00"	"Sall"	"John"	"Co-Founder, Executive Vice President"	"4/4/2023 5:01"	"North Carolina"	"South"	1948	4	4	117.24	7.5	"$21,427,700,000,000 "	88.2	101.8	78.5	9.6	36.6	328239523	37.09024	-95.712891
"1037"	1027	2900	"Media & Entertainment"	"Kenneth Feld & family"	74	"United States"	"Sarasota"	"Live entertainment"	"Media & Entertainment"	"United States"	"Feld Entertainment"	FALSE	"U"	"M"	"10/31/1948 0:00"	"Feld"	"Kenneth"	"Chairman"	"4/4/2023 5:01"	"Florida"	"South"	1948	10	31	117.24	7.5	"$21,427,700,000,000 "	88.2	101.8	78.5	9.6	36.6	328239523	37.09024	-95.712891
"1408"	1368	2200	"Technology"	"Chad Richison"	52	"United States"	"Edmond"	"Payroll processing"	"Technology"	"United States"	""	TRUE	"D"	"M"	"10/10/1970 0:00"	"Richison"	"Chad"	""	"4/4/2023 5:01"	"Oklahoma"	"South"	1970	10	10	117.24	7.5	"$21,427,700,000,000 "	88.2	101.8	78.5	9.6	36.6	328239523	37.09024	-95.712891
"2361"	2259	1200	"Energy"	"Edwin Soeryadjaya"	73	"Indonesia"	"Jakarta"	"Coal, investments"	"Energy"	"Indonesia"	""	FALSE	"D"	"M"	"7/17/1949 0:00"	"Soeryadjaya"	"Edwin"	""	"4/4/2023 5:01"	""	""	1949	7	17	151.18	3	"$1,119,190,780,753 "	36.3	106.4	71.5	10.2	30.1	270203917	-0.789275	113.921327
"2264"	2259	1200	"Technology"	"Tope Awotona"	41	"United States"	"Atlanta"	"Software"	"Technology"	"United States"	"Calendly"	TRUE	"D"	"M"	"4/22/1981 0:00"	"Awotona"	"Tope"	""	"4/4/2023 5:01"	"Georgia"	"South"	1981	4	22	117.24	7.5	"$21,427,700,000,000 "	88.2	101.8	78.5	9.6	36.6	328239523	37.09024	-95.712891
"42"	41	31600	"Fashion & Retail"	"Gerard Wertheimer"	72	"United States"	"New York"	"Chanel"	"Fashion & Retail"	"France"	""	FALSE	"U"	"M"	"1/9/1951 0:00"	"Wertheimer"	"Gerard"	""	"4/4/2023 5:01"	"New York"	"Northeast"	1951	1	9	117.24	7.5	"$21,427,700,000,000 "	88.2	101.8	78.5	9.6	36.6	328239523	37.09024	-95.712891
"1681"	1647	1800	"Metals & Mining"	"Luo Yangyong & family"	47	"China"	"Panzhihua"	"Mining"	"Metals & Mining"	"China"	""	TRUE	"D"	"M"	"6/2/1975 0:00"	"Luo"	"Yangyong"	""	"4/4/2023 5:01"	""	""	1975	6	2	125.08	2.9	"$19,910,000,000,000 "	50.6	100.2	77	9.4	59.2	1397715000	35.86166	104.195397
"713"	699	4000	"Media & Entertainment"	"Isaac Perlmutter"	80	"United States"	"Palm Beach"	"Marvel comics"	"Media & Entertainment"	"United States"	"Marvel Entertainment"	TRUE	"D"	"M"	"12/1/1942 0:00"	"Perlmutter"	"Isaac"	"Chairman"	"4/4/2023 5:01"	"Florida"	"South"	1942	12	1	117.24	7.5	"$21,427,700,000,000 "	88.2	101.8	78.5	9.6	36.6	328239523	37.09024	-95.712891
"1980"	1905	1500	"Finance & Investments"	"Carlos Rodriguez-Pastor"	63	"Peru"	"Lima"	"Finance"	"Finance & Investments"	"Peru"	""	FALSE	"Split Family Fortune"	"M"	"4/11/1959 0:00"	"Rodriguez-Pastor"	"Carlos"	""	"4/4/2023 5:01"	""	""	1959	4	11	129.78	2.1	"$226,848,050,820 "	70.7	106.9	76.5	14.3	36.8	32510453	-9.189967	-75.015152
"962"	949	3100	"Manufacturing"	"Kuok Khoon Hong"	73	"Singapore"	"Singapore"	"Palm oil"	"Manufacturing"	"Singapore"	""	FALSE	"D"	"M"	"1/1/1950 0:00"	"Kuok"	"Khoon Hong"	""	"4/4/2023 5:01"	""	""	1950	1	1	114.41	0.6	"$372,062,527,489 "	84.8	100.6	83.1	13.1	21	5703569	1.352083	103.819836
"1775"	1725	1700	"Manufacturing"	"Mrudula Parekh"	75	"India"	"Mumbai"	"Adhesives"	"Manufacturing"	"India"	""	FALSE	"D"	"F"	"1/1/1948 0:00"	"Parekh"	"Mrudula"	""	"4/4/2023 5:01"	""	""	1948	1	1	180.44	7.7	"$2,611,000,000,000 "	28.1	113	69.4	11.2	49.7	1366417754	20.593684	78.96288
"2384"	2259	1200	"Food & Beverage"	"Drorit Wertheim"	67	"Israel"	"Bnei Atarot"	"Coca Cola Israel"	"Food & Beverage"	"Israel"	""	FALSE	"D"	"F"	"1/1/1956 0:00"	"Wertheim"	"Drorit"	""	"4/4/2023 5:01"	""	""	1956	1	1	108.15	0.8	"$395,098,666,122 "	63.4	104.9	82.8	23.1	25.3	9053300	31.046051	34.851612
"559"	552	4900	"Metals & Mining"	"Lim Hariyanto Wijaya Sarwono"	94	"Indonesia"	"Jakarta"	"Palm oil, nickel mining"	"Metals & Mining"	"Indonesia"	""	TRUE	"U"	"M"	"11/1/1928 0:00"	"Lim"	"Hariyanto Wijaya Sarwono"	""	"4/4/2023 5:01"	""	""	1928	11	1	151.18	3	"$1,119,190,780,753 "	36.3	106.4	71.5	10.2	30.1	270203917	-0.789275	113.921327
"1327"	1312	2300	"Construction & Engineering"	"Erman Ilicak"	55	"Turkey"	"Ankara"	"Construction"	"Construction & Engineering"	"Turkey"	""	TRUE	"E"	"M"	"10/3/1967 0:00"	"Ilicak"	"Erman"	""	"4/4/2023 5:01"	""	""	1967	10	3	234.44	15.2	"$754,411,708,203 "	23.9	93.2	77.4	17.9	42.3	83429615	38.963745	35.243322
"1883"	1804	1600	"Media & Entertainment"	"Wang Changtian"	57	"China"	"Beijing"	"TV, movie production"	"Media & Entertainment"	"China"	""	TRUE	"D"	"M"	"4/26/1965 0:00"	"Wang"	"Changtian"	""	"4/4/2023 5:01"	""	""	1965	4	26	125.08	2.9	"$19,910,000,000,000 "	50.6	100.2	77	9.4	59.2	1397715000	35.86166	104.195397
"1748"	1725	1700	"Manufacturing"	"Ilkka Herlin"	64	"Finland"	"Helsinki"	"Elevators, escalators"	"Manufacturing"	"Finland"	""	FALSE	"U"	"M"	"1/1/1959 0:00"	"Herlin"	"Ilkka"	""	"4/4/2023 5:01"	""	""	1959	1	1	112.33	1	"$268,761,201,365 "	88.2	100.2	81.7	20.8	36.6	5520314	61.92411	25.748151
"331"	325	7100	"Manufacturing"	"Zhang Hejun"	71	"China"	"Ningbo"	"Electronics"	"Manufacturing"	"China"	""	TRUE	"U"	"M"	"1/1/1952 0:00"	"Zhang"	"Hejun"	""	"4/4/2023 5:01"	""	""	1952	1	1	125.08	2.9	"$19,910,000,000,000 "	50.6	100.2	77	9.4	59.2	1397715000	35.86166	104.195397
"927"	905	3200	"Healthcare"	"Samir Mehta"	59	"India"	"Ahmedabad"	"Pharmaceuticals, power"	"Healthcare"	"India"	""	FALSE	"U"	"M"	"9/18/1963 0:00"	"Mehta"	"Samir"	""	"4/4/2023 5:01"	""	""	1963	9	18	180.44	7.7	"$2,611,000,000,000 "	28.1	113	69.4	11.2	49.7	1366417754	20.593684	78.96288
"579"	567	4800	"Finance & Investments"	"Yu Yong"	62	"China"	"Shanghai"	"Mining"	"Finance & Investments"	"China"	""	TRUE	"U"	"M"	"2/1/1961 0:00"	"Yu"	"Yong"	""	"4/4/2023 5:01"	""	""	1961	2	1	125.08	2.9	"$19,910,000,000,000 "	50.6	100.2	77	9.4	59.2	1397715000	35.86166	104.195397
"1137"	1104	2700	"Technology"	"Li Zhongchu"	59	"China"	"Beijing"	"Software"	"Technology"	"China"	""	TRUE	"D"	"M"	"8/26/1963 0:00"	"Li"	"Zhongchu"	""	"4/4/2023 5:01"	""	""	1963	8	26	125.08	2.9	"$19,910,000,000,000 "	50.6	100.2	77	9.4	59.2	1397715000	35.86166	104.195397
"2397"	2259	1200	"Fashion & Retail"	"Yang Yunyun"	46	"China"	"Guangzhou"	"Retail"	"Fashion & Retail"	"China"	""	TRUE	"R"	"F"	"1/1/1977 0:00"	"Yang"	"Yunyun"	""	"4/4/2023 5:01"	""	""	1977	1	1	125.08	2.9	"$19,910,000,000,000 "	50.6	100.2	77	9.4	59.2	1397715000	35.86166	104.195397
"1514"	1434	2100	"Manufacturing"	"Zhang Ning & family"	49	"China"	"Shanghai"	"Chemicals"	"Manufacturing"	"Canada"	""	TRUE	"D"	"F"	"4/1/1974 0:00"	"Zhang"	"Ning"	""	"4/4/2023 5:01"	""	""	1974	4	1	125.08	2.9	"$19,910,000,000,000 "	50.6	100.2	77	9.4	59.2	1397715000	35.86166	104.195397
"702"	699	4000	"Diversified"	"Guangchang Guo"	56	"China"	"Shanghai"	"Conglomerate"	"Diversified"	"China"	""	TRUE	"D"	"M"	"2/16/1967 0:00"	"Guo"	"Guangchang"	""	"4/4/2023 5:01"	""	""	1967	2	16	125.08	2.9	"$19,910,000,000,000 "	50.6	100.2	77	9.4	59.2	1397715000	35.86166	104.195397
"1341"	1312	2300	"Fashion & Retail"	"Mi Enhua"	65	"China"	"Urumqi"	"Retail"	"Fashion & Retail"	"China"	""	TRUE	"D"	"M"	"4/1/1958 0:00"	"Mi"	"Enhua"	""	"4/4/2023 5:01"	""	""	1958	4	1	125.08	2.9	"$19,910,000,000,000 "	50.6	100.2	77	9.4	59.2	1397715000	35.86166	104.195397
"1804"	1804	1600	"Healthcare"	"Noubar Afeyan"	60	"United States"	"Lexington"	"Biotech"	"Healthcare"	"United States"	""	TRUE	"D"	"M"	"7/25/1962 0:00"	"Afeyan"	"Noubar"	""	"4/4/2023 5:01"	"Massachusetts"	"Northeast"	1962	7	25	117.24	7.5	"$21,427,700,000,000 "	88.2	101.8	78.5	9.6	36.6	328239523	37.09024	-95.712891
"330"	325	7100	"Finance & Investments"	"Wee Cho Yaw"	94	"Singapore"	"Singapore"	"Banking"	"Finance & Investments"	"Singapore"	""	FALSE	"D"	"M"	"1/10/1929 0:00"	"Wee"	"Cho Yaw"	""	"4/4/2023 5:01"	""	""	1929	1	10	114.41	0.6	"$372,062,527,489 "	84.8	100.6	83.1	13.1	21	5703569	1.352083	103.819836
"1147"	1104	2700	"Real Estate"	"Richard Peery"	84	"United States"	"Palo Alto"	"Real estate"	"Real Estate"	"United States"	""	TRUE	"D"	"M"	"10/1/1938 0:00"	"Peery"	"Richard"	""	"4/4/2023 5:01"	"California"	"West"	1938	10	1	117.24	7.5	"$21,427,700,000,000 "	88.2	101.8	78.5	9.6	36.6	328239523	37.09024	-95.712891
"1024"	982	3000	"Healthcare"	"Ye Xiaoping"	60	"China"	"Hangzhou"	"Pharmaceuticals"	"Healthcare"	"China"	""	TRUE	"U"	"M"	"2/1/1963 0:00"	"Ye"	"Xiaoping"	""	"4/4/2023 5:01"	""	""	1963	2	1	125.08	2.9	"$19,910,000,000,000 "	50.6	100.2	77	9.4	59.2	1397715000	35.86166	104.195397
"2360"	2259	1200	"Automotive"	"Konstantin Sixt"	40	"Germany"	"Munich"	"Car rentals"	"Automotive"	"Germany"	""	FALSE	"D"	"M"	"12/2/1982 0:00"	"Sixt"	"Konstantin"	""	"4/4/2023 5:01"	""	""	1982	12	2	112.85	1.4	"$3,845,630,030,824 "	70.2	104	80.9	11.5	48.8	83132799	51.165691	10.451526
"921"	905	3200	"Finance & Investments"	"Michael Hintze"	69	"United Kingdom"	"London"	"Investment"	"Finance & Investments"	"Australia"	"CQS LLP"	TRUE	"E"	"M"	"7/27/1953 0:00"	"Hintze"	"Michael"	"Founder"	"4/4/2023 5:01"	""	""	1953	7	27	119.62	1.7	"$2,827,113,184,696 "	60	101.2	81.3	25.5	30.6	66834405	55.378051	-3.435973
"313"	312	7300	"Metals & Mining"	"Iskander Makhmudov"	59	"Russia"	"Moscow"	"Mining, metals, machinery"	"Metals & Mining"	"Russia"	""	TRUE	"U"	"M"	"12/5/1963 0:00"	"Makhmudov"	"Iskander"	""	"4/4/2023 5:01"	""	""	1963	12	5	180.75	4.5	"$1,699,876,578,871 "	81.9	102.6	72.7	11.4	46.2	144373535	61.52401	105.318756
"1226"	1217	2500	"Media & Entertainment"	"Cheng Yixiao"	39	"China"	"Beijing"	"Video streaming app"	"Media & Entertainment"	"China"	""	TRUE	"D"	"M"	"1/1/1984 0:00"	"Cheng"	"Yixiao"	""	"4/4/2023 5:01"	""	""	1984	1	1	125.08	2.9	"$19,910,000,000,000 "	50.6	100.2	77	9.4	59.2	1397715000	35.86166	104.195397
"728"	721	3900	"Fashion & Retail"	"Giuseppe De'Longhi & family"	83	"Italy"	"Treviso"	"Coffee makers"	"Fashion & Retail"	"Italy"	""	FALSE	"D"	"M"	"4/24/1939 0:00"	"De'Longhi"	"Giuseppe"	""	"4/4/2023 5:01"	""	""	1939	4	24	110.62	0.6	"$2,001,244,392,042 "	61.9	101.9	82.9	24.3	59.1	60297396	41.87194	12.56738
"18"	17	59000	"Diversified"	"Julia Koch & family"	60	"United States"	"New York"	"Koch Industries"	"Diversified"	"United States"	""	FALSE	"D"	"F"	"4/12/1962 0:00"	"Koch"	"Julia"	""	"4/4/2023 5:01"	"New York"	"Northeast"	1962	4	12	117.24	7.5	"$21,427,700,000,000 "	88.2	101.8	78.5	9.6	36.6	328239523	37.09024	-95.712891
"2305"	2259	1200	"Telecom"	"Mohammed Ibrahim"	76	"United Kingdom"	"London"	"Communications"	"Telecom"	"United Kingdom"	"Mo Ibrahim Foundation"	TRUE	"E"	"M"	"5/3/1946 0:00"	"Ibrahim"	"Mohammed"	"Founder"	"4/4/2023 5:01"	""	""	1946	5	3	119.62	1.7	"$2,827,113,184,696 "	60	101.2	81.3	25.5	30.6	66834405	55.378051	-3.435973
"2097"	2020	1400	"Construction & Engineering"	"Boris Rotenberg"	66	"Russia"	"Moscow"	"Construction, pipes, chemicals"	"Construction & Engineering"	"Russia"	""	TRUE	"U"	"M"	"1/3/1957 0:00"	"Rotenberg"	"Boris"	""	"4/4/2023 5:01"	""	""	1957	1	3	180.75	4.5	"$1,699,876,578,871 "	81.9	102.6	72.7	11.4	46.2	144373535	61.52401	105.318756
"71"	71	22000	"Food & Beverage"	"Emmanuel Besnier"	52	"France"	"Laval"	"Cheese"	"Food & Beverage"	"France"	""	FALSE	"D"	"M"	"9/18/1970 0:00"	"Besnier"	"Emmanuel"	""	"4/4/2023 5:01"	""	""	1970	9	18	110.05	1.1	"$2,715,518,274,227 "	65.6	102.5	82.5	24.2	60.7	67059887	46.227638	2.213749
"455"	455	5600	"Logistics"	"Maria Angelicoussis"	41	"Greece"	""	"Shipping"	"Logistics"	"Greece"	""	FALSE	"N"	"F"	"2/18/1982 0:00"	"Angelicoussis"	"Maria"	""	"4/4/2023 5:01"	""	""	1982	2	18	101.87	0.2	"$209,852,761,469 "	136.6	99.6	81.3	26.2	51.9	10716322	39.074208	21.824312
"1486"	1434	2100	"Manufacturing"	"Zugen Ni"	66	"China"	"Suzhou"	"Appliances"	"Manufacturing"	"China"	""	TRUE	"U"	"M"	"1/18/1957 0:00"	"Ni"	"Zugen"	""	"4/4/2023 5:01"	""	""	1957	1	18	125.08	2.9	"$19,910,000,000,000 "	50.6	100.2	77	9.4	59.2	1397715000	35.86166	104.195397
"620"	611	4500	"Finance & Investments"	"David Velez & family"	41	"Brazil"	"Sao Paulo"	"Fintech"	"Finance & Investments"	"Colombia"	""	TRUE	"D"	"M"	"10/2/1981 0:00"	"Velez"	"David"	""	"4/4/2023 5:01"	""	""	1981	10	2	167.4	3.7	"$1,839,758,040,766 "	51.3	115.4	75.7	14.2	65.1	212559417	-14.235004	-51.92528
"1337"	1312	2300	"Finance & Investments"	"Hua Li"	45	"China"	"Shenzhen"	"Financial services"	"Finance & Investments"	"China"	""	TRUE	"U"	"M"	"1/1/1978 0:00"	"Li"	"Hua"	""	"4/4/2023 5:01"	""	""	1978	1	1	125.08	2.9	"$19,910,000,000,000 "	50.6	100.2	77	9.4	59.2	1397715000	35.86166	104.195397
"107"	107	15900	"Food & Beverage"	"Pang Kang"	67	"China"	"Foshan"	"Soy sauce"	"Food & Beverage"	"China"	""	TRUE	"D"	"M"	"1/19/1956 0:00"	"Pang"	"Kang"	""	"4/4/2023 5:01"	""	""	1956	1	19	125.08	2.9	"$19,910,000,000,000 "	50.6	100.2	77	9.4	59.2	1397715000	35.86166	104.195397
"2472"	2405	1100	"Manufacturing"	"Yogesh Kothari"	74	"India"	"Mumbai"	"Specialty chemicals"	"Manufacturing"	"India"	""	TRUE	"D"	"M"	"1/1/1949 0:00"	"Kothari"	"Yogesh"	""	"4/4/2023 5:01"	""	""	1949	1	1	180.44	7.7	"$2,611,000,000,000 "	28.1	113	69.4	11.2	49.7	1366417754	20.593684	78.96288
"930"	905	3200	"Real Estate"	"Geoffrey Palmer"	72	"United States"	"Beverly Hills"	"Real estate"	"Real Estate"	"United States"	""	FALSE	"N"	"M"	"5/11/1950 0:00"	"Palmer"	"Geoffrey"	""	"4/4/2023 5:01"	"California"	"West"	1950	5	11	117.24	7.5	"$21,427,700,000,000 "	88.2	101.8	78.5	9.6	36.6	328239523	37.09024	-95.712891
"815"	787	3600	"Automotive"	"Xia Zuoquan"	61	"China"	"Shenzhen"	"Automobiles, batteries"	"Automotive"	"China"	""	TRUE	"U"	"M"	"1/1/1962 0:00"	"Xia"	"Zuoquan"	""	"4/4/2023 5:01"	""	""	1962	1	1	125.08	2.9	"$19,910,000,000,000 "	50.6	100.2	77	9.4	59.2	1397715000	35.86166	104.195397
"438"	437	5900	"Diversified"	"Jaran Chiaravanont"	93	"Thailand"	"Bangkok"	"Diversified"	"Diversified"	"Thailand"	""	FALSE	"U"	"M"	"4/1/1930 0:00"	"Chiaravanont"	"Jaran"	""	"4/4/2023 5:01"	""	""	1930	4	1	113.27	0.7	"$543,649,976,166 "	49.3	99.8	76.9	14.9	29.5	69625582	15.870032	100.992541
"1138"	1104	2700	"Food & Beverage"	"Liang Yunchao"	54	"China"	"Guangzhou"	"Nutritional supplements"	"Food & Beverage"	"China"	""	TRUE	"D"	"M"	"1/3/1969 0:00"	"Liang"	"Yunchao"	""	"4/4/2023 5:01"	""	""	1969	1	3	125.08	2.9	"$19,910,000,000,000 "	50.6	100.2	77	9.4	59.2	1397715000	35.86166	104.195397
"1552"	1516	2000	"Technology"	"Matthew Prince"	48	"United States"	"Park City"	"Cybersecurity"	"Technology"	"United States"	""	TRUE	"D"	"M"	"1/1/1975 0:00"	"Prince"	"Matthew"	""	"4/4/2023 5:01"	"Utah"	"West"	1975	1	1	117.24	7.5	"$21,427,700,000,000 "	88.2	101.8	78.5	9.6	36.6	328239523	37.09024	-95.712891
"1428"	1368	2200	"Food & Beverage"	"Xu Yingzhuo"	55	"China"	"Guangzhou"	"Agribusiness"	"Food & Beverage"	"China"	""	TRUE	"D"	"M"	"1/1/1968 0:00"	"Xu"	"Yingzhuo"	""	"4/4/2023 5:01"	""	""	1968	1	1	125.08	2.9	"$19,910,000,000,000 "	50.6	100.2	77	9.4	59.2	1397715000	35.86166	104.195397
"548"	534	5000	"Healthcare"	"Thomas Straumann"	59	"Switzerland"	"Basel"	"Dental implants"	"Healthcare"	"Switzerland"	""	FALSE	"D"	"M"	"7/22/1963 0:00"	"Straumann"	"Thomas"	""	"4/4/2023 5:01"	""	""	1963	7	22	99.55	0.4	"$703,082,435,360 "	59.6	105.2	83.6	10.1	28.8	8574832	46.818188	8.227512
"2529"	2405	1100	"Technology"	"Ye Qiongjiu"	68	"China"	"Hangzhou"	"Software"	"Technology"	"China"	""	TRUE	"U"	"F"	"10/14/1954 0:00"	"Ye"	"Qiongjiu"	""	"4/4/2023 5:01"	""	""	1954	10	14	125.08	2.9	"$19,910,000,000,000 "	50.6	100.2	77	9.4	59.2	1397715000	35.86166	104.195397
"675"	659	4200	"Food & Beverage"	"Lynsi Snyder"	40	"United States"	"Glendora"	"In-N-Out Burger"	"Food & Beverage"	"United States"	""	FALSE	"E"	"F"	"5/5/1982 0:00"	"Snyder"	"Lynsi"	""	"4/4/2023 5:01"	"California"	"West"	1982	5	5	117.24	7.5	"$21,427,700,000,000 "	88.2	101.8	78.5	9.6	36.6	328239523	37.09024	-95.712891
"1714"	1647	1800	"Technology"	"Nikil Viswanathan"	35	"United States"	"San Francisco"	"Blockchain technology"	"Technology"	"United States"	""	TRUE	"D"	"M"	"10/16/1987 0:00"	"Viswanathan"	"Nikil"	""	"4/4/2023 5:01"	"California"	"West"	1987	10	16	117.24	7.5	"$21,427,700,000,000 "	88.2	101.8	78.5	9.6	36.6	328239523	37.09024	-95.712891
"214"	208	9200	"Fashion & Retail"	"Eric Smidt"	63	"United States"	"Beverly Hills"	"Hardware stores"	"Fashion & Retail"	"United States"	""	TRUE	"U"	"M"	"1/1/1960 0:00"	"Smidt"	"Eric"	""	"4/4/2023 5:01"	"California"	"West"	1960	1	1	117.24	7.5	"$21,427,700,000,000 "	88.2	101.8	78.5	9.6	36.6	328239523	37.09024	-95.712891
"1530"	1516	2000	"Metals & Mining"	"John Hancock"	47	"United Kingdom"	"London"	"Mining"	"Metals & Mining"	"Australia"	""	FALSE	"D"	"M"	"1/2/1976 0:00"	"Hancock"	"John"	""	"4/4/2023 5:01"	""	""	1976	1	2	119.62	1.7	"$2,827,113,184,696 "	60	101.2	81.3	25.5	30.6	66834405	55.378051	-3.435973
"696"	679	4100	"Diversified"	"Kerry Stokes"	82	"Australia"	"Perth"	"Construction equipment, media"	"Diversified"	"Australia"	""	TRUE	"D"	"M"	"9/13/1940 0:00"	"Stokes"	"Kerry"	""	"4/4/2023 5:01"	""	""	1940	9	13	119.8	1.6	"$1,392,680,589,329 "	113.1	100.3	82.7	23	47.4	25766605	-25.274398	133.775136
"718"	699	4000	"Energy"	"Torbjorn Tornqvist"	69	"Switzerland"	"Geneva"	"Oil trading"	"Energy"	"Sweden"	""	TRUE	"U"	"M"	"11/8/1953 0:00"	"Tornqvist"	"Torbjorn"	""	"4/4/2023 5:01"	""	""	1953	11	8	99.55	0.4	"$703,082,435,360 "	59.6	105.2	83.6	10.1	28.8	8574832	46.818188	8.227512
"1900"	1804	1600	"Manufacturing"	"Yu Lili"	55	"China"	"Changsha"	"Electronic components"	"Manufacturing"	"China"	""	TRUE	"D"	"F"	"1/1/1968 0:00"	"Yu"	"Lili"	""	"4/4/2023 5:01"	""	""	1968	1	1	125.08	2.9	"$19,910,000,000,000 "	50.6	100.2	77	9.4	59.2	1397715000	35.86166	104.195397
"2333"	2259	1200	"Healthcare"	"Alan Miller & family"	85	"United States"	"Lower Merion"	"Healthcare services"	"Healthcare"	"United States"	""	TRUE	"D"	"M"	"8/17/1937 0:00"	"Miller"	"Alan"	""	"4/4/2023 5:01"	"Pennsylvania"	"Northeast"	1937	8	17	117.24	7.5	"$21,427,700,000,000 "	88.2	101.8	78.5	9.6	36.6	328239523	37.09024	-95.712891
"296"	290	7600	"Real Estate"	"Leonard Stern"	85	"United States"	"New York"	"Real estate"	"Real Estate"	"United States"	"Hartz Mountain Industries, Inc."	FALSE	"U"	"M"	"3/28/1938 0:00"	"Stern"	"Leonard"	"Chairman and CEO"	"4/4/2023 5:01"	"New York"	"Northeast"	1938	3	28	117.24	7.5	"$21,427,700,000,000 "	88.2	101.8	78.5	9.6	36.6	328239523	37.09024	-95.712891
"1481"	1434	2100	"Healthcare"	"Kiran Mazumdar-Shaw"	70	"India"	"Bangalore"	"Biopharmaceuticals"	"Healthcare"	"India"	"Biocon"	TRUE	"D"	"F"	"3/23/1953 0:00"	"Mazumdar-Shaw"	"Kiran"	"Chair"	"4/4/2023 5:01"	""	""	1953	3	23	180.44	7.7	"$2,611,000,000,000 "	28.1	113	69.4	11.2	49.7	1366417754	20.593684	78.96288
"1423"	1368	2200	"Technology"	"Radha Vembu"	50	"India"	"Chennai"	"Business software"	"Technology"	"India"	""	FALSE	"U"	"F"	"12/24/1972 0:00"	"Vembu"	"Radha"	""	"4/4/2023 5:01"	""	""	1972	12	24	180.44	7.7	"$2,611,000,000,000 "	28.1	113	69.4	11.2	49.7	1366417754	20.593684	78.96288
"1245"	1217	2500	"Construction & Engineering"	"Wolfgang Leitner"	70	"Austria"	"Graz"	"Engineering"	"Construction & Engineering"	"Austria"	""	TRUE	"U"	"M"	"3/27/1953 0:00"	"Leitner"	"Wolfgang"	""	"4/4/2023 5:01"	""	""	1953	3	27	118.06	1.5	"$446,314,739,528 "	85.1	103.1	81.6	25.4	51.4	8877067	47.516231	14.550072
"1533"	1516	2000	"Media & Entertainment"	"Huang Qiaoling"	64	"China"	"Hangzhou"	"Amusement parks"	"Media & Entertainment"	"China"	""	TRUE	"U"	"M"	"11/15/1958 0:00"	"Huang"	"Qiaoling"	""	"4/4/2023 5:01"	""	""	1958	11	15	125.08	2.9	"$19,910,000,000,000 "	50.6	100.2	77	9.4	59.2	1397715000	35.86166	104.195397
"843"	818	3500	"Automotive"	"Vivek Chaand Sehgal"	66	"India"	"Delhi"	"Auto parts"	"Automotive"	"Australia"	""	TRUE	"U"	"M"	"9/28/1956 0:00"	"Sehgal"	"Vivek Chaand"	""	"4/4/2023 5:01"	""	""	1956	9	28	180.44	7.7	"$2,611,000,000,000 "	28.1	113	69.4	11.2	49.7	1366417754	20.593684	78.96288
"2117"	2020	1400	"Finance & Investments"	"Alfred West, Jr."	80	"United States"	"Paoli"	"Money management"	"Finance & Investments"	"United States"	""	TRUE	"U"	"M"	"12/7/1942 0:00"	"West"	"Alfred"	""	"4/4/2023 5:01"	"Pennsylvania"	"Northeast"	1942	12	7	117.24	7.5	"$21,427,700,000,000 "	88.2	101.8	78.5	9.6	36.6	328239523	37.09024	-95.712891
"902"	878	3300	"Manufacturing"	"Todd Wanek"	59	"United States"	"St. Petersburg"	"Furniture"	"Manufacturing"	"United States"	""	FALSE	"D"	"M"	"3/16/1964 0:00"	"Wanek"	"Todd"	""	"4/4/2023 5:01"	"Florida"	"South"	1964	3	16	117.24	7.5	"$21,427,700,000,000 "	88.2	101.8	78.5	9.6	36.6	328239523	37.09024	-95.712891
"1221"	1217	2500	"Construction & Engineering"	"Riley Bechtel & family"	71	"United States"	"San Francisco"	"Engineering, construction"	"Construction & Engineering"	"United States"	"Bechtel Corp."	FALSE	"D"	"M"	"3/25/1952 0:00"	"Bechtel"	"Riley"	"former Chairman and CEO"	"4/4/2023 5:01"	"California"	"West"	1952	3	25	117.24	7.5	"$21,427,700,000,000 "	88.2	101.8	78.5	9.6	36.6	328239523	37.09024	-95.712891
"1146"	1104	2700	"Diversified"	"Karsanbhai Patel"	79	"India"	"Ahmedabad"	"Consumer goods"	"Diversified"	"India"	""	TRUE	"D"	"M"	"1/7/1944 0:00"	"Patel"	"Karsanbhai"	""	"4/4/2023 5:01"	""	""	1944	1	7	180.44	7.7	"$2,611,000,000,000 "	28.1	113	69.4	11.2	49.7	1366417754	20.593684	78.96288
"2113"	2020	1400	"Manufacturing"	"Wang Yanqing & family"	76	"China"	"Weihai"	"Carbon fiber products"	"Manufacturing"	"China"	""	FALSE	"D"	"F"	"7/2/1946 0:00"	"Wang"	"Yanqing"	""	"4/4/2023 5:01"	""	""	1946	7	2	125.08	2.9	"$19,910,000,000,000 "	50.6	100.2	77	9.4	59.2	1397715000	35.86166	104.195397
"1767"	1725	1700	"Metals & Mining"	"Lin Lairong & family"	54	"China"	"Bayannur"	"Iron ore mining"	"Metals & Mining"	"China"	""	TRUE	"D"	"M"	"8/9/1968 0:00"	"Lin"	"Lairong"	""	"4/4/2023 5:01"	""	""	1968	8	9	125.08	2.9	"$19,910,000,000,000 "	50.6	100.2	77	9.4	59.2	1397715000	35.86166	104.195397
"2061"	2020	1400	"Diversified"	"Kwek Leng Peck"	67	"Singapore"	"Singapore"	"Diversified"	"Diversified"	"Singapore"	""	FALSE	"U"	"M"	"1/1/1956 0:00"	"Kwek"	"Leng Peck"	""	"4/4/2023 5:01"	""	""	1956	1	1	114.41	0.6	"$372,062,527,489 "	84.8	100.6	83.1	13.1	21	5703569	1.352083	103.819836
"2150"	2133	1300	"Manufacturing"	"Chang Jianming & family"	58	"China"	"Shanghai"	"Industrial equipment"	"Manufacturing"	"China"	""	TRUE	"N"	"M"	"2/11/1965 0:00"	"Chang"	"Jianming"	""	"4/4/2023 5:01"	""	""	1965	2	11	125.08	2.9	"$19,910,000,000,000 "	50.6	100.2	77	9.4	59.2	1397715000	35.86166	104.195397
"2225"	2133	1300	"Diversified"	"Deniz Sahenk"	77	"Turkey"	"Istanbul"	"Diversified"	"Diversified"	"Turkey"	""	FALSE	"E"	"F"	"8/6/1945 0:00"	"Sahenk"	"Deniz"	""	"4/4/2023 5:01"	""	""	1945	8	6	234.44	15.2	"$754,411,708,203 "	23.9	93.2	77.4	17.9	42.3	83429615	38.963745	35.243322
"35"	35	35000	"Gambling & Casinos"	"Miriam Adelson & family"	77	"United States"	"Las Vegas"	"Casinos"	"Gambling & Casinos"	"United States"	""	FALSE	"U"	"F"	"10/10/1945 0:00"	"Adelson"	"Miriam"	""	"4/4/2023 5:01"	"Nevada"	"West"	1945	10	10	117.24	7.5	"$21,427,700,000,000 "	88.2	101.8	78.5	9.6	36.6	328239523	37.09024	-95.712891
"407"	405	6300	"Finance & Investments"	"John Grayken"	66	"United Kingdom"	"London"	"Private equity"	"Finance & Investments"	"Ireland"	""	TRUE	"D"	"M"	"6/1/1956 0:00"	"Grayken"	"John"	"Investor"	"4/4/2023 5:01"	""	""	1956	6	1	119.62	1.7	"$2,827,113,184,696 "	60	101.2	81.3	25.5	30.6	66834405	55.378051	-3.435973
"1288"	1272	2400	"Diversified"	"Kwek Leng Kee"	68	"Singapore"	"Singapore"	"Diversified"	"Diversified"	"Singapore"	""	FALSE	"U"	"M"	"1/1/1955 0:00"	"Kwek"	"Leng Kee"	""	"4/4/2023 5:01"	""	""	1955	1	1	114.41	0.6	"$372,062,527,489 "	84.8	100.6	83.1	13.1	21	5703569	1.352083	103.819836
"2163"	2133	1300	"Healthcare"	"Weimin Du"	59	"China"	"Shenzhen"	"Vaccines"	"Healthcare"	"China"	""	TRUE	"D"	"M"	"12/1/1963 0:00"	"Du"	"Weimin"	""	"4/4/2023 5:01"	""	""	1963	12	1	125.08	2.9	"$19,910,000,000,000 "	50.6	100.2	77	9.4	59.2	1397715000	35.86166	104.195397
"880"	878	3300	"Manufacturing"	"Bill Austin"	81	"United States"	"Brownsville"	"Hearing aids"	"Manufacturing"	"United States"	""	TRUE	"U"	"M"	"2/25/1942 0:00"	"Austin"	"Bill"	""	"4/4/2023 5:01"	"Texas"	"South"	1942	2	25	117.24	7.5	"$21,427,700,000,000 "	88.2	101.8	78.5	9.6	36.6	328239523	37.09024	-95.712891
"1709"	1647	1800	"Manufacturing"	"Tran Dinh Long"	62	"Vietnam"	"Hanoi"	"Steel"	"Manufacturing"	"Vietnam"	""	TRUE	"D"	"M"	"1/1/1961 0:00"	"Tran Dinh"	"Long"	""	"4/4/2023 5:01"	""	""	1961	1	1	163.52	2.8	"$261,921,244,843 "	28.5	110.6	75.3	19.1	37.6	96462106	14.058324	108.277199
"1869"	1804	1600	"Food & Beverage"	"Sathien Sathientham"	68	"Thailand"	"Bangkok"	"energy drinks"	"Food & Beverage"	"Thailand"	""	TRUE	"E"	"M"	"4/20/1954 0:00"	"Sathientham"	"Sathien"	""	"4/4/2023 5:01"	""	""	1954	4	20	113.27	0.7	"$543,649,976,166 "	49.3	99.8	76.9	14.9	29.5	69625582	15.870032	100.992541
"683"	679	4100	"Energy"	"John Catsimatidis"	74	"United States"	"New York"	"Oil, real estate"	"Energy"	"United States"	""	TRUE	"U"	"M"	"9/7/1948 0:00"	"Catsimatidis"	"John"	""	"4/4/2023 5:01"	"New York"	"Northeast"	1948	9	7	117.24	7.5	"$21,427,700,000,000 "	88.2	101.8	78.5	9.6	36.6	328239523	37.09024	-95.712891
"1821"	1804	1600	"Finance & Investments"	"Tench Coxe"	65	"United States"	"Palo Alto"	"Venture capital"	"Finance & Investments"	"United States"	""	TRUE	"D"	"M"	"1/14/1958 0:00"	"Coxe"	"Tench"	""	"4/4/2023 5:01"	"California"	"West"	1958	1	14	117.24	7.5	"$21,427,700,000,000 "	88.2	101.8	78.5	9.6	36.6	328239523	37.09024	-95.712891
"1140"	1104	2700	"Metals & Mining"	"Patrice Motsepe"	61	"South Africa"	"Johannesburg"	"Mining"	"Metals & Mining"	"South Africa"	""	TRUE	"D"	"M"	"1/28/1962 0:00"	"Motsepe"	"Patrice"	""	"4/4/2023 5:01"	""	""	1962	1	28	158.93	4.1	"$351,431,649,241 "	22.4	100.9	63.9	27.5	29.2	58558270	-30.559482	22.937506
"736"	721	3900	"Diversified"	"Pedro Moreira Salles"	63	"Brazil"	"Sao Paulo"	"Banking, minerals"	"Diversified"	"Brazil"	""	FALSE	"U"	"M"	"10/20/1959 0:00"	"Moreira Salles"	"Pedro"	""	"4/4/2023 5:01"	""	""	1959	10	20	167.4	3.7	"$1,839,758,040,766 "	51.3	115.4	75.7	14.2	65.1	212559417	-14.235004	-51.92528
"1387"	1368	2200	"Real Estate"	"Chulong Huang"	64	"China"	"Shenzhen"	"Real estate"	"Real Estate"	"Canada"	""	TRUE	"D"	"M"	"1/1/1959 0:00"	"Huang"	"Chulong"	""	"4/4/2023 5:01"	""	""	1959	1	1	125.08	2.9	"$19,910,000,000,000 "	50.6	100.2	77	9.4	59.2	1397715000	35.86166	104.195397
"200"	195	9600	"Food & Beverage"	"Valerie Mars"	64	"United States"	"New York"	"Candy, pet food"	"Food & Beverage"	"United States"	""	FALSE	"U"	"F"	"1/26/1959 0:00"	"Mars"	"Valerie"	""	"4/4/2023 5:01"	"New York"	"Northeast"	1959	1	26	117.24	7.5	"$21,427,700,000,000 "	88.2	101.8	78.5	9.6	36.6	328239523	37.09024	-95.712891
"1615"	1575	1900	"Food & Beverage"	"Sarah MacMillan"	69	"United States"	"Los Angeles"	"Cargill"	"Food & Beverage"	"United States"	""	FALSE	"D"	"F"	"1/1/1954 0:00"	"MacMillan"	"Sarah"	""	"4/4/2023 5:01"	"California"	"West"	1954	1	1	117.24	7.5	"$21,427,700,000,000 "	88.2	101.8	78.5	9.6	36.6	328239523	37.09024	-95.712891
"1749"	1725	1700	"Real Estate"	"Asok Kumar Hiranandani"	68	"Singapore"	"Singapore"	"Real estate"	"Real Estate"	"Singapore"	""	FALSE	"U"	"M"	"11/28/1954 0:00"	"Hiranandani"	"Asok Kumar"	""	"4/4/2023 5:01"	""	""	1954	11	28	114.41	0.6	"$372,062,527,489 "	84.8	100.6	83.1	13.1	21	5703569	1.352083	103.819836
"588"	580	4700	"Media & Entertainment"	"Thomas Secunda"	68	"United States"	"Croton-on-Hudson"	"Bloomberg LP"	"Media & Entertainment"	"United States"	""	TRUE	"U"	"M"	"6/23/1954 0:00"	"Secunda"	"Thomas"	""	"4/4/2023 5:01"	"New York"	"Northeast"	1954	6	23	117.24	7.5	"$21,427,700,000,000 "	88.2	101.8	78.5	9.6	36.6	328239523	37.09024	-95.712891
"326"	325	7100	"Gambling & Casinos"	"Johann Graf"	76	"Austria"	"Vienna"	"Gambling"	"Gambling & Casinos"	"Austria"	""	TRUE	"U"	"M"	"1/3/1947 0:00"	"Graf"	"Johann"	""	"4/4/2023 5:01"	""	""	1947	1	3	118.06	1.5	"$446,314,739,528 "	85.1	103.1	81.6	25.4	51.4	8877067	47.516231	14.550072
"659"	659	4200	"Service"	"Shari Arison"	65	"Israel"	"Tel Aviv"	"Carnival Cruises"	"Service"	"Israel"	""	FALSE	"D"	"F"	"9/9/1957 0:00"	"Arison"	"Shari"	"Investor, Philanthropist"	"4/4/2023 5:01"	""	""	1957	9	9	108.15	0.8	"$395,098,666,122 "	63.4	104.9	82.8	23.1	25.3	9053300	31.046051	34.851612
"2471"	2405	1100	"Energy"	"Andrei Kosogov"	62	"Russia"	"Moscow"	"Banking"	"Energy"	"Russia"	""	TRUE	"D"	"M"	"3/15/1961 0:00"	"Kosogov"	"Andrei"	""	"4/4/2023 5:01"	""	""	1961	3	15	180.75	4.5	"$1,699,876,578,871 "	81.9	102.6	72.7	11.4	46.2	144373535	61.52401	105.318756
"1683"	1647	1800	"Media & Entertainment"	"Jose Roberto Marinho"	67	"Brazil"	"Rio de Janeiro"	"Media"	"Media & Entertainment"	"Brazil"	""	FALSE	"D"	"M"	"12/26/1955 0:00"	"Marinho"	"Jose Roberto"	""	"4/4/2023 5:01"	""	""	1955	12	26	167.4	3.7	"$1,839,758,040,766 "	51.3	115.4	75.7	14.2	65.1	212559417	-14.235004	-51.92528
"1238"	1217	2500	"Finance & Investments"	"Alec Gores"	70	"United States"	"Beverly Hills"	"Private equity"	"Finance & Investments"	"United States"	""	TRUE	"D"	"M"	"3/18/1953 0:00"	"Gores"	"Alec"	""	"4/4/2023 5:01"	"California"	"West"	1953	3	18	117.24	7.5	"$21,427,700,000,000 "	88.2	101.8	78.5	9.6	36.6	328239523	37.09024	-95.712891
"2425"	2405	1100	"Energy"	"Gang Chen"	55	"China"	"Guangzhou"	"Solar energy"	"Energy"	"China"	""	TRUE	"D"	"M"	"1/1/1968 0:00"	"Chen"	"Gang"	""	"4/4/2023 5:01"	""	""	1968	1	1	125.08	2.9	"$19,910,000,000,000 "	50.6	100.2	77	9.4	59.2	1397715000	35.86166	104.195397
"1362"	1312	2300	"Real Estate"	"Wang Zhenhua"	61	"China"	"Shanghai"	"Real estate"	"Real Estate"	"China"	""	TRUE	"D"	"M"	"3/1/1962 0:00"	"Wang"	"Zhenhua"	""	"4/4/2023 5:01"	""	""	1962	3	1	125.08	2.9	"$19,910,000,000,000 "	50.6	100.2	77	9.4	59.2	1397715000	35.86166	104.195397
"992"	982	3000	"Real Estate"	"Mang Yee Chu & family"	63	"China"	"Guangzhou"	"Real estate"	"Real Estate"	"China"	""	TRUE	"D"	"M"	"1/1/1960 0:00"	"Chu"	"Mang Yee"	""	"4/4/2023 5:01"	""	""	1960	1	1	125.08	2.9	"$19,910,000,000,000 "	50.6	100.2	77	9.4	59.2	1397715000	35.86166	104.195397
"970"	949	3100	"Finance & Investments"	"Jonathan Nelson"	66	"United States"	"Providence"	"Private equity"	"Finance & Investments"	"United States"	"Providence Equity Partners"	TRUE	"U"	"M"	"5/18/1956 0:00"	"Nelson"	"Jonathan"	"Executive Chairman "	"4/4/2023 5:01"	"Rhode Island"	"Northeast"	1956	5	18	117.24	7.5	"$21,427,700,000,000 "	88.2	101.8	78.5	9.6	36.6	328239523	37.09024	-95.712891
"1537"	1516	2000	"Technology"	"Shlomo Kramer"	57	"Israel"	"Tel Aviv"	"Software, investments"	"Technology"	"Israel"	""	TRUE	"D"	"M"	"3/14/1966 0:00"	"Kramer"	"Shlomo"	""	"4/4/2023 5:01"	""	""	1966	3	14	108.15	0.8	"$395,098,666,122 "	63.4	104.9	82.8	23.1	25.3	9053300	31.046051	34.851612
"1805"	1804	1600	"Construction & Engineering"	"Syed Mokhtar AlBukhary"	71	"Malaysia"	"Kuala Lumpur"	"Engineering, automotive"	"Construction & Engineering"	"Malaysia"	""	TRUE	"U"	"M"	"12/12/1951 0:00"	"AlBukhary"	"Syed Mokhtar"	""	"4/4/2023 5:01"	""	""	1951	12	12	121.46	0.7	"$364,701,517,788 "	45.1	105.3	76	12	38.7	32447385	4.210484	101.975766
"1417"	1368	2200	"Diversified"	"Teresita Sy-Coson"	72	"Philippines"	"Manila"	"Diversified"	"Diversified"	"Philippines"	""	FALSE	"D"	"F"	"10/1/1950 0:00"	"Sy-Coson"	"Teresita"	""	"4/4/2023 5:01"	""	""	1950	10	1	129.61	2.5	"$376,795,508,680 "	35.5	107.5	71.1	14	43.1	108116615	12.879721	121.774017
"547"	534	5000	"Real Estate"	"Alexandra Schoerghuber & family"	64	"Germany"	"Munich"	"Real estate"	"Real Estate"	"Germany"	""	FALSE	"U"	"F"	"7/24/1958 0:00"	"Schoerghuber"	"Alexandra"	""	"4/4/2023 5:01"	""	""	1958	7	24	112.85	1.4	"$3,845,630,030,824 "	70.2	104	80.9	11.5	48.8	83132799	51.165691	10.451526
"173"	171	10200	"Technology"	"David Duffield"	82	"United States"	"Incline Village"	"Business software"	"Technology"	"United States"	"Workday"	TRUE	"D"	"M"	"9/21/1940 0:00"	"Duffield"	"David"	"Chairman and Cofounder"	"4/4/2023 5:01"	"Nevada"	"West"	1940	9	21	117.24	7.5	"$21,427,700,000,000 "	88.2	101.8	78.5	9.6	36.6	328239523	37.09024	-95.712891
"1220"	1217	2500	"Fashion & Retail"	"Ted Alfond"	78	"United States"	"Weston"	"Shoes"	"Fashion & Retail"	"United States"	""	FALSE	"D"	"M"	"8/19/1944 0:00"	"Alfond"	"Ted"	""	"4/4/2023 5:01"	"Massachusetts"	"Northeast"	1944	8	19	117.24	7.5	"$21,427,700,000,000 "	88.2	101.8	78.5	9.6	36.6	328239523	37.09024	-95.712891
"1938"	1905	1500	"Real Estate"	"Niranjan Hiranandani"	73	"India"	"Mumbai"	"Real estate"	"Real Estate"	"India"	""	TRUE	"E"	"M"	"3/8/1950 0:00"	"Hiranandani"	"Niranjan"	""	"4/4/2023 5:01"	""	""	1950	3	8	180.44	7.7	"$2,611,000,000,000 "	28.1	113	69.4	11.2	49.7	1366417754	20.593684	78.96288
"2625"	2540	1000	"Healthcare"	"Wan Feng & family"	54	"China"	"Shenzhen"	"Medical equipment"	"Healthcare"	"China"	""	TRUE	"R"	"M"	"1/1/1969 0:00"	"Wan"	"Feng"	""	"4/4/2023 5:01"	""	""	1969	1	1	125.08	2.9	"$19,910,000,000,000 "	50.6	100.2	77	9.4	59.2	1397715000	35.86166	104.195397
"1738"	1725	1700	"Automotive"	"Francois Feuillet & family"	74	"France"	"Paris"	"Motorhomes, RVs"	"Automotive"	"France"	""	FALSE	"D"	"M"	"1/1/1949 0:00"	"Feuillet"	"Francois"	""	"4/4/2023 5:01"	""	""	1949	1	1	110.05	1.1	"$2,715,518,274,227 "	65.6	102.5	82.5	24.2	60.7	67059887	46.227638	2.213749
"446"	445	5700	"Healthcare"	"John Brown"	88	"United States"	"Atlanta"	"Medical equipment"	"Healthcare"	"United States"	""	TRUE	"U"	"M"	"9/15/1934 0:00"	"Brown"	"John"	""	"4/4/2023 5:01"	"Georgia"	"South"	1934	9	15	117.24	7.5	"$21,427,700,000,000 "	88.2	101.8	78.5	9.6	36.6	328239523	37.09024	-95.712891
"1962"	1905	1500	"Diversified"	"Youssef Mansour"	77	"Egypt"	"Cairo"	"Diversified"	"Diversified"	"Egypt"	""	TRUE	"E"	"M"	"5/21/1945 0:00"	"Mansour"	"Youssef"	""	"4/4/2023 5:01"	""	""	1945	5	21	288.57	9.2	"$303,175,127,598 "	35.2	106.3	71.8	12.5	44.4	100388073	26.820553	30.802498
"1628"	1575	1900	"Manufacturing"	"Qinxiang Shao"	68	"China"	"Hangzhou"	"Diversified"	"Manufacturing"	"China"	""	TRUE	"U"	"M"	"9/1/1954 0:00"	"Shao"	"Qinxiang"	""	"4/4/2023 5:01"	""	""	1954	9	1	125.08	2.9	"$19,910,000,000,000 "	50.6	100.2	77	9.4	59.2	1397715000	35.86166	104.195397
"2238"	2133	1300	"Metals & Mining"	"Konstantin Strukov & family"	64	"Russia"	"Chelyabinsk"	"Gold, coal mining"	"Metals & Mining"	"Russia"	""	TRUE	"R"	"M"	"9/10/1958 0:00"	"Strukov"	"Konstantin"	""	"4/4/2023 5:01"	""	""	1958	9	10	180.75	4.5	"$1,699,876,578,871 "	81.9	102.6	72.7	11.4	46.2	144373535	61.52401	105.318756
"2176"	2133	1300	"Service"	"Mitchell Jacobson"	72	"United States"	"Locust Valley"	"Industrial equipment"	"Service"	"United States"	""	FALSE	"E"	"M"	"3/6/1951 0:00"	"Jacobson"	"Mitchell"	""	"4/4/2023 5:01"	"New York"	"Northeast"	1951	3	6	117.24	7.5	"$21,427,700,000,000 "	88.2	101.8	78.5	9.6	36.6	328239523	37.09024	-95.712891
"1244"	1217	2500	"Real Estate"	"Brad Kelley"	66	"United States"	"Franklin"	"Tobacco"	"Real Estate"	"United States"	""	TRUE	"D"	"M"	"12/23/1956 0:00"	"Kelley"	"Brad"	""	"4/4/2023 5:01"	"Tennessee"	"South"	1956	12	23	117.24	7.5	"$21,427,700,000,000 "	88.2	101.8	78.5	9.6	36.6	328239523	37.09024	-95.712891
"235"	232	8600	"Technology"	"Hasso Plattner & family"	79	"Germany"	"Heidelberg"	"Software"	"Technology"	"Germany"	""	TRUE	"U"	"M"	"1/21/1944 0:00"	"Plattner"	"Hasso"	""	"4/4/2023 5:01"	""	""	1944	1	21	112.85	1.4	"$3,845,630,030,824 "	70.2	104	80.9	11.5	48.8	83132799	51.165691	10.451526
"1600"	1575	1900	"Manufacturing"	"Surjit Kumar Gupta"	81	"India"	"Delhi"	"Electrical equipment"	"Manufacturing"	"India"	""	FALSE	"U"	"M"	"1/13/1942 0:00"	"Gupta"	"Surjit Kumar"	""	"4/4/2023 5:01"	""	""	1942	1	13	180.44	7.7	"$2,611,000,000,000 "	28.1	113	69.4	11.2	49.7	1366417754	20.593684	78.96288
"1999"	1905	1500	"Manufacturing"	"Prachak Tangkaravakoon"	79	"Thailand"	"Bangkok"	"Paints"	"Manufacturing"	"Thailand"	""	TRUE	"U"	"M"	"3/26/1944 0:00"	"Tangkaravakoon"	"Prachak"	""	"4/4/2023 5:01"	""	""	1944	3	26	113.27	0.7	"$543,649,976,166 "	49.3	99.8	76.9	14.9	29.5	69625582	15.870032	100.992541
"2370"	2259	1200	"Food & Beverage"	"Tony Tan Caktiong"	70	"Philippines"	"Manila"	"Food"	"Food & Beverage"	"Philippines"	""	TRUE	"D"	"M"	"1/5/1953 0:00"	"Tan Caktiong"	"Tony"	""	"4/4/2023 5:01"	""	""	1953	1	5	129.61	2.5	"$376,795,508,680 "	35.5	107.5	71.1	14	43.1	108116615	12.879721	121.774017
"132"	130	13700	"Technology"	"Jan Koum"	47	"United States"	"Atherton"	"WhatsApp"	"Technology"	"United States"	"WhatsApp Inc."	TRUE	"U"	"M"	"2/24/1976 0:00"	"Koum"	"Jan"	"CEO, cofounder"	"4/4/2023 5:01"	"California"	"West"	1976	2	24	117.24	7.5	"$21,427,700,000,000 "	88.2	101.8	78.5	9.6	36.6	328239523	37.09024	-95.712891
"1324"	1312	2300	"Technology"	"Daniel Ek"	40	"Sweden"	"Stockholm"	"Spotify"	"Technology"	"Sweden"	"Spotify"	TRUE	"D"	"M"	"2/21/1983 0:00"	"Ek"	"Daniel"	"CEO"	"4/4/2023 5:01"	""	""	1983	2	21	110.51	1.8	"$530,832,908,738 "	67	126.6	82.5	27.9	49.1	10285453	60.128161	18.643501
"462"	455	5600	"Service"	"Robert Rowling"	69	"United States"	"Dallas"	"Hotels, investments"	"Service"	"United States"	""	FALSE	"U"	"M"	"9/26/1953 0:00"	"Rowling"	"Robert"	""	"4/4/2023 5:01"	"Texas"	"South"	1953	9	26	117.24	7.5	"$21,427,700,000,000 "	88.2	101.8	78.5	9.6	36.6	328239523	37.09024	-95.712891
"411"	411	6200	"Food & Beverage"	"Maria Asuncion Aramburuzabala & family"	59	"Mexico"	"Mexico City"	"Beer, investments"	"Food & Beverage"	"Mexico"	""	FALSE	"E"	"F"	"5/2/1963 0:00"	"Aramburuzabala"	"Maria Asuncion"	""	"4/4/2023 5:01"	""	""	1963	5	2	141.54	3.6	"$1,258,286,717,125 "	40.2	105.8	75	13.1	55.1	126014024	23.634501	-102.552784
"352"	352	6800	"Energy"	"Dannine Avara"	59	"United States"	"Houston"	"Pipelines"	"Energy"	"United States"	""	FALSE	"U"	"F"	"3/9/1964 0:00"	"Avara"	"Dannine"	""	"4/4/2023 5:01"	"Texas"	"South"	1964	3	9	117.24	7.5	"$21,427,700,000,000 "	88.2	101.8	78.5	9.6	36.6	328239523	37.09024	-95.712891
"436"	425	6000	"Fashion & Retail"	"Les Wexner & family"	85	"United States"	"New Albany"	"Retail"	"Fashion & Retail"	"United States"	""	TRUE	"U"	"M"	"9/8/1937 0:00"	"Wexner"	"Les"	""	"4/4/2023 5:01"	"Ohio"	"Midwest"	1937	9	8	117.24	7.5	"$21,427,700,000,000 "	88.2	101.8	78.5	9.6	36.6	328239523	37.09024	-95.712891
"2118"	2020	1400	"Manufacturing"	"Bo Wu"	68	"China"	"Nanjing"	"Machinery"	"Manufacturing"	"China"	""	TRUE	"E"	"M"	"5/1/1954 0:00"	"Wu"	"Bo"	""	"4/4/2023 5:01"	""	""	1954	5	1	125.08	2.9	"$19,910,000,000,000 "	50.6	100.2	77	9.4	59.2	1397715000	35.86166	104.195397
"2404"	2259	1200	"Construction & Engineering"	"Zhu Xingliang"	63	"China"	"Suzhou"	"Construction"	"Construction & Engineering"	"China"	""	TRUE	"D"	"M"	"5/1/1959 0:00"	"Zhu"	"Xingliang"	""	"4/4/2023 5:01"	""	""	1959	5	1	125.08	2.9	"$19,910,000,000,000 "	50.6	100.2	77	9.4	59.2	1397715000	35.86166	104.195397
"1771"	1725	1700	"Technology"	"Yusaku Maezawa"	47	"Japan"	"Chiba"	"Online retail"	"Technology"	"Japan"	""	TRUE	"D"	"M"	"11/22/1975 0:00"	"Maezawa"	"Yusaku"	""	"4/4/2023 5:01"	""	""	1975	11	22	105.48	0.5	"$5,081,769,542,380 "	63.2	98.8	84.2	11.9	46.7	126226568	36.204824	138.252924
"2624"	2540	1000	"Technology"	"Shigefumi Wada"	70	"Japan"	"Nakano, Tokyo"	"Software"	"Technology"	"Japan"	""	TRUE	"E"	"M"	"8/30/1952 0:00"	"Wada"	"Shigefumi"	""	"4/4/2023 5:01"	""	""	1952	8	30	105.48	0.5	"$5,081,769,542,380 "	63.2	98.8	84.2	11.9	46.7	126226568	36.204824	138.252924
"1591"	1575	1900	"Sports"	"Mark Davis"	67	"United States"	"Henderson"	"Las Vegas Raiders"	"Sports"	"United States"	""	FALSE	"N"	"M"	"5/18/1955 0:00"	"Davis"	"Mark"	""	"4/4/2023 5:01"	"Nevada"	"West"	1955	5	18	117.24	7.5	"$21,427,700,000,000 "	88.2	101.8	78.5	9.6	36.6	328239523	37.09024	-95.712891
"2214"	2133	1300	"Healthcare"	"John Oyler"	55	"United States"	""	"Biotech"	"Healthcare"	"United States"	""	TRUE	"U"	"M"	"4/3/1968 0:00"	"Oyler"	"John"	""	"4/4/2023 5:01"	"Nevada"	"West"	1968	4	3	117.24	7.5	"$21,427,700,000,000 "	88.2	101.8	78.5	9.6	36.6	328239523	37.09024	-95.712891
"1876"	1804	1600	"Diversified"	"Laurie Tisch"	72	"United States"	"New York"	"Insurance, NFL team"	"Diversified"	"United States"	""	FALSE	"U"	"F"	"2/19/1951 0:00"	"Tisch"	"Laurie"	""	"4/4/2023 5:01"	"New York"	"Northeast"	1951	2	19	117.24	7.5	"$21,427,700,000,000 "	88.2	101.8	78.5	9.6	36.6	328239523	37.09024	-95.712891
"1678"	1647	1800	"Sports"	"Joe Lacob"	67	"United States"	"Atherton"	"Golden State Warriors"	"Sports"	"United States"	""	TRUE	"U"	"M"	"1/10/1956 0:00"	"Lacob"	"Joe"	""	"4/4/2023 5:01"	"California"	"West"	1956	1	10	117.24	7.5	"$21,427,700,000,000 "	88.2	101.8	78.5	9.6	36.6	328239523	37.09024	-95.712891
"2220"	2133	1300	"Healthcare"	"P.V. Ramprasad Reddy"	65	"India"	"Hyderabad"	"Pharmaceuticals"	"Healthcare"	"India"	""	TRUE	"D"	"M"	"3/30/1958 0:00"	"Reddy"	"P.V. Ramprasad"	""	"4/4/2023 5:01"	""	""	1958	3	30	180.44	7.7	"$2,611,000,000,000 "	28.1	113	69.4	11.2	49.7	1366417754	20.593684	78.96288
"1954"	1905	1500	"Manufacturing"	"Li Jianli"	50	"China"	"Shenzhen"	"Lithium-ion battery cap"	"Manufacturing"	"China"	""	TRUE	"D"	"M"	"9/27/1972 0:00"	"Li"	"Jianli"	""	"4/4/2023 5:01"	""	""	1972	9	27	125.08	2.9	"$19,910,000,000,000 "	50.6	100.2	77	9.4	59.2	1397715000	35.86166	104.195397
"2100"	2020	1400	"Healthcare"	"Carlos Sanchez"	61	"Brazil"	"Santo Andre"	"Generic drugs"	"Healthcare"	"Brazil"	""	FALSE	"E"	"M"	"1/21/1962 0:00"	"Sanchez"	"Carlos"	""	"4/4/2023 5:01"	""	""	1962	1	21	167.4	3.7	"$1,839,758,040,766 "	51.3	115.4	75.7	14.2	65.1	212559417	-14.235004	-51.92528
"1106"	1104	2700	"Diversified"	"Suhail Bahwan"	84	"Oman"	"Muscat"	"Diversified"	"Diversified"	"Oman"	""	TRUE	"U"	"M"	"1/1/1939 0:00"	"Bahwan"	"Suhail"	""	"4/4/2023 5:01"	""	""	1939	1	1	113.53	0.1	"$76,983,094,928 "	38	103.4	77.6	2.5	27.4	5266535	21.4735329	55.975413
"918"	905	3200	"Fashion & Retail"	"Sergei Galitsky"	55	"Russia"	"Krasnodar"	"Retail"	"Fashion & Retail"	"Russia"	""	TRUE	"E"	"M"	"8/14/1967 0:00"	"Galitsky"	"Sergei"	""	"4/4/2023 5:01"	""	""	1967	8	14	180.75	4.5	"$1,699,876,578,871 "	81.9	102.6	72.7	11.4	46.2	144373535	61.52401	105.318756
"606"	591	4600	"Logistics"	"Fred Smith"	78	"United States"	"Memphis"	"FedEx"	"Logistics"	"United States"	"FedEx Corp."	TRUE	"D"	"M"	"8/11/1944 0:00"	"Smith"	"Fred"	"Chairman and CEO"	"4/4/2023 5:01"	"Tennessee"	"South"	1944	8	11	117.24	7.5	"$21,427,700,000,000 "	88.2	101.8	78.5	9.6	36.6	328239523	37.09024	-95.712891
"1129"	1104	2700	"Diversified"	"Mustafa Rahmi Koc"	92	"Turkey"	"Istanbul"	"Diversified"	"Diversified"	"Turkey"	""	FALSE	"U"	"M"	"10/9/1930 0:00"	"Koc"	"Mustafa Rahmi"	""	"4/4/2023 5:01"	""	""	1930	10	9	234.44	15.2	"$754,411,708,203 "	23.9	93.2	77.4	17.9	42.3	83429615	38.963745	35.243322
"1752"	1725	1700	"Real Estate"	"Keeree Kanjanapas"	72	"Thailand"	"Bangkok"	"Transportation"	"Real Estate"	"Thailand"	""	TRUE	"D"	"M"	"10/18/1950 0:00"	"Kanjanapas"	"Keeree"	""	"4/4/2023 5:01"	""	""	1950	10	18	113.27	0.7	"$543,649,976,166 "	49.3	99.8	76.9	14.9	29.5	69625582	15.870032	100.992541
"1369"	1368	2200	"Finance & Investments"	"Brian Armstrong"	40	"United States"	"San Francisco"	"Cryptocurrency"	"Finance & Investments"	"United States"	""	TRUE	"D"	"M"	"1/25/1983 0:00"	"Armstrong"	"Brian"	""	"4/4/2023 5:01"	"California"	"West"	1983	1	25	117.24	7.5	"$21,427,700,000,000 "	88.2	101.8	78.5	9.6	36.6	328239523	37.09024	-95.712891
"2357"	2259	1200	"Technology"	"Eric Ya Shen"	52	"China"	"Guangzhou"	"Online apparel retail"	"Technology"	"China"	""	TRUE	"R"	"M"	"1/1/1971 0:00"	"Shen"	"Eric Ya"	""	"4/4/2023 5:01"	""	""	1971	1	1	125.08	2.9	"$19,910,000,000,000 "	50.6	100.2	77	9.4	59.2	1397715000	35.86166	104.195397
"2354"	2259	1200	"Construction & Engineering"	"Dhruv Sawhney"	78	"United Arab Emirates"	"Dubai"	"Engineering, sugar"	"Construction & Engineering"	"India"	""	FALSE	"U"	"M"	"6/26/1944 0:00"	"Sawhney"	"Dhruv"	""	"4/4/2023 5:01"	""	""	1944	6	26	114.52	-1.9	"$421,142,267,938 "	36.8	108.4	77.8	0.1	15.9	9770529	23.424076	53.847818
"1944"	1905	1500	"Healthcare"	"Ramesh Juneja"	67	"India"	"Delhi"	"Pharmaceuticals"	"Healthcare"	"India"	""	TRUE	"U"	"M"	"7/28/1955 0:00"	"Juneja"	"Ramesh"	""	"4/4/2023 5:01"	""	""	1955	7	28	180.44	7.7	"$2,611,000,000,000 "	28.1	113	69.4	11.2	49.7	1366417754	20.593684	78.96288
"2586"	2540	1000	"Finance & Investments"	"Marcelo Kalim"	53	"Brazil"	"Sao Paulo"	"Banking"	"Finance & Investments"	"Brazil"	""	TRUE	"E"	"M"	"10/15/1969 0:00"	"Kalim"	"Marcelo"	""	"4/4/2023 5:01"	""	""	1969	10	15	167.4	3.7	"$1,839,758,040,766 "	51.3	115.4	75.7	14.2	65.1	212559417	-14.235004	-51.92528
"770"	766	3700	"Technology"	"Huang Li"	59	"China"	"Wuhan"	"Imaging systems"	"Technology"	"China"	""	TRUE	"D"	"M"	"6/27/1963 0:00"	"Huang"	"Li"	""	"4/4/2023 5:01"	""	""	1963	6	27	125.08	2.9	"$19,910,000,000,000 "	50.6	100.2	77	9.4	59.2	1397715000	35.86166	104.195397
"1712"	1647	1800	"Technology"	"Pieter van der Does"	53	"Netherlands"	"Amsterdam"	"Payments software"	"Technology"	"Netherlands"	""	TRUE	"D"	"M"	"5/1/1969 0:00"	"van der Does"	"Pieter"	""	"4/4/2023 5:01"	""	""	1969	5	1	115.91	2.6	"$909,070,395,161 "	85	104.2	81.8	23	41.2	17332850	52.132633	5.291266
"1817"	1804	1600	"Technology"	"Chey Tae-won"	62	"South Korea"	"Seoul"	"Oil, semiconductor"	"Technology"	"South Korea"	"SK Holdings"	FALSE	"D"	"M"	"12/3/1960 0:00"	"Chey"	"Tae-won"	""	"4/4/2023 5:01"	""	""	1960	12	3	115.16	0.4	"$2,029,000,000,000 "	94.3	98.1	82.6	15.6	33.2	51709098	35.907757	127.766922
"1372"	1368	2200	"Technology"	"Aneel Bhusri"	57	"United States"	"San Francisco"	"Business software"	"Technology"	"United States"	"Workday"	TRUE	"D"	"M"	"2/4/1966 0:00"	"Bhusri"	"Aneel"	"Investor"	"4/4/2023 5:01"	"California"	"West"	1966	2	4	117.24	7.5	"$21,427,700,000,000 "	88.2	101.8	78.5	9.6	36.6	328239523	37.09024	-95.712891
"2311"	2259	1200	"Real Estate"	"Alexander Klyachin"	55	"Russia"	"Moscow"	"Real estate"	"Real Estate"	"Russia"	""	TRUE	"R"	"M"	"5/18/1967 0:00"	"Klyachin"	"Alexander"	""	"4/4/2023 5:01"	""	""	1967	5	18	180.75	4.5	"$1,699,876,578,871 "	81.9	102.6	72.7	11.4	46.2	144373535	61.52401	105.318756
"1513"	1434	2100	"Manufacturing"	"Yuan Fugen & family"	72	"China"	"Suzhou"	"Metal processing"	"Manufacturing"	"China"	""	TRUE	"U"	"M"	"11/15/1950 0:00"	"Yuan"	"Fugen"	""	"4/4/2023 5:01"	""	""	1950	11	15	125.08	2.9	"$19,910,000,000,000 "	50.6	100.2	77	9.4	59.2	1397715000	35.86166	104.195397
"2188"	2133	1300	"Technology"	"Michael Krasny"	69	"United States"	"Highland Park"	"Retail"	"Technology"	"United States"	"Sawdust Investment Management Corp."	TRUE	"E"	"M"	"8/8/1953 0:00"	"Krasny"	"Michael"	"Investor"	"4/4/2023 5:01"	"Illinois"	"Midwest"	1953	8	8	117.24	7.5	"$21,427,700,000,000 "	88.2	101.8	78.5	9.6	36.6	328239523	37.09024	-95.712891
"542"	534	5000	"Fashion & Retail"	"Jane Lauder"	50	"United States"	"New York"	"Este Lauder"	"Fashion & Retail"	"United States"	""	FALSE	"D"	"F"	"1/1/1973 0:00"	"Lauder"	"Jane"	""	"4/4/2023 5:01"	"New York"	"Northeast"	1973	1	1	117.24	7.5	"$21,427,700,000,000 "	88.2	101.8	78.5	9.6	36.6	328239523	37.09024	-95.712891
"223"	223	8800	"Fashion & Retail"	"Tatyana Bakalchuk"	47	"Russia"	"Moscow region"	"Ecommerce"	"Fashion & Retail"	"Russia"	""	TRUE	"U"	"F"	"10/16/1975 0:00"	"Bakalchuk"	"Tatyana"	""	"4/4/2023 5:01"	""	""	1975	10	16	180.75	4.5	"$1,699,876,578,871 "	81.9	102.6	72.7	11.4	46.2	144373535	61.52401	105.318756
"1393"	1368	2200	"Fashion & Retail"	"Solomon Lew"	78	"Australia"	"Melbourne"	"Retail"	"Fashion & Retail"	"Australia"	""	TRUE	"D"	"M"	"3/22/1945 0:00"	"Lew"	"Solomon"	""	"4/4/2023 5:01"	""	""	1945	3	22	119.8	1.6	"$1,392,680,589,329 "	113.1	100.3	82.7	23	47.4	25766605	-25.274398	133.775136
"426"	425	6000	"Real Estate"	"Rene Benko"	46	"Austria"	""	"Real estate, retail"	"Real Estate"	"Austria"	""	TRUE	"U"	"M"	"3/20/1977 0:00"	"Benko"	"Rene"	""	"4/4/2023 5:01"	""	""	1977	3	20	118.06	1.5	"$446,314,739,528 "	85.1	103.1	81.6	25.4	51.4	8877067	47.516231	14.550072
"697"	679	4100	"Technology"	"Ken Xie"	60	"United States"	"Los Altos Hills"	"Cybersecurity"	"Technology"	"United States"	""	TRUE	"D"	"M"	"1/26/1963 0:00"	"Xie"	"Ken"	""	"4/4/2023 5:01"	"California"	"West"	1963	1	26	117.24	7.5	"$21,427,700,000,000 "	88.2	101.8	78.5	9.6	36.6	328239523	37.09024	-95.712891
"3"	3	114000	"Technology"	"Jeff Bezos"	59	"United States"	"Medina"	"Amazon"	"Technology"	"United States"	"Amazon"	TRUE	"D"	"M"	"1/12/1964 0:00"	"Bezos"	"Jeff"	"Chairman and Founder"	"4/4/2023 5:01"	"Washington"	"West"	1964	1	12	117.24	7.5	"$21,427,700,000,000 "	88.2	101.8	78.5	9.6	36.6	328239523	37.09024	-95.712891
"656"	636	4300	"Manufacturing"	"Wang Junshi & family"	74	"China"	"Ningbo"	"Solar inverters"	"Manufacturing"	"China"	""	TRUE	"D"	"M"	"1/1/1949 0:00"	"Wang"	"Junshi"	""	"4/4/2023 5:01"	""	""	1949	1	1	125.08	2.9	"$19,910,000,000,000 "	50.6	100.2	77	9.4	59.2	1397715000	35.86166	104.195397
"1224"	1217	2500	"Food & Beverage"	"Vivek Chand Burman"	85	"India"	"Delhi"	"Consumer goods"	"Food & Beverage"	"India"	""	FALSE	"D"	"M"	"4/28/1937 0:00"	"Burman"	"Vivek Chand"	""	"4/4/2023 5:01"	""	""	1937	4	28	180.44	7.7	"$2,611,000,000,000 "	28.1	113	69.4	11.2	49.7	1366417754	20.593684	78.96288
"1796"	1725	1700	"Manufacturing"	"Wu Lanlan & family"	49	"China"	"Shenzhen"	"Packaging"	"Manufacturing"	"China"	""	TRUE	"D"	"F"	"1/1/1974 0:00"	"Wu"	"Lanlan"	""	"4/4/2023 5:01"	""	""	1974	1	1	125.08	2.9	"$19,910,000,000,000 "	50.6	100.2	77	9.4	59.2	1397715000	35.86166	104.195397
"1543"	1516	2000	"Energy"	"Lin Fanlian"	61	"China"	"Linyi"	"Energy, real estate"	"Energy"	"China"	""	TRUE	"D"	"M"	"6/1/1961 0:00"	"Lin"	"Fanlian"	""	"4/4/2023 5:01"	""	""	1961	6	1	125.08	2.9	"$19,910,000,000,000 "	50.6	100.2	77	9.4	59.2	1397715000	35.86166	104.195397
"1172"	1164	2600	"Healthcare"	"Cen Junda"	58	"China"	"Lianyungang"	"Pharmaceuticals"	"Healthcare"	"China"	""	TRUE	"U"	"M"	"6/18/1964 0:00"	"Cen"	"Junda"	""	"4/4/2023 5:01"	""	""	1964	6	18	125.08	2.9	"$19,910,000,000,000 "	50.6	100.2	77	9.4	59.2	1397715000	35.86166	104.195397
"2596"	2540	1000	"Finance & Investments"	"Lev Kvetnoi"	57	"Russia"	"Moscow"	"Cement"	"Finance & Investments"	"Russia"	""	TRUE	"R"	"M"	"8/27/1965 0:00"	"Kvetnoi"	"Lev"	""	"4/4/2023 5:01"	""	""	1965	8	27	180.75	4.5	"$1,699,876,578,871 "	81.9	102.6	72.7	11.4	46.2	144373535	61.52401	105.318756
"1300"	1272	2400	"Technology"	"Arnout Schuijff"	55	"Netherlands"	"Amsterdam"	"Payments software"	"Technology"	"Netherlands"	""	TRUE	"D"	"M"	"10/16/1967 0:00"	"Schuijff"	"Arnout"	""	"4/4/2023 5:01"	""	""	1967	10	16	115.91	2.6	"$909,070,395,161 "	85	104.2	81.8	23	41.2	17332850	52.132633	5.291266
"1848"	1804	1600	"Healthcare"	"Robert Langer"	74	"United States"	"Boston"	"Biotech"	"Healthcare"	"United States"	""	TRUE	"E"	"M"	"8/29/1948 0:00"	"Langer"	"Robert"	""	"4/4/2023 5:01"	"Massachusetts"	"Northeast"	1948	8	29	117.24	7.5	"$21,427,700,000,000 "	88.2	101.8	78.5	9.6	36.6	328239523	37.09024	-95.712891
"657"	636	4300	"Technology"	"Wang Wenjing"	58	"China"	"Beijing"	"Business software"	"Technology"	"China"	""	TRUE	"D"	"M"	"12/5/1964 0:00"	"Wang"	"Wenjing"	""	"4/4/2023 5:01"	""	""	1964	12	5	125.08	2.9	"$19,910,000,000,000 "	50.6	100.2	77	9.4	59.2	1397715000	35.86166	104.195397
"1023"	982	3000	"Media & Entertainment"	"Gang Ye"	42	"Singapore"	"Singapore"	"Gaming"	"Media & Entertainment"	"Singapore"	""	TRUE	"D"	"M"	"6/1/1980 0:00"	"Ye"	"Gang"	""	"4/4/2023 5:01"	""	""	1980	6	1	114.41	0.6	"$372,062,527,489 "	84.8	100.6	83.1	13.1	21	5703569	1.352083	103.819836
"1459"	1434	2100	"Fashion & Retail"	"Stein Erik Hagen"	66	"Norway"	"Oslo"	"Consumer goods"	"Fashion & Retail"	"Norway"	""	TRUE	"D"	"M"	"7/22/1956 0:00"	"Hagen"	"Stein Erik"	""	"4/4/2023 5:01"	""	""	1956	7	22	120.27	2.2	"$403,336,363,636 "	82	100.3	82.8	23.9	36.2	5347896	60.472024	8.468946
"706"	699	4000	"Manufacturing"	"Koon Poh Keong"	61	"Malaysia"	"Petaling Jaya"	"Aluminum"	"Manufacturing"	"Malaysia"	""	TRUE	"D"	"M"	"4/25/1961 0:00"	"Koon"	"Poh Keong"	""	"4/4/2023 5:01"	""	""	1961	4	25	121.46	0.7	"$364,701,517,788 "	45.1	105.3	76	12	38.7	32447385	4.210484	101.975766
"1561"	1516	2000	"Fashion & Retail"	"Sylvia Stroeher"	67	"Germany"	"Darmstadt"	"Cosmetics"	"Fashion & Retail"	"Germany"	""	FALSE	"E"	"F"	"5/30/1955 0:00"	"Stroeher"	"Sylvia"	""	"4/4/2023 5:01"	""	""	1955	5	30	112.85	1.4	"$3,845,630,030,824 "	70.2	104	80.9	11.5	48.8	83132799	51.165691	10.451526
"2585"	2540	1000	"Manufacturing"	"Ashok Kajaria"	75	"India"	"Delhi"	"Tiles"	"Manufacturing"	"India"	""	TRUE	"R"	"M"	"8/1/1947 0:00"	"Kajaria"	"Ashok"	""	"4/4/2023 5:01"	""	""	1947	8	1	180.44	7.7	"$2,611,000,000,000 "	28.1	113	69.4	11.2	49.7	1366417754	20.593684	78.96288
"2621"	2540	1000	"Food & Beverage"	"David Tran & family"	77	"United States"	"Arcadia"	"Hot sauce"	"Food & Beverage"	"United States"	""	TRUE	"N"	"M"	"11/19/1945 0:00"	"Tran"	"David"	""	"4/4/2023 5:01"	"California"	"West"	1945	11	19	117.24	7.5	"$21,427,700,000,000 "	88.2	101.8	78.5	9.6	36.6	328239523	37.09024	-95.712891
"729"	721	3900	"Healthcare"	"Guenther Fielmann & family"	83	"Germany"	"Hamburg"	"Optometry"	"Healthcare"	"Germany"	""	TRUE	"D"	"M"	"9/17/1939 0:00"	"Fielmann"	"Guenther"	""	"4/4/2023 5:01"	""	""	1939	9	17	112.85	1.4	"$3,845,630,030,824 "	70.2	104	80.9	11.5	48.8	83132799	51.165691	10.451526
"1706"	1647	1800	"Food & Beverage"	"Bambang Sutantio"	64	"Indonesia"	""	"Dairy & consumer products"	"Food & Beverage"	"Indonesia"	""	TRUE	"U"	"M"	"12/26/1958 0:00"	"Sutantio"	"Bambang"	""	"4/4/2023 5:01"	""	""	1958	12	26	151.18	3	"$1,119,190,780,753 "	36.3	106.4	71.5	10.2	30.1	270203917	-0.789275	113.921327
"2109"	2020	1400	"Finance & Investments"	"Wilma Tisch"	95	"United States"	"New York"	"Diversified"	"Finance & Investments"	"United States"	""	FALSE	"D"	"F"	"6/25/1927 0:00"	"Tisch"	"Wilma"	""	"4/4/2023 5:01"	"New York"	"Northeast"	1927	6	25	117.24	7.5	"$21,427,700,000,000 "	88.2	101.8	78.5	9.6	36.6	328239523	37.09024	-95.712891
"2607"	2540	1000	"Manufacturing"	"Fulvio Montip & family"	78	"Italy"	"Reggio Emilia"	"Hydraulic pumps"	"Manufacturing"	"Italy"	""	TRUE	"N"	"M"	"10/22/1944 0:00"	"Montip"	"Fulvio"	""	"4/4/2023 5:01"	""	""	1944	10	22	110.62	0.6	"$2,001,244,392,042 "	61.9	101.9	82.9	24.3	59.1	60297396	41.87194	12.56738
"1314"	1312	2300	"Technology"	"John Bicket"	43	"United States"	"San Francisco"	"Sensor systems"	"Technology"	"United States"	""	TRUE	"U"	"M"	"3/20/1980 0:00"	"Bicket"	"John"	""	"4/4/2023 5:01"	"California"	"West"	1980	3	20	117.24	7.5	"$21,427,700,000,000 "	88.2	101.8	78.5	9.6	36.6	328239523	37.09024	-95.712891
"785"	766	3700	"Real Estate"	"Yitzhak Tshuva"	74	"Israel"	"Netanya"	"Real estate"	"Real Estate"	"Israel"	""	TRUE	"D"	"M"	"7/7/1948 0:00"	"Tshuva"	"Yitzhak"	""	"4/4/2023 5:01"	""	""	1948	7	7	108.15	0.8	"$395,098,666,122 "	63.4	104.9	82.8	23.1	25.3	9053300	31.046051	34.851612
"2598"	2540	1000	"Technology"	"Li Wanqiang"	45	"China"	"Beijing"	"Smartphones"	"Technology"	"China"	""	TRUE	"D"	"M"	"8/1/1977 0:00"	"Li"	"Wanqiang"	""	"4/4/2023 5:01"	""	""	1977	8	1	125.08	2.9	"$19,910,000,000,000 "	50.6	100.2	77	9.4	59.2	1397715000	35.86166	104.195397
"619"	611	4500	"Real Estate"	"Hussain Sajwani"	70	"United Arab Emirates"	"Dubai"	"Real estate"	"Real Estate"	"United Arab Emirates"	""	TRUE	"U"	"M"	"3/1/1953 0:00"	"Sajwani"	"Hussain"	""	"4/4/2023 5:01"	""	""	1953	3	1	114.52	-1.9	"$421,142,267,938 "	36.8	108.4	77.8	0.1	15.9	9770529	23.424076	53.847818
"241"	239	8500	"Manufacturing"	"Li Zhenguo & family"	55	"China"	"Xi'an"	"Solar wafers and modules"	"Manufacturing"	"China"	""	TRUE	"D"	"M"	"1/1/1968 0:00"	"Li"	"Zhenguo"	""	"4/4/2023 5:01"	""	""	1968	1	1	125.08	2.9	"$19,910,000,000,000 "	50.6	100.2	77	9.4	59.2	1397715000	35.86166	104.195397
"1442"	1434	2100	"Technology"	"Chi Yufeng"	52	"China"	"Beijing"	"Software"	"Technology"	"China"	""	FALSE	"U"	"M"	"1/1/1971 0:00"	"Chi"	"Yufeng"	""	"4/4/2023 5:01"	""	""	1971	1	1	125.08	2.9	"$19,910,000,000,000 "	50.6	100.2	77	9.4	59.2	1397715000	35.86166	104.195397
"179"	179	10100	"Technology"	"Scott Farquhar"	43	"Australia"	"Sydney"	"Software"	"Technology"	"Australia"	""	TRUE	"D"	"M"	"12/17/1979 0:00"	"Farquhar"	"Scott"	""	"4/4/2023 5:01"	""	""	1979	12	17	119.8	1.6	"$1,392,680,589,329 "	113.1	100.3	82.7	23	47.4	25766605	-25.274398	133.775136
"2263"	2259	1200	"Finance & Investments"	"Michael Arougheti"	50	"United States"	"Nyack"	"Finance"	"Finance & Investments"	"United States"	""	TRUE	"N"	"M"	"10/10/1972 0:00"	"Arougheti"	"Michael"	""	"4/4/2023 5:01"	"New York"	"Northeast"	1972	10	10	117.24	7.5	"$21,427,700,000,000 "	88.2	101.8	78.5	9.6	36.6	328239523	37.09024	-95.712891
"1887"	1804	1600	"Fashion & Retail"	"Alan Wilson"	82	"Australia"	"Melbourne"	"Retailing"	"Fashion & Retail"	"Australia"	""	FALSE	"Split Family Fortune"	"M"	"10/28/1940 0:00"	"Wilson"	"Alan"	""	"4/4/2023 5:01"	""	""	1940	10	28	119.8	1.6	"$1,392,680,589,329 "	113.1	100.3	82.7	23	47.4	25766605	-25.274398	133.775136
"651"	636	4300	"Diversified"	"Pham Nhat Vuong"	54	"Vietnam"	"Hanoi"	"Diversified"	"Diversified"	"Vietnam"	""	TRUE	"D"	"M"	"8/5/1968 0:00"	"Pham"	"Nhat Vuong"	""	"4/4/2023 5:01"	""	""	1968	8	5	163.52	2.8	"$261,921,244,843 "	28.5	110.6	75.3	19.1	37.6	96462106	14.058324	108.277199
"1036"	1027	2900	"Technology"	"Michael Federmann & family"	79	"Israel"	"Tel Aviv"	"Defense, hotels"	"Technology"	"Israel"	""	TRUE	"D"	"M"	"9/9/1943 0:00"	"Federmann"	"Michael"	""	"4/4/2023 5:01"	""	""	1943	9	9	108.15	0.8	"$395,098,666,122 "	63.4	104.9	82.8	23.1	25.3	9053300	31.046051	34.851612
"1933"	1905	1500	"Manufacturing"	"Wei Gu"	58	"China"	"Shenzhen"	"Consumer electronics"	"Manufacturing"	"China"	""	TRUE	"E"	"M"	"1/27/1965 0:00"	"Gu"	"Wei"	""	"4/4/2023 5:01"	""	""	1965	1	27	125.08	2.9	"$19,910,000,000,000 "	50.6	100.2	77	9.4	59.2	1397715000	35.86166	104.195397
"520"	511	5200	"Technology"	"Charles Simonyi"	74	"United States"	"Medina"	"Microsoft"	"Technology"	"United States"	""	TRUE	"D"	"M"	"9/10/1948 0:00"	"Simonyi"	"Charles"	""	"4/4/2023 5:01"	"Washington"	"West"	1948	9	10	117.24	7.5	"$21,427,700,000,000 "	88.2	101.8	78.5	9.6	36.6	328239523	37.09024	-95.712891
"1"	1	211000	"Fashion & Retail"	"Bernard Arnault & family"	74	"France"	"Paris"	"LVMH"	"Fashion & Retail"	"France"	"LVMH Mot Hennessy Louis Vuitton"	FALSE	"U"	"M"	"3/5/1949 0:00"	"Arnault"	"Bernard"	"Chairman and CEO"	"4/4/2023 5:01"	""	""	1949	3	5	110.05	1.1	"$2,715,518,274,227 "	65.6	102.5	82.5	24.2	60.7	67059887	46.227638	2.213749
"1523"	1516	2000	"Manufacturing"	"Huwen Chen"	52	"China"	"Shanghai"	"Stationery"	"Manufacturing"	"China"	""	TRUE	"D"	"M"	"7/1/1970 0:00"	"Chen"	"Huwen"	""	"4/4/2023 5:01"	""	""	1970	7	1	125.08	2.9	"$19,910,000,000,000 "	50.6	100.2	77	9.4	59.2	1397715000	35.86166	104.195397
"1503"	1434	2100	"Food & Beverage"	"Hamdi Ulukaya"	50	"United States"	"Norwich"	"Greek yogurt"	"Food & Beverage"	"Turkey"	"Chobani"	TRUE	"D"	"M"	"10/26/1972 0:00"	"Ulukaya"	"Hamdi"	"Founder and CEO"	"4/4/2023 5:01"	"New York"	"Northeast"	1972	10	26	117.24	7.5	"$21,427,700,000,000 "	88.2	101.8	78.5	9.6	36.6	328239523	37.09024	-95.712891
"983"	982	3000	"Diversified"	"Semahat Sevim Arsel"	94	"Turkey"	"Istanbul"	"Diversified"	"Diversified"	"Turkey"	""	FALSE	"U"	"F"	"9/8/1928 0:00"	"Arsel"	"Semahat Sevim"	""	"4/4/2023 5:01"	""	""	1928	9	8	234.44	15.2	"$754,411,708,203 "	23.9	93.2	77.4	17.9	42.3	83429615	38.963745	35.243322
"396"	390	6500	"Real Estate"	"Radovan Vitek"	51	"Switzerland"	"Crans Montana"	"Real estate"	"Real Estate"	"Czech Republic"	""	TRUE	"U"	"M"	"4/22/1971 0:00"	"Vitek"	"Radovan"	""	"4/4/2023 5:01"	""	""	1971	4	22	99.55	0.4	"$703,082,435,360 "	59.6	105.2	83.6	10.1	28.8	8574832	46.818188	8.227512
"350"	344	6900	"Fashion & Retail"	"Sandra Ortega Mera"	54	"Spain"	"La Coruna"	"Zara"	"Fashion & Retail"	"Spain"	""	FALSE	"U"	"F"	"7/9/1968 0:00"	"Ortega Mera"	"Sandra"	""	"4/4/2023 5:01"	""	""	1968	7	9	110.96	0.7	"$1,394,116,310,769 "	88.9	102.7	83.3	14.2	47	47076781	40.463667	-3.74922
"263"	261	8000	"Fashion & Retail"	"Bernard Marcus"	93	"United States"	"Atlanta"	"Home Depot"	"Fashion & Retail"	"United States"	"Home Depot"	TRUE	"D"	"M"	"5/12/1929 0:00"	"Marcus"	"Bernard"	"Co-founder, ex chairman of the board"	"4/4/2023 5:01"	"Georgia"	"South"	1929	5	12	117.24	7.5	"$21,427,700,000,000 "	88.2	101.8	78.5	9.6	36.6	328239523	37.09024	-95.712891
"2510"	2405	1100	"Automotive"	"Tang Aoqi & family"	77	"China"	"Changzhou"	"Auto parts"	"Automotive"	"China"	""	TRUE	"N"	"M"	"4/11/1945 0:00"	"Tang"	"Aoqi"	""	"4/4/2023 5:01"	""	""	1945	4	11	125.08	2.9	"$19,910,000,000,000 "	50.6	100.2	77	9.4	59.2	1397715000	35.86166	104.195397
"1745"	1725	1700	"Technology"	"He Zhaoxi"	49	"China"	"Shenzhen"	"Software"	"Technology"	"China"	""	TRUE	"E"	"M"	"1/1/1974 0:00"	"He"	"Zhaoxi"	""	"4/4/2023 5:01"	""	""	1974	1	1	125.08	2.9	"$19,910,000,000,000 "	50.6	100.2	77	9.4	59.2	1397715000	35.86166	104.195397
"2478"	2405	1100	"Finance & Investments"	"Randolph Lerner"	61	"United States"	"Cleveland"	"Banking, credit cards"	"Finance & Investments"	"United States"	""	FALSE	"E"	"M"	"2/21/1962 0:00"	"Lerner"	"Randolph"	""	"4/4/2023 5:01"	"Ohio"	"Midwest"	1962	2	21	117.24	7.5	"$21,427,700,000,000 "	88.2	101.8	78.5	9.6	36.6	328239523	37.09024	-95.712891
"2500"	2405	1100	"Energy"	"Dean Solon"	58	"United States"	"Gallatin"	"Solar systems"	"Energy"	"United States"	""	TRUE	"U"	"M"	"1/1/1965 0:00"	"Solon"	"Dean"	""	"4/4/2023 5:01"	"Tennessee"	"South"	1965	1	1	117.24	7.5	"$21,427,700,000,000 "	88.2	101.8	78.5	9.6	36.6	328239523	37.09024	-95.712891
"60"	60	24400	"Technology"	"MacKenzie Scott"	52	"United States"	"Seattle"	"Amazon"	"Technology"	"United States"	""	FALSE	"D"	"F"	"4/7/1970 0:00"	"Scott"	"MacKenzie"	"Philanthropist"	"4/4/2023 5:01"	"Washington"	"West"	1970	4	7	117.24	7.5	"$21,427,700,000,000 "	88.2	101.8	78.5	9.6	36.6	328239523	37.09024	-95.712891
"739"	721	3900	"Fashion & Retail"	"Carl Ferdinand Oetker"	50	"Germany"	"Bielefeld"	"Consumer goods"	"Fashion & Retail"	"Germany"	""	FALSE	"U"	"M"	"10/3/1972 0:00"	"Oetker"	"Carl Ferdinand"	""	"4/4/2023 5:01"	""	""	1972	10	3	112.85	1.4	"$3,845,630,030,824 "	70.2	104	80.9	11.5	48.8	83132799	51.165691	10.451526
"1915"	1905	1500	"Diversified"	"Zadik Bino & family"	79	"Israel"	"Tel Aviv"	"Banking, oil"	"Diversified"	"Israel"	""	TRUE	"D"	"M"	"1/1/1944 0:00"	"Bino"	"Zadik"	""	"4/4/2023 5:01"	""	""	1944	1	1	108.15	0.8	"$395,098,666,122 "	63.4	104.9	82.8	23.1	25.3	9053300	31.046051	34.851612
"2156"	2133	1300	"Finance & Investments"	"Alberto Cortina"	77	"Spain"	"Madrid"	"Investments"	"Finance & Investments"	"Spain"	""	TRUE	"E"	"M"	"1/20/1946 0:00"	"Cortina"	"Alberto"	""	"4/4/2023 5:01"	""	""	1946	1	20	110.96	0.7	"$1,394,116,310,769 "	88.9	102.7	83.3	14.2	47	47076781	40.463667	-3.74922
"1918"	1905	1500	"Diversified"	"Ahmet Calik"	65	"Turkey"	"Istanbul"	"Energy, banking, construction"	"Diversified"	"Turkey"	""	TRUE	"E"	"M"	"3/1/1958 0:00"	"Calik"	"Ahmet"	""	"4/4/2023 5:01"	""	""	1958	3	1	234.44	15.2	"$754,411,708,203 "	23.9	93.2	77.4	17.9	42.3	83429615	38.963745	35.243322
"1390"	1368	2200	"Automotive"	"Willis Johnson"	75	"United States"	"Franklin"	"Damaged cars"	"Automotive"	"United States"	""	TRUE	"U"	"M"	"5/26/1947 0:00"	"Johnson"	"Willis"	""	"4/4/2023 5:01"	"Tennessee"	"South"	1947	5	26	117.24	7.5	"$21,427,700,000,000 "	88.2	101.8	78.5	9.6	36.6	328239523	37.09024	-95.712891
"205"	204	9400	"Technology"	"Wang Xing"	44	"China"	"Beijing"	"Food delivery"	"Technology"	"China"	""	TRUE	"D"	"M"	"2/18/1979 0:00"	"Wang"	"Xing"	""	"4/4/2023 5:01"	""	""	1979	2	18	125.08	2.9	"$19,910,000,000,000 "	50.6	100.2	77	9.4	59.2	1397715000	35.86166	104.195397
"924"	905	3200	"Technology"	"Lee Boo-jin"	52	"South Korea"	"Seoul"	"Samsung"	"Technology"	"South Korea"	""	FALSE	"D"	"F"	"10/6/1970 0:00"	"Lee"	"Boo-jin"	""	"4/4/2023 5:01"	""	""	1970	10	6	115.16	0.4	"$2,029,000,000,000 "	94.3	98.1	82.6	15.6	33.2	51709098	35.907757	127.766922
"1789"	1725	1700	"Diversified"	"Jonathan Tisch"	69	"United States"	"New York"	"Insurance, NFL team"	"Diversified"	"United States"	""	FALSE	"U"	"M"	"12/7/1953 0:00"	"Tisch"	"Jonathan"	""	"4/4/2023 5:01"	"New York"	"Northeast"	1953	12	7	117.24	7.5	"$21,427,700,000,000 "	88.2	101.8	78.5	9.6	36.6	328239523	37.09024	-95.712891
"1261"	1217	2500	"Diversified"	"Henry Sy, Jr."	69	"Philippines"	"Manila"	"Diversified"	"Diversified"	"Philippines"	""	FALSE	"D"	"M"	"1/1/1954 0:00"	"Sy"	"Henry"	""	"4/4/2023 5:01"	""	""	1954	1	1	129.61	2.5	"$376,795,508,680 "	35.5	107.5	71.1	14	43.1	108116615	12.879721	121.774017
"2506"	2405	1100	"Manufacturing"	"Sun Weijie"	59	"China"	"Yantai"	"Oilfield equipment"	"Manufacturing"	"China"	""	TRUE	"D"	"M"	"7/26/1963 0:00"	"Sun"	"Weijie"	""	"4/4/2023 5:01"	""	""	1963	7	26	125.08	2.9	"$19,910,000,000,000 "	50.6	100.2	77	9.4	59.2	1397715000	35.86166	104.195397
"1029"	1027	2900	"Healthcare"	"Cao Longxiang & family"	65	"China"	"Taixing"	"Pharmaceuticals"	"Healthcare"	"China"	""	TRUE	"E"	"M"	"9/5/1957 0:00"	"Cao"	"Longxiang"	""	"4/4/2023 5:01"	""	""	1957	9	5	125.08	2.9	"$19,910,000,000,000 "	50.6	100.2	77	9.4	59.2	1397715000	35.86166	104.195397
"250"	249	8200	"Energy"	"German Khan"	61	"Russia"	"Moscow"	"Oil, banking, telecom"	"Energy"	"Russia"	""	TRUE	"U"	"M"	"10/24/1961 0:00"	"Khan"	"German"	""	"4/4/2023 5:01"	""	""	1961	10	24	180.75	4.5	"$1,699,876,578,871 "	81.9	102.6	72.7	11.4	46.2	144373535	61.52401	105.318756
"1186"	1164	2600	"Service"	"Dmitry Kamenshchik"	54	"Russia"	"Moscow"	"Airport"	"Service"	"Russia"	""	TRUE	"U"	"M"	"4/26/1968 0:00"	"Kamenshchik"	"Dmitry"	""	"4/4/2023 5:01"	""	""	1968	4	26	180.75	4.5	"$1,699,876,578,871 "	81.9	102.6	72.7	11.4	46.2	144373535	61.52401	105.318756
"2593"	2540	1000	"Manufacturing"	"Koo Bon-neung"	74	"South Korea"	"Seoul"	"Electronics"	"Manufacturing"	"South Korea"	"Heesung Electronics"	FALSE	"D"	"M"	"3/26/1949 0:00"	"Koo"	"Bon-neung"	""	"4/4/2023 5:01"	""	""	1949	3	26	115.16	0.4	"$2,029,000,000,000 "	94.3	98.1	82.6	15.6	33.2	51709098	35.907757	127.766922
"1912"	1905	1500	"Healthcare"	"Mori Arkin"	70	"Israel"	"Herzliya Pituach"	"Pharmaceuticals"	"Healthcare"	"Israel"	""	TRUE	"D"	"M"	"9/24/1952 0:00"	"Arkin"	"Mori"	""	"4/4/2023 5:01"	""	""	1952	9	24	108.15	0.8	"$395,098,666,122 "	63.4	104.9	82.8	23.1	25.3	9053300	31.046051	34.851612
"1571"	1516	2000	"Manufacturing"	"Zhang Wanzhen"	73	"China"	"Chaozhou"	"Electronics components"	"Manufacturing"	"China"	""	TRUE	"D"	"M"	"12/1/1949 0:00"	"Zhang"	"Wanzhen"	""	"4/4/2023 5:01"	""	""	1949	12	1	125.08	2.9	"$19,910,000,000,000 "	50.6	100.2	77	9.4	59.2	1397715000	35.86166	104.195397
"674"	659	4200	"Technology"	"Jeff Skoll"	58	"United States"	"Los Angeles"	"EBay"	"Technology"	"United States"	""	TRUE	"D"	"M"	"1/16/1965 0:00"	"Skoll"	"Jeff"	""	"4/4/2023 5:01"	"California"	"West"	1965	1	16	117.24	7.5	"$21,427,700,000,000 "	88.2	101.8	78.5	9.6	36.6	328239523	37.09024	-95.712891
"590"	580	4700	"Media & Entertainment"	"Tim Sweeney"	52	"United States"	"Cary"	"Video games"	"Media & Entertainment"	"United States"	""	TRUE	"D"	"M"	"12/13/1970 0:00"	"Sweeney"	"Tim"	""	"4/4/2023 5:01"	"North Carolina"	"South"	1970	12	13	117.24	7.5	"$21,427,700,000,000 "	88.2	101.8	78.5	9.6	36.6	328239523	37.09024	-95.712891
"1456"	1434	2100	"Diversified"	"Harsh Goenka"	65	"India"	"Mumbai"	"Diversified"	"Diversified"	"India"	""	FALSE	"E"	"M"	"12/10/1957 0:00"	"Goenka"	"Harsh"	""	"4/4/2023 5:01"	""	""	1957	12	10	180.44	7.7	"$2,611,000,000,000 "	28.1	113	69.4	11.2	49.7	1366417754	20.593684	78.96288
"863"	852	3400	"Sports"	"Robert Johnson"	75	"United States"	"Palm Beach"	"Johnson & Johnson, sports"	"Sports"	"United States"	""	FALSE	"N"	"M"	"4/12/1947 0:00"	"Johnson"	"Robert "	""	"4/4/2023 5:01"	"Florida"	"South"	1947	4	12	117.24	7.5	"$21,427,700,000,000 "	88.2	101.8	78.5	9.6	36.6	328239523	37.09024	-95.712891
"2199"	2133	1300	"Food & Beverage"	"Itamar Locks & family"	68	"Brazil"	"Rondonopolis"	"Agribusiness"	"Food & Beverage"	"Brazil"	""	FALSE	"Split Family Fortune"	"M"	"1/1/1955 0:00"	"Locks"	"Itamar"	""	"4/4/2023 5:01"	""	""	1955	1	1	167.4	3.7	"$1,839,758,040,766 "	51.3	115.4	75.7	14.2	65.1	212559417	-14.235004	-51.92528
"477"	466	5500	"Finance & Investments"	"Ludwig Merckle"	58	"Germany"	"Ulm"	"Pharmaceuticals"	"Finance & Investments"	"Germany"	""	FALSE	"D"	"M"	"1/1/1965 0:00"	"Merckle"	"Ludwig"	""	"4/4/2023 5:01"	""	""	1965	1	1	112.85	1.4	"$3,845,630,030,824 "	70.2	104	80.9	11.5	48.8	83132799	51.165691	10.451526
"1231"	1217	2500	"Food & Beverage"	"Henry Davis"	72	"United States"	"Omaha"	"Beef processing"	"Food & Beverage"	"United States"	""	FALSE	"U"	"M"	"2/16/1951 0:00"	"Davis"	"Henry"	""	"4/4/2023 5:01"	"Nebraska"	"Midwest"	1951	2	16	117.24	7.5	"$21,427,700,000,000 "	88.2	101.8	78.5	9.6	36.6	328239523	37.09024	-95.712891
"1952"	1905	1500	"Manufacturing"	"Regine Leibinger"	60	"Germany"	"Berlin"	"Machine tools"	"Manufacturing"	"Germany"	""	FALSE	"D"	"F"	"1/1/1963 0:00"	"Leibinger"	"Regine"	""	"4/4/2023 5:01"	""	""	1963	1	1	112.85	1.4	"$3,845,630,030,824 "	70.2	104	80.9	11.5	48.8	83132799	51.165691	10.451526
"1305"	1272	2400	"Media & Entertainment"	"Ted Turner"	84	"United States"	"Atlanta"	"Cable television"	"Media & Entertainment"	"United States"	""	FALSE	"U"	"M"	"11/19/1938 0:00"	"Turner"	"Ted"	""	"4/4/2023 5:01"	"Georgia"	"South"	1938	11	19	117.24	7.5	"$21,427,700,000,000 "	88.2	101.8	78.5	9.6	36.6	328239523	37.09024	-95.712891
"189"	184	9800	"Finance & Investments"	"Melker Schorling & family"	75	"Sweden"	"Stockholm"	"Investments"	"Finance & Investments"	"Sweden"	""	TRUE	"D"	"M"	"5/15/1947 0:00"	"Schorling"	"Melker"	""	"4/4/2023 5:01"	""	""	1947	5	15	110.51	1.8	"$530,832,908,738 "	67	126.6	82.5	27.9	49.1	10285453	60.128161	18.643501
"98"	97	17400	"Fashion & Retail"	"John Menard, Jr."	83	"United States"	"Eau Claire"	"Home improvement stores"	"Fashion & Retail"	"United States"	"Menard, Inc."	TRUE	"U"	"M"	"1/22/1940 0:00"	"Menard"	"John"	"Founder"	"4/4/2023 5:01"	"Wisconsin"	"Midwest"	1940	1	22	117.24	7.5	"$21,427,700,000,000 "	88.2	101.8	78.5	9.6	36.6	328239523	37.09024	-95.712891
"2251"	2133	1300	"Healthcare"	"Xiong Xiaochuan"	57	"China"	"Shenzhen"	"Medical devices"	"Healthcare"	"China"	""	TRUE	"N"	"M"	"1/1/1966 0:00"	"Xiong"	"Xiaochuan"	""	"4/4/2023 5:01"	""	""	1966	1	1	125.08	2.9	"$19,910,000,000,000 "	50.6	100.2	77	9.4	59.2	1397715000	35.86166	104.195397
"899"	878	3300	"Finance & Investments"	"Nik Storonsky"	38	"United Kingdom"	"London"	"Fintech"	"Finance & Investments"	"United Kingdom"	""	TRUE	"D"	"M"	"7/21/1984 0:00"	"Storonsky"	"Nik"	""	"4/4/2023 5:01"	""	""	1984	7	21	119.62	1.7	"$2,827,113,184,696 "	60	101.2	81.3	25.5	30.6	66834405	55.378051	-3.435973
"403"	397	6400	"Finance & Investments"	"Luis Carlos Sarmiento"	90	"Colombia"	"Bogota"	"Banking"	"Finance & Investments"	"Colombia"	""	TRUE	"D"	"M"	"1/27/1933 0:00"	"Sarmiento"	"Luis Carlos"	""	"4/4/2023 5:01"	""	""	1933	1	27	140.95	3.5	"$323,802,808,108 "	55.3	114.5	77.1	14.4	71.2	50339443	4.570868	-74.297333
"1209"	1164	2600	"Energy"	"Michael S. Smith"	67	"United States"	"Miami Beach"	"Liquefied natural gas"	"Energy"	"United States"	""	TRUE	"U"	"M"	"5/9/1955 0:00"	"Smith"	"Michael S."	"Investor"	"4/4/2023 5:01"	"Florida"	"South"	1955	5	9	117.24	7.5	"$21,427,700,000,000 "	88.2	101.8	78.5	9.6	36.6	328239523	37.09024	-95.712891
"2429"	2405	1100	"Food & Beverage"	"Cheng Lili"	58	"China"	"Changzhou"	"Poultry breeding"	"Food & Beverage"	"China"	""	TRUE	"D"	"M"	"1/1/1965 0:00"	"Cheng"	"Lili"	""	"4/4/2023 5:01"	""	""	1965	1	1	125.08	2.9	"$19,910,000,000,000 "	50.6	100.2	77	9.4	59.2	1397715000	35.86166	104.195397
"341"	332	7000	"Food & Beverage"	"J. Christopher Reyes"	69	"United States"	"Hobe Sound"	"Food distribution"	"Food & Beverage"	"United States"	"Reyes Holdings, LLC"	TRUE	"D"	"M"	"12/29/1953 0:00"	"Reyes"	"J. Christopher"	"Co-Chairman"	"4/4/2023 5:01"	"Florida"	"South"	1953	12	29	117.24	7.5	"$21,427,700,000,000 "	88.2	101.8	78.5	9.6	36.6	328239523	37.09024	-95.712891
"1666"	1647	1800	"Healthcare"	"Phillip Frost"	86	"United States"	"Miami Beach"	"Pharmaceuticals"	"Healthcare"	"United States"	""	TRUE	"D"	"M"	"11/11/1936 0:00"	"Frost"	"Phillip"	""	"4/4/2023 5:01"	"Florida"	"South"	1936	11	11	117.24	7.5	"$21,427,700,000,000 "	88.2	101.8	78.5	9.6	36.6	328239523	37.09024	-95.712891
"623"	611	4500	"Manufacturing"	"You Xiaoping & family"	65	"China"	"Wenzhou"	"Chemicals, spandex"	"Manufacturing"	"China"	""	TRUE	"D"	"M"	"1/21/1958 0:00"	"You"	"Xiaoping"	""	"4/4/2023 5:01"	""	""	1958	1	21	125.08	2.9	"$19,910,000,000,000 "	50.6	100.2	77	9.4	59.2	1397715000	35.86166	104.195397
"376"	365	6700	"Real Estate"	"Edward Roski, Jr."	84	"United States"	"Los Angeles"	"Real estate"	"Real Estate"	"United States"	"Majestic Realty, Co."	FALSE	"U"	"M"	"12/25/1938 0:00"	"Roski"	"Edward"	"President and Chairman"	"4/4/2023 5:01"	"California"	"West"	1938	12	25	117.24	7.5	"$21,427,700,000,000 "	88.2	101.8	78.5	9.6	36.6	328239523	37.09024	-95.712891
"1344"	1312	2300	"Fashion & Retail"	"David Nahmad"	75	"United States"	"New York"	"Art collection"	"Fashion & Retail"	"Monaco"	""	TRUE	"U"	"M"	"4/14/1947 0:00"	"Nahmad"	"David"	""	"4/4/2023 5:01"	"New York"	"Northeast"	1947	4	14	117.24	7.5	"$21,427,700,000,000 "	88.2	101.8	78.5	9.6	36.6	328239523	37.09024	-95.712891
"1684"	1647	1800	"Media & Entertainment"	"Roberto Irineu Marinho"	75	"Brazil"	"Rio de Janeiro"	"Media"	"Media & Entertainment"	"Brazil"	""	FALSE	"D"	"M"	"10/13/1947 0:00"	"Marinho"	"Roberto Irineu"	""	"4/4/2023 5:01"	""	""	1947	10	13	167.4	3.7	"$1,839,758,040,766 "	51.3	115.4	75.7	14.2	65.1	212559417	-14.235004	-51.92528
"2031"	2020	1400	"Real Estate"	"Chua Thian Poh"	74	"Singapore"	"Singapore"	"Real estate"	"Real Estate"	"Singapore"	""	TRUE	"U"	"M"	"7/11/1948 0:00"	"Chua"	"Thian Poh"	""	"4/4/2023 5:01"	""	""	1948	7	11	114.41	0.6	"$372,062,527,489 "	84.8	100.6	83.1	13.1	21	5703569	1.352083	103.819836
"2341"	2259	1200	"Real Estate"	"Jose Isaac Peres & family"	82	"Brazil"	"Rio de Janeiro"	"Shopping malls"	"Real Estate"	"Brazil"	""	TRUE	"U"	"M"	"7/18/1940 0:00"	"Peres"	"Jose Isaac"	""	"4/4/2023 5:01"	""	""	1940	7	18	167.4	3.7	"$1,839,758,040,766 "	51.3	115.4	75.7	14.2	65.1	212559417	-14.235004	-51.92528
"609"	591	4600	"Food & Beverage"	"Russ Weiner"	52	"United States"	"Delray Beach"	"Energy drinks"	"Food & Beverage"	"United States"	""	TRUE	"U"	"M"	"5/5/1970 0:00"	"Weiner"	"Russ"	""	"4/4/2023 5:01"	"Florida"	"South"	1970	5	5	117.24	7.5	"$21,427,700,000,000 "	88.2	101.8	78.5	9.6	36.6	328239523	37.09024	-95.712891
"389"	383	6600	"Finance & Investments"	"Nadia Thiele"	47	"Germany"	"Munich"	"Investments"	"Finance & Investments"	"Germany"	""	FALSE	"U"	"F"	"1/7/1976 0:00"	"Thiele"	"Nadia"	""	"4/4/2023 5:01"	""	""	1976	1	7	112.85	1.4	"$3,845,630,030,824 "	70.2	104	80.9	11.5	48.8	83132799	51.165691	10.451526
"1772"	1725	1700	"Fashion & Retail"	"Ilson Mateus & family"	60	"Brazil"	"Sao Luis"	"Supermarkets"	"Fashion & Retail"	"Brazil"	""	TRUE	"U"	"M"	"2/6/1963 0:00"	"Mateus"	"Ilson"	""	"4/4/2023 5:01"	""	""	1963	2	6	167.4	3.7	"$1,839,758,040,766 "	51.3	115.4	75.7	14.2	65.1	212559417	-14.235004	-51.92528
"1802"	1725	1700	"Manufacturing"	"Zheng Xiaodong"	59	"China"	"Shanghai"	"Manufacturing"	"Manufacturing"	"China"	""	TRUE	"D"	"M"	"3/1/1964 0:00"	"Zheng"	"Xiaodong"	""	"4/4/2023 5:01"	""	""	1964	3	1	125.08	2.9	"$19,910,000,000,000 "	50.6	100.2	77	9.4	59.2	1397715000	35.86166	104.195397
"1636"	1575	1900	"Fashion & Retail"	"Masateru Uno & family"	76	"Japan"	"Fukuoka"	"Drugstores"	"Fashion & Retail"	"Japan"	""	TRUE	"D"	"M"	"2/6/1947 0:00"	"Uno"	"Masateru"	""	"4/4/2023 5:01"	""	""	1947	2	6	105.48	0.5	"$5,081,769,542,380 "	63.2	98.8	84.2	11.9	46.7	126226568	36.204824	138.252924
"1977"	1905	1500	"Food & Beverage"	"Mike Repole"	55	"United States"	"Windermere"	"Sports drink"	"Food & Beverage"	"United States"	""	TRUE	"E"	"M"	"1/21/1968 0:00"	"Repole"	"Mike"	""	"4/4/2023 5:01"	"Florida"	"South"	1968	1	21	117.24	7.5	"$21,427,700,000,000 "	88.2	101.8	78.5	9.6	36.6	328239523	37.09024	-95.712891
"1893"	1804	1600	"Technology"	"Zhongyi Wu"	49	"China"	"Xiamen"	"electronics"	"Technology"	"China"	""	TRUE	"D"	"M"	"10/28/1973 0:00"	"Wu"	"Zhongyi"	""	"4/4/2023 5:01"	""	""	1973	10	28	125.08	2.9	"$19,910,000,000,000 "	50.6	100.2	77	9.4	59.2	1397715000	35.86166	104.195397
"2554"	2540	1000	"Manufacturing"	"Chen Shiliang"	59	"China"	"Tongxiang"	"Polyester"	"Manufacturing"	"China"	""	TRUE	"D"	"M"	"12/1/1963 0:00"	"Chen"	"Shiliang"	""	"4/4/2023 5:01"	""	""	1963	12	1	125.08	2.9	"$19,910,000,000,000 "	50.6	100.2	77	9.4	59.2	1397715000	35.86166	104.195397
"145"	145	12000	"Technology"	"Laurene Powell Jobs & family"	59	"United States"	"Palo Alto"	"Apple, Disney"	"Technology"	"United States"	"Emerson Collective"	FALSE	"D"	"F"	"11/6/1963 0:00"	"Powell Jobs"	"Laurene"	"Investor, Philanthropist"	"4/4/2023 5:01"	"California"	"West"	1963	11	6	117.24	7.5	"$21,427,700,000,000 "	88.2	101.8	78.5	9.6	36.6	328239523	37.09024	-95.712891
"879"	878	3300	"Finance & Investments"	"John Arnold"	49	"United States"	"Houston"	"Hedge funds"	"Finance & Investments"	"United States"	"Centaurus Advisors"	TRUE	"E"	"M"	"3/9/1974 0:00"	"Arnold"	"John"	"Founder"	"4/4/2023 5:01"	"Texas"	"South"	1974	3	9	117.24	7.5	"$21,427,700,000,000 "	88.2	101.8	78.5	9.6	36.6	328239523	37.09024	-95.712891
"2548"	2540	1000	"Media & Entertainment"	"Jimmy Buffett"	76	"United States"	"Palm Beach"	"Entertainment, Margaritaville"	"Media & Entertainment"	"United States"	""	TRUE	"N"	"M"	"12/25/1946 0:00"	"Buffett"	"Jimmy"	"Musician"	"4/4/2023 5:01"	"Florida"	""	1946	12	25	117.24	7.5	"$21,427,700,000,000 "	88.2	101.8	78.5	9.6	36.6	328239523	37.09024	-95.712891
"327"	325	7100	"Service"	"Tamara Gustavson"	61	"United States"	"Lexington"	"Self storage"	"Service"	"United States"	""	FALSE	"D"	"F"	"11/16/1961 0:00"	"Gustavson"	"Tamara"	""	"4/4/2023 5:01"	"Kentucky"	"South"	1961	11	16	117.24	7.5	"$21,427,700,000,000 "	88.2	101.8	78.5	9.6	36.6	328239523	37.09024	-95.712891
"1604"	1575	1900	"Manufacturing"	"Hu Rongda & family"	64	"China"	"Jinhua"	"Chemicals"	"Manufacturing"	"China"	""	TRUE	"U"	"M"	"1/1/1959 0:00"	"Hu"	"Rongda"	""	"4/4/2023 5:01"	""	""	1959	1	1	125.08	2.9	"$19,910,000,000,000 "	50.6	100.2	77	9.4	59.2	1397715000	35.86166	104.195397
"939"	905	3200	"Finance & Investments"	"Warren Stephens"	66	"United States"	"Little Rock"	"Investment banking"	"Finance & Investments"	"United States"	""	FALSE	"U"	"M"	"2/18/1957 0:00"	"Stephens"	"Warren"	""	"4/4/2023 5:01"	"Arkansas"	"South"	1957	2	18	117.24	7.5	"$21,427,700,000,000 "	88.2	101.8	78.5	9.6	36.6	328239523	37.09024	-95.712891
"1562"	1516	2000	"Technology"	"Otto Toto Sugiri"	69	"Indonesia"	"Jakarta"	"Data centers"	"Technology"	"Indonesia"	""	TRUE	"D"	"M"	"9/23/1953 0:00"	"Sugiri"	"Otto Toto"	""	"4/4/2023 5:01"	""	""	1953	9	23	151.18	3	"$1,119,190,780,753 "	36.3	106.4	71.5	10.2	30.1	270203917	-0.789275	113.921327
"2635"	2540	1000	"Healthcare"	"Yi Xianzhong & family"	63	"China"	"Guangzhou"	"Pharmaceuticals"	"Healthcare"	"China"	""	TRUE	"D"	"M"	"5/1/1959 0:00"	"Yi"	"Xianzhong"	""	"4/4/2023 5:01"	""	""	1959	5	1	125.08	2.9	"$19,910,000,000,000 "	50.6	100.2	77	9.4	59.2	1397715000	35.86166	104.195397
"1862"	1804	1600	"Automotive"	"Stefan Pierer"	66	"Austria"	"Wels"	"Automotive"	"Automotive"	"Austria"	""	TRUE	"U"	"M"	"11/25/1956 0:00"	"Pierer"	"Stefan"	""	"4/4/2023 5:01"	""	""	1956	11	25	118.06	1.5	"$446,314,739,528 "	85.1	103.1	81.6	25.4	51.4	8877067	47.516231	14.550072
"2617"	2540	1000	"Diversified"	"Ivan Streshinsky"	53	"Russia"	"Moscow"	"Metals, telecom"	"Diversified"	"Russia"	""	TRUE	"N"	"M"	"10/2/1969 0:00"	"Streshinsky"	"Ivan"	""	"4/4/2023 5:01"	""	""	1969	10	2	180.75	4.5	"$1,699,876,578,871 "	81.9	102.6	72.7	11.4	46.2	144373535	61.52401	105.318756
"84"	84	19000	"Automotive"	"Eric Li"	59	"China"	"Hangzhou"	"Automobiles"	"Automotive"	"China"	""	TRUE	"D"	"M"	"6/1/1963 0:00"	"Li"	"Eric"	""	"4/4/2023 5:01"	""	""	1963	6	1	125.08	2.9	"$19,910,000,000,000 "	50.6	100.2	77	9.4	59.2	1397715000	35.86166	104.195397
"756"	748	3800	"Automotive"	"Li Xiang"	41	"China"	"Beijing"	"Electric vehicles"	"Automotive"	"China"	""	TRUE	"D"	"M"	"10/1/1981 0:00"	"Li"	"Xiang"	""	"4/4/2023 5:01"	""	""	1981	10	1	125.08	2.9	"$19,910,000,000,000 "	50.6	100.2	77	9.4	59.2	1397715000	35.86166	104.195397
"337"	332	7000	"Fashion & Retail"	"Ralph Lauren"	83	"United States"	"New York"	"Apparel"	"Fashion & Retail"	"United States"	"Ralph Lauren"	TRUE	"U"	"M"	"10/14/1939 0:00"	"Lauren"	"Ralph"	"Chairman "	"4/4/2023 5:01"	"New York"	"Northeast"	1939	10	14	117.24	7.5	"$21,427,700,000,000 "	88.2	101.8	78.5	9.6	36.6	328239523	37.09024	-95.712891
"803"	787	3600	"Finance & Investments"	"Stephen Mandel, Jr."	67	"United States"	"Greenwich"	"Hedge funds"	"Finance & Investments"	"United States"	"Lone Pine Capital"	TRUE	"D"	"M"	"3/12/1956 0:00"	"Mandel"	"Stephen"	"Founder"	"4/4/2023 5:01"	"Connecticut"	"Northeast"	1956	3	12	117.24	7.5	"$21,427,700,000,000 "	88.2	101.8	78.5	9.6	36.6	328239523	37.09024	-95.712891
"2437"	2405	1100	"Manufacturing"	"Daniel Feffer"	63	"Brazil"	"So Paulo"	"Pulp and paper"	"Manufacturing"	"Brazil"	""	FALSE	"D"	"M"	"10/28/1959 0:00"	"Feffer"	"Daniel"	""	"4/4/2023 5:01"	""	""	1959	10	28	167.4	3.7	"$1,839,758,040,766 "	51.3	115.4	75.7	14.2	65.1	212559417	-14.235004	-51.92528
"494"	486	5400	"Fashion & Retail"	"Matthias Reimann-Andersen"	58	"Germany"	"Munich"	"Consumer goods"	"Fashion & Retail"	"Germany"	""	FALSE	"D"	"M"	"3/30/1965 0:00"	"Reimann-Andersen"	"Matthias"	""	"4/4/2023 5:01"	""	""	1965	3	30	112.85	1.4	"$3,845,630,030,824 "	70.2	104	80.9	11.5	48.8	83132799	51.165691	10.451526
"797"	787	3600	"Automotive"	"Huang Yi"	61	"China"	"Beijing"	"Car dealerships"	"Automotive"	"Hong Kong"	""	TRUE	"D"	"M"	"1/1/1962 0:00"	"Huang"	"Yi"	""	"4/4/2023 5:01"	""	""	1962	1	1	125.08	2.9	"$19,910,000,000,000 "	50.6	100.2	77	9.4	59.2	1397715000	35.86166	104.195397
"981"	949	3100	"Media & Entertainment"	"Yoo Jung-hyun"	53	"South Korea"	"Jeju-do"	"Online games"	"Media & Entertainment"	"South Korea"	""	TRUE	"U"	"F"	"4/16/1969 0:00"	"Yoo"	"Jung-hyun"	""	"4/4/2023 5:01"	""	""	1969	4	16	115.16	0.4	"$2,029,000,000,000 "	94.3	98.1	82.6	15.6	33.2	51709098	35.907757	127.766922
"1713"	1647	1800	"Manufacturing"	"Martin Viessmann"	69	"Germany"	"Allendorf"	"Heating and cooling equipment"	"Manufacturing"	"Germany"	""	FALSE	"D"	"M"	"10/10/1953 0:00"	"Viessmann"	"Martin"	""	"4/4/2023 5:01"	""	""	1953	10	10	112.85	1.4	"$3,845,630,030,824 "	70.2	104	80.9	11.5	48.8	83132799	51.165691	10.451526
"2046"	2020	1400	"Fashion & Retail"	"Daniel Hirschfeld"	81	"United States"	"Kearney"	"Fashion retail"	"Fashion & Retail"	"United States"	""	FALSE	"E"	"M"	"5/31/1941 0:00"	"Hirschfeld"	"Daniel"	""	"4/4/2023 5:01"	"Nebraska"	"Midwest"	1941	5	31	117.24	7.5	"$21,427,700,000,000 "	88.2	101.8	78.5	9.6	36.6	328239523	37.09024	-95.712891
"1474"	1434	2100	"Manufacturing"	"Liu Chengyu & family"	60	"China"	"Shenzhen"	"Power supply equipment"	"Manufacturing"	"China"	""	TRUE	"U"	"M"	"7/26/1962 0:00"	"Liu"	"Chengyu"	""	"4/4/2023 5:01"	""	""	1962	7	26	125.08	2.9	"$19,910,000,000,000 "	50.6	100.2	77	9.4	59.2	1397715000	35.86166	104.195397
"17"	17	59000	"Diversified"	"Charles Koch & family"	87	"United States"	"Wichita"	"Koch Industries"	"Diversified"	"United States"	"Koch Industries, Inc."	FALSE	"D"	"M"	"11/1/1935 0:00"	"Koch"	"Charles"	"Chairman and CEO"	"4/4/2023 5:01"	"Kansas"	"Midwest"	1935	11	1	117.24	7.5	"$21,427,700,000,000 "	88.2	101.8	78.5	9.6	36.6	328239523	37.09024	-95.712891
"1164"	1164	2600	"Real Estate"	"Ben Ashkenazy"	53	"United States"	"New York"	"Real estate"	"Real Estate"	"United States"	""	TRUE	"D"	"M"	"9/23/1969 0:00"	"Ashkenazy"	"Ben"	""	"4/4/2023 5:01"	"New York"	"Northeast"	1969	9	23	117.24	7.5	"$21,427,700,000,000 "	88.2	101.8	78.5	9.6	36.6	328239523	37.09024	-95.712891
"611"	611	4500	"Food & Beverage"	"Juan Domingo Beckmann Legorreta & family"	55	"Mexico"	""	"Tequila"	"Food & Beverage"	"Mexico"	""	FALSE	"U"	"M"	"7/1/1967 0:00"	"Beckmann Legorreta"	"Juan Domingo"	""	"4/4/2023 5:01"	""	""	1967	7	1	141.54	3.6	"$1,258,286,717,125 "	40.2	105.8	75	13.1	55.1	126014024	23.634501	-102.552784
"190"	190	9700	"Manufacturing"	"Andrei Guriev & family"	63	"Russia"	"Moscow"	"Fertilizers"	"Manufacturing"	"Russia"	""	TRUE	"U"	"M"	"3/24/1960 0:00"	"Guriev & family"	"Andrei"	""	"4/4/2023 5:01"	""	""	1960	3	24	180.75	4.5	"$1,699,876,578,871 "	81.9	102.6	72.7	11.4	46.2	144373535	61.52401	105.318756
"644"	636	4300	"Metals & Mining"	"Andrei Kozitsyn"	62	"Russia"	"Verkhniaya Pyshma"	"Metals"	"Metals & Mining"	"Russia"	""	TRUE	"U"	"M"	"6/9/1960 0:00"	"Kozitsyn"	"Andrei"	""	"4/4/2023 5:01"	""	""	1960	6	9	180.75	4.5	"$1,699,876,578,871 "	81.9	102.6	72.7	11.4	46.2	144373535	61.52401	105.318756
"365"	365	6700	"Finance & Investments"	"Ken Fisher"	72	"United States"	"Dallas"	"Money management"	"Finance & Investments"	"United States"	""	TRUE	"U"	"M"	"11/29/1950 0:00"	"Fisher"	"Ken"	""	"4/4/2023 5:01"	"Texas"	"South"	1950	11	29	117.24	7.5	"$21,427,700,000,000 "	88.2	101.8	78.5	9.6	36.6	328239523	37.09024	-95.712891
"1398"	1368	2200	"Finance & Investments"	"Howard Marks"	76	"United States"	"New York"	"Private equity"	"Finance & Investments"	"United States"	"Oaktree Capital Group LLC"	TRUE	"E"	"M"	"4/23/1946 0:00"	"Marks"	"Howard"	"Chairman"	"4/4/2023 5:01"	"New York"	"Northeast"	1946	4	23	117.24	7.5	"$21,427,700,000,000 "	88.2	101.8	78.5	9.6	36.6	328239523	37.09024	-95.712891
"1204"	1164	2600	"Food & Beverage"	"Alejandro Santo Domingo"	46	"United States"	"New York"	"Beer"	"Food & Beverage"	"United States"	""	FALSE	"E"	"M"	"2/13/1977 0:00"	"Santo Domingo"	"Alejandro"	""	"4/4/2023 5:01"	"New York"	"Northeast"	1977	2	13	117.24	7.5	"$21,427,700,000,000 "	88.2	101.8	78.5	9.6	36.6	328239523	37.09024	-95.712891
"1882"	1804	1600	"Energy"	"Chris Wallin"	70	"Australia"	"Brisbane"	"Mining"	"Energy"	"Australia"	""	TRUE	"R"	"M"	"1/1/1953 0:00"	"Wallin"	"Chris"	""	"4/4/2023 5:01"	""	""	1953	1	1	119.8	1.6	"$1,392,680,589,329 "	113.1	100.3	82.7	23	47.4	25766605	-25.274398	133.775136
"2207"	2133	1300	"Finance & Investments"	"Carsten Maschmeyer"	63	"Germany"	"Munich"	"Finance services"	"Finance & Investments"	"Germany"	""	TRUE	"U"	"M"	"5/8/1959 0:00"	"Maschmeyer"	"Carsten"	""	"4/4/2023 5:01"	""	""	1959	5	8	112.85	1.4	"$3,845,630,030,824 "	70.2	104	80.9	11.5	48.8	83132799	51.165691	10.451526
"285"	282	7700	"Technology"	"Robin Li"	54	"China"	"Beijing"	"Internet search"	"Technology"	"China"	"Baidu"	TRUE	"U"	"M"	"11/17/1968 0:00"	"Li"	"Robin"	"Founder and CEO"	"4/4/2023 5:01"	""	""	1968	11	17	125.08	2.9	"$19,910,000,000,000 "	50.6	100.2	77	9.4	59.2	1397715000	35.86166	104.195397
"1328"	1312	2300	"Finance & Investments"	"Justin Ishbia"	45	"United States"	"Chicago"	"Private equity"	"Finance & Investments"	"United States"	""	FALSE	"U"	"M"	"9/18/1977 0:00"	"Ishbia"	"Justin"	""	"4/4/2023 5:01"	"Illinois"	"Midwest"	1977	9	18	117.24	7.5	"$21,427,700,000,000 "	88.2	101.8	78.5	9.6	36.6	328239523	37.09024	-95.712891
"151"	151	11400	"Food & Beverage"	"Liu Hanyuan"	59	"China"	"Chengdu"	"Agribusiness"	"Food & Beverage"	"China"	""	TRUE	"D"	"M"	"1/1/1964 0:00"	"Liu"	"Hanyuan"	""	"4/4/2023 5:01"	""	""	1964	1	1	125.08	2.9	"$19,910,000,000,000 "	50.6	100.2	77	9.4	59.2	1397715000	35.86166	104.195397
"2194"	2133	1300	"Food & Beverage"	"Li Denghai"	73	"China"	"Laizhou"	"Seed production"	"Food & Beverage"	"China"	""	TRUE	"D"	"M"	"9/1/1949 0:00"	"Li"	"Denghai"	""	"4/4/2023 5:01"	""	""	1949	9	1	125.08	2.9	"$19,910,000,000,000 "	50.6	100.2	77	9.4	59.2	1397715000	35.86166	104.195397
"997"	982	3000	"Finance & Investments"	"Stephen Deckoff"	57	"United States"	"St. John"	"Private equity"	"Finance & Investments"	"United States"	""	TRUE	"N"	"M"	"11/4/1965 0:00"	"Deckoff"	"Stephen"	""	"4/4/2023 5:01"	"U.S. Virgin Islands"	"U.S. Territories"	1965	11	4	117.24	7.5	"$21,427,700,000,000 "	88.2	101.8	78.5	9.6	36.6	328239523	37.09024	-95.712891
"1084"	1067	2800	"Telecom"	"Najib Mikati"	67	"Lebanon"	"Beirut"	"Telecom"	"Telecom"	"Lebanon"	""	TRUE	"D"	"M"	"11/24/1955 0:00"	"Mikati"	"Najib"	""	"4/4/2023 5:01"	""	""	1955	11	24	130.02	3	"$53,367,042,272 "	26.3	95.1	78.9	15.3	32.2	6855713	33.854721	35.862285
"1654"	1647	1800	"Finance & Investments"	"O. Francis Biondi"	58	"United States"	"New York"	"Hedge funds"	"Finance & Investments"	"United States"	""	TRUE	"E"	"M"	"7/4/1964 0:00"	"Biondi"	"O. Francis"	""	"4/4/2023 5:01"	"New York"	"Northeast"	1964	7	4	117.24	7.5	"$21,427,700,000,000 "	88.2	101.8	78.5	9.6	36.6	328239523	37.09024	-95.712891
"2287"	2259	1200	"Diversified"	"Jose Ermirio de Moraes Neto"	70	"Brazil"	"Sao Paulo"	"Diversified"	"Diversified"	"Brazil"	""	FALSE	"D"	"M"	"6/17/1952 0:00"	"Ermirio de Moraes Neto"	"Jose"	""	"4/4/2023 5:01"	""	""	1952	6	17	167.4	3.7	"$1,839,758,040,766 "	51.3	115.4	75.7	14.2	65.1	212559417	-14.235004	-51.92528
"431"	425	6000	"Diversified"	"Sumet Jiaravanon"	88	"Thailand"	"Bangkok"	"Diversified"	"Diversified"	"Thailand"	""	FALSE	"U"	"M"	"11/2/1934 0:00"	"Jiaravanon"	"Sumet"	""	"4/4/2023 5:01"	""	""	1934	11	2	113.27	0.7	"$543,649,976,166 "	49.3	99.8	76.9	14.9	29.5	69625582	15.870032	100.992541
"760"	748	3800	"Telecom"	"Yasumitsu Shigeta"	58	"Japan"	"Tokyo"	"Mobile phone retailer"	"Telecom"	"Japan"	""	TRUE	"U"	"M"	"2/25/1965 0:00"	"Shigeta"	"Yasumitsu"	""	"4/4/2023 5:01"	""	""	1965	2	25	105.48	0.5	"$5,081,769,542,380 "	63.2	98.8	84.2	11.9	46.7	126226568	36.204824	138.252924
"1930"	1905	1500	"Fashion & Retail"	"Philippe Ginestet & family"	69	"France"	"Pujols"	"Retail stores"	"Fashion & Retail"	"France"	""	TRUE	"D"	"M"	"1/1/1954 0:00"	"Ginestet"	"Philippe"	""	"4/4/2023 5:01"	""	""	1954	1	1	110.05	1.1	"$2,715,518,274,227 "	65.6	102.5	82.5	24.2	60.7	67059887	46.227638	2.213749
"1434"	1434	2100	"Metals & Mining"	"Alex Beard"	55	"United Kingdom"	"London"	"Mining, commodities"	"Metals & Mining"	"United Kingdom"	""	TRUE	"D"	"M"	"8/3/1967 0:00"	"Beard"	"Alex"	""	"4/4/2023 5:01"	""	""	1967	8	3	119.62	1.7	"$2,827,113,184,696 "	60	101.2	81.3	25.5	30.6	66834405	55.378051	-3.435973
"722"	721	3900	"Food & Beverage"	"Austen Cargill, II."	72	"United States"	"Livingston"	"Cargill"	"Food & Beverage"	"United States"	""	FALSE	"D"	"M"	"3/9/1951 0:00"	"Cargill"	"Austen"	""	"4/4/2023 5:01"	"Montana"	"West"	1951	3	9	117.24	7.5	"$21,427,700,000,000 "	88.2	101.8	78.5	9.6	36.6	328239523	37.09024	-95.712891
"1338"	1312	2300	"Gambling & Casinos"	"Lim Kok Thay"	71	"Malaysia"	"Kuala Lumpur"	"Casinos"	"Gambling & Casinos"	"Malaysia"	""	FALSE	"U"	"M"	"8/16/1951 0:00"	"Lim"	"Kok Thay"	""	"4/4/2023 5:01"	""	""	1951	8	16	121.46	0.7	"$364,701,517,788 "	45.1	105.3	76	12	38.7	32447385	4.210484	101.975766
"2303"	2259	1200	"Fashion & Retail"	"Huang Guanlin"	58	"China"	"Ningbo"	"Textiles, apparel"	"Fashion & Retail"	"China"	""	TRUE	"D"	"M"	"1/1/1965 0:00"	"Huang"	"Guanlin"	""	"4/4/2023 5:01"	""	""	1965	1	1	125.08	2.9	"$19,910,000,000,000 "	50.6	100.2	77	9.4	59.2	1397715000	35.86166	104.195397
"607"	591	4600	"Finance & Investments"	"Barry Sternlicht"	62	"United States"	"Miami"	"Private equity"	"Finance & Investments"	"United States"	""	TRUE	"U"	"M"	"11/27/1960 0:00"	"Sternlicht"	"Barry"	""	"4/4/2023 5:01"	"Florida"	"South"	1960	11	27	117.24	7.5	"$21,427,700,000,000 "	88.2	101.8	78.5	9.6	36.6	328239523	37.09024	-95.712891
"2483"	2405	1100	"Fashion & Retail"	"Lyu Yixiong"	60	"China"	"Shanghai"	"Cosmetics"	"Fashion & Retail"	"China"	""	TRUE	"N"	"M"	"1/1/1963 0:00"	"Lyu"	"Yixiong"	""	"4/4/2023 5:01"	""	""	1963	1	1	125.08	2.9	"$19,910,000,000,000 "	50.6	100.2	77	9.4	59.2	1397715000	35.86166	104.195397
"987"	982	3000	"Technology"	"Eva Maria Bucher-Haefner"	66	"Switzerland"	"Zurich"	"Software, investments"	"Technology"	"Switzerland"	""	FALSE	"E"	"F"	"1/1/1957 0:00"	"Bucher-Haefner"	"Eva Maria"	""	"4/4/2023 5:01"	""	""	1957	1	1	99.55	0.4	"$703,082,435,360 "	59.6	105.2	83.6	10.1	28.8	8574832	46.818188	8.227512
"483"	466	5500	"Media & Entertainment"	"Margaretta Taylor"	80	"United States"	"Southampton"	"Media, automotive"	"Media & Entertainment"	"United States"	""	FALSE	"U"	"F"	"4/15/1942 0:00"	"Taylor"	"Margaretta"	""	"4/4/2023 5:01"	"New York"	"Northeast"	1942	4	15	117.24	7.5	"$21,427,700,000,000 "	88.2	101.8	78.5	9.6	36.6	328239523	37.09024	-95.712891
"1527"	1516	2000	"Diversified"	"William Franke"	85	"United States"	"Houston"	"Low-cost airlines"	"Diversified"	"United States"	""	TRUE	"D"	"M"	"4/15/1937 0:00"	"Franke"	"William"	""	"4/4/2023 5:01"	"Texas"	"South"	1937	4	15	117.24	7.5	"$21,427,700,000,000 "	88.2	101.8	78.5	9.6	36.6	328239523	37.09024	-95.712891
"740"	721	3900	"Fashion & Retail"	"Julia Oetker"	44	"Germany"	"Bielefeld"	"Consumer goods"	"Fashion & Retail"	"Germany"	""	FALSE	"U"	"F"	"1/26/1979 0:00"	"Oetker"	"Julia"	""	"4/4/2023 5:01"	""	""	1979	1	26	112.85	1.4	"$3,845,630,030,824 "	70.2	104	80.9	11.5	48.8	83132799	51.165691	10.451526
"2098"	2020	1400	"Real Estate"	"Subhash Runwal"	79	"India"	"Mumbai"	"Real estate"	"Real Estate"	"India"	""	TRUE	"E"	"M"	"5/22/1943 0:00"	"Runwal"	"Subhash"	""	"4/4/2023 5:01"	""	""	1943	5	22	180.44	7.7	"$2,611,000,000,000 "	28.1	113	69.4	11.2	49.7	1366417754	20.593684	78.96288
"1135"	1104	2700	"Real Estate"	"Maritsa Lazari & family"	78	"United Kingdom"	"London"	"Real estate"	"Real Estate"	"United Kingdom"	""	TRUE	"D"	"F"	"10/14/1944 0:00"	"Lazari"	"Maritsa"	""	"4/4/2023 5:01"	""	""	1944	10	14	119.62	1.7	"$2,827,113,184,696 "	60	101.2	81.3	25.5	30.6	66834405	55.378051	-3.435973
"808"	787	3600	"Technology"	"Melanie Perkins"	35	"Australia"	"Sydney"	"Software"	"Technology"	"Australia"	"Canva"	TRUE	"D"	"F"	"5/13/1987 0:00"	"Perkins"	"Melanie"	"Cofounder & CEO"	"4/4/2023 5:01"	""	""	1987	5	13	119.8	1.6	"$1,392,680,589,329 "	113.1	100.3	82.7	23	47.4	25766605	-25.274398	133.775136
"823"	818	3500	"Fashion & Retail"	"Claudio Del Vecchio"	66	"United States"	"Muttontown"	"Eyeglasses"	"Fashion & Retail"	"Italy"	""	FALSE	"N"	"M"	"2/26/1957 0:00"	"Del Vecchio"	"Claudio"	""	"4/4/2023 5:01"	"New York"	"Northeast"	1957	2	26	117.24	7.5	"$21,427,700,000,000 "	88.2	101.8	78.5	9.6	36.6	328239523	37.09024	-95.712891
"2315"	2259	1200	"Media & Entertainment"	"Guy Lalibert"	63	"Canada"	"Montreal"	"Cirque du Soleil"	"Media & Entertainment"	"Canada"	"Cirque du Soleil"	TRUE	"E"	"M"	"1/1/1960 0:00"	"Lalibert"	"Guy"	"Cofounder and CEO"	"4/4/2023 5:01"	""	""	1960	1	1	116.76	1.9	"$1,736,425,629,520 "	68.9	100.9	81.9	12.8	24.5	36991981	56.130366	-106.346771
"2639"	2540	1000	"Real Estate"	"Zhang Guiping & family"	71	"China"	"Nanjing"	"Real estate"	"Real Estate"	"China"	""	TRUE	"D"	"M"	"8/21/1951 0:00"	"Zhang"	"Guiping"	""	"4/4/2023 5:01"	""	""	1951	8	21	125.08	2.9	"$19,910,000,000,000 "	50.6	100.2	77	9.4	59.2	1397715000	35.86166	104.195397
"2445"	2405	1100	"Fashion & Retail"	"Rahul Gautam"	70	"India"	"Delhi"	"Mattresses"	"Fashion & Retail"	"India"	""	FALSE	"D"	"M"	"11/18/1952 0:00"	"Gautam"	"Rahul"	""	"4/4/2023 5:01"	""	""	1952	11	18	180.44	7.7	"$2,611,000,000,000 "	28.1	113	69.4	11.2	49.7	1366417754	20.593684	78.96288
"1463"	1434	2100	"Manufacturing"	"Huang Min"	49	"China"	"Suzhou"	"Machinery"	"Manufacturing"	"China"	""	TRUE	"U"	"M"	"7/1/1973 0:00"	"Huang"	"Min"	""	"4/4/2023 5:01"	""	""	1973	7	1	125.08	2.9	"$19,910,000,000,000 "	50.6	100.2	77	9.4	59.2	1397715000	35.86166	104.195397
"335"	332	7000	"Technology"	"Jack Dangermond"	77	"United States"	"Redlands"	"Mapping software"	"Technology"	"United States"	""	TRUE	"U"	"M"	"7/23/1945 0:00"	"Dangermond"	"Jack"	""	"4/4/2023 5:01"	"California"	"West"	1945	7	23	117.24	7.5	"$21,427,700,000,000 "	88.2	101.8	78.5	9.6	36.6	328239523	37.09024	-95.712891
"1577"	1575	1900	"Sports"	"David Blitzer"	53	"United States"	"New York"	"Sports"	"Sports"	"United States"	""	TRUE	"N"	"M"	"9/7/1969 0:00"	"Blitzer"	"David"	""	"4/4/2023 5:01"	"New York"	"Northeast"	1969	9	7	117.24	7.5	"$21,427,700,000,000 "	88.2	101.8	78.5	9.6	36.6	328239523	37.09024	-95.712891
"2600"	2540	1000	"Healthcare"	"Loo Choon Yong"	74	"Singapore"	"Singapore"	"Healthcare"	"Healthcare"	"Singapore"	""	TRUE	"N"	"M"	"2/27/1949 0:00"	"Loo"	"Choon Yong"	""	"4/4/2023 5:01"	""	""	1949	2	27	114.41	0.6	"$372,062,527,489 "	84.8	100.6	83.1	13.1	21	5703569	1.352083	103.819836
"25"	25	45100	"Fashion & Retail"	"Phil Knight & family"	85	"United States"	"Hillsboro"	"Nike"	"Fashion & Retail"	"United States"	"Nike"	TRUE	"D"	"M"	"2/24/1938 0:00"	"Knight"	"Phil"	"Chairman"	"4/4/2023 5:01"	"Oregon"	"West"	1938	2	24	117.24	7.5	"$21,427,700,000,000 "	88.2	101.8	78.5	9.6	36.6	328239523	37.09024	-95.712891
"2474"	2405	1100	"Gambling & Casinos"	"Manuel Lao Hernndez"	78	"Spain"	"Matadepera"	"Casinos"	"Gambling & Casinos"	"Spain"	""	TRUE	"D"	"M"	"6/10/1944 0:00"	"Lao Hernndez"	"Manuel"	""	"4/4/2023 5:01"	""	""	1944	6	10	110.96	0.7	"$1,394,116,310,769 "	88.9	102.7	83.3	14.2	47	47076781	40.463667	-3.74922
"595"	591	4600	"Energy"	"Fan Hongwei"	56	"China"	"Wujiang"	"Petrochemicals"	"Energy"	"China"	""	TRUE	"D"	"F"	"1/1/1967 0:00"	"Fan"	"Hongwei"	""	"4/4/2023 5:01"	""	""	1967	1	1	125.08	2.9	"$19,910,000,000,000 "	50.6	100.2	77	9.4	59.2	1397715000	35.86166	104.195397
"514"	511	5200	"Fashion & Retail"	"Gao Dekang & family"	71	"China"	"Changshu"	"Apparel"	"Fashion & Retail"	"China"	""	TRUE	"U"	"M"	"2/1/1952 0:00"	"Gao"	"Dekang"	""	"4/4/2023 5:01"	""	""	1952	2	1	125.08	2.9	"$19,910,000,000,000 "	50.6	100.2	77	9.4	59.2	1397715000	35.86166	104.195397
"2141"	2133	1300	"Energy"	"Kiki Barki"	83	"Indonesia"	"Jakarta"	"Coal"	"Energy"	"Indonesia"	""	TRUE	"D"	"M"	"11/25/1939 0:00"	"Barki"	"Kiki"	""	"4/4/2023 5:01"	""	""	1939	11	25	151.18	3	"$1,119,190,780,753 "	36.3	106.4	71.5	10.2	30.1	270203917	-0.789275	113.921327
"1040"	1027	2900	"Healthcare"	"Gudrun Heine"	68	"Germany"	"Ohningen"	"Medical devices"	"Healthcare"	"Germany"	""	FALSE	"D"	"F"	"10/19/1954 0:00"	"Heine"	"Gudrun"	""	"4/4/2023 5:01"	""	""	1954	10	19	112.85	1.4	"$3,845,630,030,824 "	70.2	104	80.9	11.5	48.8	83132799	51.165691	10.451526
"1005"	982	3000	"Fashion & Retail"	"Friedrich Knapp"	71	"Germany"	"Brunswick"	"Fashion retail"	"Fashion & Retail"	"Germany"	""	TRUE	"D"	"M"	"5/6/1951 0:00"	"Knapp"	"Friedrich"	""	"4/4/2023 5:01"	""	""	1951	5	6	112.85	1.4	"$3,845,630,030,824 "	70.2	104	80.9	11.5	48.8	83132799	51.165691	10.451526
"1195"	1164	2600	"Diversified"	"Lu Weiding"	52	"China"	"Hangzhou"	"Diversified"	"Diversified"	"China"	""	FALSE	"D"	"M"	"3/1/1971 0:00"	"Lu"	"Weiding"	""	"4/4/2023 5:01"	""	""	1971	3	1	125.08	2.9	"$19,910,000,000,000 "	50.6	100.2	77	9.4	59.2	1397715000	35.86166	104.195397
"62"	62	23700	"Metals & Mining"	"Vladimir Potanin"	62	"Russia"	"Moscow"	"Metals"	"Metals & Mining"	"Russia"	""	TRUE	"U"	"M"	"1/3/1961 0:00"	"Potanin"	"Vladimir"	""	"4/4/2023 5:01"	""	""	1961	1	3	180.75	4.5	"$1,699,876,578,871 "	81.9	102.6	72.7	11.4	46.2	144373535	61.52401	105.318756
"701"	699	4000	"Food & Beverage"	"Elisabeth DeLuca & family"	75	"United States"	""	"Subway"	"Food & Beverage"	"United States"	""	FALSE	"N"	"F"	"7/25/1947 0:00"	"DeLuca"	"Elisabeth"	""	"4/4/2023 5:01"	""	"South"	1947	7	25	117.24	7.5	"$21,427,700,000,000 "	88.2	101.8	78.5	9.6	36.6	328239523	37.09024	-95.712891
"1453"	1434	2100	"Energy"	"Gordon Getty"	89	"United States"	"San Francisco"	"Getty Oil"	"Energy"	"United States"	"Ann & Gordon Getty Foundation"	FALSE	"E"	"M"	"12/20/1933 0:00"	"Getty"	"Gordon"	"President and Chairman"	"4/4/2023 5:01"	"California"	"West"	1933	12	20	117.24	7.5	"$21,427,700,000,000 "	88.2	101.8	78.5	9.6	36.6	328239523	37.09024	-95.712891
"2466"	2405	1100	"Automotive"	"Sunjay Kapur"	51	"India"	"Delhi"	"Auto parts"	"Automotive"	"United States"	""	FALSE	"D"	"M"	"10/15/1971 0:00"	"Kapur"	"Sunjay"	""	"4/4/2023 5:01"	""	""	1971	10	15	180.44	7.7	"$2,611,000,000,000 "	28.1	113	69.4	11.2	49.7	1366417754	20.593684	78.96288
"1389"	1368	2200	"Fashion & Retail"	"James Jannard"	73	"United States"	"San Juan Islands"	"Sunglasses"	"Fashion & Retail"	"United States"	""	TRUE	"D"	"M"	"6/8/1949 0:00"	"Jannard"	"James"	""	"4/4/2023 5:01"	"Washington"	"West"	1949	6	8	117.24	7.5	"$21,427,700,000,000 "	88.2	101.8	78.5	9.6	36.6	328239523	37.09024	-95.712891
"188"	184	9800	"Logistics"	"Tanya Saad Zeenny"	55	"France"	"Marseille"	"Shipping"	"Logistics"	"France"	""	FALSE	"Split Family Fortune"	"F"	"2/1/1968 0:00"	"Saad Zeenny"	"Tanya"	""	"4/4/2023 5:01"	""	""	1968	2	1	110.05	1.1	"$2,715,518,274,227 "	65.6	102.5	82.5	24.2	60.7	67059887	46.227638	2.213749
"2359"	2259	1200	"Automotive"	"Alexander Sixt"	43	"Germany"	"Munich"	"Car rentals"	"Automotive"	"Germany"	""	FALSE	"D"	"M"	"10/24/1979 0:00"	"Sixt"	"Alexander"	""	"4/4/2023 5:01"	""	""	1979	10	24	112.85	1.4	"$3,845,630,030,824 "	70.2	104	80.9	11.5	48.8	83132799	51.165691	10.451526
"725"	721	3900	"Finance & Investments"	"Chen Dongsheng"	65	"China"	"Beijing"	"Insurance"	"Finance & Investments"	"China"	""	TRUE	"U"	"M"	"12/1/1957 0:00"	"Chen"	"Dongsheng"	""	"4/4/2023 5:01"	""	""	1957	12	1	125.08	2.9	"$19,910,000,000,000 "	50.6	100.2	77	9.4	59.2	1397715000	35.86166	104.195397
"2436"	2405	1100	"Service"	"Gabriel Escarrer"	88	"Spain"	"Palma de Majorca"	"Hotels"	"Service"	"Spain"	""	TRUE	"E"	"M"	"3/2/1935 0:00"	"Escarrer"	"Gabriel"	""	"4/4/2023 5:01"	""	""	1935	3	2	110.96	0.7	"$1,394,116,310,769 "	88.9	102.7	83.3	14.2	47	47076781	40.463667	-3.74922
"405"	405	6300	"Construction & Engineering"	"Anthony Bamford & family"	77	"United Kingdom"	"Gloucestershire"	"Construction equipment"	"Construction & Engineering"	"United Kingdom"	""	FALSE	"U"	"M"	"10/23/1945 0:00"	"Bamford"	"Anthony"	""	"4/4/2023 5:01"	""	""	1945	10	23	119.62	1.7	"$2,827,113,184,696 "	60	101.2	81.3	25.5	30.6	66834405	55.378051	-3.435973
"1762"	1725	1700	"Technology"	"Alexis L-Quc"	48	"United States"	"New York"	"Cloud computing"	"Technology"	"United States"	"Datadog"	TRUE	"D"	"M"	"11/14/1974 0:00"	"L-Quc"	"Alexis"	"Cofounder"	"4/4/2023 5:01"	"New York"	"Northeast"	1974	11	14	117.24	7.5	"$21,427,700,000,000 "	88.2	101.8	78.5	9.6	36.6	328239523	37.09024	-95.712891
"888"	878	3300	"Diversified"	"Kwek Leng Beng"	82	"Singapore"	"Singapore"	"Diversified"	"Diversified"	"Singapore"	""	FALSE	"U"	"M"	"1/1/1941 0:00"	"Kwek"	"Leng Beng"	""	"4/4/2023 5:01"	""	""	1941	1	1	114.41	0.6	"$372,062,527,489 "	84.8	100.6	83.1	13.1	21	5703569	1.352083	103.819836
"1679"	1647	1800	"Technology"	"Joe Lau"	33	"United States"	"Stanford"	"Blockchain, technology"	"Technology"	"United States"	""	TRUE	"D"	"M"	"7/1/1989 0:00"	"Lau"	"Joe"	""	"4/4/2023 5:01"	"California"	"West"	1989	7	1	117.24	7.5	"$21,427,700,000,000 "	88.2	101.8	78.5	9.6	36.6	328239523	37.09024	-95.712891
"371"	365	6700	"Automotive"	"Li Ping"	55	"China"	"Ningde"	"Batteries"	"Automotive"	"Hong Kong"	""	TRUE	"D"	"M"	"1/1/1968 0:00"	"Li"	"Ping"	""	"4/4/2023 5:01"	""	""	1968	1	1	125.08	2.9	"$19,910,000,000,000 "	50.6	100.2	77	9.4	59.2	1397715000	35.86166	104.195397
"1702"	1647	1800	"Food & Beverage"	"Genhuo Shao"	57	"China"	"Beijing"	"Agribusiness"	"Food & Beverage"	"China"	""	TRUE	"D"	"M"	"7/29/1965 0:00"	"Shao"	"Genhuo"	""	"4/4/2023 5:01"	""	""	1965	7	29	125.08	2.9	"$19,910,000,000,000 "	50.6	100.2	77	9.4	59.2	1397715000	35.86166	104.195397
"2377"	2259	1200	"Fashion & Retail"	"Sandro Veronesi & family"	63	"Italy"	"Milan"	"Fashion"	"Fashion & Retail"	"Italy"	""	TRUE	"D"	"M"	"10/18/1959 0:00"	"Veronesi"	"Sandro"	""	"4/4/2023 5:01"	""	""	1959	10	18	110.62	0.6	"$2,001,244,392,042 "	61.9	101.9	82.9	24.3	59.1	60297396	41.87194	12.56738
"472"	466	5500	"Automotive"	"Piero Ferrari"	77	"Italy"	"Modena"	"Automobiles"	"Automotive"	"Italy"	""	FALSE	"U"	"M"	"5/22/1945 0:00"	"Ferrari"	"Piero"	""	"4/4/2023 5:01"	""	""	1945	5	22	110.62	0.6	"$2,001,244,392,042 "	61.9	101.9	82.9	24.3	59.1	60297396	41.87194	12.56738
"652"	636	4300	"Healthcare"	"Jon Stryker"	64	"United States"	"New York"	"Medical equipment"	"Healthcare"	"United States"	""	FALSE	"U"	"M"	"5/3/1958 0:00"	"Stryker"	"Jon"	""	"4/4/2023 5:01"	"New York"	"Northeast"	1958	5	3	117.24	7.5	"$21,427,700,000,000 "	88.2	101.8	78.5	9.6	36.6	328239523	37.09024	-95.712891
"1781"	1725	1700	"Food & Beverage"	"Joe Rogers, Jr."	76	"United States"	"Atlanta"	"Waffle House"	"Food & Beverage"	"United States"	""	FALSE	"D"	"M"	"12/2/1946 0:00"	"Rogers"	"Joe"	""	"4/4/2023 5:01"	"Georgia"	"South"	1946	12	2	117.24	7.5	"$21,427,700,000,000 "	88.2	101.8	78.5	9.6	36.6	328239523	37.09024	-95.712891
"1402"	1368	2200	"Food & Beverage"	"Ni Yongpei & family"	71	"China"	"Liuan"	"Beverages"	"Food & Beverage"	"China"	""	TRUE	"D"	"M"	"1/23/1952 0:00"	"Ni"	"Yongpei"	""	"4/4/2023 5:01"	""	""	1952	1	23	125.08	2.9	"$19,910,000,000,000 "	50.6	100.2	77	9.4	59.2	1397715000	35.86166	104.195397
"2517"	2405	1100	"Diversified"	"Wang Han"	35	"China"	"Shanghai"	"Airline"	"Diversified"	"China"	""	FALSE	"D"	"M"	"8/1/1987 0:00"	"Wang"	"Han"	""	"4/4/2023 5:01"	""	""	1987	8	1	125.08	2.9	"$19,910,000,000,000 "	50.6	100.2	77	9.4	59.2	1397715000	35.86166	104.195397
"788"	787	3600	"Diversified"	"Sanjiv Bajaj"	53	"India"	"Pune"	"Diversified"	"Diversified"	"India"	""	FALSE	"Split Family Fortune"	"M"	"11/2/1969 0:00"	"Bajaj"	"Sanjiv"	""	"4/4/2023 5:01"	""	""	1969	11	2	180.44	7.7	"$2,611,000,000,000 "	28.1	113	69.4	11.2	49.7	1366417754	20.593684	78.96288
"1878"	1804	1600	"Manufacturing"	"Michael Tojner"	57	"Austria"	"Vienna"	"Batteries, investments"	"Manufacturing"	"Austria"	""	TRUE	"D"	"M"	"3/31/1966 0:00"	"Tojner"	"Michael"	""	"4/4/2023 5:01"	""	""	1966	3	31	118.06	1.5	"$446,314,739,528 "	85.1	103.1	81.6	25.4	51.4	8877067	47.516231	14.550072
"2284"	2259	1200	"Media & Entertainment"	"Mathias Doepfner"	60	"Germany"	"Potsdam"	"Media"	"Media & Entertainment"	"Germany"	""	FALSE	"D"	"M"	"1/15/1963 0:00"	"Doepfner"	"Mathias"	""	"4/4/2023 5:01"	""	""	1963	1	15	112.85	1.4	"$3,845,630,030,824 "	70.2	104	80.9	11.5	48.8	83132799	51.165691	10.451526
"2484"	2405	1100	"Technology"	"Soichiro Minami"	46	"Japan"	"Tokyo"	"Internet and software"	"Technology"	"Japan"	""	TRUE	"E"	"M"	"6/15/1976 0:00"	"Minami"	"Soichiro"	""	"4/4/2023 5:01"	""	""	1976	6	15	105.48	0.5	"$5,081,769,542,380 "	63.2	98.8	84.2	11.9	46.7	126226568	36.204824	138.252924
"673"	659	4200	"Automotive"	"E. Joe Shoen"	73	"United States"	"Phoenix"	"U-Haul"	"Automotive"	"United States"	""	FALSE	"U"	"M"	"10/28/1949 0:00"	"Shoen"	"E. Joe"	""	"4/4/2023 5:01"	"Arizona"	"West"	1949	10	28	117.24	7.5	"$21,427,700,000,000 "	88.2	101.8	78.5	9.6	36.6	328239523	37.09024	-95.712891
"1770"	1725	1700	"Finance & Investments"	"Duncan MacMillan"	85	"United States"	"Princeton"	"Bloomberg LP"	"Finance & Investments"	"United States"	""	TRUE	"U"	"M"	"12/17/1937 0:00"	"MacMillan"	"Duncan"	""	"4/4/2023 5:01"	"New Jersey"	"Northeast"	1937	12	17	117.24	7.5	"$21,427,700,000,000 "	88.2	101.8	78.5	9.6	36.6	328239523	37.09024	-95.712891
"1351"	1312	2300	"Food & Beverage"	"Richard Sands"	72	"United States"	"Delray Beach"	"Liquor"	"Food & Beverage"	"United States"	""	FALSE	"Split Family Fortune"	"M"	"3/3/1951 0:00"	"Sands"	"Richard"	""	"4/4/2023 5:01"	"Florida"	"South"	1951	3	3	117.24	7.5	"$21,427,700,000,000 "	88.2	101.8	78.5	9.6	36.6	328239523	37.09024	-95.712891
"660"	659	4200	"Finance & Investments"	"Pyotr Aven"	68	"Latvia"	""	"Oil, banking, telecom"	"Finance & Investments"	"Russia"	""	TRUE	"D"	"M"	"3/16/1955 0:00"	"Aven"	"Pyotr"	""	"4/4/2023 5:01"	""	""	1955	3	16	116.86	2.8	"$34,117,202,555 "	88.1	99.4	74.7	22.9	38.1	1912789	56.879635	24.603189
"1601"	1575	1900	"Diversified"	"Caroline Hagen Kjos"	39	"Switzerland"	"Wollerau"	"Conglomerate"	"Diversified"	"Norway"	""	FALSE	"D"	"F"	"1/1/1984 0:00"	"Hagen Kjos"	"Caroline"	""	"4/4/2023 5:01"	""	""	1984	1	1	99.55	0.4	"$703,082,435,360 "	59.6	105.2	83.6	10.1	28.8	8574832	46.818188	8.227512
"1404"	1368	2200	"Technology"	"Qi Xiangdong"	52	"China"	"Beijing"	"Software"	"Technology"	"China"	""	TRUE	"U"	"M"	"10/1/1970 0:00"	"Qi"	"Xiangdong"	""	"4/4/2023 5:01"	""	""	1970	10	1	125.08	2.9	"$19,910,000,000,000 "	50.6	100.2	77	9.4	59.2	1397715000	35.86166	104.195397
"1170"	1164	2600	"Media & Entertainment"	"Yvonne Bauer"	46	"Germany"	"Hamburg"	"Magazines, media"	"Media & Entertainment"	"Germany"	""	FALSE	"D"	"F"	"3/29/1977 0:00"	"Bauer"	"Yvonne"	""	"4/4/2023 5:01"	""	""	1977	3	29	112.85	1.4	"$3,845,630,030,824 "	70.2	104	80.9	11.5	48.8	83132799	51.165691	10.451526
"515"	511	5200	"Fashion & Retail"	"Micky Jagtiani"	71	"United Arab Emirates"	"Dubai"	"Retail"	"Fashion & Retail"	"India"	""	FALSE	"U"	"M"	"9/28/1951 0:00"	"Jagtiani"	"Micky"	""	"4/4/2023 5:01"	""	""	1951	9	28	114.52	-1.9	"$421,142,267,938 "	36.8	108.4	77.8	0.1	15.9	9770529	23.424076	53.847818
"1208"	1164	2600	"Manufacturing"	"Dieter Schnabel"	77	"Germany"	"Hamburg"	"Chemicals"	"Manufacturing"	"Germany"	""	FALSE	"U"	"M"	"1/1/1946 0:00"	"Schnabel"	"Dieter"	""	"4/4/2023 5:01"	""	""	1946	1	1	112.85	1.4	"$3,845,630,030,824 "	70.2	104	80.9	11.5	48.8	83132799	51.165691	10.451526
"1104"	1104	2700	"Finance & Investments"	"Jose Joao Abdalla Filho"	77	"Brazil"	"Rio de Janeiro"	"Investments"	"Finance & Investments"	"Brazil"	""	FALSE	"D"	"M"	"5/30/1945 0:00"	"Abdalla Filho"	"Jose Joao"	""	"4/4/2023 5:01"	""	""	1945	5	30	167.4	3.7	"$1,839,758,040,766 "	51.3	115.4	75.7	14.2	65.1	212559417	-14.235004	-51.92528
"469"	466	5500	"Technology"	"John Collison"	32	"United States"	"San Francisco"	"Payments software"	"Technology"	"Ireland"	"Stripe"	TRUE	"D"	"M"	"8/6/1990 0:00"	"Collison"	"John"	"Cofounder"	"4/4/2023 5:01"	"California"	"West"	1990	8	6	117.24	7.5	"$21,427,700,000,000 "	88.2	101.8	78.5	9.6	36.6	328239523	37.09024	-95.712891
"1411"	1368	2200	"Technology"	"Alex Shevchenko"	43	"Canada"	""	"Software"	"Technology"	"Canada"	""	TRUE	"D"	"M"	"1/1/1980 0:00"	"Shevchenko"	"Alex"	""	"4/4/2023 5:01"	""	""	1980	1	1	116.76	1.9	"$1,736,425,629,520 "	68.9	100.9	81.9	12.8	24.5	36991981	56.130366	-106.346771
"630"	624	4400	"Fashion & Retail"	"Christian Haub"	58	"Germany"	"Munich"	"Retail"	"Fashion & Retail"	"Germany"	""	FALSE	"E"	"M"	"7/22/1964 0:00"	"Haub"	"Christian"	""	"4/4/2023 5:01"	""	""	1964	7	22	112.85	1.4	"$3,845,630,030,824 "	70.2	104	80.9	11.5	48.8	83132799	51.165691	10.451526
"470"	466	5500	"Technology"	"Patrick Collison"	34	"United States"	"San Francisco"	"Payment software"	"Technology"	"Ireland"	"Stripe"	TRUE	"D"	"M"	"9/9/1988 0:00"	"Collison"	"Patrick"	"Cofounder"	"4/4/2023 5:01"	"California"	"West"	1988	9	9	117.24	7.5	"$21,427,700,000,000 "	88.2	101.8	78.5	9.6	36.6	328239523	37.09024	-95.712891
"1150"	1104	2700	"Healthcare"	"Wayne Rothbaum"	55	"United States"	"Delray Beach"	"Biotech investing"	"Healthcare"	"United States"	""	TRUE	"N"	"M"	"2/17/1968 0:00"	"Rothbaum"	"Wayne"	"Investor"	"4/4/2023 5:01"	"Florida"	"South"	1968	2	17	117.24	7.5	"$21,427,700,000,000 "	88.2	101.8	78.5	9.6	36.6	328239523	37.09024	-95.712891
"776"	766	3700	"Finance & Investments"	"Mikhail Lomtadze"	47	"Kazakhstan"	"Almaty"	"Fintech"	"Finance & Investments"	"Georgia"	""	TRUE	"U"	"M"	"10/17/1975 0:00"	"Lomtadze"	"Mikhail"	""	"4/4/2023 5:01"	""	""	1975	10	17	182.75	5.2	"$180,161,741,180 "	61.7	104.4	73.2	11.7	28.4	18513930	48.019573	66.923684
"485"	466	5500	"Diversified"	"Zhao Yan"	56	"China"	"Beijing"	"Biotech"	"Diversified"	"China"	""	TRUE	"D"	"F"	"1/1/1967 0:00"	"Zhao"	"Yan"	""	"4/4/2023 5:01"	""	""	1967	1	1	125.08	2.9	"$19,910,000,000,000 "	50.6	100.2	77	9.4	59.2	1397715000	35.86166	104.195397
"474"	466	5500	"Diversified"	"James Irving"	95	"Canada"	"Saint John"	"Diversified"	"Diversified"	"Canada"	""	FALSE	"U"	"M"	"3/20/1928 0:00"	"Irving"	"James"	""	"4/4/2023 5:01"	""	""	1928	3	20	116.76	1.9	"$1,736,425,629,520 "	68.9	100.9	81.9	12.8	24.5	36991981	56.130366	-106.346771
"1193"	1164	2600	"Service"	"Li Yongxin"	47	"China"	"Beijing"	"Education"	"Service"	"China"	""	TRUE	"D"	"M"	"3/9/1976 0:00"	"Li"	"Yongxin"	""	"4/4/2023 5:01"	""	""	1976	3	9	125.08	2.9	"$19,910,000,000,000 "	50.6	100.2	77	9.4	59.2	1397715000	35.86166	104.195397
"23"	23	50100	"Technology"	"Michael Dell"	58	"United States"	"Austin"	"Dell Technologies"	"Technology"	"United States"	"Dell Inc."	TRUE	"D"	"M"	"2/23/1965 0:00"	"Dell"	"Michael"	"Chairman and CEO"	"4/4/2023 5:01"	"Texas"	"South"	1965	2	23	117.24	7.5	"$21,427,700,000,000 "	88.2	101.8	78.5	9.6	36.6	328239523	37.09024	-95.712891
"571"	567	4800	"Manufacturing"	"H. Fisk Johnson"	64	"United States"	"Racine"	"Cleaning products"	"Manufacturing"	"United States"	""	FALSE	"U"	"M"	"5/19/1958 0:00"	"Johnson"	"H. Fisk"	""	"4/4/2023 5:01"	"Wisconsin"	"Midwest"	1958	5	19	117.24	7.5	"$21,427,700,000,000 "	88.2	101.8	78.5	9.6	36.6	328239523	37.09024	-95.712891
"384"	383	6600	"Food & Beverage"	"Bubba Cathy"	68	"United States"	"Atlanta"	"Chick-fil-A"	"Food & Beverage"	"United States"	""	FALSE	"U"	"M"	"4/22/1954 0:00"	"Cathy"	"Bubba"	""	"4/4/2023 5:01"	"Georgia"	"South"	1954	4	22	117.24	7.5	"$21,427,700,000,000 "	88.2	101.8	78.5	9.6	36.6	328239523	37.09024	-95.712891
"1169"	1164	2600	"Food & Beverage"	"Wesley Batista"	50	"Brazil"	"Sao Paulo"	"Beef packing"	"Food & Beverage"	"Brazil"	""	FALSE	"D"	"M"	"12/8/1972 0:00"	"Batista"	"Wesley"	""	"4/4/2023 5:01"	""	""	1972	12	8	167.4	3.7	"$1,839,758,040,766 "	51.3	115.4	75.7	14.2	65.1	212559417	-14.235004	-51.92528
"1353"	1312	2300	"Healthcare"	"Alberto Siccardi & family"	78	"Switzerland"	"Lugano"	"Medical devices"	"Healthcare"	"Switzerland"	""	FALSE	"D"	"M"	"5/1/1944 0:00"	"Siccardi"	"Alberto"	""	"4/4/2023 5:01"	""	""	1944	5	1	99.55	0.4	"$703,082,435,360 "	59.6	105.2	83.6	10.1	28.8	8574832	46.818188	8.227512
"689"	679	4100	"Fashion & Retail"	"Igor Kesaev"	56	"Russia"	"Moscow"	"Tobacco distribution, retail"	"Fashion & Retail"	"Russia"	""	TRUE	"U"	"M"	"10/30/1966 0:00"	"Kesaev"	"Igor"	""	"4/4/2023 5:01"	""	""	1966	10	30	180.75	4.5	"$1,699,876,578,871 "	81.9	102.6	72.7	11.4	46.2	144373535	61.52401	105.318756
"366"	365	6700	"Finance & Investments"	"Christopher Hohn"	56	"United Kingdom"	"London"	"Hedge funds"	"Finance & Investments"	"United Kingdom"	"The Children's Investment Fund Management"	TRUE	"D"	"M"	"10/27/1966 0:00"	"Hohn"	"Christopher"	"Investor"	"4/4/2023 5:01"	""	""	1966	10	27	119.62	1.7	"$2,827,113,184,696 "	60	101.2	81.3	25.5	30.6	66834405	55.378051	-3.435973
"168"	167	10500	"Fashion & Retail"	"Sky Xu"	39	"China"	"Guangzhou"	"E-commerce"	"Fashion & Retail"	"China"	""	TRUE	"U"	"M"	"1/1/1984 0:00"	"Xu"	"Sky"	""	"4/4/2023 5:01"	""	""	1984	1	1	125.08	2.9	"$19,910,000,000,000 "	50.6	100.2	77	9.4	59.2	1397715000	35.86166	104.195397
"463"	455	5600	"Gambling & Casinos"	"Teddy Sagi"	51	"Israel"	"Tel Aviv"	"Gambling software"	"Gambling & Casinos"	"Israel"	""	TRUE	"E"	"M"	"11/1/1971 0:00"	"Sagi"	"Teddy"	""	"4/4/2023 5:01"	""	""	1971	11	1	108.15	0.8	"$395,098,666,122 "	63.4	104.9	82.8	23.1	25.3	9053300	31.046051	34.851612
"1130"	1104	2700	"Finance & Investments"	"Yuri Kovalchuk & family"	71	"Russia"	"St. Petersburg"	"Banking, insurance, media"	"Finance & Investments"	"Russia"	""	TRUE	"U"	"M"	"7/25/1951 0:00"	"Kovalchuk"	"Yuri"	""	"4/4/2023 5:01"	""	""	1951	7	25	180.75	4.5	"$1,699,876,578,871 "	81.9	102.6	72.7	11.4	46.2	144373535	61.52401	105.318756
"2128"	2020	1400	"Manufacturing"	"Xinghai Zhang & family"	60	"China"	"Chongqing"	"Machinery"	"Manufacturing"	"China"	""	TRUE	"D"	"M"	"1/1/1963 0:00"	"Zhang"	"Xinghai"	""	"4/4/2023 5:01"	""	""	1963	1	1	125.08	2.9	"$19,910,000,000,000 "	50.6	100.2	77	9.4	59.2	1397715000	35.86166	104.195397
"2011"	1905	1500	"Technology"	"Xiong Wu"	47	"China"	"Shenzhen"	"Software"	"Technology"	"China"	""	TRUE	"E"	"M"	"1/1/1976 0:00"	"Xiong"	"Wu"	""	"4/4/2023 5:01"	""	""	1976	1	1	125.08	2.9	"$19,910,000,000,000 "	50.6	100.2	77	9.4	59.2	1397715000	35.86166	104.195397
"2367"	2259	1200	"Technology"	"Ion Stoica"	58	"United States"	"Berkeley"	"Data analytics"	"Technology"	"Romania"	""	TRUE	"D"	"M"	"2/12/1965 0:00"	"Stoica"	"Ion"	""	"4/4/2023 5:01"	"California"	"West"	1965	2	12	117.24	7.5	"$21,427,700,000,000 "	88.2	101.8	78.5	9.6	36.6	328239523	37.09024	-95.712891
"302"	299	7500	"Finance & Investments"	"Paul Tudor Jones, II."	68	"United States"	"Palm Beach"	"Hedge funds"	"Finance & Investments"	"United States"	"Tudor Investment Corporation"	TRUE	"U"	"M"	"9/28/1954 0:00"	"Jones"	"Paul Tudor"	"Founder"	"4/4/2023 5:01"	"Florida"	"South"	1954	9	28	117.24	7.5	"$21,427,700,000,000 "	88.2	101.8	78.5	9.6	36.6	328239523	37.09024	-95.712891
"309"	305	7400	"Manufacturing"	"Steven Rales"	72	"United States"	"Santa Barbara"	"Manufacturing, investments"	"Manufacturing"	"United States"	"Danaher"	TRUE	"D"	"M"	"3/31/1951 0:00"	"Rales"	"Steven"	"Investor"	"4/4/2023 5:01"	"California"	"West"	1951	3	31	117.24	7.5	"$21,427,700,000,000 "	88.2	101.8	78.5	9.6	36.6	328239523	37.09024	-95.712891
"2602"	2540	1000	"Manufacturing"	"Ma Xiuhui"	52	"China"	"Shanghai"	"LED lighting"	"Manufacturing"	"China"	""	TRUE	"D"	"F"	"1/7/1971 0:00"	"Ma"	"Xiuhui"	""	"4/4/2023 5:01"	""	""	1971	1	7	125.08	2.9	"$19,910,000,000,000 "	50.6	100.2	77	9.4	59.2	1397715000	35.86166	104.195397
"1241"	1217	2500	"Media & Entertainment"	"Jay-Z"	53	"United States"	"New York"	"Music"	"Media & Entertainment"	"United States"	""	TRUE	"U"	"M"	"12/4/1969 0:00"	"Jay-Z"	""	""	"4/4/2023 5:01"	"New York"	"Northeast"	1969	12	4	117.24	7.5	"$21,427,700,000,000 "	88.2	101.8	78.5	9.6	36.6	328239523	37.09024	-95.712891
"1298"	1272	2400	"Diversified"	"Rajan Raheja & family"	68	"India"	"Mumbai"	"Diversified"	"Diversified"	"India"	""	FALSE	"E"	"M"	"6/1/1954 0:00"	"Raheja"	"Rajan"	""	"4/4/2023 5:01"	""	""	1954	6	1	180.44	7.7	"$2,611,000,000,000 "	28.1	113	69.4	11.2	49.7	1366417754	20.593684	78.96288
"1322"	1312	2300	"Diversified"	"James Duff"	62	"United States"	"Hattiesburg"	"Tires, diversified"	"Diversified"	"United States"	""	TRUE	"U"	"M"	"3/7/1961 0:00"	"Duff"	"James"	""	"4/4/2023 5:01"	"Mississippi"	"South"	1961	3	7	117.24	7.5	"$21,427,700,000,000 "	88.2	101.8	78.5	9.6	36.6	328239523	37.09024	-95.712891
"1010"	982	3000	"Healthcare"	"Gilles Martin"	59	"France"	"Nantes"	"Laboratory services"	"Healthcare"	"France"	""	TRUE	"D"	"M"	"10/20/1963 0:00"	"Martin"	"Gilles"	""	"4/4/2023 5:01"	""	""	1963	10	20	110.05	1.1	"$2,715,518,274,227 "	65.6	102.5	82.5	24.2	60.7	67059887	46.227638	2.213749
"209"	208	9200	"Diversified"	"Antonia Ax:son Johnson & family"	79	"Sweden"	"Stockholm"	"Diversified"	"Diversified"	"Sweden"	""	FALSE	"U"	"F"	"9/6/1943 0:00"	"Ax:son Johnson"	"Antonia"	""	"4/4/2023 5:01"	""	""	1943	9	6	110.51	1.8	"$530,832,908,738 "	67	126.6	82.5	27.9	49.1	10285453	60.128161	18.643501
"65"	65	23100	"Metals & Mining"	"Iris Fontbona & family"	80	"Chile"	"Santiago"	"Mining"	"Metals & Mining"	"Chile"	""	FALSE	"U"	"F"	"1/1/1943 0:00"	"Fontbona"	"Iris"	""	"4/4/2023 5:01"	""	""	1943	1	1	131.91	2.6	"$282,318,159,745 "	88.5	101.4	80	18.2	34	18952038	-35.675147	-71.542969
"2169"	2133	1300	"Construction & Engineering"	"Simona Giorgetta"	45	"Italy"	"Milan"	"Chemical products"	"Construction & Engineering"	"Italy"	""	FALSE	"E"	"F"	"4/24/1977 0:00"	"Giorgetta"	"Simona"	""	"4/4/2023 5:01"	""	""	1977	4	24	110.62	0.6	"$2,001,244,392,042 "	61.9	101.9	82.9	24.3	59.1	60297396	41.87194	12.56738
"851"	818	3500	"Manufacturing"	"Barry Zekelman"	56	"Canada"	"Windsor"	"Steel"	"Manufacturing"	"Canada"	""	FALSE	"U"	"M"	"1/3/1967 0:00"	"Zekelman"	"Barry"	""	"4/4/2023 5:01"	""	""	1967	1	3	116.76	1.9	"$1,736,425,629,520 "	68.9	100.9	81.9	12.8	24.5	36991981	56.130366	-106.346771
"1906"	1905	1500	"Diversified"	"Aziz Akhannouch & family"	62	"Morocco"	"Casablanca"	"Petroleum, diversified"	"Diversified"	"Morocco"	""	FALSE	"D"	"M"	"1/1/1961 0:00"	"Akhannouch"	"Aziz"	""	"4/4/2023 5:01"	""	""	1961	1	1	111.07	0.2	"$118,725,279,596 "	35.9	113.9	76.5	21.9	45.8	36910560	31.791702	-7.09262
"1806"	1804	1600	"Finance & Investments"	"Herbert Allen, Jr. & family"	83	"United States"	"New York"	"Investment banking"	"Finance & Investments"	"United States"	""	FALSE	"E"	"M"	"3/5/1940 0:00"	"Allen"	"Herbert"	""	"4/4/2023 5:01"	"New York"	"Northeast"	1940	3	5	117.24	7.5	"$21,427,700,000,000 "	88.2	101.8	78.5	9.6	36.6	328239523	37.09024	-95.712891
"1651"	1647	1800	"Real Estate"	"Masaaki Arai"	57	"Japan"	"Tokyo"	"Home sales"	"Real Estate"	"Japan"	""	TRUE	"D"	"M"	"10/29/1965 0:00"	"Arai"	"Masaaki"	""	"4/4/2023 5:01"	""	""	1965	10	29	105.48	0.5	"$5,081,769,542,380 "	63.2	98.8	84.2	11.9	46.7	126226568	36.204824	138.252924
"561"	552	4900	"Food & Beverage"	"Emanuele (Lino) Saputo & family"	86	"Canada"	"Montreal"	"Cheese"	"Food & Beverage"	"Canada"	"Saputo"	FALSE	"U"	"M"	"1/1/1937 0:00"	"Saputo"	"Emanuele (Lino)"	"Chairman"	"4/4/2023 5:01"	""	""	1937	1	1	116.76	1.9	"$1,736,425,629,520 "	68.9	100.9	81.9	12.8	24.5	36991981	56.130366	-106.346771
"1144"	1104	2700	"Technology"	"Yuji Otsuka"	69	"Japan"	"Tokyo"	"Copy machines, software"	"Technology"	"Japan"	""	FALSE	"U"	"M"	"2/13/1954 0:00"	"Otsuka"	"Yuji"	""	"4/4/2023 5:01"	""	""	1954	2	13	105.48	0.5	"$5,081,769,542,380 "	63.2	98.8	84.2	11.9	46.7	126226568	36.204824	138.252924
"1572"	1516	2000	"Technology"	"Hongfei Zhao"	48	"China"	"Beijing"	"Software"	"Technology"	"China"	""	TRUE	"D"	"M"	"6/1/1974 0:00"	"Zhao"	"Hongfei"	""	"4/4/2023 5:01"	""	""	1974	6	1	125.08	2.9	"$19,910,000,000,000 "	50.6	100.2	77	9.4	59.2	1397715000	35.86166	104.195397
"536"	534	5000	"Healthcare"	"Dona Bertarelli"	55	"Switzerland"	"Gstaad"	"Biotech and investments"	"Healthcare"	"Switzerland"	""	FALSE	"U"	"F"	"1/1/1968 0:00"	"Bertarelli"	"Dona"	""	"4/4/2023 5:01"	""	""	1968	1	1	99.55	0.4	"$703,082,435,360 "	59.6	105.2	83.6	10.1	28.8	8574832	46.818188	8.227512
"143"	142	12200	"Healthcare"	"Jiang Rensheng & family"	69	"China"	"Chongqing"	"Vaccines"	"Healthcare"	"China"	""	TRUE	"D"	"M"	"10/8/1953 0:00"	"Jiang"	"Rensheng"	""	"4/4/2023 5:01"	""	""	1953	10	8	125.08	2.9	"$19,910,000,000,000 "	50.6	100.2	77	9.4	59.2	1397715000	35.86166	104.195397
"1981"	1905	1500	"Finance & Investments"	"Christopher Rokos"	52	"United Kingdom"	"London"	"Hedge fund"	"Finance & Investments"	"United Kingdom"	"Rokos Capital Management"	TRUE	"E"	"M"	"9/21/1970 0:00"	"Rokos"	"Christopher"	"CEO & Founder "	"4/4/2023 5:01"	""	""	1970	9	21	119.62	1.7	"$2,827,113,184,696 "	60	101.2	81.3	25.5	30.6	66834405	55.378051	-3.435973
"1182"	1164	2600	"Manufacturing"	"Fiona Geminder"	58	"Australia"	"Melbourne"	"Manufacturing"	"Manufacturing"	"Australia"	""	FALSE	"D"	"F"	"12/1/1964 0:00"	"Geminder"	"Fiona"	""	"4/4/2023 5:01"	""	""	1964	12	1	119.8	1.6	"$1,392,680,589,329 "	113.1	100.3	82.7	23	47.4	25766605	-25.274398	133.775136
"846"	818	3500	"Manufacturing"	"Wim van der Leegte & family"	75	"Netherlands"	"Eindhoven"	"Manufacturing"	"Manufacturing"	"Netherlands"	""	FALSE	"U"	"M"	"8/23/1947 0:00"	"van der Leegte"	"Wim"	""	"4/4/2023 5:01"	""	""	1947	8	23	115.91	2.6	"$909,070,395,161 "	85	104.2	81.8	23	41.2	17332850	52.132633	5.291266
"1741"	1725	1700	"Finance & Investments"	"Rolf Gerling"	68	"Switzerland"	"Zurich"	"Insurance"	"Finance & Investments"	"Germany"	""	FALSE	"E"	"M"	"12/15/1954 0:00"	"Gerling"	"Rolf"	""	"4/4/2023 5:01"	""	""	1954	12	15	99.55	0.4	"$703,082,435,360 "	59.6	105.2	83.6	10.1	28.8	8574832	46.818188	8.227512
"1668"	1647	1800	"Food & Beverage"	"Christopher Goldsbury"	80	"United States"	"San Antonio"	"Salsa"	"Food & Beverage"	"United States"	"Silver Ventures"	FALSE	"E"	"M"	"1/1/1943 0:00"	"Goldsbury"	"Christopher"	"Chief Executive Officer"	"4/4/2023 5:01"	"Texas"	"South"	1943	1	1	117.24	7.5	"$21,427,700,000,000 "	88.2	101.8	78.5	9.6	36.6	328239523	37.09024	-95.712891
"1963"	1905	1500	"Real Estate"	"Bruce Mathieson"	79	"Australia"	"Gold Coast"	"Hotels"	"Real Estate"	"Australia"	""	TRUE	"D"	"M"	"2/14/1944 0:00"	"Mathieson"	"Bruce"	""	"4/4/2023 5:01"	""	""	1944	2	14	119.8	1.6	"$1,392,680,589,329 "	113.1	100.3	82.7	23	47.4	25766605	-25.274398	133.775136
"2520"	2405	1100	"Sports"	"Tiger Woods"	47	"United States"	"Jupiter Island"	"Golf"	"Sports"	"United States"	"PGA"	TRUE	"N"	"M"	"12/30/1975 0:00"	"Woods"	"Tiger"	"Athlete"	"4/4/2023 5:01"	"Florida"	"South"	1975	12	30	117.24	7.5	"$21,427,700,000,000 "	88.2	101.8	78.5	9.6	36.6	328239523	37.09024	-95.712891
"2110"	2020	1400	"Technology"	"Jianyi Wang"	60	"China"	"Hangzhou"	"Fiber optic cables"	"Technology"	"China"	""	TRUE	"U"	"M"	"1/12/1963 0:00"	"Wang"	"Jianyi"	""	"4/4/2023 5:01"	""	""	1963	1	12	125.08	2.9	"$19,910,000,000,000 "	50.6	100.2	77	9.4	59.2	1397715000	35.86166	104.195397
"774"	766	3700	"Technology"	"Jim Kavanaugh"	60	"United States"	"St. Louis"	"IT provider"	"Technology"	"United States"	""	TRUE	"U"	"M"	"10/17/1962 0:00"	"Kavanaugh"	"Jim"	""	"4/4/2023 5:01"	"Missouri"	"Midwest"	1962	10	17	117.24	7.5	"$21,427,700,000,000 "	88.2	101.8	78.5	9.6	36.6	328239523	37.09024	-95.712891
"898"	878	3300	"Finance & Investments"	"Stephen Smith"	71	"Canada"	"Toronto"	"Finance and investments"	"Finance & Investments"	"Canada"	""	TRUE	"U"	"M"	"6/2/1951 0:00"	"Smith"	"Stephen"	""	"4/4/2023 5:01"	""	""	1951	6	2	116.76	1.9	"$1,736,425,629,520 "	68.9	100.9	81.9	12.8	24.5	36991981	56.130366	-106.346771
"76"	76	21100	"Technology"	"Jensen Huang"	60	"United States"	"Los Altos"	"Semiconductors"	"Technology"	"United States"	"Nvidia"	TRUE	"U"	"M"	"2/17/1963 0:00"	"Huang"	"Jensen"	"CEO & President"	"4/4/2023 5:01"	"California"	"West"	1963	2	17	117.24	7.5	"$21,427,700,000,000 "	88.2	101.8	78.5	9.6	36.6	328239523	37.09024	-95.712891
"12"	12	79200	"Technology"	"Larry Page"	50	"United States"	"Palo Alto"	"Google"	"Technology"	"United States"	"Alphabet"	TRUE	"D"	"M"	"3/26/1973 0:00"	"Page"	"Larry"	"Cofounder and board member"	"4/4/2023 5:01"	"California"	"West"	1973	3	26	117.24	7.5	"$21,427,700,000,000 "	88.2	101.8	78.5	9.6	36.6	328239523	37.09024	-95.712891
"1964"	1905	1500	"Diversified"	"Romano Minozzi"	88	"Italy"	"Spilamberto"	"Utilities, diversified"	"Diversified"	"Italy"	""	TRUE	"D"	"M"	"3/6/1935 0:00"	"Minozzi"	"Romano"	""	"4/4/2023 5:01"	""	""	1935	3	6	110.62	0.6	"$2,001,244,392,042 "	61.9	101.9	82.9	24.3	59.1	60297396	41.87194	12.56738
"1268"	1217	2500	"Media & Entertainment"	"Oprah Winfrey"	69	"United States"	"Montecito"	"TV shows"	"Media & Entertainment"	"United States"	""	TRUE	"D"	"F"	"1/29/1954 0:00"	"Winfrey"	"Oprah"	"Entrepreneur, Personality, Philanthropist"	"4/4/2023 5:01"	"California"	"West"	1954	1	29	117.24	7.5	"$21,427,700,000,000 "	88.2	101.8	78.5	9.6	36.6	328239523	37.09024	-95.712891
"1948"	1905	1500	"Food & Beverage"	"Jim Koch"	73	"United States"	"Newton"	"Beer"	"Food & Beverage"	"United States"	""	TRUE	"D"	"M"	"5/27/1949 0:00"	"Koch"	"Jim"	""	"4/4/2023 5:01"	"Massachusetts"	"Northeast"	1949	5	27	117.24	7.5	"$21,427,700,000,000 "	88.2	101.8	78.5	9.6	36.6	328239523	37.09024	-95.712891
"717"	699	4000	"Healthcare"	"Jerzy Starak"	75	"Poland"	"Konstancin"	"Pharmaceuticals"	"Healthcare"	"Poland"	""	TRUE	"E"	"M"	"12/12/1947 0:00"	"Starak"	"Jerzy"	""	"4/4/2023 5:01"	""	""	1947	12	12	114.11	2.2	"$592,164,400,688 "	67.8	100	77.6	17.4	40.8	37970874	51.919438	19.145136
"361"	352	6800	"Finance & Investments"	"David Siegel"	61	"United States"	"Scarsdale"	"Hedge funds"	"Finance & Investments"	"United States"	"Two Sigma"	TRUE	"U"	"M"	"7/15/1961 0:00"	"Siegel"	"David"	"Investor"	"4/4/2023 5:01"	"New York"	"Northeast"	1961	7	15	117.24	7.5	"$21,427,700,000,000 "	88.2	101.8	78.5	9.6	36.6	328239523	37.09024	-95.712891
"345"	344	6900	"Diversified"	"Edythe Broad & family"	87	"United States"	"Los Angeles"	"Homebuilding, insurance"	"Diversified"	"United States"	""	FALSE	"E"	"F"	"1/1/1936 0:00"	"Broad"	"Edythe"	""	"4/4/2023 5:01"	"California"	"West"	1936	1	1	117.24	7.5	"$21,427,700,000,000 "	88.2	101.8	78.5	9.6	36.6	328239523	37.09024	-95.712891
"2546"	2540	1000	"Healthcare"	"Ludwig Theodor Braun"	33	"Germany"	"Melsungen"	"Medical technology"	"Healthcare"	"Germany"	""	FALSE	"D"	"M"	"1/1/1990 0:00"	"Braun"	"Ludwig Theodor"	""	"4/4/2023 5:01"	""	""	1990	1	1	112.85	1.4	"$3,845,630,030,824 "	70.2	104	80.9	11.5	48.8	83132799	51.165691	10.451526
"500"	497	5300	"Finance & Investments"	"Elizabeth Johnson"	59	"United States"	"Boston"	"Fidelity"	"Finance & Investments"	"United States"	""	FALSE	"U"	"F"	"5/7/1963 0:00"	"Johnson"	"Elizabeth"	""	"4/4/2023 5:01"	"Massachusetts"	"Northeast"	1963	5	7	117.24	7.5	"$21,427,700,000,000 "	88.2	101.8	78.5	9.6	36.6	328239523	37.09024	-95.712891
"323"	317	7200	"Fashion & Retail"	"Takahisa Takahara"	61	"Japan"	"Tokyo"	"Personal care goods"	"Fashion & Retail"	"Japan"	""	FALSE	"U"	"M"	"7/12/1961 0:00"	"Takahara"	"Takahisa"	""	"4/4/2023 5:01"	""	""	1961	7	12	105.48	0.5	"$5,081,769,542,380 "	63.2	98.8	84.2	11.9	46.7	126226568	36.204824	138.252924
"2505"	2405	1100	"Technology"	"Sun Hongjun"	49	"China"	"Shanghai"	"Semiconductors"	"Technology"	"China"	""	TRUE	"D"	"M"	"7/1/1973 0:00"	"Sun"	"Hongjun"	""	"4/4/2023 5:01"	""	""	1973	7	1	125.08	2.9	"$19,910,000,000,000 "	50.6	100.2	77	9.4	59.2	1397715000	35.86166	104.195397
"1476"	1434	2100	"Food & Beverage"	"Daniel Lubetzky"	54	"United States"	"New York"	"Snack bars"	"Food & Beverage"	"United States"	""	TRUE	"D"	"M"	"9/28/1968 0:00"	"Lubetzky"	"Daniel"	""	"4/4/2023 5:01"	"New York"	"Northeast"	1968	9	28	117.24	7.5	"$21,427,700,000,000 "	88.2	101.8	78.5	9.6	36.6	328239523	37.09024	-95.712891
"2373"	2259	1200	"Finance & Investments"	"Lina Tombolato"	75	"Italy"	"Tombolo"	"Financial services"	"Finance & Investments"	"Italy"	""	FALSE	"D"	"F"	"7/28/1947 0:00"	"Tombolato"	"Lina"	""	"4/4/2023 5:01"	""	""	1947	7	28	110.62	0.6	"$2,001,244,392,042 "	61.9	101.9	82.9	24.3	59.1	60297396	41.87194	12.56738
"2081"	2020	1400	"Healthcare"	"Miao Yongjun"	55	"China"	"Zhengzhou"	"Clinical diagnostics"	"Healthcare"	"China"	""	TRUE	"U"	"M"	"12/1/1967 0:00"	"Miao"	"Yongjun"	""	"4/4/2023 5:01"	""	""	1967	12	1	125.08	2.9	"$19,910,000,000,000 "	50.6	100.2	77	9.4	59.2	1397715000	35.86166	104.195397
"2575"	2540	1000	"Energy"	"Ghan Djoe Hiang"	79	"Indonesia"	"Jakarta"	"Coal"	"Energy"	"Indonesia"	""	FALSE	"N"	"F"	"9/3/1943 0:00"	"Hiang"	"Ghan Djoe"	""	"4/4/2023 5:01"	""	""	1943	9	3	151.18	3	"$1,119,190,780,753 "	36.3	106.4	71.5	10.2	30.1	270203917	-0.789275	113.921327
"1248"	1217	2500	"Fashion & Retail"	"Lu Yiwen"	36	"China"	"Shenzhen"	"Jewelry"	"Fashion & Retail"	"China"	""	TRUE	"D"	"F"	"1/1/1987 0:00"	"Lu"	"Yiwen"	""	"4/4/2023 5:01"	""	""	1987	1	1	125.08	2.9	"$19,910,000,000,000 "	50.6	100.2	77	9.4	59.2	1397715000	35.86166	104.195397
"1097"	1067	2800	"Manufacturing"	"Sun Shoukuan"	73	"China"	"Yingkou"	"Metals, coal"	"Manufacturing"	"China"	""	TRUE	"E"	"M"	"10/1/1949 0:00"	"Sun"	"Shoukuan"	""	"4/4/2023 5:01"	""	""	1949	10	1	125.08	2.9	"$19,910,000,000,000 "	50.6	100.2	77	9.4	59.2	1397715000	35.86166	104.195397
"910"	905	3200	"Manufacturing"	"Chen Kaixuan"	64	"China"	"Guangzhou"	"Household chemicals"	"Manufacturing"	"China"	""	TRUE	"D"	"M"	"5/1/1958 0:00"	"Chen"	"Kaixuan"	""	"4/4/2023 5:01"	""	""	1958	5	1	125.08	2.9	"$19,910,000,000,000 "	50.6	100.2	77	9.4	59.2	1397715000	35.86166	104.195397
"63"	63	23500	"Technology"	"Jack Ma"	58	"China"	"Hangzhou"	"E-commerce"	"Technology"	"China"	""	TRUE	"U"	"M"	"9/10/1964 0:00"	"Ma"	"Jack"	""	"4/4/2023 5:01"	""	""	1964	9	10	125.08	2.9	"$19,910,000,000,000 "	50.6	100.2	77	9.4	59.2	1397715000	35.86166	104.195397
"875"	852	3400	"Technology"	"Yi Zheng"	52	"China"	"Hangzhou"	"Software"	"Technology"	"China"	""	TRUE	"U"	"M"	"10/15/1970 0:00"	"Yi"	"Zheng"	""	"4/4/2023 5:01"	""	""	1970	10	15	125.08	2.9	"$19,910,000,000,000 "	50.6	100.2	77	9.4	59.2	1397715000	35.86166	104.195397
"32"	31	38300	"Food & Beverage"	"John Mars"	87	"United States"	"Jackson"	"Candy, pet food"	"Food & Beverage"	"United States"	""	FALSE	"U"	"M"	"10/15/1935 0:00"	"Mars"	"John"	""	"4/4/2023 5:01"	"Wyoming"	"South"	1935	10	15	117.24	7.5	"$21,427,700,000,000 "	88.2	101.8	78.5	9.6	36.6	328239523	37.09024	-95.712891
"2462"	2405	1100	"Finance & Investments"	"Jonas Kamprad"	57	"United Kingdom"	"London"	"IKEA"	"Finance & Investments"	"Sweden"	""	FALSE	"E"	"M"	"3/4/1966 0:00"	"Kamprad"	"Jonas"	""	"4/4/2023 5:01"	""	""	1966	3	4	119.62	1.7	"$2,827,113,184,696 "	60	101.2	81.3	25.5	30.6	66834405	55.378051	-3.435973
"877"	852	3400	"Media & Entertainment"	"Charles Zegar"	75	"United States"	"New York"	"Bloomberg LP"	"Media & Entertainment"	"United States"	""	TRUE	"U"	"M"	"2/29/1948 0:00"	"Zegar"	"Charles"	""	"4/4/2023 5:01"	"New York"	"Northeast"	1948	2	29	117.24	7.5	"$21,427,700,000,000 "	88.2	101.8	78.5	9.6	36.6	328239523	37.09024	-95.712891
"1968"	1905	1500	"Logistics"	"Jerry Moyes & family"	79	"United States"	"Tolleson"	"Transportation"	"Logistics"	"United States"	""	TRUE	"U"	"M"	"1/15/1944 0:00"	"Moyes"	"Jerry"	""	"4/4/2023 5:01"	"Arizona"	"West"	1944	1	15	117.24	7.5	"$21,427,700,000,000 "	88.2	101.8	78.5	9.6	36.6	328239523	37.09024	-95.712891
"1910"	1905	1500	"Diversified"	"Katharina Andresen"	27	"Norway"	"Oslo"	"Investments"	"Diversified"	"Norway"	""	FALSE	"U"	"F"	"5/21/1995 0:00"	"Andresen"	"Katharina"	""	"4/4/2023 5:01"	""	""	1995	5	21	120.27	2.2	"$403,336,363,636 "	82	100.3	82.8	23.9	36.2	5347896	60.472024	8.468946
"984"	982	3000	"Real Estate"	"Nicolas Berggruen"	61	"United States"	"Beverly Hills"	"Real estate, investments"	"Real Estate"	"United States"	""	FALSE	"U"	"M"	"8/10/1961 0:00"	"Berggruen"	"Nicolas"	""	"4/4/2023 5:01"	"California"	"West"	1961	8	10	117.24	7.5	"$21,427,700,000,000 "	88.2	101.8	78.5	9.6	36.6	328239523	37.09024	-95.712891
"2048"	2020	1400	"Manufacturing"	"Huang Jinxiang & family"	58	"China"	"Xuancheng"	"Chemicals"	"Manufacturing"	"China"	""	TRUE	"U"	"M"	"1/27/1965 0:00"	"Huang"	"Jinxiang"	""	"4/4/2023 5:01"	""	""	1965	1	27	125.08	2.9	"$19,910,000,000,000 "	50.6	100.2	77	9.4	59.2	1397715000	35.86166	104.195397
"187"	184	9800	"Logistics"	"Rodolphe Saad"	53	"France"	"Marseille"	"Shipping"	"Logistics"	"France"	"CMA CGM"	FALSE	"Split Family Fortune"	"M"	"3/3/1970 0:00"	"Saad"	"Rodolphe"	"Chairman and CEO"	"4/4/2023 5:01"	""	""	1970	3	3	110.05	1.1	"$2,715,518,274,227 "	65.6	102.5	82.5	24.2	60.7	67059887	46.227638	2.213749
"988"	982	3000	"Healthcare"	"Cai Dongchen"	70	"China"	"Luancheng"	"Pharmaceuticals"	"Healthcare"	"China"	""	TRUE	"D"	"M"	"2/1/1953 0:00"	"Cai"	"Dongchen"	""	"4/4/2023 5:01"	""	""	1953	2	1	125.08	2.9	"$19,910,000,000,000 "	50.6	100.2	77	9.4	59.2	1397715000	35.86166	104.195397
"382"	365	6700	"Food & Beverage"	"Xu Shihui"	65	"China"	"Quanzhou"	"Snacks, beverages"	"Food & Beverage"	"China"	""	TRUE	"D"	"M"	"1/1/1958 0:00"	"Xu"	"Shihui"	""	"4/4/2023 5:01"	""	""	1958	1	1	125.08	2.9	"$19,910,000,000,000 "	50.6	100.2	77	9.4	59.2	1397715000	35.86166	104.195397
"1868"	1804	1600	"Food & Beverage"	"Andres Santo Domingo"	44	"United States"	"New York"	"Beer"	"Food & Beverage"	"United States"	""	FALSE	"E"	"M"	"6/1/1978 0:00"	"Santo Domingo"	"Andres"	""	"4/4/2023 5:01"	"New York"	"Northeast"	1978	6	1	117.24	7.5	"$21,427,700,000,000 "	88.2	101.8	78.5	9.6	36.6	328239523	37.09024	-95.712891
"1975"	1905	1500	"Construction & Engineering"	"David Penaloza Alanis"	49	"Mexico"	"Mexico City"	"Toll roads"	"Construction & Engineering"	"Mexico"	""	FALSE	"U"	"M"	"1/1/1974 0:00"	"Penaloza Alanis"	"David"	""	"4/4/2023 5:01"	""	""	1974	1	1	141.54	3.6	"$1,258,286,717,125 "	40.2	105.8	75	13.1	55.1	126014024	23.634501	-102.552784
"242"	242	8400	"Media & Entertainment"	"Jim Kennedy"	75	"United States"	"Atlanta"	"Media, automotive"	"Media & Entertainment"	"United States"	"Cox Enterprises"	FALSE	"U"	"M"	"11/29/1947 0:00"	"Kennedy"	"Jim"	"Chairman Emeritus"	"4/4/2023 5:01"	"Georgia"	"South"	1947	11	29	117.24	7.5	"$21,427,700,000,000 "	88.2	101.8	78.5	9.6	36.6	328239523	37.09024	-95.712891
"1697"	1647	1800	"Technology"	"Olivier Pomel"	46	"United States"	"New York"	"Cloud computing"	"Technology"	"France"	"Datadog"	TRUE	"D"	"M"	"3/26/1977 0:00"	"Pomel"	"Olivier"	"Cofounder"	"4/4/2023 5:01"	"New York"	"Northeast"	1977	3	26	117.24	7.5	"$21,427,700,000,000 "	88.2	101.8	78.5	9.6	36.6	328239523	37.09024	-95.712891
"1000"	982	3000	"Food & Beverage"	"Sam Goi"	76	"Singapore"	"Singapore"	"Frozen foods"	"Food & Beverage"	"Singapore"	""	TRUE	"U"	"M"	"12/28/1946 0:00"	"Goi"	"Sam"	""	"4/4/2023 5:01"	""	""	1946	12	28	114.41	0.6	"$372,062,527,489 "	84.8	100.6	83.1	13.1	21	5703569	1.352083	103.819836
"1424"	1368	2200	"Fashion & Retail"	"Wang Wenmo"	66	"China"	"Quanzhou"	"Sports apparel"	"Fashion & Retail"	"China"	""	TRUE	"U"	"M"	"1/1/1957 0:00"	"Wang"	"Wenmo"	""	"4/4/2023 5:01"	""	""	1957	1	1	125.08	2.9	"$19,910,000,000,000 "	50.6	100.2	77	9.4	59.2	1397715000	35.86166	104.195397
"227"	223	8800	"Technology"	"Pierre Omidyar"	55	"United States"	"Honolulu"	"EBay, PayPal"	"Technology"	"United States"	"eBay"	TRUE	"D"	"M"	"6/21/1967 0:00"	"Omidyar"	"Pierre"	"Founder"	"4/4/2023 5:01"	"Hawaii"	"West"	1967	6	21	117.24	7.5	"$21,427,700,000,000 "	88.2	101.8	78.5	9.6	36.6	328239523	37.09024	-95.712891
"2184"	2133	1300	"Technology"	"Alexander Karp"	55	"United States"	"Palo Alto"	"Software firm"	"Technology"	"United States"	"Palantir Technologies"	TRUE	"U"	"M"	"10/1/1967 0:00"	"Karp"	"Alexander"	"Cofounder and CEO"	"4/4/2023 5:01"	"California"	"West"	1967	10	1	117.24	7.5	"$21,427,700,000,000 "	88.2	101.8	78.5	9.6	36.6	328239523	37.09024	-95.712891
"605"	591	4600	"Food & Beverage"	"Issad Rebrab & family"	79	"Algeria"	"Algiers"	"Food"	"Food & Beverage"	"Algeria"	""	TRUE	"D"	"M"	"1/1/1944 0:00"	"Rebrab"	"Issad"	""	"4/4/2023 5:01"	""	""	1944	1	1	151.36	2	"$169,988,236,398 "	51.4	109.9	76.7	37.2	66.1	43053054	28.033886	1.659626
"430"	425	6000	"Fashion & Retail"	"Gopikishan Damani"	65	"India"	"Mumbai"	"Retail, investments"	"Fashion & Retail"	"India"	""	TRUE	"D"	"M"	"1/1/1958 0:00"	"Damani"	"Gopikishan"	""	"4/4/2023 5:01"	""	""	1958	1	1	180.44	7.7	"$2,611,000,000,000 "	28.1	113	69.4	11.2	49.7	1366417754	20.593684	78.96288
"1064"	1027	2900	"Food & Beverage"	"William Wrigley, Jr."	59	"United States"	"North Palm Beach"	"Chewing gum"	"Food & Beverage"	"United States"	"Wrigley Management, Inc."	FALSE	"D"	"M"	"11/1/1963 0:00"	"Wrigley"	"William"	"Investor"	"4/4/2023 5:01"	"Florida"	"South"	1963	11	1	117.24	7.5	"$21,427,700,000,000 "	88.2	101.8	78.5	9.6	36.6	328239523	37.09024	-95.712891
"319"	317	7200	"Real Estate"	"Jeff Greene"	68	"United States"	"Palm Beach"	"Real estate, investments"	"Real Estate"	"United States"	""	TRUE	"U"	"M"	"12/10/1954 0:00"	"Greene"	"Jeff"	""	"4/4/2023 5:01"	"Florida"	"South"	1954	12	10	117.24	7.5	"$21,427,700,000,000 "	88.2	101.8	78.5	9.6	36.6	328239523	37.09024	-95.712891
"1923"	1905	1500	"Finance & Investments"	"Ana Lucia de Mattos Barretto Villela"	49	"Brazil"	"Sao Paulo"	"Banking"	"Finance & Investments"	"Brazil"	""	FALSE	"D"	"F"	"10/25/1973 0:00"	"de Mattos Barretto Villela"	"Ana Lucia"	""	"4/4/2023 5:01"	""	""	1973	10	25	167.4	3.7	"$1,839,758,040,766 "	51.3	115.4	75.7	14.2	65.1	212559417	-14.235004	-51.92528
"2565"	2540	1000	"Healthcare"	"Feng Yuxia"	58	"China"	"Beijing"	"Pharmaceuticals"	"Healthcare"	"China"	""	TRUE	"D"	"F"	"11/6/1964 0:00"	"Feng"	"Yuxia"	""	"4/4/2023 5:01"	""	""	1964	11	6	125.08	2.9	"$19,910,000,000,000 "	50.6	100.2	77	9.4	59.2	1397715000	35.86166	104.195397
"1306"	1272	2400	"Real Estate"	"David Walentas"	84	"United States"	"New York"	"Real estate"	"Real Estate"	"United States"	""	TRUE	"U"	"M"	"8/7/1938 0:00"	"Walentas"	"David"	""	"4/4/2023 5:01"	"New York"	"Northeast"	1938	8	7	117.24	7.5	"$21,427,700,000,000 "	88.2	101.8	78.5	9.6	36.6	328239523	37.09024	-95.712891
"464"	455	5600	"Healthcare"	"Seo Jung-jin"	65	"South Korea"	"Seoul"	"Biotech"	"Healthcare"	"South Korea"	"Celltrion Inc."	TRUE	"D"	"M"	"10/23/1957 0:00"	"Seo"	"Jung-jin"	""	"4/4/2023 5:01"	""	""	1957	10	23	115.16	0.4	"$2,029,000,000,000 "	94.3	98.1	82.6	15.6	33.2	51709098	35.907757	127.766922
"465"	455	5600	"Automotive"	"Wu Jianshu"	59	"China"	"Ningbo"	"Auto parts"	"Automotive"	"Hong Kong"	""	TRUE	"D"	"M"	"1/1/1964 0:00"	"Wu"	"Jianshu"	""	"4/4/2023 5:01"	""	""	1964	1	1	125.08	2.9	"$19,910,000,000,000 "	50.6	100.2	77	9.4	59.2	1397715000	35.86166	104.195397
"11"	11	80500	"Fashion & Retail"	"Francoise Bettencourt Meyers & family"	69	"France"	"Paris"	"L'Oral"	"Fashion & Retail"	"France"	""	FALSE	"U"	"F"	"7/10/1953 0:00"	"Bettencourt Meyers"	"Francoise"	""	"4/4/2023 5:01"	""	""	1953	7	10	110.05	1.1	"$2,715,518,274,227 "	65.6	102.5	82.5	24.2	60.7	67059887	46.227638	2.213749
"298"	290	7600	"Healthcare"	"Zhong Huijuan"	62	"China"	"Shanghai"	"Pharmaceuticals"	"Healthcare"	"China"	""	TRUE	"D"	"F"	"1/1/1961 0:00"	"Zhong"	"Huijuan"	""	"4/4/2023 5:01"	""	""	1961	1	1	125.08	2.9	"$19,910,000,000,000 "	50.6	100.2	77	9.4	59.2	1397715000	35.86166	104.195397
"2021"	2020	1400	"Finance & Investments"	"Alberto Alcocer"	80	"Spain"	"Madrid"	"Investments"	"Finance & Investments"	"Spain"	""	TRUE	"U"	"M"	"12/7/1942 0:00"	"Alcocer"	"Alberto"	""	"4/4/2023 5:01"	""	""	1942	12	7	110.96	0.7	"$1,394,116,310,769 "	88.9	102.7	83.3	14.2	47	47076781	40.463667	-3.74922
"576"	567	4800	"Manufacturing"	"Winifred J. Marquart"	63	"United States"	"Virginia Beach"	"Cleaning products"	"Manufacturing"	"United States"	""	FALSE	"U"	"F"	"4/6/1959 0:00"	"Marquart"	"Winifred J."	""	"4/4/2023 5:01"	"Virginia"	"South"	1959	4	6	117.24	7.5	"$21,427,700,000,000 "	88.2	101.8	78.5	9.6	36.6	328239523	37.09024	-95.712891
"1969"	1905	1500	"Technology"	"John Ocampo"	63	"United States"	"Los Altos"	"Semiconductors"	"Technology"	"United States"	""	TRUE	"U"	"M"	"4/5/1959 0:00"	"Ocampo"	"John"	""	"4/4/2023 5:01"	"California"	"West"	1959	4	5	117.24	7.5	"$21,427,700,000,000 "	88.2	101.8	78.5	9.6	36.6	328239523	37.09024	-95.712891
"225"	223	8800	"Technology"	"Richard Liu"	49	"China"	"Beijing"	"E-commerce"	"Technology"	"China"	""	TRUE	"D"	"M"	"3/10/1974 0:00"	"Liu"	"Richard"	""	"4/4/2023 5:01"	""	""	1974	3	10	125.08	2.9	"$19,910,000,000,000 "	50.6	100.2	77	9.4	59.2	1397715000	35.86166	104.195397
"1650"	1647	1800	"Sports"	"Leslie Alexander"	79	"United States"	"Houston"	"Sports team"	"Sports"	"United States"	""	TRUE	"E"	"M"	"6/30/1943 0:00"	"Alexander"	"Leslie"	""	"4/4/2023 5:01"	"Texas"	"South"	1943	6	30	117.24	7.5	"$21,427,700,000,000 "	88.2	101.8	78.5	9.6	36.6	328239523	37.09024	-95.712891
"680"	679	4100	"Service"	"Danielle Bellon & family"	83	"France"	"Paris"	"Food services"	"Service"	"France"	""	FALSE	"U"	"F"	"2/8/1940 0:00"	"Bellon"	"Danielle"	""	"4/4/2023 5:01"	""	""	1940	2	8	110.05	1.1	"$2,715,518,274,227 "	65.6	102.5	82.5	24.2	60.7	67059887	46.227638	2.213749
"712"	699	4000	"Telecom"	"Rakesh Mittal"	67	"India"	"Delhi"	"Telecom"	"Telecom"	"India"	""	FALSE	"Split Family Fortune"	"M"	"9/18/1955 0:00"	"Mittal"	"Rakesh"	""	"4/4/2023 5:01"	""	""	1955	9	18	180.44	7.7	"$2,611,000,000,000 "	28.1	113	69.4	11.2	49.7	1366417754	20.593684	78.96288
"2491"	2405	1100	"Diversified"	"Antonio Percassi"	69	"Italy"	"Bergamo"	"Real estate, diversified"	"Diversified"	"Italy"	""	TRUE	"D"	"M"	"6/9/1953 0:00"	"Percassi"	"Antonio"	""	"4/4/2023 5:01"	""	""	1953	6	9	110.62	0.6	"$2,001,244,392,042 "	61.9	101.9	82.9	24.3	59.1	60297396	41.87194	12.56738
"266"	261	8000	"Metals & Mining"	"Pavel Tykac"	58	"Czech Republic"	"Prague"	"Coal mines"	"Metals & Mining"	"Czech Republic"	""	TRUE	"U"	"M"	"5/15/1964 0:00"	"Tykac"	"Pavel"	""	"4/4/2023 5:01"	""	""	1964	5	15	116.48	2.8	"$246,489,245,495 "	64.1	100.7	79	14.9	46.1	10669709	49.817492	15.472962
"2532"	2405	1100	"Media & Entertainment"	"Yu Faxiang"	51	"China"	"Shaoxing"	"Tourism, cultural industry"	"Media & Entertainment"	"China"	""	TRUE	"D"	"M"	"10/7/1971 0:00"	"Yu"	"Faxiang"	""	"4/4/2023 5:01"	""	""	1971	10	7	125.08	2.9	"$19,910,000,000,000 "	50.6	100.2	77	9.4	59.2	1397715000	35.86166	104.195397
"2196"	2133	1300	"Manufacturing"	"Li Yongqing"	58	"China"	"Hangzhou"	"Petro Firbe"	"Manufacturing"	"China"	""	TRUE	"D"	"M"	"6/30/1964 0:00"	"Li"	"Yongqing"	""	"4/4/2023 5:01"	""	""	1964	6	30	125.08	2.9	"$19,910,000,000,000 "	50.6	100.2	77	9.4	59.2	1397715000	35.86166	104.195397
"1643"	1575	1900	"Manufacturing"	"Chuanhua Xu & family"	88	"China"	"Hangzhou"	"Chemicals, logistics"	"Manufacturing"	"China"	"Transfar Group"	TRUE	"D"	"M"	"1/1/1935 0:00"	"Xu"	"Chuanhua"	"Founder"	"4/4/2023 5:01"	""	""	1935	1	1	125.08	2.9	"$19,910,000,000,000 "	50.6	100.2	77	9.4	59.2	1397715000	35.86166	104.195397
"369"	365	6700	"Manufacturing"	"Thomas Kirk Kristiansen"	44	"Denmark"	"Billund"	"Lego"	"Manufacturing"	"Denmark"	""	FALSE	"D"	"M"	"1/1/1979 0:00"	"Kristiansen"	"Thomas Kirk"	""	"4/4/2023 5:01"	""	""	1979	1	1	110.35	0.8	"$348,078,018,464 "	80.6	101.3	81	32.4	23.8	5818553	56.26392	9.501785
"1252"	1217	2500	"Technology"	"Bobby Murphy"	34	"United States"	"Venice"	"Snapchat"	"Technology"	"United States"	"Snap"	TRUE	"D"	"M"	"7/19/1988 0:00"	"Murphy"	"Bobby"	"Cofounder"	"4/4/2023 5:01"	"California"	"West"	1988	7	19	117.24	7.5	"$21,427,700,000,000 "	88.2	101.8	78.5	9.6	36.6	328239523	37.09024	-95.712891
"1832"	1804	1600	"Finance & Investments"	"Bill Gross"	78	"United States"	"Laguna Beach"	"Investments"	"Finance & Investments"	"United States"	"Pacific Investment Management Company LLC"	TRUE	"E"	"M"	"4/13/1944 0:00"	"Gross"	"Bill"	"Cofounder and Co-Chief Investment Officer"	"4/4/2023 5:01"	"California"	"West"	1944	4	13	117.24	7.5	"$21,427,700,000,000 "	88.2	101.8	78.5	9.6	36.6	328239523	37.09024	-95.712891
"2047"	2020	1400	"Technology"	"Drew Houston"	40	"United States"	"Austin"	"Cloud storage service"	"Technology"	"United States"	"Dropbox"	TRUE	"D"	"M"	"3/4/1983 0:00"	"Houston"	"Drew"	"CEO"	"4/4/2023 5:01"	"Texas"	"South"	1983	3	4	117.24	7.5	"$21,427,700,000,000 "	88.2	101.8	78.5	9.6	36.6	328239523	37.09024	-95.712891
"356"	352	6800	"Energy"	"Milane Frantz"	53	"United States"	"Houston"	"Pipelines"	"Energy"	"United States"	""	FALSE	"U"	"F"	"8/12/1969 0:00"	"Frantz"	"Milane"	""	"4/4/2023 5:01"	"Texas"	"South"	1969	8	12	117.24	7.5	"$21,427,700,000,000 "	88.2	101.8	78.5	9.6	36.6	328239523	37.09024	-95.712891
"217"	215	9000	"Real Estate"	"Alexander Otto"	55	"Germany"	"Hamburg"	"Real estate"	"Real Estate"	"Germany"	""	FALSE	"D"	"M"	"7/7/1967 0:00"	"Otto"	"Alexander"	""	"4/4/2023 5:01"	""	""	1967	7	7	112.85	1.4	"$3,845,630,030,824 "	70.2	104	80.9	11.5	48.8	83132799	51.165691	10.451526
"1574"	1516	2000	"Healthcare"	"Zhu Yiwen & family"	59	"China"	"Shanghai"	"Healthcare"	"Healthcare"	"China"	""	TRUE	"U"	"M"	"1/1/1964 0:00"	"Zhu"	"Yiwen"	""	"4/4/2023 5:01"	""	""	1964	1	1	125.08	2.9	"$19,910,000,000,000 "	50.6	100.2	77	9.4	59.2	1397715000	35.86166	104.195397
"1020"	982	3000	"Diversified"	"Guangxin Sun"	60	"China"	"Urumqi"	"Diversified"	"Diversified"	"China"	""	TRUE	"U"	"M"	"12/1/1962 0:00"	"Sun"	"Guangxin"	""	"4/4/2023 5:01"	""	""	1962	12	1	125.08	2.9	"$19,910,000,000,000 "	50.6	100.2	77	9.4	59.2	1397715000	35.86166	104.195397
"790"	787	3600	"Finance & Investments"	"Jim Coulter"	63	"United States"	"San Francisco"	"Private equity"	"Finance & Investments"	"United States"	""	TRUE	"U"	"M"	"12/1/1959 0:00"	"Coulter"	"Jim"	""	"4/4/2023 5:01"	"California"	"West"	1959	12	1	117.24	7.5	"$21,427,700,000,000 "	88.2	101.8	78.5	9.6	36.6	328239523	37.09024	-95.712891
"1635"	1575	1900	"Construction & Engineering"	"Mehmet Sinan Tara"	64	"Turkey"	"Istanbul"	"Construction"	"Construction & Engineering"	"Turkey"	""	FALSE	"U"	"M"	"5/24/1958 0:00"	"Tara"	"Mehmet Sinan"	""	"4/4/2023 5:01"	""	""	1958	5	24	234.44	15.2	"$754,411,708,203 "	23.9	93.2	77.4	17.9	42.3	83429615	38.963745	35.243322
"2005"	1905	1500	"Telecom"	"Kenny Troutt"	75	"United States"	"Dallas"	"Telecom"	"Telecom"	"United States"	""	TRUE	"E"	"M"	"1/8/1948 0:00"	"Troutt"	"Kenny"	""	"4/4/2023 5:01"	"Texas"	"South"	1948	1	8	117.24	7.5	"$21,427,700,000,000 "	88.2	101.8	78.5	9.6	36.6	328239523	37.09024	-95.712891
"2066"	2020	1400	"Fashion & Retail"	"Bernard Lewis & family"	97	"United Kingdom"	"London"	"Fashion retailer"	"Fashion & Retail"	"United Kingdom"	""	TRUE	"U"	"M"	"2/10/1926 0:00"	"Lewis"	"Bernard"	""	"4/4/2023 5:01"	""	""	1926	2	10	119.62	1.7	"$2,827,113,184,696 "	60	101.2	81.3	25.5	30.6	66834405	55.378051	-3.435973
"363"	352	6800	"Technology"	"Wang Laisheng"	58	"China"	"Shenzhen"	"Electronics components"	"Technology"	"Hong Kong"	""	TRUE	"D"	"M"	"12/14/1964 0:00"	"Wang"	"Laisheng"	""	"4/4/2023 5:01"	""	""	1964	12	14	125.08	2.9	"$19,910,000,000,000 "	50.6	100.2	77	9.4	59.2	1397715000	35.86166	104.195397
"2558"	2540	1000	"Manufacturing"	"Kochouseph Chittilappilly"	72	"India"	"Kochi"	"Electrical appliances"	"Manufacturing"	"India"	""	TRUE	"R"	"M"	"12/27/1950 0:00"	"Chittilappilly"	"Kochouseph"	""	"4/4/2023 5:01"	""	""	1950	12	27	180.44	7.7	"$2,611,000,000,000 "	28.1	113	69.4	11.2	49.7	1366417754	20.593684	78.96288
"1634"	1575	1900	"Manufacturing"	"Hermanto Tanoko"	60	"Indonesia"	"Surabaya"	"Paints"	"Manufacturing"	"Indonesia"	""	FALSE	"Split Family Fortune"	"M"	"9/17/1962 0:00"	"Tanoko"	"Hermanto"	""	"4/4/2023 5:01"	""	""	1962	9	17	151.18	3	"$1,119,190,780,753 "	36.3	106.4	71.5	10.2	30.1	270203917	-0.789275	113.921327
"1742"	1725	1700	"Real Estate"	"John Goff"	67	"United States"	"Fort Worth"	"Real estate"	"Real Estate"	"United States"	""	TRUE	"U"	"M"	"8/26/1955 0:00"	"Goff"	"John"	""	"4/4/2023 5:01"	"Texas"	"South"	1955	8	26	117.24	7.5	"$21,427,700,000,000 "	88.2	101.8	78.5	9.6	36.6	328239523	37.09024	-95.712891
"791"	787	3600	"Automotive"	"Nicolas D'Ieteren"	47	"Switzerland"	"Anzere"	"Auto parts, distribution"	"Automotive"	"Belgium"	""	FALSE	"N"	"M"	"4/13/1975 0:00"	"D'Ieteren"	"Nicolas "	""	"4/4/2023 5:01"	""	""	1975	4	13	99.55	0.4	"$703,082,435,360 "	59.6	105.2	83.6	10.1	28.8	8574832	46.818188	8.227512
"2640"	2540	1000	"Diversified"	"Inigo Zobel"	66	"Philippines"	"Makati"	"Diversified"	"Diversified"	"Philippines"	""	FALSE	"R"	"M"	"11/1/1956 0:00"	"Zobel"	"Inigo"	""	"4/4/2023 5:01"	""	""	1956	11	1	129.61	2.5	"$376,795,508,680 "	35.5	107.5	71.1	14	43.1	108116615	12.879721	121.774017
"362"	352	6800	"Diversified"	"Viktor Vekselberg"	65	"Russia"	"Moscow"	"Metals, investments"	"Diversified"	"Russia"	""	TRUE	"U"	"M"	"4/14/1957 0:00"	"Vekselberg"	"Viktor"	""	"4/4/2023 5:01"	""	""	1957	4	14	180.75	4.5	"$1,699,876,578,871 "	81.9	102.6	72.7	11.4	46.2	144373535	61.52401	105.318756
"1576"	1575	1900	"Energy"	"Mika Anttonen"	56	"Finland"	"Helsinki"	"Oil & gas"	"Energy"	"Finland"	""	TRUE	"U"	"M"	"12/18/1966 0:00"	"Anttonen"	"Mika"	""	"4/4/2023 5:01"	""	""	1966	12	18	112.33	1	"$268,761,201,365 "	88.2	100.2	81.7	20.8	36.6	5520314	61.92411	25.748151
"1028"	1027	2900	"Automotive"	"Alberto Bombassei"	82	"Italy"	"Bergamo"	"Automotive brakes"	"Automotive"	"Italy"	""	FALSE	"U"	"M"	"10/5/1940 0:00"	"Bombassei"	"Alberto"	""	"4/4/2023 5:01"	""	""	1940	10	5	110.62	0.6	"$2,001,244,392,042 "	61.9	101.9	82.9	24.3	59.1	60297396	41.87194	12.56738
"831"	818	3500	"Technology"	"Peter Gassner"	58	"United States"	"Pleasanton"	"Software"	"Technology"	"United States"	""	TRUE	"U"	"M"	"2/26/1965 0:00"	"Gassner"	"Peter"	""	"4/4/2023 5:01"	"California"	"West"	1965	2	26	117.24	7.5	"$21,427,700,000,000 "	88.2	101.8	78.5	9.6	36.6	328239523	37.09024	-95.712891
"1475"	1434	2100	"Fashion & Retail"	"Sergey Lomakin"	49	"Cyprus"	"Paphos"	"Retail"	"Fashion & Retail"	"Russia"	""	TRUE	"R"	"M"	"5/23/1973 0:00"	"Lomakin"	"Sergey"	""	"4/4/2023 5:01"	""	""	1973	5	23	102.51	0.3	"$24,564,647,935 "	75.9	99.3	80.8	24.5	22.4	1198575	35.126413	33.429859
"1349"	1312	2300	"Fashion & Retail"	"Marina Prada"	77	"Italy"	"Milan"	"Luxury goods"	"Fashion & Retail"	"Italy"	""	FALSE	"U"	"F"	"7/14/1945 0:00"	"Prada"	"Marina"	""	"4/4/2023 5:01"	""	""	1945	7	14	110.62	0.6	"$2,001,244,392,042 "	61.9	101.9	82.9	24.3	59.1	60297396	41.87194	12.56738
"705"	699	4000	"Technology"	"Travis Kalanick"	46	"United States"	"Los Angeles"	"Uber"	"Technology"	"United States"	"Uber Technologies Inc."	TRUE	"U"	"M"	"8/6/1976 0:00"	"Kalanick"	"Travis"	"Cofounder"	"4/4/2023 5:01"	"California"	"West"	1976	8	6	117.24	7.5	"$21,427,700,000,000 "	88.2	101.8	78.5	9.6	36.6	328239523	37.09024	-95.712891
"492"	486	5400	"Fashion & Retail"	"Miuccia Prada"	73	"Italy"	"Milan"	"Luxury goods"	"Fashion & Retail"	"Italy"	"Prada"	FALSE	"U"	"F"	"5/10/1949 0:00"	"Prada"	"Miuccia"	"CEO, Fashion Designer"	"4/4/2023 5:01"	""	""	1949	5	10	110.62	0.6	"$2,001,244,392,042 "	61.9	101.9	82.9	24.3	59.1	60297396	41.87194	12.56738
"698"	679	4100	"Healthcare"	"Liangzhi Xie & family"	57	"China"	"Beijing"	"Biotech"	"Healthcare"	"China"	""	TRUE	"D"	"M"	"1/1/1966 0:00"	"Xie"	"Liangzhi"	""	"4/4/2023 5:01"	""	""	1966	1	1	125.08	2.9	"$19,910,000,000,000 "	50.6	100.2	77	9.4	59.2	1397715000	35.86166	104.195397
"2292"	2259	1200	"Fashion & Retail"	"Gary Friedman"	65	"United States"	"Belvedere"	"Furniture retail"	"Fashion & Retail"	"United States"	""	TRUE	"D"	"M"	"8/6/1957 0:00"	"Friedman"	"Gary"	""	"4/4/2023 5:01"	"California"	"West"	1957	8	6	117.24	7.5	"$21,427,700,000,000 "	88.2	101.8	78.5	9.6	36.6	328239523	37.09024	-95.712891
"1151"	1104	2700	"Technology"	"Jeff Rothschild"	68	"United States"	"Palo Alto"	"Facebook"	"Technology"	"United States"	"Meta Platforms"	TRUE	"D"	"M"	"1/2/1955 0:00"	"Rothschild"	"Jeff"	"Advisor"	"4/4/2023 5:01"	"California"	"West"	1955	1	2	117.24	7.5	"$21,427,700,000,000 "	88.2	101.8	78.5	9.6	36.6	328239523	37.09024	-95.712891
"667"	659	4200	"Finance & Investments"	"Marc Ladreit de Lacharriere"	82	"France"	"Paris"	"Finance"	"Finance & Investments"	"France"	""	TRUE	"U"	"M"	"11/6/1940 0:00"	"Ladreit de Lacharriere"	"Marc"	""	"4/4/2023 5:01"	""	""	1940	11	6	110.05	1.1	"$2,715,518,274,227 "	65.6	102.5	82.5	24.2	60.7	67059887	46.227638	2.213749
"1929"	1905	1500	"Media & Entertainment"	"Alan Gerry"	94	"United States"	"Liberty"	"Cable television"	"Media & Entertainment"	"United States"	""	TRUE	"E"	"M"	"12/25/1928 0:00"	"Gerry"	"Alan"	""	"4/4/2023 5:01"	"New York"	"Northeast"	1928	12	25	117.24	7.5	"$21,427,700,000,000 "	88.2	101.8	78.5	9.6	36.6	328239523	37.09024	-95.712891
"521"	511	5200	"Real Estate"	"Ty Warner"	78	"United States"	"Oak Brook"	"Plush toys, real estate"	"Real Estate"	"United States"	""	TRUE	"U"	"M"	"9/3/1944 0:00"	"Warner"	"Ty"	""	"4/4/2023 5:01"	"Illinois"	"Midwest"	1944	9	3	117.24	7.5	"$21,427,700,000,000 "	88.2	101.8	78.5	9.6	36.6	328239523	37.09024	-95.712891
"473"	466	5500	"Automotive"	"Dan Friedkin"	58	"United States"	"Houston"	"Toyota dealerships"	"Automotive"	"United States"	"Gulf States Toyota"	FALSE	"U"	"M"	"2/27/1965 0:00"	"Friedkin"	"Dan"	"owner and ceo"	"4/4/2023 5:01"	"Texas"	"South"	1965	2	27	117.24	7.5	"$21,427,700,000,000 "	88.2	101.8	78.5	9.6	36.6	328239523	37.09024	-95.712891
"117"	116	14900	"Fashion & Retail"	"David Green & family"	81	"United States"	"Oklahoma City"	"Retail"	"Fashion & Retail"	"United States"	"Hobby Lobby"	TRUE	"U"	"M"	"11/13/1941 0:00"	"Green"	"David"	"CEO"	"4/4/2023 5:01"	"Oklahoma"	"South"	1941	11	13	117.24	7.5	"$21,427,700,000,000 "	88.2	101.8	78.5	9.6	36.6	328239523	37.09024	-95.712891
"824"	818	3500	"Fashion & Retail"	"Clemente Del Vecchio"	18	"Italy"	"Milan"	"Eyeglases"	"Fashion & Retail"	"Italy"	""	FALSE	"N"	"M"	"5/6/2004 0:00"	"Del Vecchio"	"Clemente"	""	"4/4/2023 5:01"	""	""	2004	5	6	110.62	0.6	"$2,001,244,392,042 "	61.9	101.9	82.9	24.3	59.1	60297396	41.87194	12.56738
"763"	748	3800	"Service"	"Steven Udvar-Hazy"	77	"United States"	"Westlake"	"Aircraft leasing"	"Service"	"United States"	"Air Lease Corp."	TRUE	"D"	"M"	"2/23/1946 0:00"	"Udvar-Hazy"	"Steven"	"CEO and Chairman"	"4/4/2023 5:01"	"Texas"	"South"	1946	2	23	117.24	7.5	"$21,427,700,000,000 "	88.2	101.8	78.5	9.6	36.6	328239523	37.09024	-95.712891
"1018"	982	3000	"Food & Beverage"	"Yonghong Shi & family"	54	"China"	"Chengdu"	"Restaurants"	"Food & Beverage"	"China"	""	TRUE	"D"	"M"	"1/1/1969 0:00"	"Shi"	"Yonghong"	""	"4/4/2023 5:01"	""	""	1969	1	1	125.08	2.9	"$19,910,000,000,000 "	50.6	100.2	77	9.4	59.2	1397715000	35.86166	104.195397
"1014"	982	3000	"Fashion & Retail"	"Guanghe Qiu & family"	71	"China"	"Wenzhou"	"Fashion retail"	"Fashion & Retail"	"China"	""	TRUE	"D"	"M"	"11/10/1951 0:00"	"Qiu"	"Guanghe"	""	"4/4/2023 5:01"	""	""	1951	11	10	125.08	2.9	"$19,910,000,000,000 "	50.6	100.2	77	9.4	59.2	1397715000	35.86166	104.195397
"185"	184	9800	"Fashion & Retail"	"Nicolas Puech"	80	"Switzerland"	"Martigny"	"Hermes"	"Fashion & Retail"	"France"	""	FALSE	"U"	"M"	"1/29/1943 0:00"	"Puech"	"Nicolas"	""	"4/4/2023 5:01"	""	""	1943	1	29	99.55	0.4	"$703,082,435,360 "	59.6	105.2	83.6	10.1	28.8	8574832	46.818188	8.227512
"2364"	2259	1200	"Construction & Engineering"	"Marco Squinzi"	51	"Italy"	"Milan"	"Chemical products"	"Construction & Engineering"	"Italy"	""	FALSE	"D"	"M"	"9/23/1971 0:00"	"Squinzi"	"Marco"	""	"4/4/2023 5:01"	""	""	1971	9	23	110.62	0.6	"$2,001,244,392,042 "	61.9	101.9	82.9	24.3	59.1	60297396	41.87194	12.56738
"1693"	1647	1800	"Diversified"	"Nihat Ozdemir"	72	"Turkey"	"Ankara"	"Diversified"	"Diversified"	"Turkey"	""	TRUE	"D"	"M"	"4/5/1950 0:00"	"Ozdemir"	"Nihat"	""	"4/4/2023 5:01"	""	""	1950	4	5	234.44	15.2	"$754,411,708,203 "	23.9	93.2	77.4	17.9	42.3	83429615	38.963745	35.243322
"1842"	1804	1600	"Fashion & Retail"	"Sergei Katsiev"	65	"Russia"	"Moscow"	"Retail, wholesale"	"Fashion & Retail"	"Russia"	""	TRUE	"R"	"M"	"1/11/1958 0:00"	"Katsiev"	"Sergei"	""	"4/4/2023 5:01"	""	""	1958	1	11	180.75	4.5	"$1,699,876,578,871 "	81.9	102.6	72.7	11.4	46.2	144373535	61.52401	105.318756
"2056"	2020	1400	"Real Estate"	"Kwee Liong Keng"	77	"Singapore"	"Singapore"	"Real estate"	"Real Estate"	"Singapore"	""	FALSE	"Split Family Fortune"	"M"	"1/1/1946 0:00"	"Kwee"	"Liong Keng"	""	"4/4/2023 5:01"	""	""	1946	1	1	114.41	0.6	"$372,062,527,489 "	84.8	100.6	83.1	13.1	21	5703569	1.352083	103.819836
"2132"	2020	1400	"Diversified"	"Boris Zingarevich"	63	"Russia"	"Saint Petersburg"	"Pulp and paper, diversified"	"Diversified"	"Russia"	""	TRUE	"R"	"M"	"7/8/1959 0:00"	"Zingarevich"	"Boris"	""	"4/4/2023 5:01"	""	""	1959	7	8	180.75	4.5	"$1,699,876,578,871 "	81.9	102.6	72.7	11.4	46.2	144373535	61.52401	105.318756
"1911"	1905	1500	"Diversified"	"Patricia Angelini Rossi"	68	"Chile"	"Santiago"	"Forestry, mining"	"Diversified"	"Chile"	""	FALSE	"U"	"F"	"4/5/1954 0:00"	"Angelini Rossi"	"Patricia"	""	"4/4/2023 5:01"	""	""	1954	4	5	131.91	2.6	"$282,318,159,745 "	88.5	101.4	80	18.2	34	18952038	-35.675147	-71.542969
"15"	15	68000	"Food & Beverage"	"Zhong Shanshan"	68	"China"	"Hangzhou"	"Beverages, pharmaceuticals"	"Food & Beverage"	"China"	""	TRUE	"U"	"M"	"12/1/1954 0:00"	"Zhong"	"Shanshan"	""	"4/4/2023 5:01"	""	""	1954	12	1	125.08	2.9	"$19,910,000,000,000 "	50.6	100.2	77	9.4	59.2	1397715000	35.86166	104.195397
"39"	39	32600	"Fashion & Retail"	"Tadashi Yanai & family"	74	"Japan"	"Tokyo"	"Fashion retail"	"Fashion & Retail"	"Japan"	""	TRUE	"U"	"M"	"2/7/1949 0:00"	"Yanai"	"Tadashi"	""	"4/4/2023 5:01"	""	""	1949	2	7	105.48	0.5	"$5,081,769,542,380 "	63.2	98.8	84.2	11.9	46.7	126226568	36.204824	138.252924
"1719"	1647	1800	"Energy"	"Wu Yingming"	56	"China"	"Ningde"	"Batteries"	"Energy"	"China"	""	TRUE	"D"	"M"	"1/1/1967 0:00"	"Wu"	"Yingming"	""	"4/4/2023 5:01"	""	""	1967	1	1	125.08	2.9	"$19,910,000,000,000 "	50.6	100.2	77	9.4	59.2	1397715000	35.86166	104.195397
"1551"	1516	2000	"Metals & Mining"	"Clive Palmer"	69	"Australia"	"Brisbane"	"Mining"	"Metals & Mining"	"Australia"	""	TRUE	"D"	"M"	"3/26/1954 0:00"	"Palmer"	"Clive"	""	"4/4/2023 5:01"	""	""	1954	3	26	119.8	1.6	"$1,392,680,589,329 "	113.1	100.3	82.7	23	47.4	25766605	-25.274398	133.775136
"1623"	1575	1900	"Fashion & Retail"	"G. Rajendran"	80	"India"	"Chennai"	"Jewellery"	"Fashion & Retail"	"India"	""	TRUE	"U"	"M"	"10/5/1942 0:00"	"Rajendran"	"G."	""	"4/4/2023 5:01"	""	""	1942	10	5	180.44	7.7	"$2,611,000,000,000 "	28.1	113	69.4	11.2	49.7	1366417754	20.593684	78.96288
"1467"	1434	2100	"Food & Beverage"	"Andrei Krivenko"	47	"Russia"	"Moscow"	"Retail"	"Food & Beverage"	"Russia"	""	TRUE	"N"	"M"	"7/25/1975 0:00"	"Krivenko"	"Andrei"	""	"4/4/2023 5:01"	""	""	1975	7	25	180.75	4.5	"$1,699,876,578,871 "	81.9	102.6	72.7	11.4	46.2	144373535	61.52401	105.318756
"2394"	2259	1200	"Service"	"Wanmao Xu"	78	"China"	"Ningbo"	"Education"	"Service"	"China"	""	TRUE	"D"	"M"	"1/1/1945 0:00"	"Xu"	"Wanmao"	""	"4/4/2023 5:01"	""	""	1945	1	1	125.08	2.9	"$19,910,000,000,000 "	50.6	100.2	77	9.4	59.2	1397715000	35.86166	104.195397
"2342"	2259	1200	"Media & Entertainment"	"Markus Persson"	43	"Sweden"	"Stockholm"	"Computer games"	"Media & Entertainment"	"Sweden"	""	TRUE	"D"	"M"	"6/1/1979 0:00"	"Persson"	"Markus"	""	"4/4/2023 5:01"	""	""	1979	6	1	110.51	1.8	"$530,832,908,738 "	67	126.6	82.5	27.9	49.1	10285453	60.128161	18.643501
"2157"	2133	1300	"Real Estate"	"Eduardo Costantini"	76	"Argentina"	"Buenos Aires"	"Real estate"	"Real Estate"	"Argentina"	""	TRUE	"D"	"M"	"9/17/1946 0:00"	"Costantini"	"Eduardo"	""	"4/4/2023 5:01"	""	""	1946	9	17	232.75	53.5	"$449,663,446,954 "	90	109.7	76.5	10.1	106.3	44938712	-38.416097	-63.616672
"194"	190	9700	"Healthcare"	"Sun Piaoyang"	64	"China"	"Lianyungang"	"Pharmaceuticals"	"Healthcare"	"China"	""	TRUE	"D"	"M"	"9/1/1958 0:00"	"Sun"	"Piaoyang"	""	"4/4/2023 5:01"	""	""	1958	9	1	125.08	2.9	"$19,910,000,000,000 "	50.6	100.2	77	9.4	59.2	1397715000	35.86166	104.195397
"27"	27	42900	"Fashion & Retail"	"Dieter Schwarz"	83	"Germany"	"Neckarsulm"	"Retail"	"Fashion & Retail"	"Germany"	""	FALSE	"D"	"M"	"9/24/1939 0:00"	"Schwarz"	"Dieter"	""	"4/4/2023 5:01"	""	""	1939	9	24	112.85	1.4	"$3,845,630,030,824 "	70.2	104	80.9	11.5	48.8	83132799	51.165691	10.451526
"1291"	1272	2400	"Finance & Investments"	"Jed McCaleb"	48	"United States"	"Berkeley"	"Cryptocurrency"	"Finance & Investments"	"United States"	""	TRUE	"D"	"M"	"1/1/1975 0:00"	"McCaleb"	"Jed"	""	"4/4/2023 5:01"	"California"	"West"	1975	1	1	117.24	7.5	"$21,427,700,000,000 "	88.2	101.8	78.5	9.6	36.6	328239523	37.09024	-95.712891
"908"	905	3200	"Manufacturing"	"Arun Bharat Ram"	82	"India"	"Delhi"	"Chemicals"	"Manufacturing"	"India"	""	FALSE	"D"	"M"	"11/15/1940 0:00"	"Bharat Ram"	"Arun"	""	"4/4/2023 5:01"	""	""	1940	11	15	180.44	7.7	"$2,611,000,000,000 "	28.1	113	69.4	11.2	49.7	1366417754	20.593684	78.96288
"21"	21	56700	"Fashion & Retail"	"Alice Walton"	73	"United States"	"Fort Worth"	"Walmart"	"Fashion & Retail"	"United States"	"Crystal Bridges Museum of American Art"	FALSE	"D"	"F"	"10/7/1949 0:00"	"Walton"	"Alice"	"Philanthropist"	"4/4/2023 5:01"	"Texas"	"South"	1949	10	7	117.24	7.5	"$21,427,700,000,000 "	88.2	101.8	78.5	9.6	36.6	328239523	37.09024	-95.712891
"1420"	1368	2200	"Technology"	"Tang Xiao'ou"	55	"China"	"Shanghai"	"Software"	"Technology"	"Hong Kong"	""	TRUE	"D"	"M"	"1/1/1968 0:00"	"Tang"	"Xiao'ou"	""	"4/4/2023 5:01"	""	""	1968	1	1	125.08	2.9	"$19,910,000,000,000 "	50.6	100.2	77	9.4	59.2	1397715000	35.86166	104.195397
"2393"	2259	1200	"Manufacturing"	"Xu Shijun & family"	60	"China"	"Nantong"	"Manufacturing"	"Manufacturing"	"China"	""	TRUE	"D"	"M"	"3/1/1963 0:00"	"Xu"	"Shijun"	""	"4/4/2023 5:01"	""	""	1963	3	1	125.08	2.9	"$19,910,000,000,000 "	50.6	100.2	77	9.4	59.2	1397715000	35.86166	104.195397
"2405"	2405	1100	"Fashion & Retail"	"Hari Krishan Agarwal"	66	"India"	"Delhi"	"Sports shoes"	"Fashion & Retail"	"India"	""	TRUE	"N"	"M"	"4/5/1956 0:00"	"Agarwal"	"Hari Krishan"	""	"4/4/2023 5:01"	""	""	1956	4	5	180.44	7.7	"$2,611,000,000,000 "	28.1	113	69.4	11.2	49.7	1366417754	20.593684	78.96288
"357"	352	6800	"Finance & Investments"	"Edward Johnson, IV."	58	"United States"	"Boston"	"Fidelity"	"Finance & Investments"	"United States"	""	FALSE	"U"	"M"	"11/18/1964 0:00"	"Johnson"	"Edward"	""	"4/4/2023 5:01"	"Massachusetts"	"Northeast"	1964	11	18	117.24	7.5	"$21,427,700,000,000 "	88.2	101.8	78.5	9.6	36.6	328239523	37.09024	-95.712891
"2578"	2540	1000	"Healthcare"	"Hu Gengxi & family"	59	"China"	"Shanghai"	"Bio-Pharma"	"Healthcare"	"China"	""	TRUE	"R"	"M"	"1/9/1964 0:00"	"Hu"	"Gengxi"	""	"4/4/2023 5:01"	""	""	1964	1	9	125.08	2.9	"$19,910,000,000,000 "	50.6	100.2	77	9.4	59.2	1397715000	35.86166	104.195397
"1898"	1804	1600	"Automotive"	"Ye Fan & family"	52	"China"	"Dongguan"	"Auto dealerships"	"Automotive"	"China"	""	TRUE	"D"	"M"	"1/1/1971 0:00"	"Ye"	"Fan"	""	"4/4/2023 5:01"	""	""	1971	1	1	125.08	2.9	"$19,910,000,000,000 "	50.6	100.2	77	9.4	59.2	1397715000	35.86166	104.195397
"218"	215	9000	"Food & Beverage"	"Anthony von Mandl"	73	"Canada"	"Vancouver"	"Alcoholic beverages"	"Food & Beverage"	"Canada"	""	TRUE	"U"	"M"	"3/10/1950 0:00"	"von Mandl"	"Anthony"	""	"4/4/2023 5:01"	""	""	1950	3	10	116.76	1.9	"$1,736,425,629,520 "	68.9	100.9	81.9	12.8	24.5	36991981	56.130366	-106.346771
"2272"	2259	1200	"Healthcare"	"Eva Maria Braun-Luedicke"	36	"Germany"	"Melsungen"	"Medical technology"	"Healthcare"	"Germany"	""	FALSE	"D"	"F"	"1/1/1987 0:00"	"Braun-Luedicke"	"Eva Maria"	""	"4/4/2023 5:01"	""	""	1987	1	1	112.85	1.4	"$3,845,630,030,824 "	70.2	104	80.9	11.5	48.8	83132799	51.165691	10.451526
"2024"	2020	1400	"Healthcare"	"Girdhari Lal Bawri"	75	"India"	"Mumbai"	"Pharmaceuticals"	"Healthcare"	"India"	""	TRUE	"D"	"M"	"8/3/1947 0:00"	"Bawri"	"Girdhari Lal"	""	"4/4/2023 5:01"	""	""	1947	8	3	180.44	7.7	"$2,611,000,000,000 "	28.1	113	69.4	11.2	49.7	1366417754	20.593684	78.96288
"2172"	2133	1300	"Manufacturing"	"Heikki Herlin"	36	"Finland"	"Helsinki"	"Elevators, escalators"	"Manufacturing"	"Finland"	""	FALSE	"U"	"M"	"1/1/1987 0:00"	"Herlin"	"Heikki"	""	"4/4/2023 5:01"	""	""	1987	1	1	112.33	1	"$268,761,201,365 "	88.2	100.2	81.7	20.8	36.6	5520314	61.92411	25.748151
"2632"	2540	1000	"Fashion & Retail"	"Xie Bingzheng & family"	54	"China"	"Guangzhou"	"Apparel"	"Fashion & Retail"	"China"	""	TRUE	"N"	"M"	"1/1/1969 0:00"	"Xie"	"Bingzheng"	""	"4/4/2023 5:01"	""	""	1969	1	1	125.08	2.9	"$19,910,000,000,000 "	50.6	100.2	77	9.4	59.2	1397715000	35.86166	104.195397
"210"	208	9200	"Energy"	"Daniel Kretinsky"	47	"Czech Republic"	"Prague"	"Energy, investments"	"Energy"	"Czech Republic"	""	TRUE	"U"	"M"	"7/9/1975 0:00"	"Kretinsky"	"Daniel"	""	"4/4/2023 5:01"	""	""	1975	7	9	116.48	2.8	"$246,489,245,495 "	64.1	100.7	79	14.9	46.1	10669709	49.817492	15.472962
"22"	22	54400	"Media & Entertainment"	"David Thomson & family"	65	"Canada"	"Toronto"	"Media"	"Media & Entertainment"	"Canada"	"Thomson Reuters Corporation"	FALSE	"U"	"M"	"6/12/1957 0:00"	"Thomson"	"David"	"Chairman"	"4/4/2023 5:01"	""	""	1957	6	12	116.76	1.9	"$1,736,425,629,520 "	68.9	100.9	81.9	12.8	24.5	36991981	56.130366	-106.346771
"1507"	1434	2100	"Food & Beverage"	"Wei Yin-Heng"	64	"China"	"Shanghai"	"Food, beverages"	"Food & Beverage"	"Taiwan"	""	TRUE	"U"	"M"	"1/1/1959 0:00"	"Wei"	"Yin-Heng"	""	"4/4/2023 5:01"	""	""	1959	1	1	125.08	2.9	"$19,910,000,000,000 "	50.6	100.2	77	9.4	59.2	1397715000	35.86166	104.195397
"279"	276	7800	"Technology"	"Qi Shi & family"	53	"China"	"Shanghai"	"Financial information"	"Technology"	"China"	""	TRUE	"D"	"M"	"1/3/1970 0:00"	"Qi"	"Shi"	""	"4/4/2023 5:01"	""	""	1970	1	3	125.08	2.9	"$19,910,000,000,000 "	50.6	100.2	77	9.4	59.2	1397715000	35.86166	104.195397
"639"	636	4300	"Finance & Investments"	"Jose E. Feliciano"	49	"United States"	"Los Angeles"	"Private equity"	"Finance & Investments"	"United States"	""	TRUE	"U"	"M"	"5/29/1973 0:00"	"Feliciano"	"Jose E."	""	"4/4/2023 5:01"	"California"	"West"	1973	5	29	117.24	7.5	"$21,427,700,000,000 "	88.2	101.8	78.5	9.6	36.6	328239523	37.09024	-95.712891
"213"	208	9200	"Finance & Investments"	"Charles Schwab"	85	"United States"	"Woodside"	"Discount brokerage"	"Finance & Investments"	"United States"	"Charles Schwab Corp."	TRUE	"D"	"M"	"7/29/1937 0:00"	"Schwab"	"Charles"	"Investor"	"4/4/2023 5:01"	"California"	"West"	1937	7	29	117.24	7.5	"$21,427,700,000,000 "	88.2	101.8	78.5	9.6	36.6	328239523	37.09024	-95.712891
"58"	58	25200	"Metals & Mining"	"Andrey Melnichenko & family"	51	"United Arab Emirates"	"Ras Al Khaimah"	"Fertilizers, coal"	"Metals & Mining"	"Russia"	""	TRUE	"U"	"M"	"3/8/1972 0:00"	"Melnichenko"	"Andrey"	""	"4/4/2023 5:01"	""	""	1972	3	8	114.52	-1.9	"$421,142,267,938 "	36.8	108.4	77.8	0.1	15.9	9770529	23.424076	53.847818
"110"	108	15800	"Food & Beverage"	"Jorge Paulo Lemann & family"	83	"Switzerland"	"Zurich"	"Beer"	"Food & Beverage"	"Brazil"	""	TRUE	"U"	"M"	"8/26/1939 0:00"	"Lemann"	"Jorge Paulo"	"Investor, Philanthropist"	"4/4/2023 5:01"	""	""	1939	8	26	99.55	0.4	"$703,082,435,360 "	59.6	105.2	83.6	10.1	28.8	8574832	46.818188	8.227512
"1002"	982	3000	"Manufacturing"	"Susan Carol Holland"	66	"Italy"	"Milan"	"Hearing aids"	"Manufacturing"	"Italy"	""	FALSE	"D"	"F"	"5/27/1956 0:00"	"Holland"	"Susan Carol"	""	"4/4/2023 5:01"	""	""	1956	5	27	110.62	0.6	"$2,001,244,392,042 "	61.9	101.9	82.9	24.3	59.1	60297396	41.87194	12.56738
"433"	425	6000	"Finance & Investments"	"Frank Lowy"	92	"Israel"	"Tel Aviv"	"Investments"	"Finance & Investments"	"Australia"	""	TRUE	"D"	"M"	"10/22/1930 0:00"	"Lowy"	"Frank"	""	"4/4/2023 5:01"	""	""	1930	10	22	108.15	0.8	"$395,098,666,122 "	63.4	104.9	82.8	23.1	25.3	9053300	31.046051	34.851612
"1496"	1434	2100	"Healthcare"	"Timothy Springer"	75	"United States"	"Chestnut Hill"	"Biotech"	"Healthcare"	"United States"	""	TRUE	"E"	"M"	"2/23/1948 0:00"	"Springer"	"Timothy"	""	"4/4/2023 5:01"	"Massachusetts"	"Northeast"	1948	2	23	117.24	7.5	"$21,427,700,000,000 "	88.2	101.8	78.5	9.6	36.6	328239523	37.09024	-95.712891
"2589"	2540	1000	"Energy"	"Muhammed Aziz Khan"	68	"Singapore"	"Singapore"	"Power"	"Energy"	"Bangladesh"	""	TRUE	"N"	"M"	"3/1/1955 0:00"	"Khan"	"Muhammed Aziz"	""	"4/4/2023 5:01"	""	""	1955	3	1	114.41	0.6	"$372,062,527,489 "	84.8	100.6	83.1	13.1	21	5703569	1.352083	103.819836
"2293"	2259	1200	"Metals & Mining"	"Dan Gertler"	49	"Israel"	"Bnei Brak"	"Mining"	"Metals & Mining"	"Israel"	""	FALSE	"E"	"M"	"12/23/1973 0:00"	"Gertler"	"Dan"	""	"4/4/2023 5:01"	""	""	1973	12	23	108.15	0.8	"$395,098,666,122 "	63.4	104.9	82.8	23.1	25.3	9053300	31.046051	34.851612
"1433"	1368	2200	"Energy"	"Zhao Fenggang"	57	"China"	"Ningde"	"Batteries"	"Energy"	"China"	""	TRUE	"D"	"M"	"1/1/1966 0:00"	"Zhao"	"Fenggang"	""	"4/4/2023 5:01"	""	""	1966	1	1	125.08	2.9	"$19,910,000,000,000 "	50.6	100.2	77	9.4	59.2	1397715000	35.86166	104.195397
"1001"	982	3000	"Diversified"	"Carlos Hank Rhon"	75	"Mexico"	"Mexico City"	"Banking"	"Diversified"	"Mexico"	""	FALSE	"U"	"M"	"12/10/1947 0:00"	"Hank Rhon"	"Carlos"	""	"4/4/2023 5:01"	""	""	1947	12	10	141.54	3.6	"$1,258,286,717,125 "	40.2	105.8	75	13.1	55.1	126014024	23.634501	-102.552784
"1501"	1434	2100	"Fashion & Retail"	"Torsten Toeller"	56	"Germany"	"Krefeld"	"Pet food"	"Fashion & Retail"	"Germany"	""	TRUE	"D"	"M"	"4/6/1966 0:00"	"Toeller"	"Torsten"	""	"4/4/2023 5:01"	""	""	1966	4	6	112.85	1.4	"$3,845,630,030,824 "	70.2	104	80.9	11.5	48.8	83132799	51.165691	10.451526
"1897"	1804	1600	"Technology"	"Steven Meng Yang & family"	40	"China"	"Changsha"	"Electronics"	"Technology"	"China"	""	TRUE	"D"	"M"	"5/1/1982 0:00"	"Yang"	"Steven Meng"	""	"4/4/2023 5:01"	""	""	1982	5	1	125.08	2.9	"$19,910,000,000,000 "	50.6	100.2	77	9.4	59.2	1397715000	35.86166	104.195397
"583"	580	4700	"Manufacturing"	"Ali Erdemoglu"	63	"Turkey"	"Istanbul"	"Carpet"	"Manufacturing"	"Turkey"	""	TRUE	"U"	"M"	"11/20/1959 0:00"	"Erdemoglu"	"Ali"	""	"4/4/2023 5:01"	""	""	1959	11	20	234.44	15.2	"$754,411,708,203 "	23.9	93.2	77.4	17.9	42.3	83429615	38.963745	35.243322
"1556"	1516	2000	"Metals & Mining"	"Ginia Rinehart"	36	"Australia"	"Sydney"	"Mining"	"Metals & Mining"	"Australia"	""	FALSE	"D"	"F"	"9/6/1986 0:00"	"Rinehart"	"Ginia"	""	"4/4/2023 5:01"	""	""	1986	9	6	119.8	1.6	"$1,392,680,589,329 "	113.1	100.3	82.7	23	47.4	25766605	-25.274398	133.775136
"1827"	1804	1600	"Metals & Mining"	"Gary Fegel"	49	"Switzerland"	"Gstaad"	"Commodities, investments"	"Metals & Mining"	"Switzerland"	""	TRUE	"E"	"M"	"1/1/1974 0:00"	"Fegel"	"Gary"	""	"4/4/2023 5:01"	""	""	1974	1	1	99.55	0.4	"$703,082,435,360 "	59.6	105.2	83.6	10.1	28.8	8574832	46.818188	8.227512
"907"	905	3200	"Fashion & Retail"	"Luciano Benetton"	87	"Italy"	"Ponzano Veneto"	"Fashion retail, investments"	"Fashion & Retail"	"Italy"	""	TRUE	"U"	"M"	"5/13/1935 0:00"	"Benetton"	"Luciano"	""	"4/4/2023 5:01"	""	""	1935	5	13	110.62	0.6	"$2,001,244,392,042 "	61.9	101.9	82.9	24.3	59.1	60297396	41.87194	12.56738
"2279"	2259	1200	"Fashion & Retail"	"Diego Della Valle"	69	"Italy"	"Sant'' Elpidio A Mare"	"Shoes"	"Fashion & Retail"	"Italy"	""	FALSE	"D"	"M"	"12/30/1953 0:00"	"Della Valle"	"Diego"	""	"4/4/2023 5:01"	""	""	1953	12	30	110.62	0.6	"$2,001,244,392,042 "	61.9	101.9	82.9	24.3	59.1	60297396	41.87194	12.56738
"1916"	1905	1500	"Fashion & Retail"	"Paolo Bulgari"	85	"Italy"	"Rome"	"Luxury goods"	"Fashion & Retail"	"Italy"	""	FALSE	"E"	"M"	"9/8/1937 0:00"	"Bulgari"	"Paolo"	""	"4/4/2023 5:01"	""	""	1937	9	8	110.62	0.6	"$2,001,244,392,042 "	61.9	101.9	82.9	24.3	59.1	60297396	41.87194	12.56738
"527"	523	5100	"Finance & Investments"	"Sami Mnaymneh"	61	"United States"	"Miami Beach"	"Private equity"	"Finance & Investments"	"United States"	""	TRUE	"U"	"M"	"7/13/1961 0:00"	"Mnaymneh"	"Sami"	""	"4/4/2023 5:01"	"Florida"	"South"	1961	7	13	117.24	7.5	"$21,427,700,000,000 "	88.2	101.8	78.5	9.6	36.6	328239523	37.09024	-95.712891
"34"	34	35300	"Technology"	"Ma Huateng"	51	"China"	"Shenzhen"	"Internet media"	"Technology"	"China"	"Tencent Holdings"	TRUE	"D"	"M"	"10/29/1971 0:00"	"Ma"	"Huateng"	"Chairman and CEO"	"4/4/2023 5:01"	""	""	1971	10	29	125.08	2.9	"$19,910,000,000,000 "	50.6	100.2	77	9.4	59.2	1397715000	35.86166	104.195397
"2613"	2540	1000	"Media & Entertainment"	"Eddy Kusnadi Sariaatmadja"	69	"Indonesia"	"Jakarta"	"Media, tech"	"Media & Entertainment"	"Indonesia"	""	TRUE	"D"	"M"	"8/23/1953 0:00"	"Sariaatmadja"	"Eddy Kusnadi"	""	"4/4/2023 5:01"	""	""	1953	8	23	151.18	3	"$1,119,190,780,753 "	36.3	106.4	71.5	10.2	30.1	270203917	-0.789275	113.921327
"1840"	1804	1600	"Metals & Mining"	"Tianjiang Jia & family"	60	"China"	"Yinchuan"	"Non-ferrous metals"	"Metals & Mining"	"China"	""	TRUE	"D"	"M"	"7/1/1962 0:00"	"Jia"	"Tianjiang"	""	"4/4/2023 5:01"	""	""	1962	7	1	125.08	2.9	"$19,910,000,000,000 "	50.6	100.2	77	9.4	59.2	1397715000	35.86166	104.195397
"1435"	1434	2100	"Food & Beverage"	"Travis Boersma"	52	"United States"	"Grants Pass"	"Coffee"	"Food & Beverage"	"United States"	""	TRUE	"D"	"M"	"1/1/1971 0:00"	"Boersma"	"Travis"	""	"4/4/2023 5:01"	"Oregon"	"West"	1971	1	1	117.24	7.5	"$21,427,700,000,000 "	88.2	101.8	78.5	9.6	36.6	328239523	37.09024	-95.712891
"1285"	1272	2400	"Real Estate"	"Mitchell Goldhar"	61	"Canada"	"North York"	"Real estate"	"Real Estate"	"Canada"	"SmartCentres"	TRUE	"D"	"M"	"7/15/1961 0:00"	"Goldhar"	"Mitchell"	"Owner"	"4/4/2023 5:01"	""	""	1961	7	15	116.76	1.9	"$1,736,425,629,520 "	68.9	100.9	81.9	12.8	24.5	36991981	56.130366	-106.346771
"672"	659	4200	"Service"	"Jean (Gigi) Pritzker"	60	"United States"	"Los Angeles"	"Hotels, investments"	"Service"	"United States"	""	FALSE	"U"	"F"	"7/1/1962 0:00"	"Pritzker"	"Jean (Gigi)"	""	"4/4/2023 5:01"	"California"	"West"	1962	7	1	117.24	7.5	"$21,427,700,000,000 "	88.2	101.8	78.5	9.6	36.6	328239523	37.09024	-95.712891
"1251"	1217	2500	"Automotive"	"Lachhman Das Mittal"	92	"India"	"Delhi"	"Tractors"	"Automotive"	"India"	""	FALSE	"E"	"M"	"11/5/1930 0:00"	"Mittal"	"Lachhman Das"	""	"4/4/2023 5:01"	""	""	1930	11	5	180.44	7.7	"$2,611,000,000,000 "	28.1	113	69.4	11.2	49.7	1366417754	20.593684	78.96288
"417"	411	6200	"Finance & Investments"	"Michal Solowow"	60	"Poland"	"Kielce"	"Investments"	"Finance & Investments"	"Poland"	""	TRUE	"E"	"M"	"7/11/1962 0:00"	"Solowow"	"Michal"	""	"4/4/2023 5:01"	""	""	1962	7	11	114.11	2.2	"$592,164,400,688 "	67.8	100	77.6	17.4	40.8	37970874	51.919438	19.145136
"744"	721	3900	"Food & Beverage"	"Nusli Wadia"	79	"India"	"Mumbai"	"Consumer goods"	"Food & Beverage"	"India"	""	FALSE	"U"	"M"	"2/15/1944 0:00"	"Wadia"	"Nusli"	""	"4/4/2023 5:01"	""	""	1944	2	15	180.44	7.7	"$2,611,000,000,000 "	28.1	113	69.4	11.2	49.7	1366417754	20.593684	78.96288
"1892"	1804	1600	"Healthcare"	"Wu Yulan"	53	"China"	"Lianyungang"	"Pharmaceuticals"	"Healthcare"	"China"	""	TRUE	"D"	"F"	"8/26/1969 0:00"	"Wu"	"Yulan"	""	"4/4/2023 5:01"	""	""	1969	8	26	125.08	2.9	"$19,910,000,000,000 "	50.6	100.2	77	9.4	59.2	1397715000	35.86166	104.195397
"734"	721	3900	"Healthcare"	"Jorge Moll Filho & family"	78	"Brazil"	"Rio de Janeiro"	"Hospitals"	"Healthcare"	"Brazil"	""	TRUE	"D"	"M"	"1/1/1945 0:00"	"Moll Filho"	"Jorge"	""	"4/4/2023 5:01"	""	""	1945	1	1	167.4	3.7	"$1,839,758,040,766 "	51.3	115.4	75.7	14.2	65.1	212559417	-14.235004	-51.92528
"2211"	2133	1300	"Finance & Investments"	"Randal Nardone"	67	"United States"	"New York"	"Investments, energy"	"Finance & Investments"	"United States"	""	TRUE	"E"	"M"	"6/22/1955 0:00"	"Nardone"	"Randal"	""	"4/4/2023 5:01"	"New York"	"Northeast"	1955	6	22	117.24	7.5	"$21,427,700,000,000 "	88.2	101.8	78.5	9.6	36.6	328239523	37.09024	-95.712891
"2197"	2133	1300	"Manufacturing"	"Li Zhigang"	46	"China"	"Wuhan"	"Machinery"	"Manufacturing"	"China"	""	TRUE	"D"	"M"	"6/1/1976 0:00"	"Li"	"Zhigang"	""	"4/4/2023 5:01"	""	""	1976	6	1	125.08	2.9	"$19,910,000,000,000 "	50.6	100.2	77	9.4	59.2	1397715000	35.86166	104.195397
"2077"	2020	1400	"Technology"	"Mao Lixiang & family"	82	"China"	"Ningbo"	"Cooking appliances"	"Technology"	"China"	""	TRUE	"D"	"M"	"1/1/1941 0:00"	"Mao"	"Lixiang"	""	"4/4/2023 5:01"	""	""	1941	1	1	125.08	2.9	"$19,910,000,000,000 "	50.6	100.2	77	9.4	59.2	1397715000	35.86166	104.195397
"2424"	2405	1100	"Healthcare"	"Chen Baohua"	61	"China"	"Linhai"	"Pharmaceutical"	"Healthcare"	"China"	""	TRUE	"D"	"M"	"1/1/1962 0:00"	"Chen"	"Baohua"	""	"4/4/2023 5:01"	""	""	1962	1	1	125.08	2.9	"$19,910,000,000,000 "	50.6	100.2	77	9.4	59.2	1397715000	35.86166	104.195397
"264"	261	8000	"Finance & Investments"	"Patrick Ryan"	85	"United States"	"Winnetka"	"Insurance"	"Finance & Investments"	"United States"	"Ryan Specialty Group"	TRUE	"E"	"M"	"5/15/1937 0:00"	"Ryan"	"Patrick"	"Chairman and CEO"	"4/4/2023 5:01"	"Illinois"	"Midwest"	1937	5	15	117.24	7.5	"$21,427,700,000,000 "	88.2	101.8	78.5	9.6	36.6	328239523	37.09024	-95.712891
"1608"	1575	1900	"Finance & Investments"	"Richard Kayne"	77	"United States"	"Santa Monica"	"Investments"	"Finance & Investments"	"United States"	""	TRUE	"U"	"M"	"1/1/1946 0:00"	"Kayne"	"Richard"	""	"4/4/2023 5:01"	"California"	"West"	1946	1	1	117.24	7.5	"$21,427,700,000,000 "	88.2	101.8	78.5	9.6	36.6	328239523	37.09024	-95.712891
"1961"	1905	1500	"Logistics"	"Lu Zongjun"	59	"China"	"Shanghai"	"Logistics"	"Logistics"	"China"	""	TRUE	"D"	"M"	"6/1/1963 0:00"	"Lu"	"Zongjun"	""	"4/4/2023 5:01"	""	""	1963	6	1	125.08	2.9	"$19,910,000,000,000 "	50.6	100.2	77	9.4	59.2	1397715000	35.86166	104.195397
"130"	130	13700	"Logistics"	"John Fredriksen"	78	"United Kingdom"	"London"	"Shipping"	"Logistics"	"Cyprus"	""	TRUE	"U"	"M"	"2/1/1945 0:00"	"Fredriksen"	"John"	"Investor"	"4/4/2023 5:01"	""	""	1945	2	1	119.62	1.7	"$2,827,113,184,696 "	60	101.2	81.3	25.5	30.6	66834405	55.378051	-3.435973
"621"	611	4500	"Manufacturing"	"Xu Jinfu"	59	"China"	"Guangzhou"	"Chemicals"	"Manufacturing"	"China"	""	TRUE	"D"	"M"	"1/1/1964 0:00"	"Xu"	"Jinfu"	""	"4/4/2023 5:01"	""	""	1964	1	1	125.08	2.9	"$19,910,000,000,000 "	50.6	100.2	77	9.4	59.2	1397715000	35.86166	104.195397
"2619"	2540	1000	"Manufacturing"	"Wijono Tanoko"	70	"Indonesia"	"Surabaya"	"Paints"	"Manufacturing"	"Indonesia"	""	FALSE	"Split Family Fortune"	"M"	"8/28/1952 0:00"	"Tanoko"	"Wijono"	""	"4/4/2023 5:01"	""	""	1952	8	28	151.18	3	"$1,119,190,780,753 "	36.3	106.4	71.5	10.2	30.1	270203917	-0.789275	113.921327
"586"	580	4700	"Technology"	"Hong Ra-hee"	77	"South Korea"	"Seoul"	"Samsung"	"Technology"	"South Korea"	""	FALSE	"D"	"F"	"7/15/1945 0:00"	"Hong"	"Ra-hee"	""	"4/4/2023 5:01"	""	""	1945	7	15	115.16	0.4	"$2,029,000,000,000 "	94.3	98.1	82.6	15.6	33.2	51709098	35.907757	127.766922
"77"	77	21000	"Fashion & Retail"	"Leonard Lauder"	90	"United States"	"New York"	"Estee Lauder"	"Fashion & Retail"	"United States"	"The Este Lauder Companies"	FALSE	"D"	"M"	"3/19/1933 0:00"	"Lauder"	"Leonard"	"Chairman Emeritus"	"4/4/2023 5:01"	"New York"	"Northeast"	1933	3	19	117.24	7.5	"$21,427,700,000,000 "	88.2	101.8	78.5	9.6	36.6	328239523	37.09024	-95.712891
"2590"	2540	1000	"Fashion & Retail"	"Kim Jung-woong"	48	"South Korea"	"Seoul"	"Cosmetics"	"Fashion & Retail"	"South Korea"	""	TRUE	"D"	"M"	"1/1/1975 0:00"	"Kim"	"Jung-woong"	""	"4/4/2023 5:01"	""	""	1975	1	1	115.16	0.4	"$2,029,000,000,000 "	94.3	98.1	82.6	15.6	33.2	51709098	35.907757	127.766922
"878"	878	3300	"Construction & Engineering"	"Mohed Altrad"	75	"France"	"Montpellier"	"Scaffolding, cement mixers"	"Construction & Engineering"	"France"	""	TRUE	"D"	"M"	"3/9/1948 0:00"	"Altrad"	"Mohed"	""	"4/4/2023 5:01"	""	""	1948	3	9	110.05	1.1	"$2,715,518,274,227 "	65.6	102.5	82.5	24.2	60.7	67059887	46.227638	2.213749
"1062"	1027	2900	"Healthcare"	"Sybill Storz"	85	"Germany"	"Leipzig"	"Medical devices"	"Healthcare"	"Germany"	""	FALSE	"D"	"F"	"4/6/1937 0:00"	"Storz"	"Sybill"	""	"4/4/2023 5:01"	""	""	1937	4	6	112.85	1.4	"$3,845,630,030,824 "	70.2	104	80.9	11.5	48.8	83132799	51.165691	10.451526
"490"	486	5400	"Diversified"	"Miao Hangen"	58	"China"	"Suzhou"	"Textiles, petrochemicals"	"Diversified"	"China"	""	TRUE	"D"	"M"	"1/1/1965 0:00"	"Miao"	"Hangen"	""	"4/4/2023 5:01"	""	""	1965	1	1	125.08	2.9	"$19,910,000,000,000 "	50.6	100.2	77	9.4	59.2	1397715000	35.86166	104.195397
"196"	195	9600	"Energy"	"Jin Baofang"	70	"China"	"Xingtai"	"Solar panels"	"Energy"	"China"	""	TRUE	"D"	"M"	"9/1/1952 0:00"	"Jin"	"Baofang"	""	"4/4/2023 5:01"	""	""	1952	9	1	125.08	2.9	"$19,910,000,000,000 "	50.6	100.2	77	9.4	59.2	1397715000	35.86166	104.195397
"745"	721	3900	"Healthcare"	"Wu Yiling"	73	"China"	"Shijiazhuang"	"Pharmaceuticals"	"Healthcare"	"China"	""	TRUE	"E"	"M"	"10/24/1949 0:00"	"Wu"	"Yiling"	""	"4/4/2023 5:01"	""	""	1949	10	24	125.08	2.9	"$19,910,000,000,000 "	50.6	100.2	77	9.4	59.2	1397715000	35.86166	104.195397
"580"	580	4700	"Diversified"	"Maria Fernanda Amorim & family"	88	"Portugal"	"Grijo"	"Energy, investments"	"Diversified"	"Portugal"	""	FALSE	"E"	"F"	"1/16/1935 0:00"	"Amorim"	"Maria Fernanda"	""	"4/4/2023 5:01"	""	""	1935	1	16	110.62	0.3	"$237,686,075,635 "	63.9	106.2	81.3	22.8	39.8	10269417	39.399872	-8.224454
"1870"	1804	1600	"Manufacturing"	"Shang Xiaobo & family"	49	"China"	"Hefei"	"Manufacturing"	"Manufacturing"	"China"	""	TRUE	"D"	"M"	"3/30/1974 0:00"	"Shang"	"Xiaobo"	""	"4/4/2023 5:01"	""	""	1974	3	30	125.08	2.9	"$19,910,000,000,000 "	50.6	100.2	77	9.4	59.2	1397715000	35.86166	104.195397
"2486"	2405	1100	"Automotive"	"Renu Munjal"	68	"India"	"Delhi"	"Two wheelers"	"Automotive"	"India"	""	FALSE	"Split Family Fortune"	"F"	"3/6/1955 0:00"	"Munjal"	"Renu"	""	"4/4/2023 5:01"	""	""	1955	3	6	180.44	7.7	"$2,611,000,000,000 "	28.1	113	69.4	11.2	49.7	1366417754	20.593684	78.96288
"2468"	2405	1100	"Healthcare"	"Kangbao Ke & family"	60	"China"	"Guangzhou"	"Retailing"	"Healthcare"	"China"	""	TRUE	"U"	"M"	"1/1/1963 0:00"	"Ke"	"Kangbao"	""	"4/4/2023 5:01"	""	""	1963	1	1	125.08	2.9	"$19,910,000,000,000 "	50.6	100.2	77	9.4	59.2	1397715000	35.86166	104.195397
"2581"	2540	1000	"Manufacturing"	"Inder Jaisinghani"	70	"India"	"Mumbai"	"Cables & wires"	"Manufacturing"	"India"	""	TRUE	"N"	"M"	"3/29/1953 0:00"	"Jaisinghani"	"Inder "	""	"4/4/2023 5:01"	""	""	1953	3	29	180.44	7.7	"$2,611,000,000,000 "	28.1	113	69.4	11.2	49.7	1366417754	20.593684	78.96288
"360"	352	6800	"Finance & Investments"	"John Overdeck"	53	"United States"	"Millburn"	"Hedge funds"	"Finance & Investments"	"United States"	"Two Sigma"	TRUE	"U"	"M"	"12/21/1969 0:00"	"Overdeck"	"John"	"Investor"	"4/4/2023 5:01"	"New Jersey"	"Northeast"	1969	12	21	117.24	7.5	"$21,427,700,000,000 "	88.2	101.8	78.5	9.6	36.6	328239523	37.09024	-95.712891
"937"	905	3200	"Manufacturing"	"Isabella Sergnoli"	77	"Italy"	"Bologna"	"Packaging"	"Manufacturing"	"Italy"	""	FALSE	"U"	"F"	"12/23/1945 0:00"	"Sergnoli"	"Isabella"	""	"4/4/2023 5:01"	""	""	1945	12	23	110.62	0.6	"$2,001,244,392,042 "	61.9	101.9	82.9	24.3	59.1	60297396	41.87194	12.56738
"1031"	1027	2900	"Telecom"	"John Caudwell"	70	"United Kingdom"	"Stoke-on-Trent"	"Mobile phones"	"Telecom"	"United Kingdom"	""	TRUE	"D"	"M"	"10/1/1952 0:00"	"Caudwell"	"John"	""	"4/4/2023 5:01"	""	""	1952	10	1	119.62	1.7	"$2,827,113,184,696 "	60	101.2	81.3	25.5	30.6	66834405	55.378051	-3.435973
"557"	552	4900	"Finance & Investments"	"Jonathan Gray"	53	"United States"	"New York"	"Investments"	"Finance & Investments"	"United States"	""	TRUE	"D"	"M"	"2/4/1970 0:00"	"Gray"	"Jonathan"	""	"4/4/2023 5:01"	"New York"	"Northeast"	1970	2	4	117.24	7.5	"$21,427,700,000,000 "	88.2	101.8	78.5	9.6	36.6	328239523	37.09024	-95.712891
"113"	113	15500	"Technology"	"Robert Pera"	45	"United States"	"San Jose"	"Wireless networking"	"Technology"	"United States"	"Ubiquiti"	TRUE	"U"	"M"	"3/10/1978 0:00"	"Pera"	"Robert"	"Chief Executive Officer"	"4/4/2023 5:01"	"California"	"West"	1978	3	10	117.24	7.5	"$21,427,700,000,000 "	88.2	101.8	78.5	9.6	36.6	328239523	37.09024	-95.712891
"2414"	2405	1100	"Diversified"	"Oleg Boyko"	58	"Switzerland"	"Lipperswil"	"Diversified"	"Diversified"	"Russia"	""	TRUE	"D"	"M"	"9/28/1964 0:00"	"Boyko"	"Oleg"	""	"4/4/2023 5:01"	""	""	1964	9	28	99.55	0.4	"$703,082,435,360 "	59.6	105.2	83.6	10.1	28.8	8574832	46.818188	8.227512
"2079"	2020	1400	"Manufacturing"	"Deepak Mehta"	66	"India"	"Vadodara"	"Chemicals"	"Manufacturing"	"India"	""	FALSE	"D"	"M"	"12/12/1956 0:00"	"Mehta"	"Deepak"	""	"4/4/2023 5:01"	""	""	1956	12	12	180.44	7.7	"$2,611,000,000,000 "	28.1	113	69.4	11.2	49.7	1366417754	20.593684	78.96288
"2511"	2405	1100	"Manufacturing"	"Vonnarat Tangkaravakoon"	51	"Thailand"	"Bangkok"	"Wire & cables, paints"	"Manufacturing"	"Thailand"	""	FALSE	"D"	"M"	"9/11/1971 0:00"	"Tangkaravakoon"	"Vonnarat"	""	"4/4/2023 5:01"	""	""	1971	9	11	113.27	0.7	"$543,649,976,166 "	49.3	99.8	76.9	14.9	29.5	69625582	15.870032	100.992541
"134"	133	13300	"Energy"	"George Kaiser"	80	"United States"	"Tulsa"	"Oil & gas, banking"	"Energy"	"United States"	"BOK Financial Corp."	FALSE	"U"	"M"	"7/29/1942 0:00"	"Kaiser"	"George"	"Chairman"	"4/4/2023 5:01"	"Oklahoma"	"South"	1942	7	29	117.24	7.5	"$21,427,700,000,000 "	88.2	101.8	78.5	9.6	36.6	328239523	37.09024	-95.712891
"2442"	2405	1100	"Fashion & Retail"	"Bernd Freier"	66	"Germany"	"Rottendorf"	"Fashion retail"	"Fashion & Retail"	"Germany"	""	TRUE	"D"	"M"	"1/1/1957 0:00"	"Freier"	"Bernd"	""	"4/4/2023 5:01"	""	""	1957	1	1	112.85	1.4	"$3,845,630,030,824 "	70.2	104	80.9	11.5	48.8	83132799	51.165691	10.451526
"730"	721	3900	"Energy"	"W. Herbert Hunt"	94	"United States"	"Dallas"	"Oil"	"Energy"	"United States"	""	FALSE	"D"	"M"	"3/6/1929 0:00"	"Hunt"	"W. Herbert"	"Investor"	"4/4/2023 5:01"	"Texas"	"South"	1929	3	6	117.24	7.5	"$21,427,700,000,000 "	88.2	101.8	78.5	9.6	36.6	328239523	37.09024	-95.712891
"829"	818	3500	"Finance & Investments"	"Walter P.J. Droege"	70	"Germany"	"Dusseldorf"	"Investing"	"Finance & Investments"	"Germany"	""	TRUE	"D"	"M"	"11/25/1952 0:00"	"Droege"	"Walter P.J."	""	"4/4/2023 5:01"	""	""	1952	11	25	112.85	1.4	"$3,845,630,030,824 "	70.2	104	80.9	11.5	48.8	83132799	51.165691	10.451526
"767"	766	3700	"Finance & Investments"	"William Berkley"	76	"United States"	"Coconut Grove"	"Insurance"	"Finance & Investments"	"United States"	"WR Berkley"	TRUE	"E"	"M"	"9/1/1946 0:00"	"Berkley"	"William"	"Chairman and CEO"	"4/4/2023 5:01"	"Florida"	"South"	1946	9	1	117.24	7.5	"$21,427,700,000,000 "	88.2	101.8	78.5	9.6	36.6	328239523	37.09024	-95.712891
"2262"	2259	1200	"Metals & Mining"	"Jose Maria Aristrain"	60	"Switzerland"	"Gstaad"	"Steel"	"Metals & Mining"	"Spain"	""	FALSE	"E"	"M"	"11/2/1962 0:00"	"Aristrain"	"Jose Maria"	""	"4/4/2023 5:01"	""	""	1962	11	2	99.55	0.4	"$703,082,435,360 "	59.6	105.2	83.6	10.1	28.8	8574832	46.818188	8.227512
"857"	852	3400	"Manufacturing"	"Markus Blocher"	52	"Switzerland"	"Wilen bei Wollerau"	"Chemicals"	"Manufacturing"	"Switzerland"	""	FALSE	"U"	"M"	"1/1/1971 0:00"	"Blocher"	"Markus"	""	"4/4/2023 5:01"	""	""	1971	1	1	99.55	0.4	"$703,082,435,360 "	59.6	105.2	83.6	10.1	28.8	8574832	46.818188	8.227512
"1989"	1905	1500	"Technology"	"Frank Slootman"	64	"United States"	"Pleasanton"	"Software"	"Technology"	"United States"	""	TRUE	"D"	"M"	"10/3/1958 0:00"	"Slootman"	"Frank"	""	"4/4/2023 5:01"	"California"	"West"	1958	10	3	117.24	7.5	"$21,427,700,000,000 "	88.2	101.8	78.5	9.6	36.6	328239523	37.09024	-95.712891
"377"	365	6700	"Real Estate"	"John A. Sobrato & family"	83	"United States"	"Atherton"	"Real estate"	"Real Estate"	"United States"	"Sobrato Development Cos."	TRUE	"U"	"M"	"5/23/1939 0:00"	"Sobrato"	"John A."	"Founder and Chairman"	"4/4/2023 5:01"	"California"	"West"	1939	5	23	117.24	7.5	"$21,427,700,000,000 "	88.2	101.8	78.5	9.6	36.6	328239523	37.09024	-95.712891
"1356"	1312	2300	"Technology"	"Tian Ming"	69	"China"	"Hefei"	"Measuring instruments"	"Technology"	"China"	""	TRUE	"U"	"M"	"12/20/1953 0:00"	"Tian"	"Ming"	""	"4/4/2023 5:01"	""	""	1953	12	20	125.08	2.9	"$19,910,000,000,000 "	50.6	100.2	77	9.4	59.2	1397715000	35.86166	104.195397
"2290"	2259	1200	"Manufacturing"	"Zsolt Felcsuti"	51	"Hungary"	""	"Manufacturing"	"Manufacturing"	"Hungary"	""	TRUE	"N"	"M"	"5/26/1971 0:00"	"Felcsuti"	"Zsolt"	""	"4/4/2023 5:01"	""	""	1971	5	26	121.64	3.3	"$160,967,157,504 "	48.5	100.8	75.8	23	37.9	9769949	47.162494	19.503304
"1400"	1368	2200	"Real Estate"	"Adam Neumann"	44	"United States"	"Miami"	"WeWork"	"Real Estate"	"Israel"	""	TRUE	"U"	"M"	"4/1/1979 0:00"	"Neumann"	"Adam"	""	"4/4/2023 5:01"	"Florida"	"South"	1979	4	1	117.24	7.5	"$21,427,700,000,000 "	88.2	101.8	78.5	9.6	36.6	328239523	37.09024	-95.712891
"1808"	1804	1600	"Finance & Investments"	"Clifford Asness"	56	"United States"	"Greenwich"	"Money management"	"Finance & Investments"	"United States"	"AQR Capital Management"	TRUE	"E"	"M"	"10/17/1966 0:00"	"Asness"	"Clifford"	""	"4/4/2023 5:01"	"Connecticut"	"Northeast"	1966	10	17	117.24	7.5	"$21,427,700,000,000 "	88.2	101.8	78.5	9.6	36.6	328239523	37.09024	-95.712891
"524"	523	5100	"Finance & Investments"	"Rekha Jhunjhunwala"	59	"India"	"Mumbai"	"Investments"	"Finance & Investments"	"India"	""	FALSE	"N"	"F"	"9/12/1963 0:00"	"Jhunjhunwala"	"Rekha"	""	"4/4/2023 5:01"	""	""	1963	9	12	180.44	7.7	"$2,611,000,000,000 "	28.1	113	69.4	11.2	49.7	1366417754	20.593684	78.96288
"2332"	2259	1200	"Technology"	"Jeffrey Michael & family"	66	"United States"	"Minnetonka"	"Data management"	"Technology"	"United States"	""	TRUE	"U"	"M"	"7/18/1956 0:00"	"Michael"	"Jeffrey"	""	"4/4/2023 5:01"	"Minnesota"	"Midwest"	1956	7	18	117.24	7.5	"$21,427,700,000,000 "	88.2	101.8	78.5	9.6	36.6	328239523	37.09024	-95.712891
"1595"	1575	1900	"Diversified"	"Bulent Eczacibasi"	73	"Turkey"	"Istanbul"	"Pharmaceuticals, diversified"	"Diversified"	"Turkey"	""	FALSE	"U"	"M"	"12/25/1949 0:00"	"Eczacibasi"	"Bulent"	""	"4/4/2023 5:01"	""	""	1949	12	25	234.44	15.2	"$754,411,708,203 "	23.9	93.2	77.4	17.9	42.3	83429615	38.963745	35.243322
"1183"	1164	2600	"Finance & Investments"	"Stewart Horejsi & family"	85	"United States"	"Phoenix"	"Berkshire Hathaway"	"Finance & Investments"	"United States"	""	TRUE	"D"	"M"	"9/19/1937 0:00"	"Horejsi"	"Stewart"	""	"4/4/2023 5:01"	"Arizona"	"West"	1937	9	19	117.24	7.5	"$21,427,700,000,000 "	88.2	101.8	78.5	9.6	36.6	328239523	37.09024	-95.712891
"1015"	982	3000	"Fashion & Retail"	"Stephen Rubin"	86	"United Kingdom"	"London"	"Sports apparel"	"Fashion & Retail"	"United Kingdom"	""	FALSE	"R"	"M"	"3/12/1937 0:00"	"Rubin"	"Stephen"	""	"4/4/2023 5:01"	""	""	1937	3	12	119.62	1.7	"$2,827,113,184,696 "	60	101.2	81.3	25.5	30.6	66834405	55.378051	-3.435973
"2568"	2540	1000	"Manufacturing"	"Gao Yunfeng"	56	"China"	"Shenzhen"	"Industrial lasers"	"Manufacturing"	"China"	""	TRUE	"D"	"M"	"2/1/1967 0:00"	"Gao"	"Yunfeng"	""	"4/4/2023 5:01"	""	""	1967	2	1	125.08	2.9	"$19,910,000,000,000 "	50.6	100.2	77	9.4	59.2	1397715000	35.86166	104.195397
"2400"	2259	1200	"Technology"	"Zhang Xuezheng"	47	"China"	"Jiaxing"	"Telecom"	"Technology"	"China"	""	TRUE	"D"	"M"	"6/1/1975 0:00"	"Zhang"	"Xuezheng"	""	"4/4/2023 5:01"	""	""	1975	6	1	125.08	2.9	"$19,910,000,000,000 "	50.6	100.2	77	9.4	59.2	1397715000	35.86166	104.195397
"546"	534	5000	"Healthcare"	"Ugur Sahin"	57	"Germany"	"Mainz"	"Biotechnology"	"Healthcare"	"Germany"	""	TRUE	"D"	"M"	"9/19/1965 0:00"	"Sahin"	"Ugur"	""	"4/4/2023 5:01"	""	""	1965	9	19	112.85	1.4	"$3,845,630,030,824 "	70.2	104	80.9	11.5	48.8	83132799	51.165691	10.451526
"2022"	2020	1400	"Fashion & Retail"	"Nigel Austin"	52	"Australia"	"Melbourne"	"Retail"	"Fashion & Retail"	"Australia"	""	TRUE	"D"	"M"	"9/25/1970 0:00"	"Austin"	"Nigel"	""	"4/4/2023 5:01"	""	""	1970	9	25	119.8	1.6	"$1,392,680,589,329 "	113.1	100.3	82.7	23	47.4	25766605	-25.274398	133.775136
"1928"	1905	1500	"Manufacturing"	"Fu Mingkang & family"	60	"China"	"Ningbo"	"Manufacturing"	"Manufacturing"	"China"	""	TRUE	"D"	"M"	"3/17/1963 0:00"	"Fu"	"Mingkang"	""	"4/4/2023 5:01"	""	""	1963	3	17	125.08	2.9	"$19,910,000,000,000 "	50.6	100.2	77	9.4	59.2	1397715000	35.86166	104.195397
"889"	878	3300	"Finance & Investments"	"Pablo Legorreta"	59	"United States"	"Sag Harbor"	"Investments"	"Finance & Investments"	"United States"	""	TRUE	"D"	"M"	"10/30/1963 0:00"	"Legorreta"	"Pablo"	""	"4/4/2023 5:01"	"New York"	"Northeast"	1963	10	30	117.24	7.5	"$21,427,700,000,000 "	88.2	101.8	78.5	9.6	36.6	328239523	37.09024	-95.712891
"1078"	1067	2800	"Diversified"	"Adi Godrej"	81	"India"	"Mumbai"	"Consumer goods"	"Diversified"	"India"	""	FALSE	"U"	"M"	"4/3/1942 0:00"	"Godrej"	"Adi"	""	"4/4/2023 5:01"	""	""	1942	4	3	180.44	7.7	"$2,611,000,000,000 "	28.1	113	69.4	11.2	49.7	1366417754	20.593684	78.96288
"1907"	1905	1500	"Diversified"	"Hamdi Akin & family"	68	"Turkey"	"Istanbul"	"Diversified"	"Diversified"	"Turkey"	""	TRUE	"E"	"M"	"1/1/1955 0:00"	"Akin"	"Hamdi"	""	"4/4/2023 5:01"	""	""	1955	1	1	234.44	15.2	"$754,411,708,203 "	23.9	93.2	77.4	17.9	42.3	83429615	38.963745	35.243322
"1343"	1312	2300	"Food & Beverage"	"David Murdock"	99	"United States"	"Ventura"	"Dole, real estate"	"Food & Beverage"	"United States"	""	TRUE	"E"	"M"	"4/10/1923 0:00"	"Murdock"	"David"	""	"4/4/2023 5:01"	"California"	"West"	1923	4	10	117.24	7.5	"$21,427,700,000,000 "	88.2	101.8	78.5	9.6	36.6	328239523	37.09024	-95.712891
"1329"	1312	2300	"Technology"	"Long Jiang"	49	"China"	"Weifang"	"Manufacturing"	"Technology"	"China"	""	TRUE	"U"	"M"	"2/1/1974 0:00"	"Jiang"	"Long"	""	"4/4/2023 5:01"	""	""	1974	2	1	125.08	2.9	"$19,910,000,000,000 "	50.6	100.2	77	9.4	59.2	1397715000	35.86166	104.195397
"2282"	2259	1200	"Fashion & Retail"	"Ding Shui Po"	52	"China"	"Quanzhou"	"Sneakers, sportswear"	"Fashion & Retail"	"China"	""	FALSE	"D"	"M"	"11/1/1970 0:00"	"Ding"	"Shui Po"	""	"4/4/2023 5:01"	""	""	1970	11	1	125.08	2.9	"$19,910,000,000,000 "	50.6	100.2	77	9.4	59.2	1397715000	35.86166	104.195397
"912"	905	3200	"Manufacturing"	"Antonio Del Valle Ruiz & family"	84	"Mexico"	"Mexico City"	"Chemicals"	"Manufacturing"	"Mexico"	""	TRUE	"D"	"M"	"8/13/1938 0:00"	"Del Valle Ruiz"	"Antonio"	""	"4/4/2023 5:01"	""	""	1938	8	13	141.54	3.6	"$1,258,286,717,125 "	40.2	105.8	75	13.1	55.1	126014024	23.634501	-102.552784
"136"	136	13200	"Automotive"	"Lu Xiangyang"	60	"China"	"Guangzhou"	"Automobiles, batteries"	"Automotive"	"China"	""	TRUE	"D"	"M"	"12/28/1962 0:00"	"Lu"	"Xiangyang"	""	"4/4/2023 5:01"	""	""	1962	12	28	125.08	2.9	"$19,910,000,000,000 "	50.6	100.2	77	9.4	59.2	1397715000	35.86166	104.195397
"222"	220	8900	"Food & Beverage"	"Kirsten Rausing"	70	"United Kingdom"	"Newmarket"	"Packaging"	"Food & Beverage"	"Sweden"	""	FALSE	"D"	"F"	"6/6/1952 0:00"	"Rausing"	"Kirsten"	""	"4/4/2023 5:01"	""	""	1952	6	6	119.62	1.7	"$2,827,113,184,696 "	60	101.2	81.3	25.5	30.6	66834405	55.378051	-3.435973
"980"	949	3100	"Fashion & Retail"	"Frank VanderSloot"	74	"United States"	"Idaho Falls"	"Nutrition, wellness products"	"Fashion & Retail"	"United States"	""	TRUE	"U"	"M"	"8/14/1948 0:00"	"VanderSloot"	"Frank"	""	"4/4/2023 5:01"	"Idaho"	"West"	1948	8	14	117.24	7.5	"$21,427,700,000,000 "	88.2	101.8	78.5	9.6	36.6	328239523	37.09024	-95.712891
"139"	138	12900	"Sports"	"Stanley Kroenke"	75	"United States"	"Electra"	"Sports, real estate"	"Sports"	"United States"	""	TRUE	"U"	"M"	"7/29/1947 0:00"	"Kroenke"	"Stanley"	""	"4/4/2023 5:01"	"Texas"	"South"	1947	7	29	117.24	7.5	"$21,427,700,000,000 "	88.2	101.8	78.5	9.6	36.6	328239523	37.09024	-95.712891
"2250"	2133	1300	"Diversified"	"Wu Xushun & family"	74	"China"	"Wuhu"	"Internet"	"Diversified"	"China"	""	TRUE	"D"	"M"	"4/28/1948 0:00"	"Wu"	"Xushun"	""	"4/4/2023 5:01"	""	""	1948	4	28	125.08	2.9	"$19,910,000,000,000 "	50.6	100.2	77	9.4	59.2	1397715000	35.86166	104.195397
"505"	497	5300	"Food & Beverage"	"Stewart Resnick"	86	"United States"	"Beverly Hills"	"Agriculture"	"Food & Beverage"	"United States"	""	TRUE	"Split Family Fortune"	"M"	"12/24/1936 0:00"	"Resnick"	"Stewart"	""	"4/4/2023 5:01"	"California"	"West"	1936	12	24	117.24	7.5	"$21,427,700,000,000 "	88.2	101.8	78.5	9.6	36.6	328239523	37.09024	-95.712891
"1589"	1575	1900	"Food & Beverage"	"Alexandra Daitch"	60	"United States"	"Old Lyme"	"Cargill"	"Food & Beverage"	"United States"	""	FALSE	"D"	"F"	"1/1/1963 0:00"	"Daitch"	"Alexandra"	""	"4/4/2023 5:01"	"Connecticut"	"Northeast"	1963	1	1	117.24	7.5	"$21,427,700,000,000 "	88.2	101.8	78.5	9.6	36.6	328239523	37.09024	-95.712891
"2155"	2133	1300	"Telecom"	"R. Marcelo Claure"	52	"United States"	"Miami Beach"	"Cell phone distribution"	"Telecom"	"United States"	""	TRUE	"N"	"M"	"12/9/1970 0:00"	"Claure"	"R. Marcelo"	""	"4/4/2023 5:01"	"Florida"	"South"	1970	12	9	117.24	7.5	"$21,427,700,000,000 "	88.2	101.8	78.5	9.6	36.6	328239523	37.09024	-95.712891
"1058"	1027	2900	"Healthcare"	"Alexey Repik"	43	"Russia"	"Moscow"	"Pharmaceuticals"	"Healthcare"	"Russia"	""	TRUE	"U"	"M"	"8/27/1979 0:00"	"Repik"	"Alexey"	""	"4/4/2023 5:01"	""	""	1979	8	27	180.75	4.5	"$1,699,876,578,871 "	81.9	102.6	72.7	11.4	46.2	144373535	61.52401	105.318756
"153"	153	11300	"Finance & Investments"	"Israel Englander"	74	"United States"	"New York"	"Hedge funds"	"Finance & Investments"	"United States"	"Millennium Management, L.L.C."	TRUE	"D"	"M"	"9/30/1948 0:00"	"Englander"	"Israel"	"Founder"	"4/4/2023 5:01"	"New York"	"Northeast"	1948	9	30	117.24	7.5	"$21,427,700,000,000 "	88.2	101.8	78.5	9.6	36.6	328239523	37.09024	-95.712891
"1860"	1804	1600	"Energy"	"Massimo Moratti"	77	"Italy"	"Milan"	"Oil refinery"	"Energy"	"Italy"	""	FALSE	"U"	"M"	"5/16/1945 0:00"	"Moratti"	"Massimo"	""	"4/4/2023 5:01"	""	""	1945	5	16	110.62	0.6	"$2,001,244,392,042 "	61.9	101.9	82.9	24.3	59.1	60297396	41.87194	12.56738
"1957"	1905	1500	"Manufacturing"	"Li Shui-po"	66	"China"	"Kunshan"	"Stainless steel products"	"Manufacturing"	"Taiwan"	""	TRUE	"U"	"M"	"8/1/1956 0:00"	"Li"	"Shui-po"	""	"4/4/2023 5:01"	""	""	1956	8	1	125.08	2.9	"$19,910,000,000,000 "	50.6	100.2	77	9.4	59.2	1397715000	35.86166	104.195397
"2488"	2405	1100	"Energy"	"Dmitry Nikolaev"	56	"Russia"	"Kemerovo"	"Coal"	"Energy"	"Russia"	""	TRUE	"N"	"M"	"8/17/1966 0:00"	"Nikolaev"	"Dmitry "	""	"4/4/2023 5:01"	""	""	1966	8	17	180.75	4.5	"$1,699,876,578,871 "	81.9	102.6	72.7	11.4	46.2	144373535	61.52401	105.318756
"1647"	1647	1800	"Technology"	"Cameron Adams"	43	"Australia"	"Sydney"	"Software"	"Technology"	"Australia"	""	TRUE	"D"	"M"	"12/26/1979 0:00"	"Adams"	"Cameron"	""	"4/4/2023 5:01"	""	""	1979	12	26	119.8	1.6	"$1,392,680,589,329 "	113.1	100.3	82.7	23	47.4	25766605	-25.274398	133.775136
"913"	905	3200	"Healthcare"	"Gustavo Denegri & family"	86	"Italy"	"torino"	"Biotech"	"Healthcare"	"Italy"	""	TRUE	"Split Family Fortune"	"M"	"3/17/1937 0:00"	"Denegri"	"Gustavo"	""	"4/4/2023 5:01"	""	""	1937	3	17	110.62	0.6	"$2,001,244,392,042 "	61.9	101.9	82.9	24.3	59.1	60297396	41.87194	12.56738
"1579"	1575	1900	"Energy"	"Nikolai Buinov"	55	"Russia"	"Irkutsk"	"Oil, gas"	"Energy"	"Russia"	""	TRUE	"U"	"M"	"7/9/1967 0:00"	"Buinov"	"Nikolai"	""	"4/4/2023 5:01"	""	""	1967	7	9	180.75	4.5	"$1,699,876,578,871 "	81.9	102.6	72.7	11.4	46.2	144373535	61.52401	105.318756
"2124"	2020	1400	"Healthcare"	"Yuan Liping"	52	"China"	"Shenzhen"	"Pharmaceuticals"	"Healthcare"	"Canada"	""	FALSE	"D"	"F"	"1/1/1971 0:00"	"Yuan"	"Liping"	""	"4/4/2023 5:01"	""	""	1971	1	1	125.08	2.9	"$19,910,000,000,000 "	50.6	100.2	77	9.4	59.2	1397715000	35.86166	104.195397
"193"	190	9700	"Manufacturing"	"Friedhelm Loh"	76	"Germany"	"Haiger"	"Manufacturing"	"Manufacturing"	"Germany"	""	FALSE	"U"	"M"	"8/15/1946 0:00"	"Loh"	"Friedhelm"	""	"4/4/2023 5:01"	""	""	1946	8	15	112.85	1.4	"$3,845,630,030,824 "	70.2	104	80.9	11.5	48.8	83132799	51.165691	10.451526
"765"	748	3800	"Manufacturing"	"Richard Uihlein"	77	"United States"	"Lake Forest"	"Packaging materials"	"Manufacturing"	"United States"	""	TRUE	"N"	"M"	"8/27/1945 0:00"	"Uihlein"	"Richard"	""	"4/4/2023 5:01"	"Illinois"	"Midwest"	1945	8	27	117.24	7.5	"$21,427,700,000,000 "	88.2	101.8	78.5	9.6	36.6	328239523	37.09024	-95.712891
"2219"	2133	1300	"Logistics"	"G. M. Rao"	72	"India"	"Bangalore"	"Infrastructure"	"Logistics"	"India"	""	TRUE	"D"	"M"	"7/1/1950 0:00"	"Rao"	"G. M."	""	"4/4/2023 5:01"	""	""	1950	7	1	180.44	7.7	"$2,611,000,000,000 "	28.1	113	69.4	11.2	49.7	1366417754	20.593684	78.96288
"2275"	2259	1200	"Food & Beverage"	"Chen Xianbao & family"	63	"China"	"Hefei"	"Food"	"Food & Beverage"	"China"	""	TRUE	"D"	"M"	"5/19/1959 0:00"	"Chen"	"Xianbao"	""	"4/4/2023 5:01"	""	""	1959	5	19	125.08	2.9	"$19,910,000,000,000 "	50.6	100.2	77	9.4	59.2	1397715000	35.86166	104.195397
"1685"	1647	1800	"Healthcare"	"Gary Michelson"	74	"United States"	"Los Angeles"	"Medical patents"	"Healthcare"	"United States"	""	TRUE	"E"	"M"	"1/14/1949 0:00"	"Michelson"	"Gary"	""	"4/4/2023 5:01"	"California"	"West"	1949	1	14	117.24	7.5	"$21,427,700,000,000 "	88.2	101.8	78.5	9.6	36.6	328239523	37.09024	-95.712891
"2269"	2259	1200	"Energy"	"Bai Houshan"	59	"China"	"Ningbo"	"Lithium battery"	"Energy"	"China"	""	TRUE	"D"	"M"	"1/1/1964 0:00"	"Bai"	"Houshan"	""	"4/4/2023 5:01"	""	""	1964	1	1	125.08	2.9	"$19,910,000,000,000 "	50.6	100.2	77	9.4	59.2	1397715000	35.86166	104.195397
"1652"	1647	1800	"Fashion & Retail"	"Sabrina Benetton"	49	"Italy"	"Treviso"	"Fashion retail, investments"	"Fashion & Retail"	"Italy"	""	FALSE	"U"	"F"	"10/4/1973 0:00"	"Benetton"	"Sabrina"	""	"4/4/2023 5:01"	""	""	1973	10	4	110.62	0.6	"$2,001,244,392,042 "	61.9	101.9	82.9	24.3	59.1	60297396	41.87194	12.56738
"506"	497	5300	"Service"	"Gary Rollins"	78	"United States"	"Atlanta"	"Pest control"	"Service"	"United States"	""	FALSE	"E"	"M"	"8/30/1944 0:00"	"Rollins"	"Gary"	""	"4/4/2023 5:01"	"Georgia"	"South"	1944	8	30	117.24	7.5	"$21,427,700,000,000 "	88.2	101.8	78.5	9.6	36.6	328239523	37.09024	-95.712891
"741"	721	3900	"Manufacturing"	"Ruan Hongliang & family"	62	"China"	"Jiaxing"	"Glass"	"Manufacturing"	"China"	""	TRUE	"D"	"M"	"1/1/1961 0:00"	"Ruan"	"Hongliang"	""	"4/4/2023 5:01"	""	""	1961	1	1	125.08	2.9	"$19,910,000,000,000 "	50.6	100.2	77	9.4	59.2	1397715000	35.86166	104.195397
"167"	167	10500	"Finance & Investments"	"Suleiman Kerimov & family"	57	"Russia"	"Moscow"	"Gold"	"Finance & Investments"	"Russia"	""	TRUE	"U"	"M"	"3/12/1966 0:00"	"Kerimov & family"	"Suleiman"	""	"4/4/2023 5:01"	""	""	1966	3	12	180.75	4.5	"$1,699,876,578,871 "	81.9	102.6	72.7	11.4	46.2	144373535	61.52401	105.318756
"1307"	1272	2400	"Finance & Investments"	"Urs Wietlisbach"	61	"Switzerland"	"Zug"	"Private equity"	"Finance & Investments"	"Switzerland"	""	TRUE	"D"	"M"	"8/25/1961 0:00"	"Wietlisbach"	"Urs"	""	"4/4/2023 5:01"	""	""	1961	8	25	99.55	0.4	"$703,082,435,360 "	59.6	105.2	83.6	10.1	28.8	8574832	46.818188	8.227512
"942"	905	3200	"Technology"	"Harald Tschira"	48	"Germany"	"Heidelberg"	"Software"	"Technology"	"Germany"	""	FALSE	"Split Family Fortune"	"M"	"4/25/1974 0:00"	"Tschira"	"Harald"	""	"4/4/2023 5:01"	""	""	1974	4	25	112.85	1.4	"$3,845,630,030,824 "	70.2	104	80.9	11.5	48.8	83132799	51.165691	10.451526
"2304"	2259	1200	"Technology"	"Sam Hupert"	68	"Australia"	"Melbourne"	"Technology"	"Technology"	"Australia"	""	TRUE	"N"	"M"	"12/25/1954 0:00"	"Hupert"	"Sam"	""	"4/4/2023 5:01"	""	""	1954	12	25	119.8	1.6	"$1,392,680,589,329 "	113.1	100.3	82.7	23	47.4	25766605	-25.274398	133.775136
"1949"	1905	1500	"Real Estate"	"Raj Kumar"	68	"Singapore"	"Singapore"	"Real estate, hotels"	"Real Estate"	"Singapore"	""	TRUE	"Split Family Fortune"	"M"	"5/25/1954 0:00"	"Kumar"	"Raj"	""	"4/4/2023 5:01"	""	""	1954	5	25	114.41	0.6	"$372,062,527,489 "	84.8	100.6	83.1	13.1	21	5703569	1.352083	103.819836
"2390"	2259	1200	"Manufacturing"	"Xia Xinde"	58	"China"	"Guangzhou"	"Batteries"	"Manufacturing"	"China"	""	TRUE	"U"	"M"	"10/15/1964 0:00"	"Xia"	"Xinde"	""	"4/4/2023 5:01"	""	""	1964	10	15	125.08	2.9	"$19,910,000,000,000 "	50.6	100.2	77	9.4	59.2	1397715000	35.86166	104.195397
"1976"	1905	1500	"Fashion & Retail"	"Karl-Johan Persson"	48	"Sweden"	"Stockholm"	"H&M"	"Fashion & Retail"	"Sweden"	""	FALSE	"E"	"M"	"3/25/1975 0:00"	"Persson"	"Karl-Johan"	""	"4/4/2023 5:01"	""	""	1975	3	25	110.51	1.8	"$530,832,908,738 "	67	126.6	82.5	27.9	49.1	10285453	60.128161	18.643501
"1904"	1804	1600	"Gambling & Casinos"	"Fredrik sterberg"	52	"Sweden"	"Stockholm"	"Gambling products"	"Gambling & Casinos"	"Sweden"	""	TRUE	"U"	"M"	"1/19/1971 0:00"	"sterberg"	"Fredrik"	""	"4/4/2023 5:01"	""	""	1971	1	19	110.51	1.8	"$530,832,908,738 "	67	126.6	82.5	27.9	49.1	10285453	60.128161	18.643501
"1951"	1905	1500	"Manufacturing"	"Peter Leibinger"	56	"Germany"	"Schwieberdingen"	"Machine tools"	"Manufacturing"	"Germany"	""	FALSE	"D"	"M"	"1/1/1967 0:00"	"Leibinger"	"Peter"	""	"4/4/2023 5:01"	""	""	1967	1	1	112.85	1.4	"$3,845,630,030,824 "	70.2	104	80.9	11.5	48.8	83132799	51.165691	10.451526
"1489"	1434	2100	"Technology"	"Leonid Radvinsky"	40	"United States"	""	"E-commerce"	"Technology"	"United States"	""	TRUE	"U"	"M"	"5/30/1982 0:00"	"Radvinsky"	"Leonid"	""	"4/4/2023 5:01"	"Florida"	"South"	1982	5	30	117.24	7.5	"$21,427,700,000,000 "	88.2	101.8	78.5	9.6	36.6	328239523	37.09024	-95.712891
"624"	624	4400	"Healthcare"	"Stphane Bancel"	50	"United States"	"Boston"	"Biotech, vaccines"	"Healthcare"	"France"	""	TRUE	"D"	"M"	"7/20/1972 0:00"	"Bancel"	"Stphane"	""	"4/4/2023 5:01"	"Massachusetts"	"Northeast"	1972	7	20	117.24	7.5	"$21,427,700,000,000 "	88.2	101.8	78.5	9.6	36.6	328239523	37.09024	-95.712891
"2363"	2259	1200	"Technology"	"Mike Speiser"	52	"United Kingdom"	"London"	"Software"	"Technology"	"United States"	"Sutter Hill Ventures"	TRUE	"U"	"M"	"1/25/1971 0:00"	"Speiser"	"Mike"	"Managing Director"	"4/4/2023 5:01"	""	""	1971	1	25	119.62	1.7	"$2,827,113,184,696 "	60	101.2	81.3	25.5	30.6	66834405	55.378051	-3.435973
"1237"	1217	2500	"Technology"	"Serge Godin"	73	"Canada"	"Westmount"	"Information technology"	"Technology"	"Canada"	"CGI Group"	TRUE	"U"	"M"	"11/17/1949 0:00"	"Godin"	"Serge"	"Chairman and CEO"	"4/4/2023 5:01"	""	""	1949	11	17	116.76	1.9	"$1,736,425,629,520 "	68.9	100.9	81.9	12.8	24.5	36991981	56.130366	-106.346771
"2135"	2133	1300	"Healthcare"	"Rajendra Agarwal"	64	"India"	"Mumbai"	"Pharmaceuticals"	"Healthcare"	"India"	""	TRUE	"D"	"M"	"2/25/1959 0:00"	"Agarwal"	"Rajendra"	""	"4/4/2023 5:01"	""	""	1959	2	25	180.44	7.7	"$2,611,000,000,000 "	28.1	113	69.4	11.2	49.7	1366417754	20.593684	78.96288
"7"	7	94500	"Media & Entertainment"	"Michael Bloomberg"	81	"United States"	"New York"	"Bloomberg LP"	"Media & Entertainment"	"United States"	"Bloomberg"	TRUE	"U"	"M"	"2/14/1942 0:00"	"Bloomberg"	"Michael"	"CEO"	"4/4/2023 5:01"	"New York"	"Northeast"	1942	2	14	117.24	7.5	"$21,427,700,000,000 "	88.2	101.8	78.5	9.6	36.6	328239523	37.09024	-95.712891
"1726"	1725	1700	"Finance & Investments"	"Marc Andreessen"	51	"United States"	"Atherton"	"Venture capital investing"	"Finance & Investments"	"United States"	"Andreessen Horowitz"	TRUE	"E"	"M"	"7/9/1971 0:00"	"Andreessen"	"Marc"	"Investor"	"4/4/2023 5:01"	"California"	"West"	1971	7	9	117.24	7.5	"$21,427,700,000,000 "	88.2	101.8	78.5	9.6	36.6	328239523	37.09024	-95.712891
"1641"	1575	1900	"Food & Beverage"	"Charlotte Colket Weber"	80	"United States"	"Hobe Sound"	"Campbell Soup"	"Food & Beverage"	"United States"	"Campbell Soup"	FALSE	"U"	"F"	"11/19/1942 0:00"	"Weber"	"Charlotte Colket"	"Director"	"4/4/2023 5:01"	"Florida"	"South"	1942	11	19	117.24	7.5	"$21,427,700,000,000 "	88.2	101.8	78.5	9.6	36.6	328239523	37.09024	-95.712891
"52"	52	27000	"Metals & Mining"	"Gina Rinehart"	69	"Australia"	"Perth"	"Mining"	"Metals & Mining"	"Australia"	"Hancock Prospecting"	FALSE	"D"	"F"	"2/9/1954 0:00"	"Rinehart"	"Gina"	"Executive Chairman"	"4/4/2023 5:01"	""	""	1954	2	9	119.8	1.6	"$1,392,680,589,329 "	113.1	100.3	82.7	23	47.4	25766605	-25.274398	133.775136
"2504"	2405	1100	"Manufacturing"	"Manny Stul"	73	"Australia"	"Melbourne"	"Toys"	"Manufacturing"	"Australia"	""	TRUE	"D"	"M"	"5/9/1949 0:00"	"Stul"	"Manny"	""	"4/4/2023 5:01"	""	""	1949	5	9	119.8	1.6	"$1,392,680,589,329 "	113.1	100.3	82.7	23	47.4	25766605	-25.274398	133.775136
"864"	852	3400	"Finance & Investments"	"Steven Klinsky"	66	"United States"	"New York"	"Investments"	"Finance & Investments"	"United States"	"New Mountain Capital"	TRUE	"E"	"M"	"5/30/1956 0:00"	"Klinsky"	"Steven"	"Founder & CEO"	"4/4/2023 5:01"	"New York"	"Northeast"	1956	5	30	117.24	7.5	"$21,427,700,000,000 "	88.2	101.8	78.5	9.6	36.6	328239523	37.09024	-95.712891
"1256"	1217	2500	"Technology"	"Qiu Minxiu"	77	"China"	"Shangyu"	"Semiconductors"	"Technology"	"China"	""	TRUE	"E"	"F"	"9/17/1945 0:00"	"Qiu"	"Minxiu"	""	"4/4/2023 5:01"	""	""	1945	9	17	125.08	2.9	"$19,910,000,000,000 "	50.6	100.2	77	9.4	59.2	1397715000	35.86166	104.195397
"234"	232	8600	"Food & Beverage"	"Ravi Jaipuria"	68	"India"	"Delhi"	"Soft drinks, fast food"	"Food & Beverage"	"India"	""	FALSE	"U"	"M"	"11/28/1954 0:00"	"Jaipuria"	"Ravi"	""	"4/4/2023 5:01"	""	""	1954	11	28	180.44	7.7	"$2,611,000,000,000 "	28.1	113	69.4	11.2	49.7	1366417754	20.593684	78.96288
"1945"	1905	1500	"Diversified"	"Ke Xiping & family"	62	"China"	"Xiamen"	"Investments"	"Diversified"	"China"	""	TRUE	"E"	"M"	"6/7/1960 0:00"	"Ke"	"Xiping"	""	"4/4/2023 5:01"	""	""	1960	6	7	125.08	2.9	"$19,910,000,000,000 "	50.6	100.2	77	9.4	59.2	1397715000	35.86166	104.195397
"700"	699	4000	"Technology"	"Ben Chestnut"	48	"United States"	"Atlanta"	"Email marketing"	"Technology"	"United States"	""	TRUE	"D"	"M"	"6/15/1974 0:00"	"Chestnut"	"Ben"	""	"4/4/2023 5:01"	"Georgia"	"South"	1974	6	15	117.24	7.5	"$21,427,700,000,000 "	88.2	101.8	78.5	9.6	36.6	328239523	37.09024	-95.712891
"510"	497	5300	"Fashion & Retail"	"M.A. Yusuff Ali"	67	"United Arab Emirates"	"Abu Dhabi"	"Retail"	"Fashion & Retail"	"India"	""	TRUE	"D"	"M"	"11/15/1955 0:00"	"Yusuff Ali"	"M.A."	""	"4/4/2023 5:01"	""	""	1955	11	15	114.52	-1.9	"$421,142,267,938 "	36.8	108.4	77.8	0.1	15.9	9770529	23.424076	53.847818
"759"	748	3800	"Energy"	"Trevor Rees-Jones"	71	"United States"	"Dallas"	"Oil & gas"	"Energy"	"United States"	""	TRUE	"D"	"M"	"8/12/1951 0:00"	"Rees-Jones"	"Trevor"	""	"4/4/2023 5:01"	"Texas"	"South"	1951	8	12	117.24	7.5	"$21,427,700,000,000 "	88.2	101.8	78.5	9.6	36.6	328239523	37.09024	-95.712891
"2158"	2133	1300	"Food & Beverage"	"Wenjun Dai"	54	"China"	"Changsha"	"Food"	"Food & Beverage"	"China"	""	TRUE	"D"	"M"	"8/12/1968 0:00"	"Dai"	"Wenjun"	""	"4/4/2023 5:01"	""	""	1968	8	12	125.08	2.9	"$19,910,000,000,000 "	50.6	100.2	77	9.4	59.2	1397715000	35.86166	104.195397
"2389"	2259	1200	"Fashion & Retail"	"Wu Yonghua"	52	"China"	"Xiamen"	"Apparel"	"Fashion & Retail"	"China"	""	TRUE	"U"	"M"	"1/1/1971 0:00"	"Wu"	"Yonghua"	""	"4/4/2023 5:01"	""	""	1971	1	1	125.08	2.9	"$19,910,000,000,000 "	50.6	100.2	77	9.4	59.2	1397715000	35.86166	104.195397
"1270"	1217	2500	"Metals & Mining"	"Xie Weitong"	66	"Singapore"	""	"Cobalt"	"Metals & Mining"	"Taiwan"	""	TRUE	"D"	"M"	"1/1/1957 0:00"	"Xie"	"Weitong"	""	"4/4/2023 5:01"	""	""	1957	1	1	114.41	0.6	"$372,062,527,489 "	84.8	100.6	83.1	13.1	21	5703569	1.352083	103.819836
"538"	534	5000	"Technology"	"Martin Haefner"	69	"Switzerland"	"Zurich"	"Software, investments"	"Technology"	"Switzerland"	""	FALSE	"U"	"M"	"1/1/1954 0:00"	"Haefner"	"Martin"	""	"4/4/2023 5:01"	""	""	1954	1	1	99.55	0.4	"$703,082,435,360 "	59.6	105.2	83.6	10.1	28.8	8574832	46.818188	8.227512
"855"	852	3400	"Food & Beverage"	"Ramon Ang"	69	"Philippines"	"Manila"	"Diversified"	"Food & Beverage"	"Philippines"	""	TRUE	"U"	"M"	"1/14/1954 0:00"	"Ang"	"Ramon"	""	"4/4/2023 5:01"	""	""	1954	1	14	129.61	2.5	"$376,795,508,680 "	35.5	107.5	71.1	14	43.1	108116615	12.879721	121.774017
"125"	124	14200	"Manufacturing"	"Aliko Dangote"	65	"Nigeria"	"Lagos"	"Cement, sugar"	"Manufacturing"	"Nigeria"	"Dangote Group"	TRUE	"U"	"M"	"4/10/1957 0:00"	"Dangote"	"Aliko"	"CEO"	"4/4/2023 5:01"	""	""	1957	4	10	267.51	11.4	"$448,120,428,859 "	10.2	84.7	54.3	1.5	34.8	200963599	9.081999	8.675277
"2477"	2405	1100	"Finance & Investments"	"Norma Lerner"	87	"United States"	"Cleveland"	"Banking"	"Finance & Investments"	"United States"	""	FALSE	"E"	"F"	"3/28/1936 0:00"	"Lerner"	"Norma"	""	"4/4/2023 5:01"	"Ohio"	"Midwest"	1936	3	28	117.24	7.5	"$21,427,700,000,000 "	88.2	101.8	78.5	9.6	36.6	328239523	37.09024	-95.712891
"2502"	2405	1100	"Finance & Investments"	"Joseph Steinberg"	79	"United States"	"New York"	"Investments"	"Finance & Investments"	"United States"	""	TRUE	"U"	"M"	"2/5/1944 0:00"	"Steinberg"	"Joseph"	""	"4/4/2023 5:01"	"New York"	"Northeast"	1944	2	5	117.24	7.5	"$21,427,700,000,000 "	88.2	101.8	78.5	9.6	36.6	328239523	37.09024	-95.712891
"2409"	2405	1100	"Food & Beverage"	"Abigail Bennett"	42	"United States"	"Rochester"	"Liquor"	"Food & Beverage"	"United States"	""	FALSE	"Split Family Fortune"	"F"	"12/27/1980 0:00"	"Bennett"	"Abigail"	""	"4/4/2023 5:01"	"New York"	"Northeast"	1980	12	27	117.24	7.5	"$21,427,700,000,000 "	88.2	101.8	78.5	9.6	36.6	328239523	37.09024	-95.712891
"246"	246	8300	"Fashion & Retail"	"John Morris"	75	"United States"	"Springfield"	"Sporting goods retail"	"Fashion & Retail"	"United States"	""	TRUE	"U"	"M"	"3/19/1948 0:00"	"Morris"	"John"	""	"4/4/2023 5:01"	"Missouri"	"Midwest"	1948	3	19	117.24	7.5	"$21,427,700,000,000 "	88.2	101.8	78.5	9.6	36.6	328239523	37.09024	-95.712891
"257"	256	8100	"Diversified"	"Thierry Dassault"	66	"France"	"Paris"	"Diversified"	"Diversified"	"France"	""	FALSE	"D"	"M"	"3/26/1957 0:00"	"Dassault"	"Thierry"	""	"4/4/2023 5:01"	""	""	1957	3	26	110.05	1.1	"$2,715,518,274,227 "	65.6	102.5	82.5	24.2	60.7	67059887	46.227638	2.213749
"968"	949	3100	"Fashion & Retail"	"Ravi Modi"	46	"India"	"Kolkata"	"Readymade garments"	"Fashion & Retail"	"India"	""	TRUE	"U"	"M"	"3/13/1977 0:00"	"Modi"	"Ravi"	""	"4/4/2023 5:01"	""	""	1977	3	13	180.44	7.7	"$2,611,000,000,000 "	28.1	113	69.4	11.2	49.7	1366417754	20.593684	78.96288
"2521"	2405	1100	"Fashion & Retail"	"Horst Wortmann"	81	"Germany"	"Detmold"	"Footwear"	"Fashion & Retail"	"Germany"	""	TRUE	"D"	"M"	"5/8/1941 0:00"	"Wortmann"	"Horst"	""	"4/4/2023 5:01"	""	""	1941	5	8	112.85	1.4	"$3,845,630,030,824 "	70.2	104	80.9	11.5	48.8	83132799	51.165691	10.451526
"522"	511	5200	"Real Estate"	"Sam Zell"	81	"United States"	"Chicago"	"Real estate, private equity"	"Real Estate"	"United States"	""	TRUE	"D"	"M"	"9/28/1941 0:00"	"Zell"	"Sam"	""	"4/4/2023 5:01"	"Illinois"	""	1941	9	28	117.24	7.5	"$21,427,700,000,000 "	88.2	101.8	78.5	9.6	36.6	328239523	37.09024	-95.712891
"1740"	1725	1700	"Finance & Investments"	"Mario Gabelli"	81	"United States"	"Greenwich"	"Money management"	"Finance & Investments"	"United States"	""	TRUE	"D"	"M"	"3/31/1942 0:00"	"Gabelli"	"Mario"	""	"4/4/2023 5:01"	"Connecticut"	"Northeast"	1942	3	31	117.24	7.5	"$21,427,700,000,000 "	88.2	101.8	78.5	9.6	36.6	328239523	37.09024	-95.712891
"488"	486	5400	"Finance & Investments"	"Mat Ishbia"	43	"United States"	"Bloomfield Hills"	"Mortgage lender"	"Finance & Investments"	"United States"	""	FALSE	"U"	"M"	"1/6/1980 0:00"	"Ishbia"	"Mat"	""	"4/4/2023 5:01"	"Michigan"	"Midwest"	1980	1	6	117.24	7.5	"$21,427,700,000,000 "	88.2	101.8	78.5	9.6	36.6	328239523	37.09024	-95.712891
"1776"	1725	1700	"Fashion & Retail"	"Dragos Paval"	56	"Romania"	"Bacau"	"Retail"	"Fashion & Retail"	"Romania"	""	TRUE	"U"	"M"	"6/22/1966 0:00"	"Paval"	"Dragos"	""	"4/4/2023 5:01"	""	""	1966	6	22	123.78	3.8	"$250,077,444,017 "	49.4	85.2	75.4	14.6	20	19356544	45.943161	24.96676
"1846"	1804	1600	"Manufacturing"	"Pyotr Kondrashev"	73	"Austria"	"Wien"	"Investments"	"Manufacturing"	"Russia"	""	TRUE	"U"	"M"	"7/16/1949 0:00"	"Kondrashev"	"Pyotr"	""	"4/4/2023 5:01"	""	""	1949	7	16	118.06	1.5	"$446,314,739,528 "	85.1	103.1	81.6	25.4	51.4	8877067	47.516231	14.550072
"793"	787	3600	"Real Estate"	"Bob Gaglardi"	82	"Canada"	"Vancouver"	"Hotels"	"Real Estate"	"Canada"	""	TRUE	"U"	"M"	"2/19/1941 0:00"	"Gaglardi"	"Bob"	""	"4/4/2023 5:01"	""	""	1941	2	19	116.76	1.9	"$1,736,425,629,520 "	68.9	100.9	81.9	12.8	24.5	36991981	56.130366	-106.346771
"961"	949	3100	"Fashion & Retail"	"Miguel Krigsner"	73	"Brazil"	"Sao Jose dos Pinhais"	"Cosmetics"	"Fashion & Retail"	"Brazil"	""	TRUE	"D"	"M"	"1/9/1950 0:00"	"Krigsner"	"Miguel"	""	"4/4/2023 5:01"	""	""	1950	1	9	167.4	3.7	"$1,839,758,040,766 "	51.3	115.4	75.7	14.2	65.1	212559417	-14.235004	-51.92528
"1115"	1104	2700	"Food & Beverage"	"Jack Cowin"	80	"Australia"	"Sydney"	"Fast food"	"Food & Beverage"	"Australia"	""	TRUE	"D"	"M"	"7/13/1942 0:00"	"Cowin"	"Jack"	""	"4/4/2023 5:01"	""	""	1942	7	13	119.8	1.6	"$1,392,680,589,329 "	113.1	100.3	82.7	23	47.4	25766605	-25.274398	133.775136
"161"	161	10900	"Finance & Investments"	"Philip Anschutz"	83	"United States"	"Denver"	"Energy, sports, entertainment"	"Finance & Investments"	"United States"	""	FALSE	"E"	"M"	"12/28/1939 0:00"	"Anschutz"	"Philip"	""	"4/4/2023 5:01"	"Colorado"	"West"	1939	12	28	117.24	7.5	"$21,427,700,000,000 "	88.2	101.8	78.5	9.6	36.6	328239523	37.09024	-95.712891
"207"	206	9300	"Manufacturing"	"James Dyson"	75	"United Kingdom"	"Gloucestershire"	"Vacuums"	"Manufacturing"	"United Kingdom"	""	TRUE	"U"	"M"	"5/2/1947 0:00"	"Dyson"	"James"	""	"4/4/2023 5:01"	""	""	1947	5	2	119.62	1.7	"$2,827,113,184,696 "	60	101.2	81.3	25.5	30.6	66834405	55.378051	-3.435973
"2245"	2133	1300	"Service"	"Junjin Wang"	54	"China"	"Shanghai"	"Airline"	"Service"	"China"	""	TRUE	"D"	"M"	"12/1/1968 0:00"	"Wang"	"Junjin"	""	"4/4/2023 5:01"	""	""	1968	12	1	125.08	2.9	"$19,910,000,000,000 "	50.6	100.2	77	9.4	59.2	1397715000	35.86166	104.195397
"195"	195	9600	"Technology"	"Rick Cohen & family"	70	"United States"	"Keene"	"Warehouse automation"	"Technology"	"United States"	"C&S Wholesale Grocers"	FALSE	"N"	"M"	"7/25/1952 0:00"	"Cohen"	"Rick"	"Entrepreneur"	"4/4/2023 5:01"	"New Hampshire"	"Northeast"	1952	7	25	117.24	7.5	"$21,427,700,000,000 "	88.2	101.8	78.5	9.6	36.6	328239523	37.09024	-95.712891
"2202"	2133	1300	"Food & Beverage"	"Blairo Maggi"	66	"Brazil"	"Cuiaba"	"Agribusiness"	"Food & Beverage"	"Brazil"	""	FALSE	"Split Family Fortune"	"M"	"5/29/1956 0:00"	"Maggi"	"Blairo"	""	"4/4/2023 5:01"	""	""	1956	5	29	167.4	3.7	"$1,839,758,040,766 "	51.3	115.4	75.7	14.2	65.1	212559417	-14.235004	-51.92528
"1994"	1905	1500	"Real Estate"	"Su Suyu & family"	74	"China"	"Shantou"	"Utilities, real estate"	"Real Estate"	"China"	""	TRUE	"D"	"F"	"11/24/1948 0:00"	"Su"	"Suyu"	""	"4/4/2023 5:01"	""	""	1948	11	24	125.08	2.9	"$19,910,000,000,000 "	50.6	100.2	77	9.4	59.2	1397715000	35.86166	104.195397
"2362"	2259	1200	"Healthcare"	"Abhay Soi"	49	"India"	"Mumbai"	"Healthcare"	"Healthcare"	"India"	""	TRUE	"N"	"M"	"8/19/1973 0:00"	"Soi"	"Abhay"	""	"4/4/2023 5:01"	""	""	1973	8	19	180.44	7.7	"$2,611,000,000,000 "	28.1	113	69.4	11.2	49.7	1366417754	20.593684	78.96288
"1583"	1575	1900	"Fashion & Retail"	"Jianxing Che"	56	"China"	"Shanghai"	"Furniture retailing"	"Fashion & Retail"	"China"	""	TRUE	"D"	"M"	"7/18/1966 0:00"	"Che"	"Jianxing"	""	"4/4/2023 5:01"	""	""	1966	7	18	125.08	2.9	"$19,910,000,000,000 "	50.6	100.2	77	9.4	59.2	1397715000	35.86166	104.195397
"272"	268	7900	"Finance & Investments"	"Ramzi Musallam"	54	"United States"	"New York"	"Private equity"	"Finance & Investments"	"United States"	""	TRUE	"U"	"M"	"9/17/1968 0:00"	"Musallam"	"Ramzi"	""	"4/4/2023 5:01"	"New York"	"Northeast"	1968	9	17	117.24	7.5	"$21,427,700,000,000 "	88.2	101.8	78.5	9.6	36.6	328239523	37.09024	-95.712891
"1680"	1647	1800	"Diversified"	"Louise Lindh"	43	"Sweden"	"Stockholm"	"Investments"	"Diversified"	"Sweden"	""	FALSE	"U"	"F"	"10/20/1979 0:00"	"Lindh"	"Louise"	""	"4/4/2023 5:01"	""	""	1979	10	20	110.51	1.8	"$530,832,908,738 "	67	126.6	82.5	27.9	49.1	10285453	60.128161	18.643501
"2482"	2405	1100	"Telecom"	"Lu Rongfu"	52	"China"	"Xiamen"	"Telecommunication"	"Telecom"	"China"	""	TRUE	"D"	"M"	"1/1/1971 0:00"	"Lu"	"Rongfu"	""	"4/4/2023 5:01"	""	""	1971	1	1	125.08	2.9	"$19,910,000,000,000 "	50.6	100.2	77	9.4	59.2	1397715000	35.86166	104.195397
"2221"	2133	1300	"Healthcare"	"Satish Reddy"	55	"India"	"Hyderabad"	"Pharmaceuticals"	"Healthcare"	"India"	""	FALSE	"E"	"M"	"6/9/1967 0:00"	"Reddy"	"Satish"	""	"4/4/2023 5:01"	""	""	1967	6	9	180.44	7.7	"$2,611,000,000,000 "	28.1	113	69.4	11.2	49.7	1366417754	20.593684	78.96288
"841"	818	3500	"Fashion & Retail"	"Remo Ruffini"	61	"Italy"	"Como"	"Winter jackets"	"Fashion & Retail"	"Italy"	""	TRUE	"U"	"M"	"8/27/1961 0:00"	"Ruffini"	"Remo"	""	"4/4/2023 5:01"	""	""	1961	8	27	110.62	0.6	"$2,001,244,392,042 "	61.9	101.9	82.9	24.3	59.1	60297396	41.87194	12.56738
"2299"	2259	1200	"Fashion & Retail"	"Richard Hayne"	75	"United States"	"Philadelphia"	"Urban Outfitters"	"Fashion & Retail"	"United States"	"Urban Outfitters Inc."	TRUE	"E"	"M"	"9/1/1947 0:00"	"Hayne"	"Richard"	"Chairman, President & Chief Executive Officer"	"4/4/2023 5:01"	"Pennsylvania"	"Northeast"	1947	9	1	117.24	7.5	"$21,427,700,000,000 "	88.2	101.8	78.5	9.6	36.6	328239523	37.09024	-95.712891
"2035"	2020	1400	"Finance & Investments"	"J. Christopher Flowers"	65	"United States"	"Palm Beach"	"Investments"	"Finance & Investments"	"United States"	"J.C. Flowers & Co. LLC"	TRUE	"U"	"M"	"10/27/1957 0:00"	"Flowers"	"J. Christopher"	"Founder and Managing Director"	"4/4/2023 5:01"	"Florida"	"South"	1957	10	27	117.24	7.5	"$21,427,700,000,000 "	88.2	101.8	78.5	9.6	36.6	328239523	37.09024	-95.712891
"2175"	2133	1300	"Finance & Investments"	"Gregg Hymowitz"	57	"United States"	"New York"	"Asset management"	"Finance & Investments"	"United States"	""	TRUE	"N"	"M"	"11/16/1965 0:00"	"Hymowitz"	"Gregg"	""	"4/4/2023 5:01"	"New York"	"Northeast"	1965	11	16	117.24	7.5	"$21,427,700,000,000 "	88.2	101.8	78.5	9.6	36.6	328239523	37.09024	-95.712891
"563"	552	4900	"Sports"	"Dan Snyder"	58	"United States"	"Potomac"	"Washington Commanders"	"Sports"	"United States"	""	TRUE	"U"	"M"	"11/23/1964 0:00"	"Snyder"	"Dan"	""	"4/4/2023 5:01"	"Maryland"	"South"	1964	11	23	117.24	7.5	"$21,427,700,000,000 "	88.2	101.8	78.5	9.6	36.6	328239523	37.09024	-95.712891
"1431"	1368	2200	"Finance & Investments"	"Oren Zeev"	58	"United States"	"Los Altos"	"Investments"	"Finance & Investments"	"Israel"	""	TRUE	"D"	"M"	"9/23/1964 0:00"	"Zeev"	"Oren"	""	"4/4/2023 5:01"	"California"	"West"	1964	9	23	117.24	7.5	"$21,427,700,000,000 "	88.2	101.8	78.5	9.6	36.6	328239523	37.09024	-95.712891
"2230"	2133	1300	"Healthcare"	"Devi Shetty"	70	"India"	"Bangalore"	"Healthcare"	"Healthcare"	"India"	""	TRUE	"U"	"M"	"1/1/1953 0:00"	"Shetty"	"Devi"	""	"4/4/2023 5:01"	""	""	1953	1	1	180.44	7.7	"$2,611,000,000,000 "	28.1	113	69.4	11.2	49.7	1366417754	20.593684	78.96288
"2495"	2405	1100	"Healthcare"	"Rao Wei & family"	58	"China"	"Shenzhen"	"Pharmaceuticals"	"Healthcare"	"China"	""	TRUE	"R"	"M"	"11/12/1964 0:00"	"Rao"	"Wei"	""	"4/4/2023 5:01"	""	""	1964	11	12	125.08	2.9	"$19,910,000,000,000 "	50.6	100.2	77	9.4	59.2	1397715000	35.86166	104.195397
"897"	878	3300	"Technology"	"Gil Shwed"	54	"Israel"	"Tel Aviv"	"Software"	"Technology"	"Israel"	""	TRUE	"D"	"M"	"6/12/1968 0:00"	"Shwed"	"Gil"	""	"4/4/2023 5:01"	""	""	1968	6	12	108.15	0.8	"$395,098,666,122 "	63.4	104.9	82.8	23.1	25.3	9053300	31.046051	34.851612
"1480"	1434	2100	"Diversified"	"Katarina Martinson"	41	"Sweden"	"Stockholm"	"Investments"	"Diversified"	"Sweden"	""	FALSE	"U"	"F"	"5/4/1981 0:00"	"Martinson"	"Katarina"	""	"4/4/2023 5:01"	""	""	1981	5	4	110.51	1.8	"$530,832,908,738 "	67	126.6	82.5	27.9	49.1	10285453	60.128161	18.643501
"43"	43	31200	"Logistics"	"Gianluigi Aponte"	82	"Switzerland"	"Geneva"	"Shipping"	"Logistics"	"Switzerland"	""	TRUE	"Split Family Fortune"	"M"	"6/27/1940 0:00"	"Aponte"	"Gianluigi"	""	"4/4/2023 5:01"	""	""	1940	6	27	99.55	0.4	"$703,082,435,360 "	59.6	105.2	83.6	10.1	28.8	8574832	46.818188	8.227512
"1472"	1434	2100	"Sports"	"Theodore Leonsis"	67	"United States"	"Bethesda"	"Sports teams"	"Sports"	"United States"	""	TRUE	"U"	"M"	"1/8/1956 0:00"	"Leonsis"	"Theodore"	""	"4/4/2023 5:01"	"Maryland"	"South"	1956	1	8	117.24	7.5	"$21,427,700,000,000 "	88.2	101.8	78.5	9.6	36.6	328239523	37.09024	-95.712891
"1866"	1804	1600	"Manufacturing"	"Francisco Jose Riberas Mera"	58	"Spain"	"Madrid"	"Steel, autoparts"	"Manufacturing"	"Spain"	""	FALSE	"U"	"M"	"6/1/1964 0:00"	"Riberas Mera"	"Francisco Jose"	""	"4/4/2023 5:01"	""	""	1964	6	1	110.96	0.7	"$1,394,116,310,769 "	88.9	102.7	83.3	14.2	47	47076781	40.463667	-3.74922
"2285"	2259	1200	"Manufacturing"	"Farhad Ebrahimi"	84	"United States"	"Denver"	"Solar panels"	"Manufacturing"	"United States"	""	TRUE	"N"	"M"	"1/1/1939 0:00"	"Ebrahimi"	"Farhad"	""	"4/4/2023 5:01"	"Colorado"	"West"	1939	1	1	117.24	7.5	"$21,427,700,000,000 "	88.2	101.8	78.5	9.6	36.6	328239523	37.09024	-95.712891
"2410"	2405	1100	"Fashion & Retail"	"Sara Blakely"	52	"United States"	"Atlanta"	"Spanx"	"Fashion & Retail"	"United States"	"Spanx"	TRUE	"E"	"F"	"2/27/1971 0:00"	"Blakely"	"Sara"	"Founder"	"4/4/2023 5:01"	"Georgia"	"South"	1971	2	27	117.24	7.5	"$21,427,700,000,000 "	88.2	101.8	78.5	9.6	36.6	328239523	37.09024	-95.712891
"2266"	2259	1200	"Real Estate"	"Danna Azrieli"	55	"Israel"	"Herzliya"	"Real estate"	"Real Estate"	"Israel"	""	FALSE	"D"	"F"	"6/3/1967 0:00"	"Azrieli"	"Danna"	""	"4/4/2023 5:01"	""	""	1967	6	3	108.15	0.8	"$395,098,666,122 "	63.4	104.9	82.8	23.1	25.3	9053300	31.046051	34.851612
"1217"	1217	2500	"Food & Beverage"	"S. Daniel Abraham"	98	"United States"	"Palm Beach"	"Slim-Fast"	"Food & Beverage"	"United States"	"S. Daniel Abraham Center for Middle East Peace"	TRUE	"U"	"M"	"8/15/1924 0:00"	"Abraham"	"S. Daniel"	"Chairman"	"4/4/2023 5:01"	"Florida"	"South"	1924	8	15	117.24	7.5	"$21,427,700,000,000 "	88.2	101.8	78.5	9.6	36.6	328239523	37.09024	-95.712891
"2025"	2020	1400	"Diversified"	"John Bloor"	79	"United Kingdom"	"Aberdyfi"	"Real estate, manufacturing"	"Diversified"	"United Kingdom"	""	TRUE	"D"	"M"	"6/16/1943 0:00"	"Bloor"	"John"	""	"4/4/2023 5:01"	""	""	1943	6	16	119.62	1.7	"$2,827,113,184,696 "	60	101.2	81.3	25.5	30.6	66834405	55.378051	-3.435973
"31"	31	38300	"Food & Beverage"	"Jacqueline Mars"	83	"United States"	"The Plains"	"Candy, pet food"	"Food & Beverage"	"United States"	""	FALSE	"U"	"F"	"10/10/1939 0:00"	"Mars"	"Jacqueline"	""	"4/4/2023 5:01"	"Virginia"	"South"	1939	10	10	117.24	7.5	"$21,427,700,000,000 "	88.2	101.8	78.5	9.6	36.6	328239523	37.09024	-95.712891
"1688"	1647	1800	"Technology"	"Adriaan Mol"	39	"Netherlands"	"Amsterdam"	"Fintech"	"Technology"	"Netherlands"	""	TRUE	"N"	"M"	"3/14/1984 0:00"	"Mol"	"Adriaan"	""	"4/4/2023 5:01"	""	""	1984	3	14	115.91	2.6	"$909,070,395,161 "	85	104.2	81.8	23	41.2	17332850	52.132633	5.291266
"1178"	1164	2600	"Manufacturing"	"Deng Weiming & family"	54	"China"	"Changsha"	"Battery components"	"Manufacturing"	"China"	""	TRUE	"D"	"M"	"9/1/1968 0:00"	"Deng"	"Weiming"	""	"4/4/2023 5:01"	""	""	1968	9	1	125.08	2.9	"$19,910,000,000,000 "	50.6	100.2	77	9.4	59.2	1397715000	35.86166	104.195397
"171"	171	10200	"Technology"	"Mike Cannon-Brookes"	43	"Australia"	"Sydney"	"Software"	"Technology"	"Australia"	""	TRUE	"D"	"M"	"11/17/1979 0:00"	"Cannon-Brookes"	"Mike"	""	"4/4/2023 5:01"	""	""	1979	11	17	119.8	1.6	"$1,392,680,589,329 "	113.1	100.3	82.7	23	47.4	25766605	-25.274398	133.775136
"1857"	1804	1600	"Telecom"	"Terence (Terry) Matthews"	80	"Canada"	"Ottawa"	"Telecom"	"Telecom"	"Canada"	""	TRUE	"E"	"M"	"4/1/1943 0:00"	"Matthews"	"Terence (Terry)"	""	"4/4/2023 5:01"	""	""	1943	4	1	116.76	1.9	"$1,736,425,629,520 "	68.9	100.9	81.9	12.8	24.5	36991981	56.130366	-106.346771
"1206"	1164	2600	"Automotive"	"Maria-Elisabeth Schaeffler-Thumann"	81	"Germany"	"Herzogenaurach"	"Auto parts"	"Automotive"	"Germany"	""	FALSE	"U"	"F"	"8/17/1941 0:00"	"Schaeffler-Thumann"	"Maria-Elisabeth"	""	"4/4/2023 5:01"	""	""	1941	8	17	112.85	1.4	"$3,845,630,030,824 "	70.2	104	80.9	11.5	48.8	83132799	51.165691	10.451526
"2295"	2259	1200	"Finance & Investments"	"Lawrence Golub"	63	"United States"	"New York"	"Private equity"	"Finance & Investments"	"United States"	""	TRUE	"E"	"M"	"10/3/1959 0:00"	"Golub"	"Lawrence"	"Investor"	"4/4/2023 5:01"	"New York"	"Northeast"	1959	10	3	117.24	7.5	"$21,427,700,000,000 "	88.2	101.8	78.5	9.6	36.6	328239523	37.09024	-95.712891
"1545"	1516	2000	"Real Estate"	"Bill Malhotra"	73	"Canada"	"Ottawa"	"Real estate"	"Real Estate"	"Canada"	""	TRUE	"U"	"M"	"9/8/1949 0:00"	"Malhotra"	"Bill"	""	"4/4/2023 5:01"	""	""	1949	9	8	116.76	1.9	"$1,736,425,629,520 "	68.9	100.9	81.9	12.8	24.5	36991981	56.130366	-106.346771
"2049"	2020	1400	"Manufacturing"	"Rameshchandra Jain"	74	"India"	"Mumbai"	"Textiles"	"Manufacturing"	"India"	""	TRUE	"U"	"M"	"6/22/1948 0:00"	"Jain"	"Rameshchandra"	""	"4/4/2023 5:01"	""	""	1948	6	22	180.44	7.7	"$2,611,000,000,000 "	28.1	113	69.4	11.2	49.7	1366417754	20.593684	78.96288
"2296"	2259	1200	"Manufacturing"	"Saroj Rani Gupta"	72	"India"	"Delhi"	"Steel tubes"	"Manufacturing"	"India"	""	TRUE	"N"	"F"	"7/5/1950 0:00"	"Gupta"	"Saroj Rani"	""	"4/4/2023 5:01"	""	""	1950	7	5	180.44	7.7	"$2,611,000,000,000 "	28.1	113	69.4	11.2	49.7	1366417754	20.593684	78.96288
"1956"	1905	1500	"Fashion & Retail"	"Li Rucheng"	71	"China"	"Ningbo"	"Apparel"	"Fashion & Retail"	"China"	""	TRUE	"D"	"M"	"6/13/1951 0:00"	"Li"	"Rucheng"	""	"4/4/2023 5:01"	""	""	1951	6	13	125.08	2.9	"$19,910,000,000,000 "	50.6	100.2	77	9.4	59.2	1397715000	35.86166	104.195397
"2257"	2133	1300	"Metals & Mining"	"Kostyantin Zhevago"	49	"Ukraine"	"Kiev"	"Mining"	"Metals & Mining"	"Ukraine"	""	TRUE	"E"	"M"	"1/7/1974 0:00"	"Zhevago"	"Kostyantin"	""	"4/4/2023 5:01"	""	""	1974	1	7	281.66	7.9	"$153,781,069,118 "	82.7	99	71.6	20.1	45.2	44385155	48.379433	31.16558
"1567"	1516	2000	"Manufacturing"	"William Young"	82	"United States"	"Ypsilanti"	"Plastics"	"Manufacturing"	"United States"	""	TRUE	"D"	"M"	"1/1/1941 0:00"	"Young"	"William"	""	"4/4/2023 5:01"	"Michigan"	"Midwest"	1941	1	1	117.24	7.5	"$21,427,700,000,000 "	88.2	101.8	78.5	9.6	36.6	328239523	37.09024	-95.712891
"769"	766	3700	"Real Estate"	"Yakir Gabay"	56	"United Kingdom"	"London"	"Real estate"	"Real Estate"	"Cyprus"	""	TRUE	"D"	"M"	"4/13/1966 0:00"	"Gabay"	"Yakir"	""	"4/4/2023 5:01"	""	""	1966	4	13	119.62	1.7	"$2,827,113,184,696 "	60	101.2	81.3	25.5	30.6	66834405	55.378051	-3.435973
"562"	552	4900	"Automotive"	"Mark Shoen"	72	"United States"	"Phoenix"	"U-Haul"	"Automotive"	"United States"	""	FALSE	"U"	"M"	"11/20/1950 0:00"	"Shoen"	"Mark"	""	"4/4/2023 5:01"	"Arizona"	"West"	1950	11	20	117.24	7.5	"$21,427,700,000,000 "	88.2	101.8	78.5	9.6	36.6	328239523	37.09024	-95.712891
"2149"	2133	1300	"Technology"	"Anthony Casalena"	40	"United States"	"Monkton"	"Software"	"Technology"	"United States"	""	TRUE	"E"	"M"	"4/24/1982 0:00"	"Casalena"	"Anthony"	""	"4/4/2023 5:01"	"Maryland"	"South"	1982	4	24	117.24	7.5	"$21,427,700,000,000 "	88.2	101.8	78.5	9.6	36.6	328239523	37.09024	-95.712891
"164"	164	10700	"Media & Entertainment"	"Donald Newhouse"	93	"United States"	"New York"	"Media"	"Media & Entertainment"	"United States"	""	FALSE	"D"	"M"	"8/5/1929 0:00"	"Newhouse"	"Donald"	""	"4/4/2023 5:01"	"New York"	"Northeast"	1929	8	5	117.24	7.5	"$21,427,700,000,000 "	88.2	101.8	78.5	9.6	36.6	328239523	37.09024	-95.712891
"1272"	1272	2400	"Technology"	"Brian Acton"	51	"United States"	"Palo Alto"	"WhatsApp"	"Technology"	"United States"	"WhatsApp Inc."	TRUE	"D"	"M"	"2/17/1972 0:00"	"Acton"	"Brian"	"Cofounder"	"4/4/2023 5:01"	"California"	"West"	1972	2	17	117.24	7.5	"$21,427,700,000,000 "	88.2	101.8	78.5	9.6	36.6	328239523	37.09024	-95.712891
"1222"	1217	2500	"Diversified"	"Thor Bjorgolfsson"	56	"United Kingdom"	"London"	"Investments"	"Diversified"	"Iceland"	""	TRUE	"E"	"M"	"3/19/1967 0:00"	"Bjorgolfsson"	"Thor"	""	"4/4/2023 5:01"	""	""	1967	3	19	119.62	1.7	"$2,827,113,184,696 "	60	101.2	81.3	25.5	30.6	66834405	55.378051	-3.435973
"637"	636	4300	"Finance & Investments"	"Behdad Eghbali"	46	"United States"	"Los Angeles"	"Private equity"	"Finance & Investments"	"United States"	""	TRUE	"U"	"M"	"5/6/1976 0:00"	"Eghbali"	"Behdad"	""	"4/4/2023 5:01"	"California"	"West"	1976	5	6	117.24	7.5	"$21,427,700,000,000 "	88.2	101.8	78.5	9.6	36.6	328239523	37.09024	-95.712891
"598"	591	4600	"Fashion & Retail"	"Ronald Lauder"	79	"United States"	"New York"	"Estee Lauder"	"Fashion & Retail"	"United States"	""	FALSE	"D"	"M"	"2/26/1944 0:00"	"Lauder"	"Ronald"	""	"4/4/2023 5:01"	"New York"	"Northeast"	1944	2	26	117.24	7.5	"$21,427,700,000,000 "	88.2	101.8	78.5	9.6	36.6	328239523	37.09024	-95.712891
"1292"	1272	2400	"Manufacturing"	"Fatih Ozmen"	65	"United States"	"Reno"	"Aerospace"	"Manufacturing"	"United States"	""	TRUE	"D"	"M"	"2/2/1958 0:00"	"Ozmen"	"Fatih"	""	"4/4/2023 5:01"	"Nevada"	"West"	1958	2	2	117.24	7.5	"$21,427,700,000,000 "	88.2	101.8	78.5	9.6	36.6	328239523	37.09024	-95.712891
"501"	497	5300	"Finance & Investments"	"Douglas Leone"	65	"United States"	"Atherton"	"Venture capital"	"Finance & Investments"	"United States"	"Sequoia"	TRUE	"D"	"M"	"7/4/1957 0:00"	"Leone"	"Douglas"	"Global Managing Partner"	"4/4/2023 5:01"	"California"	"West"	1957	7	4	117.24	7.5	"$21,427,700,000,000 "	88.2	101.8	78.5	9.6	36.6	328239523	37.09024	-95.712891
"282"	282	7700	"Food & Beverage"	"Jean-Michel Besnier"	55	"France"	"Laval"	"Cheese"	"Food & Beverage"	"France"	""	FALSE	"D"	"M"	"6/5/1967 0:00"	"Besnier"	"Jean-Michel"	""	"4/4/2023 5:01"	""	""	1967	6	5	110.05	1.1	"$2,715,518,274,227 "	65.6	102.5	82.5	24.2	60.7	67059887	46.227638	2.213749
"2439"	2405	1100	"Telecom"	"Gleb Fetisov"	56	"Cyprus"	"Limassol"	"Investments"	"Telecom"	"Russia"	""	TRUE	"D"	"M"	"6/5/1966 0:00"	"Fetisov"	"Gleb"	""	"4/4/2023 5:01"	""	""	1966	6	5	102.51	0.3	"$24,564,647,935 "	75.9	99.3	80.8	24.5	22.4	1198575	35.126413	33.429859
"1134"	1104	2700	"Manufacturing"	"Frank Laukien"	63	"United States"	"Boston"	"Scientific equipment"	"Manufacturing"	"United States"	""	FALSE	"U"	"M"	"2/4/1960 0:00"	"Laukien"	"Frank"	""	"4/4/2023 5:01"	"Massachusetts"	"Northeast"	1960	2	4	117.24	7.5	"$21,427,700,000,000 "	88.2	101.8	78.5	9.6	36.6	328239523	37.09024	-95.712891
"4"	4	107000	"Technology"	"Larry Ellison"	78	"United States"	"Lanai"	"Oracle"	"Technology"	"United States"	"Oracle"	TRUE	"U"	"M"	"8/17/1944 0:00"	"Ellison"	"Larry"	"CTO and Founder"	"4/4/2023 5:01"	"Hawaii"	"West"	1944	8	17	117.24	7.5	"$21,427,700,000,000 "	88.2	101.8	78.5	9.6	36.6	328239523	37.09024	-95.712891
"2116"	2020	1400	"Manufacturing"	"Anne Werninghaus"	37	"Brazil"	"Joinville"	"Industrial machinery"	"Manufacturing"	"Brazil"	""	FALSE	"U"	"F"	"1/1/1986 0:00"	"Werninghaus"	"Anne"	""	"4/4/2023 5:01"	""	""	1986	1	1	167.4	3.7	"$1,839,758,040,766 "	51.3	115.4	75.7	14.2	65.1	212559417	-14.235004	-51.92528
"1165"	1164	2600	"Finance & Investments"	"Felix Baker"	54	"United States"	"New York"	"Biotech investing"	"Finance & Investments"	"United States"	""	TRUE	"D"	"M"	"3/29/1969 0:00"	"Baker"	"Felix"	""	"4/4/2023 5:01"	"New York"	"Northeast"	1969	3	29	117.24	7.5	"$21,427,700,000,000 "	88.2	101.8	78.5	9.6	36.6	328239523	37.09024	-95.712891
"882"	878	3300	"Food & Beverage"	"Bennett Dorrance"	77	"United States"	"Paradise Valley"	"Campbell Soup"	"Food & Beverage"	"United States"	""	FALSE	"U"	"M"	"2/9/1946 0:00"	"Dorrance"	"Bennett"	""	"4/4/2023 5:01"	"Arizona"	"West"	1946	2	9	117.24	7.5	"$21,427,700,000,000 "	88.2	101.8	78.5	9.6	36.6	328239523	37.09024	-95.712891
"138"	138	12900	"Finance & Investments"	"Uday Kotak"	64	"India"	"Mumbai"	"Banking"	"Finance & Investments"	"India"	""	TRUE	"D"	"M"	"3/15/1959 0:00"	"Kotak"	"Uday"	""	"4/4/2023 5:01"	""	""	1959	3	15	180.44	7.7	"$2,611,000,000,000 "	28.1	113	69.4	11.2	49.7	1366417754	20.593684	78.96288
"513"	511	5200	"Real Estate"	"Robert Faith"	59	"United States"	"Charleston"	"Real estate management"	"Real Estate"	"United States"	""	TRUE	"N"	"M"	"10/3/1963 0:00"	"Faith"	"Robert"	""	"4/4/2023 5:01"	"South Carolina"	"South"	1963	10	3	117.24	7.5	"$21,427,700,000,000 "	88.2	101.8	78.5	9.6	36.6	328239523	37.09024	-95.712891
"1416"	1368	2200	"Diversified"	"Harley Sy"	63	"Philippines"	"Manila"	"Diversified"	"Diversified"	"Philippines"	""	FALSE	"D"	"M"	"6/1/1959 0:00"	"Sy"	"Harley"	""	"4/4/2023 5:01"	""	""	1959	6	1	129.61	2.5	"$376,795,508,680 "	35.5	107.5	71.1	14	43.1	108116615	12.879721	121.774017
"1044"	1027	2900	"Technology"	"Lee Seo-hyun"	49	"South Korea"	"Seoul"	"Samsung"	"Technology"	"South Korea"	""	FALSE	"D"	"F"	"9/20/1973 0:00"	"Lee"	"Seo-hyun"	""	"4/4/2023 5:01"	""	""	1973	9	20	115.16	0.4	"$2,029,000,000,000 "	94.3	98.1	82.6	15.6	33.2	51709098	35.907757	127.766922
"329"	325	7100	"Healthcare"	"Frederik Paulsen"	72	"Switzerland"	"Lausanne"	"Health care"	"Healthcare"	"Sweden"	""	FALSE	"D"	"M"	"10/30/1950 0:00"	"Paulsen"	"Frederik"	""	"4/4/2023 5:01"	""	""	1950	10	30	99.55	0.4	"$703,082,435,360 "	59.6	105.2	83.6	10.1	28.8	8574832	46.818188	8.227512
"353"	352	6800	"Diversified"	"Silvio Berlusconi & family"	86	"Italy"	"Milan"	"Media"	"Diversified"	"Italy"	""	TRUE	"D"	"M"	"9/29/1936 0:00"	"Berlusconi"	"Silvio"	""	"4/4/2023 5:01"	""	""	1936	9	29	110.62	0.6	"$2,001,244,392,042 "	61.9	101.9	82.9	24.3	59.1	60297396	41.87194	12.56738
"957"	949	3100	"Real Estate"	"Sergei Gordeev"	50	"Russia"	"Moscow"	"Real estate"	"Real Estate"	"Russia"	""	TRUE	"U"	"M"	"11/22/1972 0:00"	"Gordeev"	"Sergei"	""	"4/4/2023 5:01"	""	""	1972	11	22	180.75	4.5	"$1,699,876,578,871 "	81.9	102.6	72.7	11.4	46.2	144373535	61.52401	105.318756
"768"	766	3700	"Real Estate"	"Charles Cohen"	71	"United States"	"New York"	"Real estate"	"Real Estate"	"United States"	""	FALSE	"U"	"M"	"2/8/1952 0:00"	"Cohen"	"Charles"	""	"4/4/2023 5:01"	"New York"	"Northeast"	1952	2	8	117.24	7.5	"$21,427,700,000,000 "	88.2	101.8	78.5	9.6	36.6	328239523	37.09024	-95.712891
"1494"	1434	2100	"Finance & Investments"	"Thaksin Shinawatra"	73	"United Arab Emirates"	"Dubai"	"Investments"	"Finance & Investments"	"Thailand"	""	TRUE	"U"	"M"	"7/26/1949 0:00"	"Shinawatra"	"Thaksin"	""	"4/4/2023 5:01"	""	""	1949	7	26	114.52	-1.9	"$421,142,267,938 "	36.8	108.4	77.8	0.1	15.9	9770529	23.424076	53.847818
"1773"	1725	1700	"Manufacturing"	"Meng Qingshan & family"	74	"China"	"Langfang"	"Chemicals"	"Manufacturing"	"China"	""	TRUE	"U"	"M"	"11/17/1948 0:00"	"Meng"	"Qingshan"	""	"4/4/2023 5:01"	""	""	1948	11	17	125.08	2.9	"$19,910,000,000,000 "	50.6	100.2	77	9.4	59.2	1397715000	35.86166	104.195397
"149"	148	11500	"Healthcare"	"Andreas Struengmann & family"	73	"Germany"	"Tegernsee"	"Pharmaceuticals"	"Healthcare"	"Germany"	""	TRUE	"D"	"M"	"2/16/1950 0:00"	"Struengmann"	"Andreas"	""	"4/4/2023 5:01"	""	""	1950	2	16	112.85	1.4	"$3,845,630,030,824 "	70.2	104	80.9	11.5	48.8	83132799	51.165691	10.451526
"627"	624	4400	"Service"	"Jim Davis"	63	"United States"	"Cockeysville"	"Staffing & recruiting"	"Service"	"United States"	""	TRUE	"U"	"M"	"3/13/1960 0:00"	"Davis"	"Jim"	""	"4/4/2023 5:01"	"Maryland"	"South"	1960	3	13	117.24	7.5	"$21,427,700,000,000 "	88.2	101.8	78.5	9.6	36.6	328239523	37.09024	-95.712891
"1522"	1516	2000	"Manufacturing"	"Cao Jianwei"	44	"China"	"Shangyu"	"Semiconductors"	"Manufacturing"	"China"	""	TRUE	"E"	"M"	"5/30/1978 0:00"	"Cao"	"Jianwei"	""	"4/4/2023 5:01"	""	""	1978	5	30	125.08	2.9	"$19,910,000,000,000 "	50.6	100.2	77	9.4	59.2	1397715000	35.86166	104.195397
"2475"	2405	1100	"Construction & Engineering"	"Lee Joong-keun"	82	"South Korea"	"Seoul"	"Construction, real estate"	"Construction & Engineering"	"South Korea"	"Booyoung Group"	TRUE	"D"	"M"	"1/11/1941 0:00"	"Lee"	"Joong-keun"	""	"4/4/2023 5:01"	""	""	1941	1	11	115.16	0.4	"$2,029,000,000,000 "	94.3	98.1	82.6	15.6	33.2	51709098	35.907757	127.766922
"1315"	1312	2300	"Technology"	"Sanjit Biswas"	41	"United States"	"San Francisco"	"Sensor systems"	"Technology"	"United States"	""	TRUE	"U"	"M"	"1/12/1982 0:00"	"Biswas"	"Sanjit"	""	"4/4/2023 5:01"	"California"	"West"	1982	1	12	117.24	7.5	"$21,427,700,000,000 "	88.2	101.8	78.5	9.6	36.6	328239523	37.09024	-95.712891
"2004"	1905	1500	"Automotive"	"Tran Ba Duong & family"	63	"Vietnam"	"Ho Chi Minh City"	"Automotive"	"Automotive"	"Vietnam"	""	TRUE	"D"	"M"	"4/1/1960 0:00"	"Tran"	"Ba Duong"	""	"4/4/2023 5:01"	""	""	1960	4	1	163.52	2.8	"$261,921,244,843 "	28.5	110.6	75.3	19.1	37.6	96462106	14.058324	108.277199
"1485"	1434	2100	"Finance & Investments"	"Alexander Nesis"	60	"Russia"	"Moscow"	"Metals, banking, fertilizers"	"Finance & Investments"	"Russia"	""	TRUE	"U"	"M"	"12/19/1962 0:00"	"Nesis"	"Alexander"	""	"4/4/2023 5:01"	""	""	1962	12	19	180.75	4.5	"$1,699,876,578,871 "	81.9	102.6	72.7	11.4	46.2	144373535	61.52401	105.318756
"2331"	2259	1200	"Diversified"	"Lorinc Meszaros"	57	"Hungary"	"Felcst"	"Diversified"	"Diversified"	"Hungary"	""	TRUE	"E"	"M"	"2/25/1966 0:00"	"Meszaros"	"Lorinc"	""	"4/4/2023 5:01"	""	""	1966	2	25	121.64	3.3	"$160,967,157,504 "	48.5	100.8	75.8	23	37.9	9769949	47.162494	19.503304
"499"	497	5300	"Manufacturing"	"Ibrahim Erdemoglu"	60	"Turkey"	"Istanbul"	"Carpet"	"Manufacturing"	"Turkey"	""	TRUE	"U"	"M"	"9/26/1962 0:00"	"Erdemoglu"	"Ibrahim"	""	"4/4/2023 5:01"	""	""	1962	9	26	234.44	15.2	"$754,411,708,203 "	23.9	93.2	77.4	17.9	42.3	83429615	38.963745	35.243322
"1207"	1164	2600	"Healthcare"	"Leonard Schleifer"	70	"United States"	"Tarrytown"	"Pharmaceuticals"	"Healthcare"	"United States"	"Regeneron Pharmaceuticals"	TRUE	"U"	"M"	"7/7/1952 0:00"	"Schleifer"	"Leonard"	"CEO and Founder"	"4/4/2023 5:01"	"New York"	"Northeast"	1952	7	7	117.24	7.5	"$21,427,700,000,000 "	88.2	101.8	78.5	9.6	36.6	328239523	37.09024	-95.712891
"1853"	1804	1600	"Real Estate"	"Li Wa"	57	"China"	"Shenzhen"	"Real estate"	"Real Estate"	"Hong Kong"	""	TRUE	"D"	"M"	"1/1/1966 0:00"	"Li"	"Wa"	""	"4/4/2023 5:01"	""	""	1966	1	1	125.08	2.9	"$19,910,000,000,000 "	50.6	100.2	77	9.4	59.2	1397715000	35.86166	104.195397
"1798"	1725	1700	"Manufacturing"	"Yang Xuegang"	58	"China"	"Beijing"	"Coking"	"Manufacturing"	"China"	""	TRUE	"D"	"M"	"2/1/1965 0:00"	"Yang"	"Xuegang"	""	"4/4/2023 5:01"	""	""	1965	2	1	125.08	2.9	"$19,910,000,000,000 "	50.6	100.2	77	9.4	59.2	1397715000	35.86166	104.195397
"1820"	1804	1600	"Finance & Investments"	"Jack Cockwell"	82	"Canada"	"Toronto"	"Real estate, private equity"	"Finance & Investments"	"Canada"	""	TRUE	"D"	"M"	"1/12/1941 0:00"	"Cockwell"	"Jack"	""	"4/4/2023 5:01"	""	""	1941	1	12	116.76	1.9	"$1,736,425,629,520 "	68.9	100.9	81.9	12.8	24.5	36991981	56.130366	-106.346771
"533"	523	5100	"Sports"	"Denise York & family"	72	"United States"	"Youngstown"	"San Francisco 49ers"	"Sports"	"United States"	"San Francisco 49ers"	FALSE	"U"	"F"	"10/21/1950 0:00"	"York"	"Denise"	"Co-Chairman"	"4/4/2023 5:01"	"Ohio"	"Midwest"	1950	10	21	117.24	7.5	"$21,427,700,000,000 "	88.2	101.8	78.5	9.6	36.6	328239523	37.09024	-95.712891
"81"	81	20200	"Healthcare"	"Thomas Frist, Jr. & family"	84	"United States"	"Nashville"	"Hospitals"	"Healthcare"	"United States"	""	TRUE	"D"	"M"	"8/12/1938 0:00"	"Frist"	"Thomas"	""	"4/4/2023 5:01"	"Tennessee"	"South"	1938	8	12	117.24	7.5	"$21,427,700,000,000 "	88.2	101.8	78.5	9.6	36.6	328239523	37.09024	-95.712891
"2399"	2259	1200	"Diversified"	"Zan Shengda"	60	"China"	"Nantong"	"Diversified"	"Diversified"	"China"	""	TRUE	"D"	"M"	"4/2/1963 0:00"	"Zan"	"Shengda"	""	"4/4/2023 5:01"	""	""	1963	4	2	125.08	2.9	"$19,910,000,000,000 "	50.6	100.2	77	9.4	59.2	1397715000	35.86166	104.195397
"1215"	1164	2600	"Technology"	"Zhao Lixin"	57	"China"	"Shanghai"	"Electronics"	"Technology"	"China"	""	TRUE	"D"	"M"	"1/1/1966 0:00"	"Zhao"	"Lixin"	""	"4/4/2023 5:01"	""	""	1966	1	1	125.08	2.9	"$19,910,000,000,000 "	50.6	100.2	77	9.4	59.2	1397715000	35.86166	104.195397
"1919"	1905	1500	"Technology"	"Safra Catz"	61	"United States"	"Redwood City"	"Software"	"Technology"	"United States"	"Oracle"	TRUE	"E"	"F"	"12/13/1961 0:00"	"Catz"	"Safra"	"CEO"	"4/4/2023 5:01"	"California"	"South"	1961	12	13	117.24	7.5	"$21,427,700,000,000 "	88.2	101.8	78.5	9.6	36.6	328239523	37.09024	-95.712891
"176"	171	10200	"Technology"	"Eduardo Saverin"	41	"Singapore"	"Singapore"	"Facebook"	"Technology"	"Brazil"	"Meta Platforms"	TRUE	"D"	"M"	"3/19/1982 0:00"	"Saverin"	"Eduardo"	"Investor"	"4/4/2023 5:01"	""	""	1982	3	19	114.41	0.6	"$372,062,527,489 "	84.8	100.6	83.1	13.1	21	5703569	1.352083	103.819836
"2161"	2133	1300	"Finance & Investments"	"Annalisa Doris"	52	"Italy"	"Segrate"	"Financial services"	"Finance & Investments"	"Italy"	""	FALSE	"N"	"F"	"5/7/1970 0:00"	"Doris"	"Annalisa"	""	"4/4/2023 5:01"	""	""	1970	5	7	110.62	0.6	"$2,001,244,392,042 "	61.9	101.9	82.9	24.3	59.1	60297396	41.87194	12.56738
"616"	611	4500	"Technology"	"N.R. Narayana Murthy"	76	"India"	"Bangalore"	"Software services"	"Technology"	"India"	""	TRUE	"U"	"M"	"8/20/1946 0:00"	"Murthy"	"N.R. Narayana"	""	"4/4/2023 5:01"	""	""	1946	8	20	180.44	7.7	"$2,611,000,000,000 "	28.1	113	69.4	11.2	49.7	1366417754	20.593684	78.96288
"482"	466	5500	"Healthcare"	"Sergio Stevanato & family"	80	"Italy"	"Venice"	"Medical packaging"	"Healthcare"	"Italy"	""	TRUE	"U"	"M"	"3/20/1943 0:00"	"Stevanato"	"Sergio"	""	"4/4/2023 5:01"	""	""	1943	3	20	110.62	0.6	"$2,001,244,392,042 "	61.9	101.9	82.9	24.3	59.1	60297396	41.87194	12.56738
"1216"	1164	2600	"Technology"	"Hongyi Zhou"	52	"China"	"Beijing"	"Security software"	"Technology"	"China"	""	TRUE	"U"	"M"	"10/1/1970 0:00"	"Zhou"	"Hongyi"	""	"4/4/2023 5:01"	""	""	1970	10	1	125.08	2.9	"$19,910,000,000,000 "	50.6	100.2	77	9.4	59.2	1397715000	35.86166	104.195397
"294"	290	7600	"Real Estate"	"Philip Ng"	64	"Singapore"	"Singapore"	"Real Estate"	"Real Estate"	"Singapore"	""	FALSE	"Split Family Fortune"	"M"	"1/1/1959 0:00"	"Ng"	"Philip"	""	"4/4/2023 5:01"	""	""	1959	1	1	114.41	0.6	"$372,062,527,489 "	84.8	100.6	83.1	13.1	21	5703569	1.352083	103.819836
"1854"	1804	1600	"Technology"	"Li Weiwei"	46	"China"	"Shanghai"	"Online games"	"Technology"	"China"	""	TRUE	"D"	"M"	"1/1/1977 0:00"	"Li"	"Weiwei"	""	"4/4/2023 5:01"	""	""	1977	1	1	125.08	2.9	"$19,910,000,000,000 "	50.6	100.2	77	9.4	59.2	1397715000	35.86166	104.195397
"1451"	1434	2100	"Fashion & Retail"	"Stefano Gabbana"	60	"Italy"	"Milan"	"Luxury goods"	"Fashion & Retail"	"Italy"	""	TRUE	"U"	"M"	"11/14/1962 0:00"	"Gabbana"	"Stefano"	""	"4/4/2023 5:01"	""	""	1962	11	14	110.62	0.6	"$2,001,244,392,042 "	61.9	101.9	82.9	24.3	59.1	60297396	41.87194	12.56738
"325"	325	7100	"Technology"	"Judy Faulkner"	79	"United States"	"Madison"	"Healthcare software"	"Technology"	"United States"	"Epic Systems"	TRUE	"U"	"F"	"8/1/1943 0:00"	"Faulkner"	"Judy"	"Founder and CEO"	"4/4/2023 5:01"	"Wisconsin"	"Midwest"	1943	8	1	117.24	7.5	"$21,427,700,000,000 "	88.2	101.8	78.5	9.6	36.6	328239523	37.09024	-95.712891
"2552"	2540	1000	"Manufacturing"	"Chen Jiancheng"	64	"China"	"Shangyu"	"Manufacturing"	"Manufacturing"	"China"	""	TRUE	"D"	"M"	"1/13/1959 0:00"	"Chen"	"Jiancheng"	""	"4/4/2023 5:01"	""	""	1959	1	13	125.08	2.9	"$19,910,000,000,000 "	50.6	100.2	77	9.4	59.2	1397715000	35.86166	104.195397
"2325"	2259	1200	"Food & Beverage"	"John MacMillan"	73	"United States"	"Plymouth"	"Cargill"	"Food & Beverage"	"United States"	""	FALSE	"D"	"M"	"9/20/1949 0:00"	"MacMillan"	"John"	""	"4/4/2023 5:01"	"Minnesota"	"Midwest"	1949	9	20	117.24	7.5	"$21,427,700,000,000 "	88.2	101.8	78.5	9.6	36.6	328239523	37.09024	-95.712891
"1167"	1164	2600	"Media & Entertainment"	"David Baszucki"	60	"United States"	"San Francisco"	"Online games"	"Media & Entertainment"	"United States"	""	TRUE	"U"	"M"	"1/20/1963 0:00"	"Baszucki"	"David"	""	"4/4/2023 5:01"	"California"	"West"	1963	1	20	117.24	7.5	"$21,427,700,000,000 "	88.2	101.8	78.5	9.6	36.6	328239523	37.09024	-95.712891
"1173"	1164	2600	"Finance & Investments"	"Richard Chandler"	64	"Singapore"	"Singapore"	"Investments"	"Finance & Investments"	"New Zealand"	""	FALSE	"U"	"M"	"1/1/1959 0:00"	"Chandler"	"Richard"	""	"4/4/2023 5:01"	""	""	1959	1	1	114.41	0.6	"$372,062,527,489 "	84.8	100.6	83.1	13.1	21	5703569	1.352083	103.819836
"2570"	2540	1000	"Finance & Investments"	"Sven Hagstrmer"	79	"Sweden"	"Stockholm"	"Financial services"	"Finance & Investments"	"Sweden"	""	TRUE	"D"	"M"	"11/30/1943 0:00"	"Hagstrmer"	"Sven"	""	"4/4/2023 5:01"	""	""	1943	11	30	110.51	1.8	"$530,832,908,738 "	67	126.6	82.5	27.9	49.1	10285453	60.128161	18.643501
"1421"	1368	2200	"Fashion & Retail"	"Lottie Tham & family"	73	"Sweden"	"Stockholm"	"H&M"	"Fashion & Retail"	"Sweden"	""	FALSE	"D"	"F"	"4/18/1949 0:00"	"Tham"	"Lottie"	""	"4/4/2023 5:01"	""	""	1949	4	18	110.51	1.8	"$530,832,908,738 "	67	126.6	82.5	27.9	49.1	10285453	60.128161	18.643501
"147"	147	11600	"Real Estate"	"Stephen Ross"	82	"United States"	"New York"	"Real estate"	"Real Estate"	"United States"	""	TRUE	"U"	"M"	"5/10/1940 0:00"	"Ross"	"Stephen"	""	"4/4/2023 5:01"	"New York"	"Northeast"	1940	5	10	117.24	7.5	"$21,427,700,000,000 "	88.2	101.8	78.5	9.6	36.6	328239523	37.09024	-95.712891
"2329"	2259	1200	"Manufacturing"	"Mao Zhongwu"	60	"China"	"Changsha"	"Manufacturing"	"Manufacturing"	"China"	""	TRUE	"D"	"M"	"8/13/1962 0:00"	"Mao"	"Zhongwu"	""	"4/4/2023 5:01"	""	""	1962	8	13	125.08	2.9	"$19,910,000,000,000 "	50.6	100.2	77	9.4	59.2	1397715000	35.86166	104.195397
"466"	466	5500	"Service"	"Micky Arison"	73	"United States"	"Bal Harbour"	"Carnival Cruises"	"Service"	"United States"	"Carnival Corp."	FALSE	"D"	"M"	"6/29/1949 0:00"	"Arison"	"Micky"	"Chairman and CEO"	"4/4/2023 5:01"	"Florida"	"South"	1949	6	29	117.24	7.5	"$21,427,700,000,000 "	88.2	101.8	78.5	9.6	36.6	328239523	37.09024	-95.712891
"1458"	1434	2100	"Real Estate"	"Jane Goldman"	67	"United States"	"New York"	"Real estate"	"Real Estate"	"United States"	""	FALSE	"D"	"F"	"7/29/1955 0:00"	"Goldman"	"Jane"	""	"4/4/2023 5:01"	"New York"	"Northeast"	1955	7	29	117.24	7.5	"$21,427,700,000,000 "	88.2	101.8	78.5	9.6	36.6	328239523	37.09024	-95.712891
"311"	305	7400	"Food & Beverage"	"Harry Stine"	81	"United States"	"Adel"	"Agriculture"	"Food & Beverage"	"United States"	""	TRUE	"U"	"M"	"11/30/1941 0:00"	"Stine"	"Harry"	""	"4/4/2023 5:01"	"Iowa"	"Midwest"	1941	11	30	117.24	7.5	"$21,427,700,000,000 "	88.2	101.8	78.5	9.6	36.6	328239523	37.09024	-95.712891
"1096"	1067	2800	"Media & Entertainment"	"Su Hua"	41	"China"	"Beijing"	"Video streaming"	"Media & Entertainment"	"China"	""	TRUE	"D"	"M"	"1/1/1982 0:00"	"Su"	"Hua"	""	"4/4/2023 5:01"	""	""	1982	1	1	125.08	2.9	"$19,910,000,000,000 "	50.6	100.2	77	9.4	59.2	1397715000	35.86166	104.195397
"215"	215	9000	"Technology"	"David Cheriton"	72	"United States"	"Palo Alto"	"Google"	"Technology"	"Canada"	"Stanford University"	TRUE	"D"	"M"	"3/29/1951 0:00"	"Cheriton"	"David"	"Professor"	"4/4/2023 5:01"	"California"	"West"	1951	3	29	117.24	7.5	"$21,427,700,000,000 "	88.2	101.8	78.5	9.6	36.6	328239523	37.09024	-95.712891
"1118"	1104	2700	"Sports"	"Frank Fertitta, III."	61	"United States"	"Las Vegas"	"Casinos, mixed martial arts"	"Sports"	"United States"	""	FALSE	"U"	"M"	"2/24/1962 0:00"	"Fertitta"	"Frank"	""	"4/4/2023 5:01"	"Nevada"	"West"	1962	2	24	117.24	7.5	"$21,427,700,000,000 "	88.2	101.8	78.5	9.6	36.6	328239523	37.09024	-95.712891
"2190"	2133	1300	"Finance & Investments"	"Kristo Krmann"	42	"United Kingdom"	"London"	"Payments, banking"	"Finance & Investments"	"Estonia"	"Wise"	TRUE	"U"	"M"	"9/1/1980 0:00"	"Krmann"	"Kristo"	"Cofounder"	"4/4/2023 5:01"	""	""	1980	9	1	119.62	1.7	"$2,827,113,184,696 "	60	101.2	81.3	25.5	30.6	66834405	55.378051	-3.435973
"1191"	1164	2600	"Technology"	"Mark Leonard & family"	66	"Canada"	"Toronto"	"Software"	"Technology"	"Canada"	""	TRUE	"U"	"M"	"5/6/1956 0:00"	"Leonard"	"Mark"	""	"4/4/2023 5:01"	""	""	1956	5	6	116.76	1.9	"$1,736,425,629,520 "	68.9	100.9	81.9	12.8	24.5	36991981	56.130366	-106.346771
"2376"	2259	1200	"Finance & Investments"	"Ruben Vardanyan & family"	54	"Armenia"	"Erevan"	"Investment banking"	"Finance & Investments"	"Armenia"	""	TRUE	"R"	"M"	"5/25/1968 0:00"	"Vardanyan"	"Ruben"	""	"4/4/2023 5:01"	""	""	1968	5	25	129.18	1.4	"$13,672,802,158 "	54.6	92.7	74.9	20.9	22.6	2957731	40.069099	45.038189
"1669"	1647	1800	"Healthcare"	"Yusuf Hamied"	86	"India"	"Mumbai"	"Pharmaceuticals"	"Healthcare"	"India"	""	FALSE	"D"	"M"	"7/26/1936 0:00"	"Hamied"	"Yusuf"	""	"4/4/2023 5:01"	""	""	1936	7	26	180.44	7.7	"$2,611,000,000,000 "	28.1	113	69.4	11.2	49.7	1366417754	20.593684	78.96288
"1517"	1516	2000	"Fashion & Retail"	"Mohamed Al Fayed"	94	"United Kingdom"	"London"	"Retail, investments"	"Fashion & Retail"	"Egypt"	""	TRUE	"D"	"M"	"1/27/1929 0:00"	"Al Fayed"	"Mohamed"	""	"4/4/2023 5:01"	""	""	1929	1	27	119.62	1.7	"$2,827,113,184,696 "	60	101.2	81.3	25.5	30.6	66834405	55.378051	-3.435973
"89"	89	18500	"Energy"	"Harold Hamm & family"	77	"United States"	"Oklahoma City"	"Oil & gas"	"Energy"	"United States"	"Continental Resources Inc. "	TRUE	"U"	"M"	"12/11/1945 0:00"	"Hamm"	"Harold"	"Chairman and CEO"	"4/4/2023 5:01"	"Oklahoma"	"South"	1945	12	11	117.24	7.5	"$21,427,700,000,000 "	88.2	101.8	78.5	9.6	36.6	328239523	37.09024	-95.712891
"575"	567	4800	"Technology"	"Thai Lee"	64	"United States"	"Austin"	"IT provider"	"Technology"	"United States"	""	TRUE	"U"	"F"	"11/27/1958 0:00"	"Lee"	"Thai"	""	"4/4/2023 5:01"	"Texas"	"South"	1958	11	27	117.24	7.5	"$21,427,700,000,000 "	88.2	101.8	78.5	9.6	36.6	328239523	37.09024	-95.712891
"2038"	2020	1400	"Diversified"	"Lance Gokongwei"	55	"Philippines"	"Manila"	"Diversified"	"Diversified"	"Philippines"	""	FALSE	"D"	"M"	"12/1/1967 0:00"	"Gokongwei"	"Lance"	""	"4/4/2023 5:01"	""	""	1967	12	1	129.61	2.5	"$376,795,508,680 "	35.5	107.5	71.1	14	43.1	108116615	12.879721	121.774017
"1240"	1217	2500	"Finance & Investments"	"J. Tomilson Hill"	74	"United States"	"New York"	"Investments"	"Finance & Investments"	"United States"	""	TRUE	"D"	"M"	"5/24/1948 0:00"	"Hill"	"J. Tomilson"	""	"4/4/2023 5:01"	"New York"	"Northeast"	1948	5	24	117.24	7.5	"$21,427,700,000,000 "	88.2	101.8	78.5	9.6	36.6	328239523	37.09024	-95.712891
"1405"	1368	2200	"Technology"	"Phillip T. (Terry) Ragon"	73	"United States"	"Boston"	"Health IT"	"Technology"	"United States"	""	TRUE	"U"	"M"	"6/1/1949 0:00"	"Ragon"	"Phillip T. (Terry)"	""	"4/4/2023 5:01"	"Massachusetts"	"Northeast"	1949	6	1	117.24	7.5	"$21,427,700,000,000 "	88.2	101.8	78.5	9.6	36.6	328239523	37.09024	-95.712891
"886"	878	3300	"Real Estate"	"John Gandel"	88	"Australia"	"Melbourne"	"Shopping malls"	"Real Estate"	"Australia"	""	FALSE	"E"	"M"	"8/13/1934 0:00"	"Gandel"	"John"	""	"4/4/2023 5:01"	""	""	1934	8	13	119.8	1.6	"$1,392,680,589,329 "	113.1	100.3	82.7	23	47.4	25766605	-25.274398	133.775136
"1056"	1027	2900	"Finance & Investments"	"Sebastian Piera & family"	73	"Chile"	"Santiago"	"Investments"	"Finance & Investments"	"Chile"	"Chile"	TRUE	"U"	"M"	"12/1/1949 0:00"	"Piera"	"Sebastian"	"President"	"4/4/2023 5:01"	""	""	1949	12	1	131.91	2.6	"$282,318,159,745 "	88.5	101.4	80	18.2	34	18952038	-35.675147	-71.542969
"1784"	1725	1700	"Diversified"	"Ivan Savvidis & family"	64	"Russia"	"Rostov-on-Don"	"Agribusiness"	"Diversified"	"Russia"	""	TRUE	"U"	"M"	"3/27/1959 0:00"	"Savvidis"	"Ivan"	""	"4/4/2023 5:01"	""	""	1959	3	27	180.75	4.5	"$1,699,876,578,871 "	81.9	102.6	72.7	11.4	46.2	144373535	61.52401	105.318756
"292"	290	7600	"Manufacturing"	"Andrew Currie"	67	"United Kingdom"	"London"	"Chemicals"	"Manufacturing"	"United Kingdom"	""	TRUE	"U"	"M"	"12/4/1955 0:00"	"Currie"	"Andrew"	""	"4/4/2023 5:01"	""	""	1955	12	4	119.62	1.7	"$2,827,113,184,696 "	60	101.2	81.3	25.5	30.6	66834405	55.378051	-3.435973
"1839"	1804	1600	"Manufacturing"	"Hui Lin Chit"	69	"China"	"Jinjiang"	"Hygiene products"	"Manufacturing"	"China"	""	TRUE	"D"	"M"	"6/16/1953 0:00"	"Hui"	"Lin Chit"	""	"4/4/2023 5:01"	""	""	1953	6	16	125.08	2.9	"$19,910,000,000,000 "	50.6	100.2	77	9.4	59.2	1397715000	35.86166	104.195397
"291"	290	7600	"Healthcare"	"Hasmukh Chudgar & family"	89	"India"	"Ahmedabad"	"Pharmaceuticals"	"Healthcare"	"India"	""	TRUE	"U"	"M"	"9/19/1933 0:00"	"Chudgar"	"Hasmukh"	""	"4/4/2023 5:01"	""	""	1933	9	19	180.44	7.7	"$2,611,000,000,000 "	28.1	113	69.4	11.2	49.7	1366417754	20.593684	78.96288
"90"	89	18500	"Finance & Investments"	"David Tepper"	65	"United States"	"Palm Beach"	"Hedge funds"	"Finance & Investments"	"United States"	"Appaloosa Management"	TRUE	"U"	"M"	"9/11/1957 0:00"	"Tepper"	"David"	"President and Founder"	"4/4/2023 5:01"	"Florida"	"South"	1957	9	11	117.24	7.5	"$21,427,700,000,000 "	88.2	101.8	78.5	9.6	36.6	328239523	37.09024	-95.712891
"1123"	1104	2700	"Metals & Mining"	"Alexander Frolov"	58	"Russia"	"Moscow"	"Mining, steel"	"Metals & Mining"	"Russia"	""	TRUE	"U"	"M"	"5/17/1964 0:00"	"Frolov"	"Alexander"	""	"4/4/2023 5:01"	""	""	1964	5	17	180.75	4.5	"$1,699,876,578,871 "	81.9	102.6	72.7	11.4	46.2	144373535	61.52401	105.318756
"695"	679	4100	"Real Estate"	"Donald Sterling"	88	"United States"	"Beverly Hills"	"Real estate"	"Real Estate"	"United States"	""	TRUE	"U"	"M"	"4/26/1934 0:00"	"Sterling"	"Donald"	""	"4/4/2023 5:01"	"California"	"West"	1934	4	26	117.24	7.5	"$21,427,700,000,000 "	88.2	101.8	78.5	9.6	36.6	328239523	37.09024	-95.712891
"2023"	2020	1400	"Technology"	"Binny Bansal"	40	"Singapore"	"Singapore"	"Flipkart"	"Technology"	"India"	""	TRUE	"U"	"M"	"12/3/1982 0:00"	"Bansal"	"Binny"	""	"4/4/2023 5:01"	""	""	1982	12	3	114.41	0.6	"$372,062,527,489 "	84.8	100.6	83.1	13.1	21	5703569	1.352083	103.819836
"408"	405	6300	"Healthcare"	"Alain Merieux & family"	85	"France"	"Lyon"	"Pharmaceuticals"	"Healthcare"	"France"	""	FALSE	"D"	"M"	"1/1/1938 0:00"	"Merieux"	"Alain"	""	"4/4/2023 5:01"	""	""	1938	1	1	110.05	1.1	"$2,715,518,274,227 "	65.6	102.5	82.5	24.2	60.7	67059887	46.227638	2.213749
"2498"	2405	1100	"Technology"	"Paul Sciarra"	42	"United States"	"San Francisco"	"Pinterest"	"Technology"	"United States"	""	TRUE	"D"	"M"	"2/15/1981 0:00"	"Sciarra"	"Paul"	""	"4/4/2023 5:01"	"California"	"West"	1981	2	15	117.24	7.5	"$21,427,700,000,000 "	88.2	101.8	78.5	9.6	36.6	328239523	37.09024	-95.712891
"1599"	1575	1900	"Fashion & Retail"	"Guo Zhenyu & family"	59	"China"	"Kunming"	"Cosmetics"	"Fashion & Retail"	"Canada"	""	TRUE	"D"	"M"	"11/1/1963 0:00"	"Guo"	"Zhenyu"	""	"4/4/2023 5:01"	""	""	1963	11	1	125.08	2.9	"$19,910,000,000,000 "	50.6	100.2	77	9.4	59.2	1397715000	35.86166	104.195397
"20"	20	57600	"Fashion & Retail"	"Rob Walton & family"	78	"United States"	"Bentonville"	"Walmart"	"Fashion & Retail"	"United States"	"Walmart"	FALSE	"D"	"M"	"10/27/1944 0:00"	"Walton"	"Rob"	"Director"	"4/4/2023 5:01"	"Arkansas"	"South"	1944	10	27	117.24	7.5	"$21,427,700,000,000 "	88.2	101.8	78.5	9.6	36.6	328239523	37.09024	-95.712891
"1861"	1804	1600	"Finance & Investments"	"Liora Ofer"	69	"Israel"	"Tel Aviv"	"Investments"	"Finance & Investments"	"Israel"	""	FALSE	"D"	"F"	"12/22/1953 0:00"	"Ofer"	"Liora"	""	"4/4/2023 5:01"	""	""	1953	12	22	108.15	0.8	"$395,098,666,122 "	63.4	104.9	82.8	23.1	25.3	9053300	31.046051	34.851612
"1626"	1575	1900	"Construction & Engineering"	"Dwight Schar"	81	"United States"	"Palm Beach"	"Homebuilding, NFL team"	"Construction & Engineering"	"United States"	""	TRUE	"E"	"M"	"2/8/1942 0:00"	"Schar"	"Dwight"	""	"4/4/2023 5:01"	"Florida"	"South"	1942	2	8	117.24	7.5	"$21,427,700,000,000 "	88.2	101.8	78.5	9.6	36.6	328239523	37.09024	-95.712891
"1664"	1647	1800	"Healthcare"	"Robert Duggan"	78	"United States"	"Clearwater"	"Pharmaceuticals"	"Healthcare"	"United States"	""	TRUE	"D"	"M"	"4/28/1944 0:00"	"Duggan"	"Robert"	""	"4/4/2023 5:01"	"Florida"	"South"	1944	4	28	117.24	7.5	"$21,427,700,000,000 "	88.2	101.8	78.5	9.6	36.6	328239523	37.09024	-95.712891
"2401"	2259	1200	"Manufacturing"	"Zhang Yin"	66	"China"	"Dongguan"	"Paper manufacturing"	"Manufacturing"	"China"	""	TRUE	"D"	"F"	"2/1/1957 0:00"	"Zhang"	"Yin"	""	"4/4/2023 5:01"	""	""	1957	2	1	125.08	2.9	"$19,910,000,000,000 "	50.6	100.2	77	9.4	59.2	1397715000	35.86166	104.195397
"1407"	1368	2200	"Sports"	"Jerry Reinsdorf"	87	"United States"	"Chicago"	"Sports teams"	"Sports"	"United States"	""	TRUE	"U"	"M"	"2/25/1936 0:00"	"Reinsdorf"	"Jerry"	""	"4/4/2023 5:01"	"Illinois"	"Midwest"	1936	2	25	117.24	7.5	"$21,427,700,000,000 "	88.2	101.8	78.5	9.6	36.6	328239523	37.09024	-95.712891
"812"	787	3600	"Fashion & Retail"	"Lawrence Stroll"	63	"Switzerland"	"Geneva"	"Fashion investments"	"Fashion & Retail"	"Canada"	""	TRUE	"U"	"M"	"7/11/1959 0:00"	"Stroll"	"Lawrence"	""	"4/4/2023 5:01"	""	""	1959	7	11	99.55	0.4	"$703,082,435,360 "	59.6	105.2	83.6	10.1	28.8	8574832	46.818188	8.227512
"202"	202	9500	"Finance & Investments"	"Vincent Bollor & family"	71	"France"	"Paris"	"Investments"	"Finance & Investments"	"France"	""	FALSE	"U"	"M"	"4/1/1952 0:00"	"Bollor"	"Vincent"	""	"4/4/2023 5:01"	""	""	1952	4	1	110.05	1.1	"$2,715,518,274,227 "	65.6	102.5	82.5	24.2	60.7	67059887	46.227638	2.213749
"1370"	1368	2200	"Energy"	"Albert Avdolyan"	52	"Russia"	"Moscow"	"Oil, mining"	"Energy"	"Russia"	""	TRUE	"R"	"M"	"11/8/1970 0:00"	"Avdolyan"	"Albert"	""	"4/4/2023 5:01"	""	""	1970	11	8	180.75	4.5	"$1,699,876,578,871 "	81.9	102.6	72.7	11.4	46.2	144373535	61.52401	105.318756
"1554"	1516	2000	"Construction & Engineering"	"P.V. Krishna Reddy"	53	"India"	"Hyderabad"	"Infrastructure"	"Construction & Engineering"	"India"	""	TRUE	"U"	"M"	"6/30/1969 0:00"	"Reddy"	"P.V. Krishna"	""	"4/4/2023 5:01"	""	""	1969	6	30	180.44	7.7	"$2,611,000,000,000 "	28.1	113	69.4	11.2	49.7	1366417754	20.593684	78.96288
"16"	16	64400	"Technology"	"Mark Zuckerberg"	38	"United States"	"Palo Alto"	"Facebook"	"Technology"	"United States"	"Meta Platforms"	TRUE	"D"	"M"	"5/14/1984 0:00"	"Zuckerberg"	"Mark"	"Cofounder"	"4/4/2023 5:01"	"California"	"West"	1984	5	14	117.24	7.5	"$21,427,700,000,000 "	88.2	101.8	78.5	9.6	36.6	328239523	37.09024	-95.712891
"679"	679	4100	"Food & Beverage"	"Andrej Babis"	68	"Czech Republic"	"Prague"	"Agriculture"	"Food & Beverage"	"Czech Republic"	""	TRUE	"D"	"M"	"9/2/1954 0:00"	"Babis"	"Andrej"	""	"4/4/2023 5:01"	""	""	1954	9	2	116.48	2.8	"$246,489,245,495 "	64.1	100.7	79	14.9	46.1	10669709	49.817492	15.472962
"2580"	2540	1000	"Finance & Investments"	"Hedda im Brahm-Droege"	68	"Germany"	"Dusseldorf"	"Investments"	"Finance & Investments"	"Germany"	""	TRUE	"D"	"F"	"1/1/1955 0:00"	"im Brahm-Droege"	"Hedda"	""	"4/4/2023 5:01"	""	""	1955	1	1	112.85	1.4	"$3,845,630,030,824 "	70.2	104	80.9	11.5	48.8	83132799	51.165691	10.451526
"840"	818	3500	"Construction & Engineering"	"Arkady Rotenberg"	71	"Russia"	"Moscow"	"Construction, pipes, banking"	"Construction & Engineering"	"Russia"	""	TRUE	"U"	"M"	"12/15/1951 0:00"	"Rotenberg"	"Arkady"	""	"4/4/2023 5:01"	""	""	1951	12	15	180.75	4.5	"$1,699,876,578,871 "	81.9	102.6	72.7	11.4	46.2	144373535	61.52401	105.318756
"681"	679	4100	"Media & Entertainment"	"Hubert Burda"	83	"Germany"	"Munich"	"Publishing"	"Media & Entertainment"	"Germany"	""	FALSE	"U"	"M"	"2/9/1940 0:00"	"Burda"	"Hubert"	""	"4/4/2023 5:01"	""	""	1940	2	9	112.85	1.4	"$3,845,630,030,824 "	70.2	104	80.9	11.5	48.8	83132799	51.165691	10.451526
"1676"	1647	1800	"Diversified"	"Koo Kwang-mo"	45	"South Korea"	"Seoul"	"LG"	"Diversified"	"South Korea"	""	FALSE	"U"	"M"	"1/23/1978 0:00"	"Koo"	"Kwang-mo"	""	"4/4/2023 5:01"	""	""	1978	1	23	115.16	0.4	"$2,029,000,000,000 "	94.3	98.1	82.6	15.6	33.2	51709098	35.907757	127.766922
"1205"	1164	2600	"Technology"	"Steven Sarowitz"	57	"United States"	"Highland Park"	"Payroll software"	"Technology"	"United States"	""	TRUE	"D"	"M"	"11/7/1965 0:00"	"Sarowitz"	"Steven"	""	"4/4/2023 5:01"	"Illinois"	"Midwest"	1965	11	7	117.24	7.5	"$21,427,700,000,000 "	88.2	101.8	78.5	9.6	36.6	328239523	37.09024	-95.712891
"703"	699	4000	"Manufacturing"	"Vinod Rai Gupta"	77	"India"	"Delhi"	"Electrical equipment"	"Manufacturing"	"India"	""	FALSE	"U"	"F"	"9/15/1945 0:00"	"Gupta"	"Vinod Rai"	""	"4/4/2023 5:01"	""	""	1945	9	15	180.44	7.7	"$2,611,000,000,000 "	28.1	113	69.4	11.2	49.7	1366417754	20.593684	78.96288
"166"	165	10600	"Food & Beverage"	"Marcel Herrmann Telles"	73	"Brazil"	"Sao Paulo"	"Beer"	"Food & Beverage"	"Brazil"	""	TRUE	"U"	"M"	"1/1/1950 0:00"	"Telles"	"Marcel Herrmann"	""	"4/4/2023 5:01"	""	""	1950	1	1	167.4	3.7	"$1,839,758,040,766 "	51.3	115.4	75.7	14.2	65.1	212559417	-14.235004	-51.92528
"1080"	1067	2800	"Real Estate"	"Lee Yeow Chor"	56	"Malaysia"	""	"Palm oil, property"	"Real Estate"	"Malaysia"	""	FALSE	"Split Family Fortune"	"M"	"1/1/1967 0:00"	"Lee"	"Yeow Chor"	""	"4/4/2023 5:01"	""	""	1967	1	1	121.46	0.7	"$364,701,517,788 "	45.1	105.3	76	12	38.7	32447385	4.210484	101.975766
"1858"	1804	1600	"Technology"	"Jim McKelvey"	57	"United States"	"St. Louis"	"Mobile payments"	"Technology"	"United States"	""	TRUE	"D"	"M"	"10/19/1965 0:00"	"McKelvey"	"Jim"	""	"4/4/2023 5:01"	"Missouri"	"Midwest"	1965	10	19	117.24	7.5	"$21,427,700,000,000 "	88.2	101.8	78.5	9.6	36.6	328239523	37.09024	-95.712891
"1673"	1647	1800	"Healthcare"	"Lei Jin"	57	"China"	"Changchun"	"Pharmaceuticals"	"Healthcare"	"China"	""	TRUE	"U"	"M"	"8/1/1965 0:00"	"Jin"	"Lei"	""	"4/4/2023 5:01"	""	""	1965	8	1	125.08	2.9	"$19,910,000,000,000 "	50.6	100.2	77	9.4	59.2	1397715000	35.86166	104.195397
"314"	312	7300	"Fashion & Retail"	"Anders Holch Povlsen"	50	"Denmark"	"Aarhus"	"Fashion retail"	"Fashion & Retail"	"Denmark"	""	FALSE	"D"	"M"	"11/4/1972 0:00"	"Povlsen"	"Anders Holch"	""	"4/4/2023 5:01"	""	""	1972	11	4	110.35	0.8	"$348,078,018,464 "	80.6	101.3	81	32.4	23.8	5818553	56.26392	9.501785
"2499"	2405	1100	"Finance & Investments"	"Rajesh Sharma"	53	"India"	"Mumbai"	"Finance"	"Finance & Investments"	"India"	""	FALSE	"N"	"M"	"2/25/1970 0:00"	"Sharma"	"Rajesh"	""	"4/4/2023 5:01"	""	""	1970	2	25	180.44	7.7	"$2,611,000,000,000 "	28.1	113	69.4	11.2	49.7	1366417754	20.593684	78.96288
"332"	332	7000	"Technology"	"Marc Benioff"	58	"United States"	"San Francisco"	"Business software"	"Technology"	"United States"	"Salesforce.com"	TRUE	"D"	"M"	"9/25/1964 0:00"	"Benioff"	"Marc"	"Chairman and CEO"	"4/4/2023 5:01"	"California"	"West"	1964	9	25	117.24	7.5	"$21,427,700,000,000 "	88.2	101.8	78.5	9.6	36.6	328239523	37.09024	-95.712891
"818"	818	3500	"Fashion & Retail"	"Rocco Basilico"	33	"United States"	"Los Angeles"	"Eyeglasses"	"Fashion & Retail"	"Italy"	""	FALSE	"N"	"M"	"7/11/1989 0:00"	"Basilico"	"Rocco"	""	"4/4/2023 5:01"	"California"	"West"	1989	7	11	117.24	7.5	"$21,427,700,000,000 "	88.2	101.8	78.5	9.6	36.6	328239523	37.09024	-95.712891
"1602"	1575	1900	"Finance & Investments"	"Roberto Hernandez Ramirez"	81	"Mexico"	"Mexico City"	"Banking, investments"	"Finance & Investments"	"Mexico"	""	TRUE	"E"	"M"	"3/24/1942 0:00"	"Hernandez Ramirez"	"Roberto"	""	"4/4/2023 5:01"	""	""	1942	3	24	141.54	3.6	"$1,258,286,717,125 "	40.2	105.8	75	13.1	55.1	126014024	23.634501	-102.552784
"1447"	1434	2100	"Diversified"	"Georgi Domuschiev"	50	"United Kingdom"	"London"	"Animal health, investments"	"Diversified"	"Bulgaria"	""	TRUE	"U"	"M"	"8/6/1972 0:00"	"Domuschiev"	"Georgi"	""	"4/4/2023 5:01"	""	""	1972	8	6	119.62	1.7	"$2,827,113,184,696 "	60	101.2	81.3	25.5	30.6	66834405	55.378051	-3.435973
"518"	511	5200	"Food & Beverage"	"Robert Rich, Jr."	82	"United States"	"Islamorada"	"Frozen foods"	"Food & Beverage"	"United States"	""	FALSE	"U"	"M"	"1/25/1941 0:00"	"Rich"	"Robert"	""	"4/4/2023 5:01"	"Florida"	"South"	1941	1	25	117.24	7.5	"$21,427,700,000,000 "	88.2	101.8	78.5	9.6	36.6	328239523	37.09024	-95.712891
"2086"	2020	1400	"Finance & Investments"	"Niti Osathanugrah"	49	"Thailand"	"Bangkok"	"Energy drinks,investments"	"Finance & Investments"	"Thailand"	""	FALSE	"D"	"M"	"10/18/1973 0:00"	"Osathanugrah"	"Niti"	""	"4/4/2023 5:01"	""	""	1973	10	18	113.27	0.7	"$543,649,976,166 "	49.3	99.8	76.9	14.9	29.5	69625582	15.870032	100.992541
"838"	818	3500	"Finance & Investments"	"Ira Rennert"	88	"United States"	"New York"	"Investments"	"Finance & Investments"	"United States"	""	TRUE	"D"	"M"	"5/31/1934 0:00"	"Rennert"	"Ira"	""	"4/4/2023 5:01"	"New York"	"Northeast"	1934	5	31	117.24	7.5	"$21,427,700,000,000 "	88.2	101.8	78.5	9.6	36.6	328239523	37.09024	-95.712891
"2019"	1905	1500	"Fashion & Retail"	"Zhou Zongwen & family"	66	"China"	"Shenzhen"	"Jewelry"	"Fashion & Retail"	"China"	""	TRUE	"D"	"M"	"3/1/1957 0:00"	"Zhou"	"Zongwen"	""	"4/4/2023 5:01"	""	""	1957	3	1	125.08	2.9	"$19,910,000,000,000 "	50.6	100.2	77	9.4	59.2	1397715000	35.86166	104.195397
"1909"	1905	1500	"Diversified"	"Alexandra Andresen"	26	"Norway"	"Oslo"	"Investments"	"Diversified"	"Norway"	""	FALSE	"U"	"F"	"7/23/1996 0:00"	"Andresen"	"Alexandra"	""	"4/4/2023 5:01"	""	""	1996	7	23	120.27	2.2	"$403,336,363,636 "	82	100.3	82.8	23.9	36.2	5347896	60.472024	8.468946
"2583"	2540	1000	"Fashion & Retail"	"Johan Johannson"	56	"Norway"	"Oslo"	"Grocery stores"	"Fashion & Retail"	"Norway"	""	FALSE	"D"	"M"	"1/1/1967 0:00"	"Johannson"	"Johan"	""	"4/4/2023 5:01"	""	""	1967	1	1	120.27	2.2	"$403,336,363,636 "	82	100.3	82.8	23.9	36.2	5347896	60.472024	8.468946
"1430"	1368	2200	"Logistics"	"Huijiao Yu"	57	"China"	"Shanghai"	"Package delivery"	"Logistics"	"China"	"Shanghai YTO Express (Logistics)"	TRUE	"D"	"M"	"4/1/1966 0:00"	"Yu"	"Huijiao"	"Founder and Chairman"	"4/4/2023 5:01"	""	""	1966	4	1	125.08	2.9	"$19,910,000,000,000 "	50.6	100.2	77	9.4	59.2	1397715000	35.86166	104.195397
"2002"	1905	1500	"Telecom"	"David Teoh"	67	"Australia"	"Sydney"	"Telecom"	"Telecom"	"Australia"	""	TRUE	"D"	"M"	"1/1/1956 0:00"	"Teoh"	"David"	""	"4/4/2023 5:01"	""	""	1956	1	1	119.8	1.6	"$1,392,680,589,329 "	113.1	100.3	82.7	23	47.4	25766605	-25.274398	133.775136
"2253"	2133	1300	"Technology"	"Yan Jane & family"	53	"China"	"Beijing"	"Software"	"Technology"	"China"	""	TRUE	"U"	"F"	"7/19/1969 0:00"	"Yan"	"Jane"	""	"4/4/2023 5:01"	""	""	1969	7	19	125.08	2.9	"$19,910,000,000,000 "	50.6	100.2	77	9.4	59.2	1397715000	35.86166	104.195397
"1779"	1725	1700	"Healthcare"	"Jinsheng Ren & family"	60	"China"	"Nanjing"	"Pharmaceutical"	"Healthcare"	"China"	""	TRUE	"U"	"M"	"1/1/1963 0:00"	"Ren"	"Jinsheng"	""	"4/4/2023 5:01"	""	""	1963	1	1	125.08	2.9	"$19,910,000,000,000 "	50.6	100.2	77	9.4	59.2	1397715000	35.86166	104.195397
"19"	19	58800	"Fashion & Retail"	"Jim Walton"	74	"United States"	"Bentonville"	"Walmart"	"Fashion & Retail"	"United States"	"Arvest Bank Group, Inc."	FALSE	"D"	"M"	"6/7/1948 0:00"	"Walton"	"Jim"	"Chairman and CEO"	"4/4/2023 5:01"	"Arkansas"	"South"	1948	6	7	117.24	7.5	"$21,427,700,000,000 "	88.2	101.8	78.5	9.6	36.6	328239523	37.09024	-95.712891
"2599"	2540	1000	"Fashion & Retail"	"Liu Baolin"	69	"China"	"Wuhan"	"Pharmacies"	"Fashion & Retail"	"China"	""	TRUE	"E"	"M"	"6/1/1953 0:00"	"Liu"	"Baolin"	""	"4/4/2023 5:01"	""	""	1953	6	1	125.08	2.9	"$19,910,000,000,000 "	50.6	100.2	77	9.4	59.2	1397715000	35.86166	104.195397
"1491"	1434	2100	"Construction & Engineering"	"P.P. Reddy"	65	"India"	"Hyderabad"	"Infrastructure"	"Construction & Engineering"	"India"	""	TRUE	"U"	"M"	"8/30/1957 0:00"	"Reddy"	"P.P."	""	"4/4/2023 5:01"	""	""	1957	8	30	180.44	7.7	"$2,611,000,000,000 "	28.1	113	69.4	11.2	49.7	1366417754	20.593684	78.96288
"1575"	1575	1900	"Diversified"	"Roberto Angelini Rossi"	74	"Chile"	"Santiago"	"Forestry, mining"	"Diversified"	"Chile"	""	FALSE	"U"	"M"	"7/30/1948 0:00"	"Angelini Rossi"	"Roberto"	""	"4/4/2023 5:01"	""	""	1948	7	30	131.91	2.6	"$282,318,159,745 "	88.5	101.4	80	18.2	34	18952038	-35.675147	-71.542969
"529"	523	5100	"Finance & Investments"	"Tony Tamer"	65	"United States"	"New York"	"Private equity"	"Finance & Investments"	"United States"	""	TRUE	"U"	"M"	"10/12/1957 0:00"	"Tamer"	"Tony"	""	"4/4/2023 5:01"	"New York"	"Northeast"	1957	10	12	117.24	7.5	"$21,427,700,000,000 "	88.2	101.8	78.5	9.6	36.6	328239523	37.09024	-95.712891
"512"	511	5200	"Food & Beverage"	"Cheng Xue"	53	"China"	"Foshan"	"Soy sauce"	"Food & Beverage"	"China"	""	TRUE	"D"	"F"	"2/26/1970 0:00"	"Cheng"	"Xue"	""	"4/4/2023 5:01"	""	""	1970	2	26	125.08	2.9	"$19,910,000,000,000 "	50.6	100.2	77	9.4	59.2	1397715000	35.86166	104.195397
"1026"	982	3000	"Manufacturing"	"Zhu Gongshan & family"	65	"China"	"Shanghai"	"Solar panel materials"	"Manufacturing"	"China"	""	TRUE	"D"	"M"	"1/1/1958 0:00"	"Zhu"	"Gongshan"	""	"4/4/2023 5:01"	""	""	1958	1	1	125.08	2.9	"$19,910,000,000,000 "	50.6	100.2	77	9.4	59.2	1397715000	35.86166	104.195397
"1339"	1312	2300	"Food & Beverage"	"Kishore Mariwala"	88	"India"	"Mumbai"	"Consumer goods"	"Food & Beverage"	"India"	""	FALSE	"D"	"M"	"2/14/1935 0:00"	"Mariwala"	"Kishore"	""	"4/4/2023 5:01"	""	""	1935	2	14	180.44	7.7	"$2,611,000,000,000 "	28.1	113	69.4	11.2	49.7	1366417754	20.593684	78.96288
"184"	184	9800	"Diversified"	"Vinod Adani"	74	"United Arab Emirates"	"Dubai"	"Infrastructure, commodities"	"Diversified"	"Cyprus"	""	TRUE	"Split Family Fortune"	"M"	"1/10/1949 0:00"	"Adani"	"Vinod"	""	"4/4/2023 5:01"	""	""	1949	1	10	114.52	-1.9	"$421,142,267,938 "	36.8	108.4	77.8	0.1	15.9	9770529	23.424076	53.847818
"1364"	1312	2300	"Fashion & Retail"	"Xie Bingkun & family"	56	"China"	"Fuzhou"	"Pearlescent pigments"	"Fashion & Retail"	"China"	""	TRUE	"U"	"M"	"8/25/1966 0:00"	"Xie"	"Bingkun"	""	"4/4/2023 5:01"	""	""	1966	8	25	125.08	2.9	"$19,910,000,000,000 "	50.6	100.2	77	9.4	59.2	1397715000	35.86166	104.195397
"1721"	1647	1800	"Real Estate"	"Yan Zhi"	50	"China"	"Wuhan"	"Real estate"	"Real Estate"	"China"	""	TRUE	"D"	"M"	"7/1/1972 0:00"	"Yan"	"Zhi"	""	"4/4/2023 5:01"	""	""	1972	7	1	125.08	2.9	"$19,910,000,000,000 "	50.6	100.2	77	9.4	59.2	1397715000	35.86166	104.195397
"1735"	1725	1700	"Finance & Investments"	"Marek Dospiva"	53	"Czech Republic"	"Prague"	"Investments"	"Finance & Investments"	"Czech Republic"	""	TRUE	"U"	"M"	"7/18/1969 0:00"	"Dospiva"	"Marek"	""	"4/4/2023 5:01"	""	""	1969	7	18	116.48	2.8	"$246,489,245,495 "	64.1	100.7	79	14.9	46.1	10669709	49.817492	15.472962
"1825"	1804	1600	"Technology"	"Daniel Dines"	51	"United States"	"New York"	"Software"	"Technology"	"Romania"	""	TRUE	"D"	"M"	"1/1/1972 0:00"	"Dines"	"Daniel"	""	"4/4/2023 5:01"	"New York"	"Northeast"	1972	1	1	117.24	7.5	"$21,427,700,000,000 "	88.2	101.8	78.5	9.6	36.6	328239523	37.09024	-95.712891
"28"	28	40100	"Fashion & Retail"	"Franois Pinault & family"	86	"France"	"Paris"	"Luxury goods"	"Fashion & Retail"	"France"	""	TRUE	"D"	"M"	"8/21/1936 0:00"	"Pinault"	"Franois"	""	"4/4/2023 5:01"	""	""	1936	8	21	110.05	1.1	"$2,715,518,274,227 "	65.6	102.5	82.5	24.2	60.7	67059887	46.227638	2.213749
"198"	195	9600	"Food & Beverage"	"Marijke Mars"	58	"United States"	"Los Angeles"	"Candy, pet food"	"Food & Beverage"	"United States"	""	FALSE	"U"	"F"	"7/28/1964 0:00"	"Mars"	"Marijke"	""	"4/4/2023 5:01"	"California"	"West"	1964	7	28	117.24	7.5	"$21,427,700,000,000 "	88.2	101.8	78.5	9.6	36.6	328239523	37.09024	-95.712891
"374"	365	6700	"Telecom"	"Xavier Niel"	55	"France"	"Paris"	"Internet, telecom"	"Telecom"	"France"	""	TRUE	"D"	"M"	"8/25/1967 0:00"	"Niel"	"Xavier"	""	"4/4/2023 5:01"	""	""	1967	8	25	110.05	1.1	"$2,715,518,274,227 "	65.6	102.5	82.5	24.2	60.7	67059887	46.227638	2.213749
"775"	766	3700	"Real Estate"	"Richard LeFrak & family"	77	"United States"	"New York"	"Real estate"	"Real Estate"	"United States"	""	FALSE	"E"	"M"	"8/29/1945 0:00"	"LeFrak"	"Richard"	""	"4/4/2023 5:01"	"New York"	"Northeast"	1945	8	29	117.24	7.5	"$21,427,700,000,000 "	88.2	101.8	78.5	9.6	36.6	328239523	37.09024	-95.712891
"1901"	1804	1600	"Technology"	"Zeng Kaitian"	48	"China"	"Shanghai"	"Online games"	"Technology"	"China"	""	TRUE	"D"	"M"	"1/1/1975 0:00"	"Zeng"	"Kaitian"	""	"4/4/2023 5:01"	""	""	1975	1	1	125.08	2.9	"$19,910,000,000,000 "	50.6	100.2	77	9.4	59.2	1397715000	35.86166	104.195397
"1275"	1272	2400	"Media & Entertainment"	"Koos Bekker"	70	"South Africa"	"Cape Town"	"Media, investments"	"Media & Entertainment"	"South Africa"	""	TRUE	"U"	"M"	"12/14/1952 0:00"	"Bekker"	"Koos"	""	"4/4/2023 5:01"	""	""	1952	12	14	158.93	4.1	"$351,431,649,241 "	22.4	100.9	63.9	27.5	29.2	58558270	-30.559482	22.937506
"915"	905	3200	"Media & Entertainment"	"Charles Ergen"	70	"United States"	"Denver"	"Satellite TV"	"Media & Entertainment"	"United States"	"DISH Network"	TRUE	"D"	"M"	"3/1/1953 0:00"	"Ergen"	"Charles"	"Founder and Chairman"	"4/4/2023 5:01"	"Colorado"	"West"	1953	3	1	117.24	7.5	"$21,427,700,000,000 "	88.2	101.8	78.5	9.6	36.6	328239523	37.09024	-95.712891
"1371"	1368	2200	"Diversified"	"Sezai Bacaksiz"	73	"Turkey"	"Ankara"	"Diversified"	"Diversified"	"Turkey"	""	TRUE	"U"	"M"	"7/27/1949 0:00"	"Bacaksiz"	"Sezai"	""	"4/4/2023 5:01"	""	""	1949	7	27	234.44	15.2	"$754,411,708,203 "	23.9	93.2	77.4	17.9	42.3	83429615	38.963745	35.243322
"230"	230	8700	"Manufacturing"	"Chen Jianhua"	52	"China"	"Wujiang"	"Chemicals"	"Manufacturing"	"China"	""	TRUE	"U"	"M"	"1/1/1971 0:00"	"Chen"	"Jianhua"	""	"4/4/2023 5:01"	""	""	1971	1	1	125.08	2.9	"$19,910,000,000,000 "	50.6	100.2	77	9.4	59.2	1397715000	35.86166	104.195397
"2013"	1905	1500	"Technology"	"Xu Zhihan"	50	"China"	"Wuxi"	"Electronics"	"Technology"	"China"	""	TRUE	"D"	"M"	"11/30/1972 0:00"	"Xu"	"Zhihan"	""	"4/4/2023 5:01"	""	""	1972	11	30	125.08	2.9	"$19,910,000,000,000 "	50.6	100.2	77	9.4	59.2	1397715000	35.86166	104.195397
"2555"	2540	1000	"Technology"	"Tianqiao Chen"	49	"United States"	"Atherton"	"Online games"	"Technology"	"China"	""	TRUE	"D"	"M"	"5/16/1973 0:00"	"Chen"	"Tianqiao"	""	"4/4/2023 5:01"	"California"	"West"	1973	5	16	117.24	7.5	"$21,427,700,000,000 "	88.2	101.8	78.5	9.6	36.6	328239523	37.09024	-95.712891
"1038"	1027	2900	"Manufacturing"	"Gu Yuhua & family"	73	"China"	"Hangzhou"	"Furniture"	"Manufacturing"	"China"	""	TRUE	"D"	"M"	"10/5/1949 0:00"	"Gu"	"Yuhua"	""	"4/4/2023 5:01"	""	""	1949	10	5	125.08	2.9	"$19,910,000,000,000 "	50.6	100.2	77	9.4	59.2	1397715000	35.86166	104.195397
"1696"	1647	1800	"Finance & Investments"	"Ronald Perelman"	80	"United States"	"New York"	"Leveraged buyouts"	"Finance & Investments"	"United States"	""	TRUE	"D"	"M"	"1/1/1943 0:00"	"Perelman"	"Ronald"	""	"4/4/2023 5:01"	"New York"	"Northeast"	1943	1	1	117.24	7.5	"$21,427,700,000,000 "	88.2	101.8	78.5	9.6	36.6	328239523	37.09024	-95.712891
"287"	282	7700	"Technology"	"Henry Samueli"	68	"United States"	"Newport Beach"	"Semiconductors"	"Technology"	"United States"	"Broadcom"	TRUE	"U"	"M"	"9/20/1954 0:00"	"Samueli"	"Henry"	"Cofounder, Chief Technology Officer and Chairman"	"4/4/2023 5:01"	"California"	"West"	1954	9	20	117.24	7.5	"$21,427,700,000,000 "	88.2	101.8	78.5	9.6	36.6	328239523	37.09024	-95.712891
"1896"	1804	1600	"Healthcare"	"George Yancopoulos"	63	"United States"	"Yorktown Heights"	"Pharmaceuticals"	"Healthcare"	"United States"	""	TRUE	"U"	"M"	"9/10/1959 0:00"	"Yancopoulos"	"George"	""	"4/4/2023 5:01"	"New York"	"Northeast"	1959	9	10	117.24	7.5	"$21,427,700,000,000 "	88.2	101.8	78.5	9.6	36.6	328239523	37.09024	-95.712891
"2592"	2540	1000	"Real Estate"	"Kong Jian Min"	55	"China"	"Guangzhou"	"Real estate"	"Real Estate"	"China"	""	TRUE	"D"	"M"	"1/1/1968 0:00"	"Kong"	"Jian Min"	""	"4/4/2023 5:01"	""	""	1968	1	1	125.08	2.9	"$19,910,000,000,000 "	50.6	100.2	77	9.4	59.2	1397715000	35.86166	104.195397
"710"	699	4000	"Automotive"	"Gail Miller"	79	"United States"	"Salt Lake City"	"Car dealerships"	"Automotive"	"United States"	""	TRUE	"U"	"F"	"10/14/1943 0:00"	"Miller"	"Gail"	""	"4/4/2023 5:01"	"Utah"	"West"	1943	10	14	117.24	7.5	"$21,427,700,000,000 "	88.2	101.8	78.5	9.6	36.6	328239523	37.09024	-95.712891
"806"	787	3600	"Technology"	"Masahiro Noda"	84	"Japan"	"Tokyo"	"Software"	"Technology"	"Japan"	""	TRUE	"U"	"M"	"8/24/1938 0:00"	"Noda"	"Masahiro"	""	"4/4/2023 5:01"	""	""	1938	8	24	105.48	0.5	"$5,081,769,542,380 "	63.2	98.8	84.2	11.9	46.7	126226568	36.204824	138.252924
"1795"	1725	1700	"Energy"	"Ian Wood & family"	80	"United Kingdom"	"Aberdeen"	"Energy services"	"Energy"	"United Kingdom"	""	FALSE	"E"	"M"	"7/21/1942 0:00"	"Wood"	"Ian"	""	"4/4/2023 5:01"	""	""	1942	7	21	119.62	1.7	"$2,827,113,184,696 "	60	101.2	81.3	25.5	30.6	66834405	55.378051	-3.435973
"568"	567	4800	"Fashion & Retail"	"Tomasz Biernacki"	50	"Poland"	"Krotoszyn,"	"Supermarkets"	"Fashion & Retail"	"Poland"	""	TRUE	"U"	"M"	"1/1/1973 0:00"	"Biernacki"	"Tomasz"	""	"4/4/2023 5:01"	""	""	1973	1	1	114.11	2.2	"$592,164,400,688 "	67.8	100	77.6	17.4	40.8	37970874	51.919438	19.145136
"273"	268	7900	"Finance & Investments"	"David Shaw"	72	"United States"	"New York"	"Hedge funds"	"Finance & Investments"	"United States"	"D. E. Shaw & Co., L.P."	TRUE	"U"	"M"	"3/29/1951 0:00"	"Shaw"	"David"	"Founder"	"4/4/2023 5:01"	"New York"	"Northeast"	1951	3	29	117.24	7.5	"$21,427,700,000,000 "	88.2	101.8	78.5	9.6	36.6	328239523	37.09024	-95.712891
"883"	878	3300	"Food & Beverage"	"Walter Faria"	68	"Brazil"	"Rio de Janeiro"	"Beer"	"Food & Beverage"	"Brazil"	""	TRUE	"E"	"M"	"4/1/1955 0:00"	"Faria"	"Walter"	""	"4/4/2023 5:01"	""	""	1955	4	1	167.4	3.7	"$1,839,758,040,766 "	51.3	115.4	75.7	14.2	65.1	212559417	-14.235004	-51.92528
"2533"	2405	1100	"Metals & Mining"	"Zeng Chaolin"	40	"China"	"Yongzhou"	"Aluminium"	"Metals & Mining"	"China"	""	FALSE	"D"	"M"	"8/1/1982 0:00"	"Zeng"	"Chaolin"	""	"4/4/2023 5:01"	""	""	1982	8	1	125.08	2.9	"$19,910,000,000,000 "	50.6	100.2	77	9.4	59.2	1397715000	35.86166	104.195397
"780"	766	3700	"Fashion & Retail"	"Horst Paulmann & family"	88	"Chile"	"Santiago"	"Retail"	"Fashion & Retail"	"Chile"	""	TRUE	"U"	"M"	"1/1/1935 0:00"	"Paulmann"	"Horst"	""	"4/4/2023 5:01"	""	""	1935	1	1	131.91	2.6	"$282,318,159,745 "	88.5	101.4	80	18.2	34	18952038	-35.675147	-71.542969
"1813"	1804	1600	"Food & Beverage"	"Josef Boquoi & family"	89	"Germany"	"Straelen"	"Frozen foods"	"Food & Beverage"	"Germany"	""	TRUE	"D"	"M"	"1/1/1934 0:00"	"Boquoi"	"Josef"	""	"4/4/2023 5:01"	""	""	1934	1	1	112.85	1.4	"$3,845,630,030,824 "	70.2	104	80.9	11.5	48.8	83132799	51.165691	10.451526
"180"	179	10100	"Diversified"	"Quek Leng Chan"	81	"Malaysia"	"Kuala Lumpur"	"Banking, property"	"Diversified"	"Malaysia"	""	FALSE	"D"	"M"	"8/12/1941 0:00"	"Quek"	"Leng Chan"	""	"4/4/2023 5:01"	""	""	1941	8	12	121.46	0.7	"$364,701,517,788 "	45.1	105.3	76	12	38.7	32447385	4.210484	101.975766
"2541"	2540	1000	"Finance & Investments"	"Christian Angermayer"	44	"United Kingdom"	"London"	"Investments"	"Finance & Investments"	"Germany"	""	TRUE	"D"	"M"	"4/26/1978 0:00"	"Angermayer"	"Christian"	""	"4/4/2023 5:01"	""	""	1978	4	26	119.62	1.7	"$2,827,113,184,696 "	60	101.2	81.3	25.5	30.6	66834405	55.378051	-3.435973
"324"	317	7200	"Food & Beverage"	"Zong Qinghou"	77	"China"	"Hangzhou"	"Beverages"	"Food & Beverage"	"China"	"Hangzhou Wahaha Group"	TRUE	"D"	"M"	"10/1/1945 0:00"	"Zong"	"Qinghou"	"Chairman"	"4/4/2023 5:01"	""	""	1945	10	1	125.08	2.9	"$19,910,000,000,000 "	50.6	100.2	77	9.4	59.2	1397715000	35.86166	104.195397
"1310"	1272	2400	"Manufacturing"	"Yang Weidong & family"	54	"China"	"Jiaxing"	"Chemicals"	"Manufacturing"	"China"	""	TRUE	"D"	"M"	"9/9/1968 0:00"	"Yang"	"Weidong"	""	"4/4/2023 5:01"	""	""	1968	9	9	125.08	2.9	"$19,910,000,000,000 "	50.6	100.2	77	9.4	59.2	1397715000	35.86166	104.195397
"160"	159	11000	"Technology"	"Zhang Zhidong"	51	"China"	"Shenzhen"	"Internet media"	"Technology"	"China"	""	TRUE	"D"	"M"	"1/1/1972 0:00"	"Zhang"	"Zhidong"	""	"4/4/2023 5:01"	""	""	1972	1	1	125.08	2.9	"$19,910,000,000,000 "	50.6	100.2	77	9.4	59.2	1397715000	35.86166	104.195397
"2310"	2259	1200	"Healthcare"	"Ke Yunfeng & family"	56	"China"	"Guangzhou"	"Retailing"	"Healthcare"	"China"	""	TRUE	"U"	"M"	"1/1/1967 0:00"	"Ke"	"Yunfeng"	""	"4/4/2023 5:01"	""	""	1967	1	1	125.08	2.9	"$19,910,000,000,000 "	50.6	100.2	77	9.4	59.2	1397715000	35.86166	104.195397
"1971"	1905	1500	"Energy"	"Rubens Ometto Silveira Mello"	73	"Brazil"	"Sao Paulo"	"Sugar, ethanol"	"Energy"	"Brazil"	""	FALSE	"D"	"M"	"1/1/1950 0:00"	"Ometto Silveira Mello"	"Rubens"	""	"4/4/2023 5:01"	""	""	1950	1	1	167.4	3.7	"$1,839,758,040,766 "	51.3	115.4	75.7	14.2	65.1	212559417	-14.235004	-51.92528
"1542"	1516	2000	"Manufacturing"	"Liang Zhaoxian"	58	"China"	"Foshan"	"Appliances"	"Manufacturing"	"China"	""	FALSE	"D"	"M"	"1/1/1965 0:00"	"Liang"	"Zhaoxian"	""	"4/4/2023 5:01"	""	""	1965	1	1	125.08	2.9	"$19,910,000,000,000 "	50.6	100.2	77	9.4	59.2	1397715000	35.86166	104.195397
"537"	534	5000	"Finance & Investments"	"Alexander Gerko"	43	"United Kingdom"	"London"	"Trading"	"Finance & Investments"	"United Kingdom"	""	TRUE	"N"	"M"	"12/3/1979 0:00"	"Gerko"	"Alexander"	""	"4/4/2023 5:01"	""	""	1979	12	3	119.62	1.7	"$2,827,113,184,696 "	60	101.2	81.3	25.5	30.6	66834405	55.378051	-3.435973
"994"	982	3000	"Fashion & Retail"	"Jean Coutu & family"	95	"Canada"	"Montreal"	"Drugstores"	"Fashion & Retail"	"Canada"	"Jean Coutu Group (PJC) Inc. (Cl A)"	TRUE	"D"	"M"	"5/29/1927 0:00"	"Coutu"	"Jean"	"Chairman"	"4/4/2023 5:01"	""	""	1927	5	29	116.76	1.9	"$1,736,425,629,520 "	68.9	100.9	81.9	12.8	24.5	36991981	56.130366	-106.346771
"2386"	2259	1200	"Finance & Investments"	"Tyler Winklevoss"	41	"United States"	"New York"	"Cryptocurrency"	"Finance & Investments"	"United States"	""	TRUE	"D"	"M"	"8/21/1981 0:00"	"Winklevoss"	"Tyler"	""	"4/4/2023 5:01"	"New York"	"Northeast"	1981	8	21	117.24	7.5	"$21,427,700,000,000 "	88.2	101.8	78.5	9.6	36.6	328239523	37.09024	-95.712891
"711"	699	4000	"Telecom"	"Rajan Mittal"	63	"India"	"Delhi"	"Telecom"	"Telecom"	"India"	""	FALSE	"Split Family Fortune"	"M"	"1/5/1960 0:00"	"Mittal"	"Rajan"	""	"4/4/2023 5:01"	""	""	1960	1	5	180.44	7.7	"$2,611,000,000,000 "	28.1	113	69.4	11.2	49.7	1366417754	20.593684	78.96288
"1313"	1312	2300	"Energy"	"Lee Bass"	66	"United States"	"Fort Worth"	"Oil, investments"	"Energy"	"United States"	""	FALSE	"U"	"M"	"5/24/1956 0:00"	"Bass"	"Lee"	""	"4/4/2023 5:01"	"Texas"	"South"	1956	5	24	117.24	7.5	"$21,427,700,000,000 "	88.2	101.8	78.5	9.6	36.6	328239523	37.09024	-95.712891
"873"	852	3400	"Food & Beverage"	"Hans Peter Wild"	81	"Switzerland"	"Zug"	"Flavorings"	"Food & Beverage"	"Switzerland"	""	FALSE	"D"	"M"	"6/16/1941 0:00"	"Wild"	"Hans Peter"	""	"4/4/2023 5:01"	""	""	1941	6	16	99.55	0.4	"$703,082,435,360 "	59.6	105.2	83.6	10.1	28.8	8574832	46.818188	8.227512
"387"	383	6600	"Finance & Investments"	"Bruce Kovner"	78	"United States"	"New York"	"Hedge funds"	"Finance & Investments"	"United States"	"Caxton Associates LP"	TRUE	"U"	"M"	"2/25/1945 0:00"	"Kovner"	"Bruce"	"Founder"	"4/4/2023 5:01"	"New York"	"Northeast"	1945	2	25	117.24	7.5	"$21,427,700,000,000 "	88.2	101.8	78.5	9.6	36.6	328239523	37.09024	-95.712891
